* 名字,* 公司,* 介绍,*地址,* 身份证,* 时间,* 法人,* 注册金额,编号,*网址
美住购,吉林美住购科技有限公司,美住购是一个客房电子商务平台，包含商家线上线下整合管理平台，各项经营管理模块简单易操作、可实现前台和后台的无缝对接。用户进入到首页，首先注册账号并登陆美住购，然后挑选自已需要的房型，包括标准房、豪华房、大床房等，也可直接输入店家或者房间代码直接搜索。进入筛选页面后，用户可以通过房间类型、宾馆位置、价格、入住时间等条件进一步细化自己的订房需求。进入到客房详情页，页面上端为360°全景客房展示区，用户按住鼠标左键移动即可变换视角，一房一图，可以真正做到所见即所得。,吉林美住购科技有限公司,吉林高新区海口路29号,220214020016961,未知,柴韦衣,100万元人民币,91220214MA148CPC6N,www.meizhugou.com
信瑞达,西安信瑞达网络科技有限公司,信瑞达主营电子通信产品、数据产品、通信电源、微电子产品、阀门、智能仪器仪表、电力电子装置、高低压智能配电装置、计算机网络产品开发、生产销售及工程服务，以及电子产品及元器件的进出口贸易。,西安信瑞达网络科技有限公司,,610131100048341,2010-10-15,贺晓光,1000万元人民币,9161013156147576XR
国民飞骧,深圳飞骧科技有限公司,深圳国民飞骧科技有限公司由国民技术无线射频事业部独立而来，后者自2010年开始经营PA产品，已经发售了数千万颗PA。在独立之时，国民飞骧已经拥有了国内同行业内最完整、最齐全的4G射频解决方案，覆盖包括MTK、高通、展讯、联芯、Marvell等各种平台。   国民飞骧从PA起步，但并不局限于PA，而是矢志于成为向市场提供全领域的无线射频器件和系统，包括移动通信、物联家居、工业电子等等。,深圳飞骧科技有限公司,深圳市南山区粤海街道科技园中区科技中三路国人大厦B栋3F层318,440301112876292,2015-05-15,潘清寿,12428.9784万元人民币,914403003425338867
爱品选,中和宝电子商务（北京）有限公司,爱品选为中和宝电子商务（北京）有限公司旗下电商平台。爱品选，以“高品质定制和优选服务”为定位，为用户定制和优选多元化商品和服务，包含掌上商城、生活缴费、商旅出行、旅游、时尚美妆等，同时注重用户体验和差异化需求，为不同层级的会员提供专属精准服务。,中和宝电子商务（北京）有限公司,北京市朝阳区东三环北路甲19号楼31层3610,110105020960619,2016-04-05,夏仕兵,1000万元人民币,91110105MA004JN82B,www.zhbservice.com
财猫网络,北京聚链时代科技集团股份有限公司,北京财猫时代网络股份有限公司是一家提供应用交付产品及相关服务的高新技术企业。主要从事应用交付类技术和产品的开发、生产、销售及服务，为企业智能应用网络提供快速、安全、高可用的高性价比解决方案。主要用于于改善网络资源及应用基础设施的可用性、响应速度、安全性和管理的方便性，帮助客户提高IT系统的运行效率。目前公司已经取得了8项软件著作权。,北京聚链时代科技集团股份有限公司,北京市海淀区安宁庄路11号29B楼一层部分、1-7层北京天信亮酒店303,110108011501167,2008-12-05,李林,723.4699万元人民币,91110108683570714N,www.caimao.com
智慧传媒,深圳智慧传媒科技有限公司,智慧传媒IntelMT为品牌企业或者是内容制作播出机构提供到端的消费者数字关系管理解决方案。,深圳智慧传媒科技有限公司,深圳市罗湖区东晓街道东昌金迪名苑A栋1708,440301108966555,2014-03-13,张腾飞,1000万元人民币,9144030009418492X6,www.intellmt.com
开立医疗,深圳开立生物医疗科技股份有限公司,深圳开立生物医疗科技股份有限公司（以下简称“开立医疗”）自成立伊始，始终致力于临床医疗设备的研发和制造，产品涵盖超声诊断系统、电子内镜系统、体外诊断系列。开立医疗以领先的创新科技、卓越的产品性能及优质的贴心服务，向客户提供全方位、多样化的医疗产品和解决方案，成为全球领先的医疗科技及解决方案供应商。,深圳开立生物医疗科技股份有限公司,深圳市南山区玉泉路毅哲大厦4、5、8、9、10楼,440301103617854,2002-09-27,陈志强,40001万元人民币,91440300743219767A,www.sonoscape.com.cn
洛唐,重庆洛唐信息技术有限公司,重庆洛唐信息技术有限公司成立于2017年，致力于微信营销系统，物联网技术研发。公司在智能餐饮，智能图书，工业智能化，共享经济，微信公众号，小程序开发等积累了丰富的行业经验。为客户提供经济、适用、稳定的解决方案。,重庆洛唐信息技术有限公司,重庆市北部新区高新园黄山大道中段5号3-5号,500905009549381,2017-04-25,周奇,200万,91500000MA5UJ9X529,www.lotaai.com
学思堂,苏州学思堂教育咨询有限公司,学思堂教育连锁创办于2009年，传承孔子“学而不思则罔，思而不学则殆”的教育理念，创新“一对一”个性化教育辅导模式，专注于18岁以下孩子学习的培养与提升，让学生成为会思考、会学习的主人。,苏州学思堂教育咨询有限公司,,320503000080927,2010-02-26,尹思华,50万元人民币,91320508551190728H,www.xuesitang.cn
控糖卫士,北京糖协控糖卫士健康管理有限公司,控糖卫士是一个糖尿病患者院外远程管理平台，核心功能包括高危人群筛查、就医导诊、血糖监测、医患交流、运动管理、数据分析、药物提醒、在线教育及饮食指导等。隶属于北京新净科技有限公司。,北京糖协控糖卫士健康管理有限公司,北京市朝阳区五里桥二街2号院8号楼1层0128,110105017509406,2014-07-04,何道新,1000万元人民币,91110105306378962A,www.bjtxw.org
五格殿下,天津五格教育科技有限责任公司,五格教育是一个少儿机器人编程教育服务平台，专注于7-12岁少儿编程教育项目，通过线上网课、线下班课两种教育方式，开发有定制化课程、教具等软硬件结合的课程体系，致力于从故事、游戏、动画、艺术、互动媒体到机器人等角度，为用户提供一站式编程知识及课程服务。项目包括Scratch入门编程的一阶趣味编程，认识Goboard传感器板的二阶互动硬件学习，创意搭建、综合应用机器人的三阶积木机器人、动手组装与编写机器人程序的四阶单片机器人和代码学习阶段的Python入门五阶课程体系，项目自研了通过声音、光线、摇杆、触摸等传感器的控制，结合硬件完成各类趣味编程的互动硬件套装；研发了通过编程实现循迹、避障、防摔、声音侦测等各种功能的机器人的积木机器人套装；还研发了集组装搭建、结构创意、程序扩展的综合套装，功能强大的单片机器人套装。,天津五格教育科技有限责任公司,天津市河西区徽州道29号(北方创客体验中心B座)2044,120103000309732,2017-04-01,张宇光,100万元人民币,91120103MA05PFHB73,www.wugedianxia.com
奥迪通用照明,广州奥迪通用照明有限公司,奥迪通用照明是一家建筑照明产品生产商，致力于提供建筑照明产品和照明产品整体解决方案，产品包括庭院灯、线性洗墙灯、埋地灯、筒灯等，目前产品已应用在场馆建筑、机场等标志性建筑中。,广州奥迪通用照明有限公司,,440101400028688,1999-11-19,关崇安,5982.64万元人民币,91440101714290564N
博为光电,深圳市博为光电股份有限公司,"""公司成立于深圳,2009年中国在过去五年里公司从小型贸易公司到领先的LED灯制造商专注于北美市场,拥有超过200员工,每月超过300000灯的输出。面向北美市场的制造商,Bravoled提供最先进的技术支持和服务的所有行UL / CUL DLC,ETL / CETL和能源之星认证的产品,包括LED管,LED高海湾、洪水LED灯,LED面板灯,LED筒灯,LED PAR灯等。""",深圳市博为光电股份有限公司,深圳市光明新区公明街道上村社区元山工业区B区第22栋,440306105270625,2011-03-22,刘子昂,900万元人民币,91440300571976680Y,www.bravoled.com
惠众云商,深圳市惠众云商科技有限公司,深圳惠众云商科技有限公司（简称惠众云商），是一家从事电子商务信息化技术服务、电子商务运营咨询的高科技“双软”企业。致力于自主知识产权的网商软件的研究、开发和推广，企业互联网品牌及形象的设计与规划。自成立以来，惠众云商科技有限公司坚持自主创新，从最基础的管理软件做起，从最直接的客户做起，成立之初便得到了多家大型网商企业的认可，并直接获得融资。,深圳市惠众云商科技有限公司,深圳市前海深港合作区前湾一路鲤鱼门街一号前海深港合作区管理局综合办公楼A栋201室（入驻深圳市前海商务秘书有限公司）,440301109405637,2014-05-21,韩涛,500万元人民币,914403003061516109,www.ecdev.cn
富伦生态,杭州富伦生态科技有限公司,富伦生态是一家纸塑铝复合包装物再利用业务运营商，主要从事废弃牛奶盒、饮料软包装的回收，并进行再资源化综合处理，生产再生纸、再生塑料粒子、铝粉等产品。该公司自建回收渠道，比如商业回收、社区分类回收、校园回收等模式。,杭州富伦生态科技有限公司,,330183000035639,2009-01-06,羊军,5111.7577万元人民币,91330183682926010L,www.fulunpaper.com

