* 名字,* 公司,* 介绍,*地址,* 身份证,* 时间,* 法人,* 注册金额,编号,*网址
铁大大,宁波西铁供应链管理有限公司,铁大大是一家中欧铁路物流服务提供商，提供以国际铁路为主、空运为辅的供应链物流服务，在线上整合了国内现有的中欧班列口岸信息，致力于打造中欧班列咨询平台以及打造全新的互联网分销模式。,宁波西铁供应链管理有限公司,宁波鄞州区百丈路158号（9-17）,330214000048633,2014-03-12,邵一峰,500万元人民币,913302040933533733,www.tiedada.com
畅映文化,长沙市畅映文化传播有限公司,畅映文化旗下红星迪达艺术培训学校是一所专业培养综合类现代艺术人才的正规培训学校。致力于培养德艺双馨的艺术人才；为热爱艺术、渴望进入艺术殿堂的学员开辟设计了，以教学→考级→比赛→演出→考学为主线的系统培养模式，为孩子们提供广阔的演出、大赛、深造平台。,长沙市畅映文化传播有限公司,,430111000344649,2015-09-07,李鸿桢,20万元人民币,91430111355525404W
土巴兔装修网,深圳市彬讯科技有限公司,土巴兔是一个一站式装修服务平台，有装修保及设计本两大系列产品，平台主要为用户提供免费验房、免费设计与报价、免费监理、建材特卖、装修资金监管、装修贷款、保险等服务。产品服务：（1）装修保，是土巴兔装修网为保障业主和装修公司双方共同利益而推出的一项“装修款项托管”和“第三方工程监理”的完全免费保障性服务，为业主装修款及工程质量进行双重保障，同时解决装修公司尾款难收的问题。（2）设计本，是土巴兔旗下成立的一个平台，用户主要是一些个性化业主以及设计师、设计公司，主要打造的是:一个业主、设计师、设计公司和商家的交易平台。,深圳市彬讯科技有限公司,深圳市南山区高新区中区科研路9号比克科技大厦10楼1001-A,440301103504817,2008-07-18,王国彬,222.2222万元人民币,91440300676666021L,www.to8to.com
特神网络,上海特神文化传播有限公司,蒸汽世界是一个专注于原创IP概设计、道具及场景制作、文化传播、销售推广的平台，业务范围覆盖以围绕IP，打造主题包含公园、电影、游戏、动画、绘本、商业主题活动推广销售等领域。,上海特神文化传播有限公司,上海市长宁区金钟路968号11号楼302室,310112001452984,2014-12-15,徐娴,104.1667万元人民币,91310105324634376N,www.steamworld.com.cn
小绿谷信息科技,新疆小绿谷信息科技有限公司,123微导航由新疆小绿谷信息科技有限公司研发运营，于2015年6月创建于新疆乌鲁木齐，123微导航作为“活动推荐引擎”，为企业APP / 自媒体平台等用户推荐有价值、需求匹配的活动资源，提供连接粉丝与活动的新型服务，活跃平台粉丝，降低平台运营成本，是国内移动互联网领域高速成长的产品服务之一。2015年12月发布3.0迭代版本。3.0活动推荐引擎更智慧，截至2016年1月，123微导航覆盖上百座城市，粉丝覆盖用户数达2500万 ，平台数量1200 。,新疆小绿谷信息科技有限公司,新疆乌鲁木齐经济技术开发区喀什西路752号西部绿谷大厦二层办公区,650000058049147,2015-09-06,王义民,500万元人民币,91650100MA7754CJ63,www.123vdh.com
彦泽科技,深圳彦泽科技有限公司,彦泽科技是综合位置服务解决方案提供商，致力于提供创新技术与产品解决方案，让用户享有物联网中的社交、电子商务、移动办公等全方位的位置服务。GPS定位电子校牌功能：电子签到，家校互动功能，到离校短信通知学生家长。隶属于深圳彦泽科技有限公司。,深圳彦泽科技有限公司,深圳市南山区西丽街道高新区北区新西路7号兰光科技大楼7楼A-711,440301108417674,2013-11-29,胡抗震,100万元人民币,9144030008460541XW,www.51cq.cc
深感科技,北京深感科技有限公司,北京深感科技有限公司成立于2015年，专注于人脸识别算法。深感科技的人脸识别算法，采用了ResNet结构，融合了多种loss进行网络调优，算法模型展现出非常强的表征能力和泛化能力。,北京深感科技有限公司,北京市海淀区知春路1号1202室,110108020094468,2015-10-29,苏晓生,228.5714万元人民币,91110108MA001HJG0K,www.deepsense.cn
卓尔钛乙,成都卓尔钛乙科技有限公司,成都卓尔钛乙科技有限公司是一家从事智能白酒终端售卖机为核心业务、为酒类企业提供O2O营销服务平台的高端制造企业。 公司以创新的商业模式，帮助酒企实现酒类智能售卖终端直供餐饮企业、白酒价格合理化，致力于打造白酒销售渠道品牌和渠道平台，改变中国白酒消费方式和销售方式。,成都卓尔钛乙科技有限公司,成都高新区天晖路360号14层9号,510109000693935,2015-12-14,周文耀,500万元人民币,91510100MA61RX6P92,www.etiyi.com.cn
快乐星球体育,广西众星教育咨询有限公司,快乐星球儿童体育主要是围绕着3~14岁的孩子做校园、家庭、户外运动的教育理念，来弥补孩子体育运动的不足。快乐星球体育以幼儿体育为切入点，以幼儿园为精准流量入口通过家庭小区周边体育运动范围和户外体育不同的场景来解决儿童体育运动所需，打造儿童体育教育+互联网平台。,广西众星教育咨询有限公司,,450108000100496,2013-01-29,韦元亮,200万元人民币,914501080617280701
友鱼科技,深圳市友鱼信息科技有限公司,致力于整合并发展移动互联网时代的富媒体泛娱乐产业。目前，众妙投资并运营了深圳话社、深圳美人互娱，深圳友鱼信息科技，成都颜色因子四家子公司。涉及三大业务板块：以艺人经纪，艺人养成，网络综艺为代表的互动娱乐业务，以粉丝社区，网红社群，网络游戏，新媒体，垂直社交为代表的移动互联网业务，以影视广告，直播电商，商业直播，品牌推广，流量广告为代表增值服务业务。集团旗下的2万多网红主播，触达粉丝量达到9000+万人，目前正在进军韩国，东南亚市场。,深圳市友鱼信息科技有限公司,深圳市福田区莲花街道益田路西福中路北新世界商务中心2809,440301118043555,2016-11-17,刘伟,200万元人民币,91440300MA5DPA3275,www.youyuzone.com
几度聊天,上海几度信息科技有限公司,Simplr是一款基于校园的陌生人社交软件，用户需要通过校园卡或校园Edu邮箱认证后获得使用权限，软件以发现身边的同学为切入点，在发现页面用户可以根据学校，院系，年级等信息筛选用户，也根据用户的使用习惯、地理位置、活跃度等进行用户推荐。,上海几度信息科技有限公司,上海市普陀区中山北路3663号269幢204室,310107000744166,2014-07-10,姜宁,164.9435万元人民币,91310107398694267M,simplr.cn
量化平台科技,北京量化平台科技有限公司,量化平台科技是一家量化投研工具开发商，面向个人和机构提供回测表现优异的开源和半开源量化策略及说明，策略类型包括组合、择时、对冲、跨市场、跨品种等。同时平台通过策略更新订阅机制扩大智能投顾用户规模，普及量化投资理念和方法，并通过为券商和私募发展新用户来盈利。主要用户群体为二级市场投资者。,北京量化平台科技有限公司,北京市海淀区苏州街3号506-1,110108022781230,2017-01-06,徐松泉,10万元人民币,91110108MA00B2TU2K
福星学车,广州好顺信息技术有限公司,福星学车是一个学车平台，用户可以在平台上选择驾校，在线报名，隶属于广州好顺信息技术有限公司。,广州好顺信息技术有限公司,广州市高新技术产业开发区科学城科汇三街12号601房（仅限办公用途）,440101000388715,2015-11-25,黄伟星,5000万元人民币,91440101MA59AW9B3B,www.fuxingxueche.com
管车所,广东管车所资产管理有限公司,管车所是一个汽车共享租赁服务提供商 ，专注于在互联网+汽车+金融全方面的服务于汽车产业生态圈，联合新能源汽车集团+互联网领域共享平台，打造全国性保险经纪公司共同开创汽车消费金融、云端5S店和微商融合的创新模式。,广东管车所资产管理有限公司,东莞市南城区元美路华凯广场C区106号,441900002777694,2015-11-23,唐大进,1111.1111万元人民币,91441900MA4UK3YX5U,www.guanchesuo.com
斯麦高,江西斯麦高医疗器械科技有限公司,斯麦高是一家康复医疗机器人研发销售商。,江西斯麦高医疗器械科技有限公司,江西省新余市渝水区新兴工业产业园光电园11号,360504210025250,2018-01-10,宋小兵,1500万元人民币,91360504MA37NTGD1D
万国车汇,郑州万国汽车进出口有限公司,万国汽车，是在国家提出“一带一路”的大战略背景下，在郑欧班列常态化运行与郑州整车进口口岸获批的前提下，成立的首家自营分销跨境汽车电商平台企业。主营整车销售、二手车业务及零配件。,郑州万国汽车进出口有限公司,郑州经济技术开发区第八大街和经南二路交叉口创业园孵化基地3楼345号,410198000049489,2014-09-24,秦保红,5000万元人民币,91410100317217697P,www.wgcar.com
微米生物科技,广州市微米生物科技有限公司,广州微米生物是一家诊断试剂研发商，专注于体外诊断试剂及仪器的研发、生产和销售，依托时间分辨免疫荧光层析等技术，研发生产了病原微生物检测、炎症检测、产前检测、心脑血管疾病检测等系列产品，主要包括改良型醋酸白溶液、 C-反应蛋白测定试剂、降钙素原测定试剂、血清淀粉样蛋白A测定试剂等。微米生物（Weimi Bio-Tech）成立于2013年，位于广州市科学城华南新材料创新园，是一家致力于新型体外诊断技术与POCT产业融合发展的集研发、生产和销售于一体的生物医学高新技术科技企业。公司掌握了时间分辨免疫荧光层析的核心技术，拥有10多项核心专利，承担了市中小企业技术创新基金和市产学研协同创新重大专项等多项科技项目。,广州市微米生物科技有限公司,,440108000076407,2013-09-13,汪波平,2000万元人民币,91440116078417690A,www.weimibio.com
华远微电,深圳华远微电科技有限公司,华远微电是一家声表器件制造商，拥有国内领先的晶片加工和声表器件组装的全自动生产线，主要产品有声表面谐振器、声表面滤波器、表晶、晶振、传感器及射频模块等，主要应用于有线电视、卫星定位等领域。,深圳华远微电科技有限公司,深圳市宝安区沙井街道新二社区庄村路5号D、E栋,440306106037789,2012-03-05,董启明,3000万元人民币,914403005930095600,www.sfsaw.com
赏金时代,四川赏金时代网络科技有限公司,赏金时代是一个任务发布平台，提供的服务就是给那些需要帮助的人一个平台，通过平台发布需要被帮助的内容，然后通过赏金的方式来解决问题。,四川赏金时代网络科技有限公司,,510109001164399,2017-07-04,彭鹏,1000万元人民币,91510100MA6DDYJA6Q
房脉网,陕西朗恩科技信息有限公司,房脉是陕西朗恩科技信息有限公司成立的首家新房消费产业信息服务供应商首创“房脉APP+特色体验店+专职分析师”的O2O新房销售模式。,陕西朗恩科技信息有限公司,陕西省西安市经开区雅荷城市花园107-341-D,610000100278685,2006-01-23,李成,300万元人民币,91610000783669789D,www.f-mai.com
星星微店,广西南宁市超新星商品信息咨询服务有限公司,星星微店是一个网上购物的电子商务app，致力于使商户宣传并出售店内商品，为消费者提供网络付款、享受送货上门的服务。隶属于广西南宁市超新星商品信息咨询服务有限公司。,广西南宁市超新星商品信息咨询服务有限公司,南宁市良庆区五象大道15号金盛财富广场B座2112号,450108000113762,2014-12-22,韦义定,200万元人民币,9145010833073068XH,www.xxwd.wang
新精武,苏州市精新武体育培训服务有限公司,苏州市精新武体育培训服务有限公司，致力于中国青少年儿童业余武术培训，在中国营业校区到达31家，年累计培训学员达30000余人；新精武以打造小朋友“第三空间”（学校、家庭、新精武）为办学目标，以“学到一些本领、快乐的成长、强身健体”为教学理念，凭借着优秀的教练团队、不浪费学员上课每一分钟务实的教学作风、强劲的反思学习能力，迅速在行业当中脱颖而出；新精武的教学除了帮助加强青少年儿童身体素质和武术基本功，还着重于武术的表演，自信心的树立、社会技巧、磨练小朋友的坚强意志、乐观向上的人生态度；使学生的综合的素质在短期内得到明显的提高。,苏州市精新武体育培训服务有限公司,苏州市吴中西路909号(沧浪新城汇邻中心),320508000133483,2015-05-15,彭玉宝,5万元人民币,91320508339035560B,www.jwws.com.cn
中视科技,安徽中视网络科技股份有限公司,网红孵化器及互动直播平台。中视科技致力于打造网红培养基地，通过运用创新VR全景直播技术，构建旗下中国视频娱乐网为互动直播平台。,安徽中视网络科技股份有限公司,,340100000678240,2012-07-24,谢金堂,2150万元人民币,913401000501945877,www.0058.com
兔小二,上海兔小二科技有限公司,兔小二是一家酒店运营服务平台，致力于提供酒店行业互联网+运营服务。平台分为酒店管家和出行助手两大系统：酒店管家系统是一款为酒店主及管理人员提供酒店运营管理帮助的智慧系统；出行助手则为旅客提供旅行生活帮助。,上海兔小二科技有限公司,上海市杨浦区凤城路1号123幢418室,310110000873672,2017-01-24,张健东,10000万元人民币,91310110MA1G8BTT9T,www.ituxiaoer.com
女神馆,武汉市旭美尚诺电子商务有限公司,女神馆通过引入大学生在平台开店方式，提供包括女大学生创业平台、全套创业培训体系、形象培训体系、配套运营管理服务体系在内的精品服务内容，计划带动和服务10万余名大学生实现创业梦。隶属于武汉市旭美尚诺电子商务有限公司。,武汉市旭美尚诺电子商务有限公司,武汉市江夏区庙山经济开发区江夏大道16号武昌理工学院图书馆,420115000122878,2016-07-21,程添,50万元人民币,91420115MA4KN5C08U,nvsguan.com
菲力尔,前视红外光电科技（上海）有限公司,前视红外光电科技（上海）有限公司是一家红外热像仪服务商。专注于设计、开发、生产、营销和推广用于增强态势感知力的专业技术。依托我们强大的热成像系统、可见光成像系统、定位系统、测量与诊断系统，以及先进的威胁检测系统，将创新型感应解决方案融入人们的日常生活中。FLIR的产品有效改善了人们与周围环境的互动方式，增强了公共安全与人们的生活福祉，提高了能源利用效率，致力于为广大用户营造健康、欢乐的社会环境。,前视红外光电科技（上海）有限公司,上海市普陀区大渡河路168弄26号301、302室,310000400608946,2009-11-09,TODD MICHAEL DUCHENE,1700万元人民币,913100006942432177,www.flir.cn
暖芯迦,杭州暖芯迦电子科技有限公司,暖芯迦电子是一家专业从事芯片设计及半导体微电子相关产品的高新技术企业，公司主营业务包括高速无线通讯芯片、生物医疗芯片以及相关智能可穿戴设备产品等。生物芯片产业被誉为21世纪的最大产业。Nanochap暖芯迦是一家生物医疗芯片研发商，上游主营生物医疗芯片和健康产品芯片模块，于产业链中游则直接面向智能健康类产品的厂商和手机厂商，包括智能手机、手环、智能手表等。 暖芯迦成立于 2014 年，公司致力于神经刺激器、生物传感器等生物医疗类芯片和智能健康产品的研发和销售，是国内最早从事 “ 高分辨率人工视网膜 ” 研究的企业之一，已有 10 年以上的研究和开发资历。,杭州暖芯迦电子科技有限公司,浙江省杭州市余杭区五常街道文一西路998号4幢608室，杭州市余杭区五常街道文一西路998号5幢408（B）室,330184000280211,2014-02-28,周莉莉,1147.3435万元人民币,9133011009205374XR,www.nanochap.cn
柳丝木,广州华图化妆品科技有限公司,柳丝木是一个唇部护理品牌，一个“质”高无上，美丽不昂贵的美妆品牌。柳丝木唇部产品均使用食品级成分，不含防腐剂、香精、色素、矿物油，主打天然安全的概念，这与时下流行的健康、绿色生活理念不谋而合。,广州华图化妆品科技有限公司,广州市白云区黄园路129号(2栋)1120房,440111000031672,2009-09-04,邓建明,500万元人民币,91440111693588643F,www.ositree.com.cn
众辰科技,上海众辰电子科技有限公司,上海众辰电子科技有限公司位于上海市风景秀丽的松江区泖港镇，是一家专注于电气传动、工业自动化产品的研发、生产、销售和服务为一体的工业设备制造商。公司成立于2005年，目前厂房面积约27000㎡，是目前最具规模的变频器厂商之一。公司拥有先进的生产设备、检验设备和办公设备，先后通过了IS09001质量管理体系认证和欧盟CE认证。,上海众辰电子科技有限公司,上海市松江区泖港镇新波路517弄8号,310104000336756,2006-02-20,张建军,3766万元人民币,91310117785618491Q,www.zc-drive.com
万维博石,北京万维博石农业科技有限公司,万维博石成立于2015年9月，是国内领先的互联网时代下的农业大数据服务提供商和农产品交易商。公司业务围绕着小麦、玉米等大宗农业商品展开，推出了交易决策平台、物流调度平台、数据分析平台的产品矩阵。公司管理团队来自于顶级私募基金、顶级游戏互联网平台、资深云计算平台和知名上市公司，拥有该领域,北京万维博石农业科技有限公司,北京市朝阳区静安东里12号院4号楼六层A601室,110105019872330,2015-09-17,张霆,6667万元人民币,91110105358327454U,www.wvagri.com
中泰橡胶,信阳中泰橡胶贸易有限公司,中泰橡胶是一家轮胎贸易公司，公司主要经营汽车轮胎，代理世界品牌和国内知名品牌等等,信阳中泰橡胶贸易有限公司,,411500000012143,2011-10-27,李萍,300万元人民币,9141150058438473X2
劳恩普斯,成都劳恩普斯科技有限公司,成都劳恩普斯科技有限公司是一家政府参与的油田技术服务商，专注于油气藏增产技术领域服务，提供技术领先的油田化学品技术解决方案，主营油气田酸化压裂技术研发、现场施工服务、化学品解决方案，是国内页岩气压裂液化学品技术与产品主力供应商致力于油气藏开采的增产、降本、环保三方面。,成都劳恩普斯科技有限公司,中国(四川)自由贸易试验区成都高新区府城大道西段399号7栋3单元8层803号,510109000518658,2014-12-17,任山,3157.895万元人民币,915101003215707925,www.cdleps.com
南北电子,广州南北电子科技有限公司,专注于创新医疗器械研发、制造和服务，是医疗器械“微型化、轻量化、无线化”的倡导者和践行者，致力于通过产品和商业模式创新，推动医疗服务的进步和发展。公司拥有技术特色鲜明、市场竞争力强的多条产品线，并逐步形成了完整的研发、生产体系以及遍布全球的销售网络，致力于发展成为全球领先的微型光电诊疗设备与解决方案供应商。,广州南北电子科技有限公司,广州经济技术开发区科学城天丰路5号202-1房,440108000004365,2009-09-03,黎燕红,1050万元人民币,91440116693588352L,www.nsechina.com
尚翼科技,杭州尚翼科技有限公司,尚翼科技是一家众创空间服务提供商,杭州尚翼科技有限公司,,330184000426824,2016-01-05,潘小口,1000万元人民币,91330110MA27WN8Q81
志丰印刷,中山市志丰印刷实业有限公司,中山市志丰印刷实业有限公司是一家软包装业印刷服务商。创办于1988年，一贯以真挚、专业的精神致力发展软包装业，精益求精、力求完美；到1997年公司起了决定性的变化，在业务方向及设备投入方面都进行了大幅度的改变，专业只做商标标签的印制。,中山市志丰印刷实业有限公司,中山市小榄镇西区工业区,442000000282247,1997-12-04,郑源标,500万元人民币,91442000617776167E,www.tagboard.com.cn
小宝充电,北京租乐科技有限公司,小宝充电的产品形态为立式大机柜，充电线与充电宝一体。韩迪称目前已经向供应链下单投产，将优先布放在进入门槛较高的大交通场景，原因在于此类场景人流量最为密集，且小宝充电股东拥有相关渠道资源。,北京租乐科技有限公司,北京市海淀区温泉镇中央档案馆西侧（原温泉农业服务中心办公楼）620号，北京市海淀区温泉镇中央档案馆西侧(原温泉农业服务中心办公楼)620号,110108022563812,2016-12-06,韩迪,万人民币,91110108MA00A3J19G
水源网共享水平台,北京华夏昌达商贸有限公司,水源网共享水平台是一家共享智能饮水机服务提供商，通过在室外投放相应数量的共享智能饮水机，用户可依照专属二维码扫码完成移动支付，即可享用洁净、安全的热水，主要服务于旅游景区、学校、商场等场所。,北京华夏昌达商贸有限公司,北京市朝阳区西大望路甲2号8层8F-27,110105016458571,2013-11-13,王华,500万元人民币,91110105082863677G
瑞鲨,江西瑞鲨信息技术有限公司,瑞鲨移动联盟经营团队有着多年的移动广告联盟运作经验，创建并运营了多个国内顶尖的网络广告联盟。技术团队独立研发了业界领先的广告推送、防作弊、效果分析等自主技术。凭借企业强大的资金实力、灵活安全的付款方式，建立了良好的市场口碑，与众多流量开发者及各行业广告主建立了长期稳定的合作关系。瑞鲨移动联盟致力于以创新求生存、以诚信谋发展的企业宗旨，建设一流平台，争创流量开发者、广告主及公司员工共赢局面。,江西瑞鲨信息技术有限公司,江西省上饶市上饶县罗桥街道办旭日北大道307号,,2018-03-01,卓友圳,1000万元人民币,91361100MA37QDXQ9T,www.ruisha.com
种子娱乐,深圳市前海种子娱乐科技有限公司,种子娱乐是一家专业从事VR虚拟现实游戏研发生产，运营维护的公司，致力于自主研发pc端游戏以及手游，维护运营，更好的服务于用户，为顾客提供计算机软件技术解决方案。,深圳市前海种子娱乐科技有限公司,深圳市前海深港合作区前湾一路1号A栋201室（入驻深圳市前海商务秘书有限公司）,440301116726786,2016-07-05,薛扬,1000万元人民币,91440300MA5DFUP27K
嘟嘟养成记,杭州嘟云科技有限公司,嘟嘟养成记是一个基于云端服务的幼儿行为养成和成长记录平台。老师和家长可以在嘟嘟养成记中记录下宝贝平日中在园、在家以及外出游玩时的精彩瞬间，帮助宝贝养成良好的行为习惯。根据家长和老师的共同记录，嘟嘟养成记系统会自动整理生成可永久保存的电子成长档案，家长可随时查看。科学的评价体系帮助宝贝养成良好的行为习惯。,杭州嘟云科技有限公司,浙江省杭州市江干区九环路63号1幢1楼1175室,330104600558172,2014-07-21,侯维玮,111.1111万元人民币,913301043113058131,www.ddycj.com
津启创恒,津启创恒（天津）科技有限公司,主营业务有：企业孵化服务；创业指导服务；企业管理服务；知识产权代理服务；物业管理；自有房屋租赁；企业营销策划；会议及展览展示服务；教育信息咨询（教育培训除外）；商务信息咨询；计算机软硬件技术开发、转让、咨询、服务；组织策划文化艺术交流活动；批发和零售业。,津启创恒（天津）科技有限公司,,120113000318354,2017-04-13,齐高,10万元人民币,91120113MA05PPQ36Q
姜芋科技,大连姜芋科技有限公司,姜芋科技是一家VR教育内容研发商，致力于借助VR内容开发，打造新的教育模式，实现课程知识与技术的结合，主要开发产品为VR课本，用以取代当下投影设备，帮助课堂教育增加兴趣，提升孩子的学习积极性。,大连姜芋科技有限公司,,210211000206597,2016-07-05,赵宇飞,20万元人民币,91210211MA0QEULP7W,m.vr-steam.com
巅峰科技,深圳市巅峰科技股份有限公司,巅峰科技是一个综合电商服务平台，专注于消费类电子产品的研发、生产和销售，定位于产品推广和品牌经营，并拥有完善的销售体系。,深圳市巅峰科技股份有限公司,深圳市南山区南海大道南山大厦600A#,440301103345211,2005-09-07,张亚伟,500万元人民币,91440300779858106H,www.dftop.com
