名字,公司,介绍,公司,地址,身份证,时间,法人,注册金额,编号,网址
尚且猫智能,武汉尚且猫智能科技有限公司,尚且猫智能是一家智能语音系统开发商。致力于人工智能语音的算法，核心技术分别为语音识别系统、自然语言处理系统、客户营销管理系统、大数据分析系统和呼叫通讯管理系统。随着人工智能时代的到来，武汉尚且猫率先发布了“尚且猫”智能语音系统，该系统识别率高达95%左右。,武汉尚且猫智能科技有限公司,武汉市东湖新技术开发区珞喻东路4号慧谷时空1栋18层01号-7,420100000683430,2016-09-14,孙自亮,580万元人民币,91420100MA4KNHBG5C,shangqiemao.com
圣才电子书,圣才电子书（武汉）有限公司,圣才电子书（武汉）有限公司是一家开发、制作与销售3D电子书（题库）的专业性电子书公司。圣才e书是中国首家可植入高清视频讲解720度立体旋转的新型电子书。,圣才电子书（武汉）有限公司,洪山区工农湾樱花大厦B单元16、17层B-1601、1603、1604、1701,420111000058371,2008-10-20,段久龙,2200万元人民币,91420111679138515L,e.100xuexi.com
本威,杭州本威进出口股份有限公司,杭州本威进出口有限公司是一个纺织品原材料和纱线的贸易公司；主要市场为独联体市场、南美市场、中东市场等。,杭州本威进出口股份有限公司,,330104000175962,2012-08-03,周丽含,500万元人民币,91330100599579134M,www.bowchina.cn
九洲互通,深圳市九洲汇通国际货运代理有限公司,九洲互通是一个移动支付、B2B2C及供应链金融综合服务平台，通过公司的移动平台和智能POS终端等软硬件，推出了集线上销售、线下配送、ERP连接工厂直采、实时库存的一体化门店移动端SaaS平台，为中小商户提供与工厂直连的渠道，降低运营成本。,深圳市九洲汇通国际货运代理有限公司,深圳市宝安区福永街道下十围下沙南五巷五号102（办公场所）,440301105718560,2011-09-21,谢志强,200万元人民币,9144030058274579X4,www.szjzht.com
捷福装备,捷福装备（武汉）股份有限公司,捷福装备(武汉)股份有限公司是电阻焊接设备的专业生产商，主营业务为电阻焊接类产品及相关设备的研发、生产和销售。公司的主要产品是电阻焊接全系列产品，包括应用于汽车制造行业的电阻焊接控制柜、电阻焊钳以及电阻焊接类产品的维修、配件销售。另外公司还拥有和车体制造相关的工装夹具类产品。,捷福装备（武汉）股份有限公司,武汉经济技术开发区17C1地块东合中心E栋9层2-5室,420100400000385,2007-07-30,李贵生,4970万元人民币,91420100663464252B,www.isi-gf.com
巴口香,察布查尔锡伯自治县牧源农业发展有限公司,"""新疆巴口香农业投资发展股份有限公司自成立以来一直从事农产品的种植与销售，目前公司主要种植的品种包括小麦、青贮玉米、玉米、苜蓿等农作物，各类农作物年种植面积约22,000亩。""",察布查尔锡伯自治县牧源农业发展有限公司,新疆伊犁州察布查尔县固尔扎路,654122050001652,2011-02-25,张新贤,3000万元人民币,91654000568867782L,--
电驾游,北京电驾游信息技术有限公司,电驾游是一家电动汽车自驾游服务提供商，为新能源汽车车主提供自驾游过程中的各项服务，主要业务：提供电动汽车自驾游出行服务，其中包括电动汽车出行攻略、酒店预订、充电服务等。隶属于北京电驾游信息技术有限公司。,北京电驾游信息技术有限公司,北京市丰台区汽车博物馆东路6号3号楼1单元7层702（园区）,110106021874110,2016-08-16,周振飞,222.22万元人民币,91110106MA007PEW4J,www.evyou.com
Go户外,上海磐拓电子商务有限公司,上海磐拓电子商务有限公司是一家专业经营各类户外用品的电子商务公司，旗下的品牌磐拓户外创立于2014年，是集户外产品购买、知识普及、活动策划的一站式平台，目前代理经营多个世界顶级户外品牌，涉及数百款产品，并同时拥有线上、线下多种销售渠道。,上海磐拓电子商务有限公司,上海市嘉定区安亭镇嘉松北路6988号1幢1层108室J154,310114002653376,2014-02-14,潘攀,797.619万元人民币,913101140879364258,www.pantuo.com
早豆,上海闺音科技有限公司,上海闺音科技有限公司是一家洗发水销售商。致力于研发含咖啡因的防脱发护发洗发水。,上海闺音科技有限公司,浦东新区新场镇沪南公路7508弄2-24(双)号3层,,2018-09-06,王可佳,100万元人民币,91310115MA1HA8D38T
中茂圣达,中茂圣达电子商务有限公司,中茂圣达是一家电子商务公司。,中茂圣达电子商务有限公司,北京市海淀区羊坊店路18号2幢12层1235-6,,2018-04-10,代启超,8000万元人民币,91110105MA01BAQT8T
极阅,极跃互动科技（北京）有限公司,极阅是由极跃互动科技(北京)有限公司开发的一款手机资讯类阅读软件，支持IOS和Android平台。,极跃互动科技（北京）有限公司,北京市海淀区中关村东路18号1号楼C-511,110108013613752,2011-02-25,崔英三,5万元人民币,,jiyue.cc
Biubiulive,深圳市朗雅新媒体网络科技有限公司,Biubiulive集短视频社交，任务分期，信用购物互动模式来达到为品牌创意营销的电商平台，用户商城产品信用下单后收到产品通过拍摄产品的创意视频分享来取得免费拥有的权益，通过任务信用分期形式达到互助推广和营销。自身通过自己的劳动成果创造自身的价值获取商品的免费权，同时为商家品牌方省去更多中间商投入成本，通过用户参与产品的创意拍摄视频分享获得品牌传播和曝光，让更多的人来参与，不仅得到的了产品的推广更能通过短视频海选代言获得产品更好的创意介绍，为后续品牌推广做创意营销沉淀。,深圳市朗雅新媒体网络科技有限公司,深圳市前海深港合作区前湾一路1号A栋201室(入驻深圳市前海商务秘书有限公司),440300204947150,2018-07-13,汪章成,500万元人民币,91440300MA5F7RBD8N,www.zulaaa.com
惠众二手车,潍坊惠众二手车交易服务有限公司,惠众二手车交易平台是一个车源信息采集，整合.销售于一体的信息平台一个旨在改变传统交易模式，约束规范市场交易形式的服务交易公司，一个服务全面，覆盖广阔，快速成交，专业帮买帮卖，评估鉴定服务型平台公司解决车辆买卖交易中缺少的专业性.不信任.车况不透明.利润不透明.买卖客户信息不共享，导致一系列成交难现状,潍坊惠众二手车交易服务有限公司,,370705200159830,2016-11-10,王玉磊,200万元人民币,91370705MA3CL8RNXQ,www.huizhong1.cn
东阿阿胶,东阿阿胶股份有限公司,东阿阿胶股份有限公司，成立于1952年，1996年上市。公司拥有中成药、保健品、生物药等产业门类，系全国最大的阿胶系列产品生产企业，产品远销欧美及东南亚各国，系国家高新技术企业、国家级创新型企业、国家胶类中药工程技术研究中心、国家胶类中药标准引领者，国家级非物质文化遗产东阿阿胶制作技艺传承人企业。,东阿阿胶股份有限公司,山东省东阿县阿胶街７８号,370000018003312,1994-06-04,秦玉峰,65402.1537万元人民币,91370000168130028J,www.dongeejiao.com
班图网络,上海班图网络科技有限公司,上海班图网络科技有限公司不仅是一家从事移动游戏研发的新兴互联网公司，更是一家文化传播平台，旗下的同人游戏平台开创的众创模式，汇聚了五湖四海的作者，他们在同人游戏引擎下发挥创意制作游戏，将历史文化用游戏的方式重新演绎，让玩家在游戏中学习并乐在其中。公司搭建的同人游戏平台是移动互联网上第一个战棋RPG游戏平台。,上海班图网络科技有限公司,上海市闵行区东川路555号戊楼1218室,310112001371060,2014-05-08,沈李明,476.22万元人民币,91310112301691167K,www.trgame.cn
南京中港电力,南京中港电力股份有限公司,"""南京中港电力股份有限公司，是一家以清洁能源汽车产业为核心业务的国家级高新技术企业，拥有汽车级体系认证标准的专业化工厂，秉承“以客户价值为导向，致力清洁能源汽车发展”的理念，致力于为客户提供高可靠性、高效率、高功率密度的电力电子解决方案。公司自2013年成立以来，业务快速发展，建立了业界一流的产品研发、测试及制造的软硬件平台，通过了ISO9001, ISO14001, ISO16949等权威认证，赢得了北汽新能源、东风日产、长安、江淮、奇瑞、吉利、众泰、知豆等国内外一流的清洁能源汽车整车制造企业的信任合作。研""",南京中港电力股份有限公司,南京市江宁区东山街道东麒路6号,320125000139924,2013-04-22,杨晓川,1060.1774万元人民币,91320115067051670U,www.zg-ps.com
遨趣网,南京遨趣网络科技有限公司,遨趣网是一个在线商旅资讯及网络预订服务平台，以专业免费电子语音导游服务为载体，提供机票、酒店、景区门票、车辆预订等商旅服务。,南京遨趣网络科技有限公司,南京市雨花台区郁金香路17号C栋6楼（5号工位）,320105000184674,2014-01-02,钱成龙,240万元人民币,91320114088138716F,www.ourtrip.cn
聊城粤泰,聊城粤泰汽车配件有限公司,,聊城粤泰汽车配件有限公司,未知,371500018022416,2000-02-25,孔桂芬,111万元人民币,91371500863137352D
答尔文,深圳市华问科技有限公司,专业的知识社交平台——答尔文，答尔文app为用户提供一个答疑解惑的平台，用户在这里可以将生活中的疑难问题提出来，专业人士会为你解答。,深圳市华问科技有限公司,,440301118110885,2016-11-24,汪昊旻,222.22万元人民币,91440300MA5DPM6X22,www.aihuawen.com
家喻新材,贵州安顺家喻新型材料股份有限公司,"""公司主要从事蒸压加气砼砌块、蒸压粉煤灰砖等新型墙体材料及其他建筑、装饰材料的研制、生产和销售。公司凭借自主生产的蒸压加气砼砌块、蒸压粉煤灰砖,向建筑工程承包商、房地产开发商或个人等建筑工程施工单位及个人提供质量可靠的产品。""",贵州安顺家喻新型材料股份有限公司,,522501000091454,2011-07-29,何克行,3000万元人民币,915204005806512206
成格信息,广州市成格信息技术有限公司,成格信息专注于成为专用通信设备及专用信息处理系统提供解决方案供应商，是各种新型的、非标的、更加专业的信息处理系统创造者。以”科技创新 ，自成一格”的企业定位向客户提供优质的产品和优异的服务为己任。努力打造成为客户的理想供应商和合作伙伴。,广州市成格信息技术有限公司,广州市天河区中山大道西89号办公楼(部位:C栋401-402房)(仅限办公用途),440106000332116,2010-11-10,林俊发,1400万元人民币,91440106563985982D,www.chgit.com.cn
迎啦,广州互迎网络科技有限公司,迎啦是一个AI流量开放平台。,广州互迎网络科技有限公司,广州市天河区科韵路12号之一1102室(仅限办公),,2019-03-22,赵耀,100万元人民币,91440101MA5CN55E23
电玩青年科技,厦门电玩青年网络科技有限公司,暂无信息,厦门电玩青年网络科技有限公司,,350299200071424,2016-04-19,黄森堂,2万元人民币,91350200MA347L0363
南京爱必梦,南京爱必梦生物材料有限公司,南京爱必梦生物材料有限公司（abm）,南京爱必梦生物材料有限公司,南京市浦口区经济开发区万寿路15号C1幢401-87号,320100400052356,2012-10-23,李沛祥(Li Peixiang),400万元人民币,913201000532805367,www.abmgood.com
速优达科技,深圳市速优达科技有限公司,速优达科技是一家致力于汽车后市场的电商。公司目前主要在京东POP平台和自营平台经营车载电子产品，产品线包括行车记录仪、电子狗、导航仪、车载电源和其他车载配件。旗下品牌和代理品牌包括阿波罗、罗波特、联想、海尔、博鹏第1现场、肯尼等。,深圳市速优达科技有限公司,深圳市龙华新区大浪街道华庭路131号鹏腾达工业园1栋5F,440301107841979,2013-08-26,程玄英,100万元人民币,91440300077507731M,www.ropote.com
阿尔法链,深圳金信时空科技有限公司,阿尔法链是一个投融资全生态链智能服务平台，基于投融资领域及大数据征信领域资源，为用户提供投前尽职调查、投后智能监管、股权转让及证券化、企业股债融资优化、招商引资分级优选等功能，同时提供具有大数据深度解析评价的尽职调查报告。,深圳金信时空科技有限公司,,440300202490330,2017-09-25,马填依,10000万元人民币,91440300MA5ER1F04Y
丹拓商城,吉林省丹拓科技有限公司,丹拓商城，隶属于吉林省丹拓科技有限公司，是吉林省垂直电商办公领域商务企业。网站于2014年7月22日正式上线，率先在国内成功实现了由线上“丹拓商城”与线下“丹拓办公一体化解决方案展厅”为基础的“双平台B2B2O”经营模式。,吉林省丹拓科技有限公司,高新区卫星路以南，致远街以东盈泰国际1幢1011号房,220107000023332,2014-03-18,于海军,101万元人民币,912201010951222373,www.dt118.com
青瞳视觉,上海青瞳视觉科技有限公司,青瞳视觉是一家红外光学位置追踪系统研发商，产品可进行实时流畅动作捕捉，广泛应用于军工，医疗，教育科研，生命科学工程，虚拟仿真，影视特技与三维动画游戏制作等领域。公司专注于交互方案研究，为客户提供优质，稳定的交互方案。,上海青瞳视觉科技有限公司,上海市静安区广中路805、851号2幢804室,310108000605165,2015-08-07,张海威,222.2222万元人民币,9131010835116287X5,www.chingmu.com
优拜单车,上海轺辂信息技术有限公司,优拜单车专注于为用户短途出行提供解决方案，公司已单车为切入点，为用户创造新的出行方式。连接这些数量庞大、市场反响不够积极、没有充分使用的政府资源，在停车桩、扫码解锁上对其做出改进。隶属于上海轺辂信息技术有限公司。,上海轺辂信息技术有限公司,浦东新区南汇新城镇环湖西二路888号C楼,310115003173571,2016-09-21,余熠,195.61万元人民币,91310115MA1H877E67,www.ubike.cn
闽鹭房,厦门闽鹭房电子商务有限公司,厦门闽鹭房电子商务有限公司（简称闽鹭房社交），是在外贸大环境不景气的情况下诞生的一家致力于为中国外贸型B2B和B2C企业提供海外本土化社交媒体运营的专业性、高成长型的公司。 在外贸行业定制化企业官网+创意内容制作并采用运营手段、线下实操培训，为外贸客户提供最佳化的一站式海外全网营销解決方案。服务团队深耕电商、外贸、旅游、品牌等多个领域，拥有自己的培训基地，摄影工作室，运营工作室等设施，服务众多知名品牌和各行业翘楚，并且在全球市场充分获取官方资源支持和跨境营销经验。闽鹭房海外广告创意专家，为客户提供基于广告历史数据以及市场现状数据的素材创意与制作服务，并且有专门的广告投手，为跨境企业提供广告投放技术支持。,厦门闽鹭房电子商务有限公司,厦门市思明区古兴里6栋1204室,,2018-04-18,欧阳吉,200万元人民币,91350203MA31M7U032,minlufang.top
汇元通,上海汇元通商务服务有限公司,汇元通集团中国总部设在上海。自2007年以来，中国业务取得了长足的发展。在中国国家外汇管理局和其他相关部门的大力支持下， 上海汇元通商务服务有限公司是最早一批获得特许外币兑换资质的专业外币兑换公司之一。 依托精心打造的强大外币兑换操作系统和完善的专业管理团队，汇元通将为中国庞大的外币兑换市场提供一流的专业服务。,上海汇元通商务服务有限公司,中国(上海)自由贸易试验区新金桥路27号13号楼2层,310115400222689,2007-04-24,郑杰,500万美元,91310115660767039B,www.geoswift.com.cn
心音传媒,安徽心音文化传媒有限公司,心音传媒主营项目：音乐，电影，综艺节目的开发，创作和制作，及发行。艺能综合培训。,安徽心音文化传媒有限公司,合肥市蜀山区望江西路198号信旺?华府骏苑13幢-14幢13-1213,340100001289688,2015-06-25,苏杭,650万元人民币,913401003439584058
国投电力,国投电力控股股份有限公司,"""国投电力控股股份有限公司（股票简称“国投电力”，股票代码“600886”）于2002年由湖北兴化与国家开发投资公司(简称“国投公司”)进行资产置换后变更登记设立。目前公司总股本6,786,023,347股，其中，国家开发投资公司持股3,337,136,589股，占公司总股本的49.18%。""",国投电力控股股份有限公司,北京市西城区西直门南小街147号楼11层1108,620000000006064,1996-06-18,胡刚,678602.3347万元人民币,911100002717519818,www.sdicpower.com
快托网,山东阿帕网络技术有限公司,山东阿帕网络技术有限公司是“国家智慧物流示范企业”“临沂十佳电商企业”临沂电子商务示范企业”。公司由新加坡罗宾逊控股有限公司投资创立，公司位于“物流之都”临沂。公司旗下“快托网”主要是服务物流业，帮助物流行业进行标准化和信息化，让物流从线段式运输走向网状式运输。,山东阿帕网络技术有限公司,山东省临沂市高新区应用科学城B座8楼,371331200007798,2013-04-16,周纪念,5000万元人民币,913713000673687316,www.kt56.com
中外运化工,中外运化工国际物流有限公司,中外运化工是一家综合性物流服务公司，公司致力于为客户提供化工综合物流供应链解决方案，业务范围涵盖了国际货运代理、危险品剧毒品道路运输、仓储、散装化学品物流、多式联运、工程物流及增值服务。,中外运化工国际物流有限公司,上海市化学工业区目华北路599号,310000400294576,2002-03-20,刘波,4985.9797万美元,913100007109368748,www.sinotransline.com
佳灿信息,杭州佳灿信息科技有限公司,永灿成立于2005年，沪上较有影响力的专业线上营销服务商。通过十几年的发展，已经拥有过百人的专业营销及技术团队，,杭州佳灿信息科技有限公司,浙江省杭州市萧山区宁围街道钱江世纪城宝盛世纪中心A楼1109室(托管586),330102000117475,2014-02-12,黎长鑫,10万元人民币,91330108088899072P,www.ucantech.com
合宙通信,上海合宙通信科技有限公司,合宙通信是一家物联网行业无线通讯领域的专业方案商，提供GPRS、GPS、WIFI模块硬件开发，软件系统开发等服务。隶属于上海合宙通信科技有限公司,上海合宙通信科技有限公司,上海市黄浦区北京东路666号C区816室,310115002322872,2014-05-22,秦鹏,1000万元人民币,91310101301429919J,www.xiaomanmanxiao.com
云朗网络,河南云朗网络科技有限公司,河南云朗网络科技有限公司是一家集软件开发、智能设备集成、移动互联网产品运维为一体的科技公司。,河南云朗网络科技有限公司,郑州市郑东新区商务外环路1号27层2701号,410101000244016,2015-12-09,袁首京,500万元人民币,91410100MA3X5NPF4C,www.yunland.com
红杉传媒,福建红杉传媒有限公司,红杉传媒是一家网红孵化与推广平台，主要业务范围有主播经纪、原创IP内容输出、品牌授权及衍生产业定制一站式直播化服务。,福建红杉传媒有限公司,,350103100464101,2016-11-21,高翔,106.6667万元人民币,91350103MA2XRUFQ8J,www.1wanghong.com
微喵,成都腾木科技有限公司,微喵是一个酒吧营销互动服务平台，可实现场景社交、娱乐互动、游戏互动、点歌打赏、直播等功能，丰富了娱乐生活，助力酒吧增加收入；喵STAR于2019年1月上线，从业者注册量达30万人，产品获取酒吧从业者大数据，精准匹配，直接沟通，能实现垂直招聘、影视资源、艺人培训、签约孵化等；喵BOSS：已于2019年1月上线，具备酒水销售、订座点单、拼桌约酒、收益管理等功能；喵扑APP、公众号、小程序：可实现活动发布、粉丝运营、地图社交、引流导客等功能。,成都腾木科技有限公司,中国(四川)自由贸易试验区成都高新区萃华路89号1栋1单元24层2401号,510107000642744,2013-04-11,张毅,772.5876万元人民币,91510107064337024Q,wemew.cn
海文石影视,天津海文石文化传播有限公司,视频影视公司。海文石影视的项目是一个比较偏传统影视公司，主要是帮一些公司做内容制作的额事情，网剧，定制视频等等业务。,天津海文石文化传播有限公司,,120103000260214,2016-02-25,邓建,30万人民币,91120103MA05J07C8B
拎包客,杭州风口投资管理有限公司,拎包客是一个集居住、创业办公、交友、娱乐为一体的青年社区，楼下休闲咖啡厅、影视厅、健身房、台球室、采访室、洗衣中心，为创业群体提供优质房屋租赁服务，通过资源整合，在居住空间中创造新的价值。,杭州风口投资管理有限公司,杭州市滨江区滨安路1197号2幢447室,330184000343935,2015-02-12,华杰,135.87万元人民币,91330110328259999M,www.linbaoke.com
北京科锐,北京科锐配电自动化股份有限公司,"""北京科锐配电自动化股份有限公司是一家从事12kV配电及控制设备的研发、生产和销售的企业.其主要产品包括箱式变电站、永磁机构真空开关设备、环网柜等.公司坚曾率先引进、推广和研发户外环网柜、美式箱变、永磁机构真空开关设备、故障指示器、重合器、GRC箱壳等多种新型配电设备及技术.公司为""""国家火炬计划重点高新技术企业""""、""""北京市高新技术企业"""",公司技术研发中心被认定为""""北京市级企业技术中心"""".公司自成立起即从事配电及控制设备的开发与生产,是国内最早从事配电自动化设备开发与生产的企业之一,在行业内处于领先地位。""",北京科锐配电自动化股份有限公司,北京市海淀区西北旺东路10号院东区4号楼107,110000005016383,1993-07-17,张新育,50027.1975万元人民币,9111000010209313X4,www.creat-da.com.cn
中金亿信,中金亿信（北京）投资基金管理有限公司,"""中金亿信集团是经国家工商管理总局核准成立的综合性金融服务企业。在中国金融行业服务领域，中金亿信集团在近几年的改革发展征程中，始终秉承“专业、勤勉、诚信、共赢“的企业经营理念，积极履行企业社会责任，为服务经济社会发展,提供了全方位、高质量的金融服务。 目前，中金亿信集团旗下拥有中金亿信(北京)投资基金管理有限公司、中金亿信财富投资管理（北京）有限公司、北京亿信实坤投资有限公司、亿信（北京）金融信息服务有限公司、中金亿信(北京)金融服务外包有限公司等五家全资子公司。业务领域涵盖财富管理、股权基金（Pre-IPO""",中金亿信（北京）投资基金管理有限公司,北京市朝阳区东三环中路7号4号楼33层3807,110000016228557,2013-08-27,李胜,10000万元人民币,911101050765934478,www.zhongjinyixin.com
盈丰食品,盈丰食品股份有限公司,盈丰食品股份有限公司以食品加工开发为主导产业，实行多元化发展战略，面向全国、走向世界。公司拥有盈丰食品股份有限公司本部，漳州泉丰食品开发有限公司，东山融丰食品有限公司等多家企业。,盈丰食品股份有限公司,漳浦县绥安镇黄仓开发区,350000400001914,1993-01-06,李飞跃,32000万元人民币,913506006114553892,www.yingfeng-cn.com
Sumscope森浦资讯,宁波森浦信息技术有限公司,Sumscope森浦资讯是一家主打金融科技和财经数据服务公司，目前专注于固定收益及衍生品市场，为客户提供工作平台、实时资讯平台以及Data service服务。此外还提供银行间市场实时报价解决方案。客户包括货币经纪公司、银行、证券公司、基金公司等金融机构。森浦资讯一直以客户需求为导向，致力于帮助客户创造可持续的竞争优势。2012年3月，森浦资讯成立了宁波数据中心，扩大了数据资源的累积规模，为客户提供更加全面的数据信息服务。,宁波森浦信息技术有限公司,宁波市鄞州区首南街道新兴工业园区,330212000276822,2010-02-09,王枫,5200.6997万元人民币,91330212551505566A,www.sumscope.com
四维祥泰,北京四维祥泰科技有限公司,四维祥泰是一家专注于服务妇科医疗领域，集产品研发、生产、销售、服务为一体的综合性科技型企业，专注妇科宫颈癌、子宫内膜 癌筛查领域、辅助生殖耗材领域相关产品的研发、生产和销售，并提供相关销售和售后服务。,北京四维祥泰科技有限公司,北京市石景山区时代花园南路17号6层608室,110107012871991,2010-05-12,苏思明,250万元人民币,9111010755484140X0,www.bjswxt.com
