名字,公司,介绍,公司,地址,身份证,时间,法人,注册金额,编号,网址
大管家APP,河南大管家金融服务有限公司,河南大管家金融服务有限公司（简称河南大管家、大管家）创立于2013年，是一家专业从事互联网技术研发、金融技术外包服务为主的高科技企业。 大管家秉承“诚信、敢为、创新、共赢”的核心理念，专注为客户提供售前、售中和售后的一站式互联网金融服务。,河南大管家金融服务有限公司,郑州市二七区京广南路西、代庄街北、京莎广场B座2022号,410103000165552,2015-08-18,姚志超,777万元人民币,914101033534359904,www.daguanjiajinrong.com
天弈谷能源,北京天弈谷能源技术有限公司,北京天弈谷能源技术有限公司是一家致力于节能、环保领域的创新型高科技企业， 目前公司专利产品主要包括外转子电机曳引抽油机、一拖多变频控制系统，主要经营产品包括高压变频、高压静止无功发生器、四象限变频控制柜以及数字化测控诊断系统等，产品应用广泛受到了用户的高度评价。现拥有北京天弈新能科技有限公司、沈阳天弈电机技术有限公司、濮阳天弈信宇石油装备有限公司等子公司。,北京天弈谷能源技术有限公司,北京市海淀区信息路22号A座1109室,110108012225166,2009-09-03,马宁,1000万元人民币,911101086950395921,www.techeasy.net.cn
环渤海体育,环渤海（大连）体育文化发展有限公司,环渤海体育文化发展有限公司，正式成立于2015年1月，是一家水上体育服务、帆船培训旅游、体育赛事资源、体育赛事运营及营销的企业。主要提供水上体育服务、专业水上帆船培训、国家级赛事运营、新兴赛事项目研发、体育赛事产品研发、衍生市场拓展等服务。,环渤海（大连）体育文化发展有限公司,辽宁省大连市沙河口区星海广场F区9A号4层3号,210200000644661,2015-01-27,房磊磊,1016.9492万元人民币,912102003114233184,www.hbhsports.cn
新鼎明,杭州新鼎明影视投资管理股份有限公司,新鼎明成立于2011年，至今已建成完善的影视全产业链服务体系，旗下拥有两家持牌影视基金管理公司、互联网众筹平台、16家影视厂牌公司、影院广告、数据调研、电影发行、植入广告、行业媒体、艺人经纪、音乐节、现场演出、游戏娱乐、孵化器等除播放平台以外几乎全产业链的控股子公司，协同运作更为有力的支持创作活动。,杭州新鼎明影视投资管理股份有限公司,杭州市滨江区滨安路1197号7幢387室,330108000077430,2011-06-27,方军,1000万元人民币,91330100580296169G,www.newtiming.net
御和必果,广州御和必果网络科技有限公司,广州御和必果网络科技有限公司是一家专注于高品质移动游戏开发的互联网企业，公司于2014年成立，核心团队成员都是来自游戏行业的精英，目前公司团队积累了多款过千万流水的游戏产品经验，如《梦幻西游》《天下贰》《QQ仙侠传》《御龙在天》《神将三国》等，公司核心成员更是多款成功游戏项目的主要制作和重要参与者。,广州御和必果网络科技有限公司,"""广州市天河区中山大道建工路13,15号3-6层3楼316房（仅限办公用途）""",440106001943377,2017-04-11,梅曦,100万元人民币,91440101MA59KW6U4K
途游户外旅行网,牡丹江山水旅行社有限责任公司,途游户外旅行网隶属于牡丹江市山水旅行社有限责任公司，是旗下专业的户外旅行网站，专业操作东北三省线路，已建立完整的东北旅行联盟体系。,牡丹江山水旅行社有限责任公司,黑龙江省牡丹江市西安区太平路４６号,231000100041418,2004-06-03,贺玉成,30万元人民币,91231000762712629A,www.aitoyou.com
小乔生活网,南阳双桥贸易有限公司,小乔生活网是一个在线交易B2C平台，致力于让消费者足不出户就可以浏览各个超市、卖场、连锁店中的商品信息、打折商品和促销活动等一系列消费信息。隶属于南阳双桥贸易有限公司。,南阳双桥贸易有限公司,南阳高新区创业大厦1509室,411393000015753,2014-04-22,李克,1000万元人民币,914113000993047409
乡途网,杭州八阵网络科技有限公司,乡途网，一个乡村休闲与养生旅游平台，通过地理位置与农家乐特色标签将游客和农家乐的需求进行直接匹配。隶属于杭州八阵网络科技有限公司。,杭州八阵网络科技有限公司,杭州市滨江区东冠路611号3幢6层606室,330108000103469,2012-08-10,马骞,100万元人民币,913301085995826677,www.98066.com
紫极科技,成都紫极伟业科技股份有限公司,成都紫极伟业科技股份有限公司创建于2011年。公司以智慧政府时代为契机，从行业的研究，到产品的研发-营销-体验-实施-服务，可为用户提供全方位的政务人力资源整体解决方案。目前，已成功实施的用户遍布浙江、四川、广西、云南、湖南、重庆等地。公司主营业务：电子政务领域人力资源系列软件产品的研发、生产和销售。主要产品：人事工资信息管理平台、事业单位职称评审公共服务平台、事业单位人事岗位管理系统、政务人力资源综合管理平台。,成都紫极伟业科技股份有限公司,成都市锦江区东大街下东大街段216号1栋23楼9号，成都市锦江区东御街57号13层B1、B2区,510104000106594,2011-04-07,翟永明,500万元人民币,91510100572265397R,www.kingway.net
麦芽直播,河北捷盈网络科技有限公司,麦芽直播旨在打造多元化娱乐互动直播，打破传统行业内容单一化的常态。围绕创新直播，呈现好玩、前沿、先锋、时尚、商业价值的跨界互动娱乐直播!,河北捷盈网络科技有限公司,河北省秦皇岛市海港区文昌路9号、11号,130300000062136,2009-11-03,李博龙,5000万元人民币,9113030269588776XM,www.haoqilive.cn
iCoastline海岸线,江苏海岸线互联网科技有限公司,iCoastline致力于研发供应链集成管理云平台产品，以过程质量管理（PQM）为切入点，提供供应链标准化数据采集平台和基于云技术的工业物联网整体解决方案，进阶工业大数据分析，助力中国智能制造。公司的核心技术产品包括NPI云服务，eAudit云服务，PQM云服务，MasterPlan云服务，Kanban云服务和Sorting。隶属于江苏海岸线互联网科技有限公司。海岸线的链企云平台连接供应链上下游厂商，将协同流程搬到线上。客户在平台发起需求，平台将需求按照指定规则分配给供应商，供应商登录平台管理交付计划，实时上传生产过程相关数据，数据采集方式包括设备数据接入和人工录入等。客户通过数据可视化界面，实现供应链监控与管理。海岸线采集底层业务数据和设备数据，提供管理层及决策层所需的数据可视化报表等功能。在平台沉淀了足够多的数据后，未来可向数据BI，供应链金融，行业体系标准，行业白皮书等方向扩展业务，让数据产生更多价值。海岸线产品以SaaS形式部署在云端，支持混合云，按产品模块功能订阅模式收费，上下游厂商均需付费。提供标准化产品和解决方案，其中标准化产品占比65%，两周可实现完全交付，解决方案项目周期平均为半年。,江苏海岸线互联网科技有限公司,苏州工业园区星湖街218号5幢A7楼303单元,320594000594683,2016-07-28,熊海燕,1000万元人民币,91320594MA1MQJLR7B,www.gtscloud.cc
隆锦科技,吉林省隆锦科技有限公司,"""隆锦科技是一家以自主研发为主的高科技创新型企业，专注于自闭症儿童康复训练产品设计与研发，为自闭症儿童康复训练提供系统化解决方案,引领自闭症儿童康复训练新领域。""",吉林省隆锦科技有限公司,吉林省长春市高新开发区硅谷大街526号中玖科技创业园4层,220000000170132,2011-06-30,贾秋玲,500万元人民币,912201045740897880,www.jllongjin.com
和远科技,北京和远科技有限公司,北京和远科技有限公司(Hysim Technology)是面向高端制造业提供虚拟仿真应用与咨询服务的高新技术企业，是一家专业的提供虚拟仿真软件开发、项目制作、系统集成业务的整体解决方案提供商和服务商。,北京和远科技有限公司,北京市朝阳区朝阳路69号1号楼9层2-1001号,110108017477754,2014-06-30,宋子明,1000万元人民币,91110105306380958R,www.hysim.cc
毅御实业,上海毅御实业有限公司,上海毅御实业有限公司是一家专业代理国内外工业自动化产品的内资公司，公司自成立以来始终把客户利益放在首位，在保证产品质量、供货周期及各项全方位服务的前提下，紧密把握产品信息和行业动态，以市场为导向，以产品为根本，不断改革创新，与时俱进。公司拥有一支经验丰富、认真负责、业务精湛的团队，在坚持不懈的努力下，凭借诚信、务实、高效、专业的工作作风，用扎扎实实的行动把一流的产品和最佳的服务奉献给客户，赢得了广大客户的一致信赖和好评。,上海毅御实业有限公司,上海市金山区金山卫镇钱鑫路301号205-H室,310116003080350,2014-04-30,祝翀,500万元人民币,91310116301567932R,www.yycch.com
GROWTHPOWER旋动,东莞市元皓运动器材有限公司,GROWTHPOWER旋动是一家运动器材零售品牌，其产品主要包括碳纤鞋、平花鞋、儿童可调鞋、滑板、护具、头盔等，用户可通过淘宝官方旗舰店以及京东店购买所需产品。,东莞市元皓运动器材有限公司,东莞市厚街镇博览大道桥头西段,441900001733395,2013-10-09,杨华,10万元人民币,91441900081084794Q
信美留学,北京信美联合国际教育咨询有限公司,信美留学以美国高端留学咨询和申请为主要业务。目前公司正在向互联网教育方向转型，以全新的运作模式建立互联网留学服务模式，开创互联网留学第一品牌。公司始终坚持“以信立业，以美成人，因信而美”的服务理念，为客户提供更为便捷、强大和完善的国际教育整体解决方案。,北京信美联合国际教育咨询有限公司,北京市朝阳区建国路93号院12号楼305号,110105015297615,2012-10-12,黄玲艳,200万元人民币,91110105055603300B,www.xinmeiedu.com
立刻保,北京立康保险代理有限公司,立刻保是一家综合保险服务平台，致力于车险、医疗险、寿险等快速投保服务，北京立康保险代理有限公司旗下网站。,北京立康保险代理有限公司,北京市朝阳区静安里26号楼501内5005室,110101012475812,2009-12-10,倪伟,5000万元人民币,911101086976739334,www.like18.com
恩多克,深圳恩多克医疗有限公司,深圳恩多克医疗有限公司是一个医疗器械生产制造商。,深圳恩多克医疗有限公司,深圳市坪山区坑梓街道秀新社区中兴路14号7#厂房2楼,,2018-08-03,牛会甫,140万元人民币,91440300MA5F8PKGXH
人人胖,北京森芭迪体育文化发展有限公司,人人胖是一家具有全国专业权威的封闭式减肥训练营，是一家将枯燥的减肥训练结合时尚运动元素的减肥健身俱乐部，也是第一家成功开展线上互动减肥俱乐部的公司。,北京森芭迪体育文化发展有限公司,,110105020504672,2016-01-07,范峥熠,100万元人民币,91110105MA0030FU4K,www.renrenpang.com
紫荆花,安徽紫荆花壁纸股份有限公司,安徽紫荆花壁纸股份有限公司系由我国无纺布及布艺行业龙头企业——杭州中迅实业集团投资兴建的一家集研发设计、先进制造、贸易销售于一体的国内知名墙纸（墙布）企业。公司自2012年建成投产以来，注入资本金5135万元，累计完成投资约9000万元。目前35133平方米厂房投入使用，7条现代化生产线正常运行，已形成年产720万卷新一代环保型中、高档壁纸壁布的生产能力。,安徽紫荆花壁纸股份有限公司,安徽省黄山市经济开发区,341000000033279,2011-01-13,郭文平,5135万元人民币,91341000567539816B,www.bauhinia-wallpaper.com
可芮宝,芮予科技（上海）有限公司,可芮宝是一家母婴用品研发商。该公司在原材料的选择环节，坚持以创造优异、对母婴有益的产品为根本，并优先使用兼顾环保的材料。母婴是人类的希望，环境更是人类的未来。CREBABY品牌目前已打通线上、线下多个销售平台，做到线上、线下的产品同步与同质。CREBABY可芮宝品牌取自单词Creative与Baby。品牌的核心理念即创造力，这体现在团队对研发安全的原材料有着不懈的追求，也体现在公司期望所设计的产品有助于启发孩子的创造力。,芮予科技（上海）有限公司,上海市奉贤区庄行镇庄北路412号153室,310120003962590,2018-01-10,吴涛,500万元人民币,91310120MA1HNF1FXT,crebaby.com
蓝狮子,杭州蓝狮子文化创意股份有限公司,蓝狮子是一家原创财经出版机构，致力于于财经领域的内容策划与图书出版。出版系列囊括企业管理、经济金融、商业趋势、人文社科等内容，代表作品有《激荡30年》、《大败局》等。,杭州蓝狮子文化创意股份有限公司,杭州市下城区西文街213号琥珀晶座1212室,330103000147719,2012-01-06,吴文胜,4494.4万元人民币,91330100586541065G,www.lanshizi.com
尚升科技,青岛尚升智能科技有限公司,尚升科技的城市道路智慧照明解决方案，以物联网技术（以低压电力线载波为主要信道）为核心采用国内先进的电力线载波通信技术，能通过现有路灯供电电力线对每盏路灯进行远程监控，道路路灯的控制、监测、计能和故障诊断，进而实现对路灯系统的智能化管理。,青岛尚升智能科技有限公司,山东省青岛市高新区松园路17号青岛市工业技术研究院A区A1楼3楼301、303室,370222230014459,2015-12-08,程刚,1000万元人民币,91370222MA3C2DYW8W,www.qdsamson.com
博元信息,广州博元讯息服务有限公司,"""广州博元讯息服务有限公司（以下简称博元讯息）是由着名电信企业“润迅通信”创始人及团队，于2007 年共同创立的一家电信增值服务提供商, 博元讯息在广州和香港均设置了分支机构, 并获得了香港通讯事务管理局颁发的”流动虚拟网络营办商服务”牌照（牌照号码：1687）和广东省通信管理局颁发的移动通信转售业务试点批文(粤通业函[2014]112号)。""",广州博元讯息服务有限公司,广州市越秀区中山一路51号前座六楼601房,440104000249507,2007-06-08,王文山,1000万元人民币,914401016618461690,www.multi-byte.com
天泰志远,北京天泰志远科技股份有限公司,北京天泰志远科技股份有限公司主营业务为石油、石化行业提供上下游一体化的安全、健康、环保、节能方面的技术咨询与服务、管理咨询，风险评价、可靠性/完整性评价等服务。,北京天泰志远科技股份有限公司,北京市朝阳区小关北里甲2号楼B座B519,110105010838267,2008-02-29,徐智,1288万元人民币,91110105672847140T
游戏工坊,江苏万游网络科技有限公司,游戏工坊是一家专注于整合网络游戏资源的公司，致力于为玩家提供一个制作、分享、交流的平台，搜集玩家制作开发的游戏MOD补丁等予以展示分享。网站内容涵盖游戏资讯、游戏视频、讨论专区、游戏MOD等。,江苏万游网络科技有限公司,连云港市海州区南极南路58号民生花苑2号楼103号门面,320700000214041,2016-04-11,李帅,1000万元人民币,91320700MA1MHQY09T,www.modwang.com
eWiFi云平台,杭州全维技术股份有限公司,杭州全维技术股份有限公司（证券简称：全维技术，证券代码：831153），成立于2011年，注册资本4500万元，是国家高新技术企业和软件企业。　　公司是提供硬件设备、集成服务、维护优化、应用软件开发、场景化运营和大数据感知平台的WiFi全产业链解决方案提供商，主要业务是向中国移动、中国电信、中国联通、广电网络等运营商提供系统集成、网络维护、优化服务以及相关软件产品的研发和销售。　　目前，公司相关业务已覆盖全国多个省市。公司的eWiFi云平台、AC日志分析系统、WLAN优化管理系统和WiFi智能管道系统等产品,杭州全维技术股份有限公司,杭州市西湖区西斗门路3号天堂软件园D幢12层A座,330108000089889,2011-12-20,朱建武,4500万元人民币,91330100586533292C,www.quantongfu.com
成都珍岛,成都珍岛信息技术有限公司,珍岛最早成立于2005年，后于2009年重新增资成立上海珍岛信息技术有限公司。专注于数字营销的技术、产品、服务的创新与整合，致力于成为中国领先的数字生态服务平台（www.71360.com)。,成都珍岛信息技术有限公司,成都市锦江区工业园区锦华路三段86号汇融国际C座22层,510104000297275,2015-09-14,古飞,200万元人民币,915101043579753456,www.chengdu.71360.com
武汉音宁,武汉音宁信息技术有限公司,武汉音宁信息技术有限公司是一家创业团队，旗下的宅不住是武汉本地白领首选白领社交组局平台，功能有场馆预定，活动报名，诚信机制，团建助手。,武汉音宁信息技术有限公司,武汉东湖开发区东信路SBI创业街5幢8层801号,420100000292598,2012-02-23,查良骥,100万元人民币,91420100591059468T,nozhai.cn
ruyi.ai,上海海知智能科技有限公司,海知智能ruyi.ai是个性化聊天机器人开放技术平台，为智能家居行业提供一站式语义理解机器人大脑解决方案。ruyi.ai整合了千万级版权音乐曲库、主流网络电台有声故事音频节目、覆盖全国全部区县的天气信息、千万量级百科知识问答、数十万菜谱等常用技能插件领域服务，同时提供工具支持业务或领域知识专家而非技术人员进行二次定制形成自己的技能插件，亦提供开放接口面可以提供接入自己的知识库、业务系统等，来打造拥有差异化特点和个性化语言的智能机器人。,上海海知智能科技有限公司,中国(上海)自由贸易试验区盛夏路570号1010室,310115002649726,2015-04-21,谢殿侠,1000万元人民币,91310000332615255U,ruyi.ai
普泉科技,北京普泉科技有限公司,北京普泉科技有限公司研制发明了普泉控水头，在世界上首创了普泉无耗能自动灌溉技术，实现了以极低的成本对植物进行按需灌溉，集节水、节能、自动为一体，实现了植物供水与植物需水之间的完全自动平衡。以其技术为依托，公司开发出三大系列产品：普泉自动灌溉系统：创造了比目前灌溉技术（包括滴灌）更为节水、成本更低的灌溉形式。即将掀起一次灌溉业的革命。普泉控水袋：在极端干旱的沙漠地带，也能自动保证植物的生长需水数月之久，每分每秒不间断地进行灌溉，完全免除人工维护。控水袋技术对改善我国乃至世界的生态环境将起到难以估量的重要作用。,北京普泉科技有限公司,北京市海淀区中关村南大街35号21栋,110108007780969,2004-11-19,董宝青,1000万元人民币,911101087693580016,www.puquan.cn
江西科骏,江西科骏实业有限公司,江西科骏实业有限公司是从事AR增强现实领域的开发及应用企业，产品业务涵盖AVR应用开发、AVR硬件设计、AR SDK研发、AR操作系统标准化、行业AR解决方案深度定制等，拥有“平台+内容+终端+应用”完整的生态服务系统，致力于打造为集硬件、软件、内容、用户为一体的国际化综合产业生态集团。,江西科骏实业有限公司,南昌市望城新区璜溪大道19号10楼1020室,360122210040701,2015-12-24,罗军,12000万元人民币,91360122MA35G2WM3C,www.kmax-arvr.com
乐邦科技,重庆乐邦科技股份有限公司,"""公司成立于2006年12月31日,子公司已通过(GB/T19001-2008 、ISO9001:2008)质量管理体系认证,具有国家环境工程专项设计(甲级)资质、环境工程专项承包(贰级)资质、环境污染治理(甲级),资质及工业废水、生活污水处理设施运营乙级资质。由于环保工程项目具有一定的地域性特征,目前公司的主要市场集中在重庆、四川、贵州等西南地区,在该地区具有较强的知名度。面对激烈的市场竞争,公司通过对资本、人才、技术等各类资源的不断整合,综合实力和影响力持续扩大。在消化吸收国内外先进技术、工艺及新型环保设""",重庆乐邦科技股份有限公司,重庆市九龙坡区科园一路6号14-6号,500901000031935,2006-12-31,罗茂蜀,1300万元人民币,915001077980023469
深赤湾Ａ,招商局港口集团股份有限公司,"""深圳赤湾港航股份有限公司是一家从事集装箱、散杂货码头及港口配套业务的开发建设和经营管理的企业.公司主营业务为集装箱和散杂货的港口装卸、仓储、运输及其它配套服务.2010年公司全年完成集装箱吞吐量同比增加29.0%,增速在深圳三大集装箱港口中领先,占深圳港集装箱码头业务市场份额的27.2%。""",招商局港口集团股份有限公司,深圳市南山区招商街道赤湾石油大厦八楼,440301501124494,1990-07-19,付刚峰,64476.373万元人民币,91440300618832968J,www.szcwh.com
世界村,安徽世界村新材料有限公司,安徽世界村新材料有限公司是由上市公司国家级重点高新技术企业红太阳集团投资建设，成立于2015年6月，注册资金2亿元人民币。目前已在建一期年处理10万吨废旧轮胎高值化综合利用项目，该项目位于皖江城市带安徽省马鞍山市雨山经济开发区，规划占地173亩，总投资5.06亿元。公司依托红太阳集团“九大”优势及“互联网+”资源平台，充分发挥业务、品牌与资本的生态协同效益，逐步形成以大数据产业为纽带的节能环保绿色再生橡胶、混炼胶新材料及橡塑制品上下游全产业链闭合生态圈。,安徽世界村新材料有限公司,马鞍山市雨山经济开发区霍里山大道与创新路口交叉口东北角1号厂房,340500000197318,2015-06-10,李健,20000万元人民币,91340500343912765R,www.ahsjcxcl.com
创业帮帮忙,上海耀星投资管理有限公司,创业帮帮忙致力于服务高科技和创意领域的正在创业者和想创业者，利用开放共赢的心态来做产业上下游资源整合，梳理和解决创业各个环节上存在的普遍共性问题，为优化创业环境和提高创业效率实践本组织的社会责任。致力于上海创业投资圈的打造，会员主要来自于互联网、电子商务、移动互联网、VC、孵化器、园区、金融、传媒、开源硬件、物联网、品牌营销、律师、创意设计等行业。每月定期举办丰富的线下活动、讲座、路演等。,上海耀星投资管理有限公司,上海市浦东新区黄赵路318号101A9室,310115002268078,2014-03-27,贺智,10万元人民币,91310115093790741L,www.cybbm.com
彩通科技,郑州彩通科技股份有限公司,"""彩通公司是专业信息化服务提供商,为客户提供“一站式”的IT整体解决方案，致力于帮助客户提升信息化水平，以提高信息工作者的生产力，充分发挥政府的服务能力和企业的无限潜能。公司提供信息系统集成服务帮助客户应对业务挑战，并创造机会，推动其实现卓越绩效。深知行业动态及业务流程，具有应用新兴技术的经验。彩通公司的理念、经验、拥有熟练技术的员工以及行业化的方法使其在交付高质量、低成本的企业系统方面处于市场领先地位。""",郑州彩通科技股份有限公司,郑州市高新区翠竹街1号11幢,410105100098002,2008-10-23,张玉峰,2201万元人民币,91410100680787731W,www.ctone.net
江蔬种苗,江苏省江蔬种苗科技有限公司,江蔬种苗是一家蔬菜种苗生产商，专注于辣椒、番茄、茄子、甘蓝、白菜等等蔬菜作物及鲜食玉米种苗的研发、生产及销售，产品主要包括苏椒5号、春丰甘蓝、春丰007、博春、苏崎系列茄子等，销售及服务网络覆盖全国二十多个省、市、地区。,江苏省江蔬种苗科技有限公司,,320000000019169,2003-09-30,亢立平,700万元人民币,913200007532476495,www.jaasseed.com
快递快滴,韶关市新流向网络科技有限公司,快递快滴是一个网络共享寄件服务平台。平台综合中通、盛通(申通)、圆通、邮政、百世等多个快滴公司的服务，用户下单寄件，平台则把订单推给入驻平台的快递员，既利用了快递行业的闲置资源，又提高了客户的寄件效率。,韶关市新流向网络科技有限公司,韶关市武江区乳韶路芙蓉小区芙蓉一路富康苑A座商住楼首层9号商铺,440203000013251,2016-08-16,王津明,200万元人民币,91440203MA4UTPJGX6,www.kuaidikd.com
