名字,公司,介绍,公司,地址,身份证,时间,法人,注册金额,编号,网址
指尖悦动,深圳市指尖悦动科技有限公司,指尖悦动是一家手机游戏发行商，该公司专注于发行SLG、MMORPG等类型的手机游戏，公司已发行的手机游戏产品包括SLG游戏《坦克前线》、《超级群英传》；MMORPG游戏《星辰奇缘》等。,深圳市指尖悦动科技有限公司,,440307111901962,2014-12-23,吴宝华,50万元人民币,91440300326225947F
昂特曼科技,北京昂特曼科技有限公司,北京昂特曼科技有限公司是一家高科技测试仪表开发公司，致力于通讯测试领域的科技创新，为客户在4G，IoT， 5G、车联网、物联网等领域，提供测试，保障和咨询方案。努力实现通信测试平台本土化。,北京昂特曼科技有限公司,北京市朝阳区立清路6号院1号楼19层2单元2203,,2018-08-21,孙水清,100万元人民币,91110105MA01E6RQ5F,www.antmantech.cn
大麦电商,广州大麦信息科技有限公司,大麦电商是国内领先的电子商务服务公司。公司主营业务为多平台电商运营及全网品牌推广，涉及全店代运营、线上推广、品牌策划、软件开发、企业咨询、人才培育等一站式服务，致力打造良性电商服务生态圈。,广州大麦信息科技有限公司,,440106000490042,2011-08-16,余焕文,111.11万元人民币,91440106579995018L,www.da-mai.com
企话通,深圳迅鱼网络科技有限公司,深圳迅鱼网络科技有限公司成立于2013年，公司专业从事语音应用开发，联合中国移动、中国联通、中国电信等知名运营商，为国内1000多家知名公司提供智能语音外呼服务，语音外呼广泛应用于通知、广告、营销、品牌推广等等，因业务快速拓展需要，诚意邀请有志之士共同发展。 公司定位于以企业客户服务为核心，利用自身在IT服务领域、电信服务领域及咨询管理领域的优势，为各行业提供通讯领域的咨询与解决方案。我们拥有专业的管理团队，拥有一支敬业乐业、专业素质高、能力强的技术开发队伍，拥有丰富的跨行业的解决经验。 多年来我们还与国内,深圳迅鱼网络科技有限公司,深圳市龙岗区坂田街道永甘路2号2楼201,440301107825665,2013-08-22,熊宏福,1000万元人民币,914403000769401112,www.7huatong.com
快客速达,广西牧道网络科技有限公司,"""广西牧道网络科技有限公司是一家专门为配送公司提供配送管理一站式服务的系统, 是以企业流程为中心, 并提供配套的周边服务如: 配送员管理, 运单管理, 服务点管理, 业绩统计, 客户对账等功能, 致力于打造企业自身品牌, 提高自身管理功能, 并整合整个配送链的一套2B的系统.""",广西牧道网络科技有限公司,桂林市临桂区临桂镇世纪东路桂林奥林匹克花园7#8#地块组团二13幢1单元2层2号,450322000124170,2016-05-23,谭政成,200万元人民币,91450322MA5KCDPG5Y,www.kksuda.com
腾云智航,天津腾云智航科技有限公司,腾云智航是一家无人机飞控系统研发商，专注于从事无人机核心技术和产品的研发与设计。,天津腾云智航科技有限公司,天津自贸试验区（空港经济区）环河北路空港商务园东区8号楼A701房间,120118000059456,2015-09-10,王少海,1080万元人民币,91120118MA05L2415B
上海酷奇,上海酷奇贸易有限公司,上海酷奇是一家笔记本电脑配件、手机配件生产商，主要经营两大类产品，一是笔记本电脑配件，包括键盘膜系列、液晶膜系列、笔记本支架系列、清洁套装系列、电脑包系列、USB产品系列，二是手机配件，包括车载支架系列、笔记本散热器系列、蓝牙系列、移动电源系列、防水袋系列。,上海酷奇贸易有限公司,上海市嘉定区科福路358_368号4幢1层E区J1084室,310114001782086,2007-01-09,彭全因,100万元人民币,91310114797047817D,www.cooskin.com.cn
紫荆清远,苏州紫荆清远新能源汽车技术有限公司,紫荆清远是一家新能源汽车研发商，致力于新能源汽车整车平台与整车产品、关键零部件的研发与制造。旗下产品主要有小型纯电动、装甲SUV以及球形车等，汽车采用220V电压进行充电，不需要设专门的充电桩进行充电。,苏州紫荆清远新能源汽车技术有限公司,吴江经济技术开发区长安路东侧,320584000393824,2013-12-25,金达锋,2500.4884万元人民币,91320509089312552R,www.zjqymotors.com
万杰智能,万杰智能科技股份有限公司,"""公司创建于1996年3月,一直致力于和面系列、揉面系列、馒头系列、包馅系列、鲜食面条系列、蒸制系列、大型食品加工生产线系列等民族文化主食机械的研发、制造、营销和服务。    十八年来,万杰凭借着“讲真话、做实事、先做强、再做大”的万杰精神,实现食品机械第一品牌,完成中式面点产业化生态系统商业模式,带动民族文化主食健康发展的企业使命;成为中国文化主食机械的标准制定者,成为中式面点产业化生态系统的引领者,成为一流人才的缔造者的企业愿景。发展成为拥有500多名员工,各类专业技能人才占70%以上;占地130.5亩,""",万杰智能科技股份有限公司,,411025000000841,2009-09-10,王晓杰,7490万元人民币,9141100069486737X6
花甲科技,北京花甲科技有限公司,花甲科技是一家安全全栈SaaS平台提供商，针对代码防护、APP防护、链路防护及运行防护，提供基于自有知识产权的杀毒引擎、风控引擎的App检测、加固、安全SDK、业务风控等系列产品。,北京花甲科技有限公司,北京市海淀区上地信息路26号01层0112-190室,110108020257233,2015-11-27,邱寅峰,1485万元人民币,91110108MA0024PC68,www.securitystack.cn
云客yunkecn,北京联云天下科技有限公司,云客是一家以精准线索推荐切入，井整合营销渠道和销售管理全过程的云电销服务系统，通过客户线索推荐引擎更有效帮企业开源获客。App端主要提供行动管理、线索推荐、客户管理的功能。线索推荐引擎通过用户行为、线索行为、线索数据采集等离线数据加工，构建独有的云客数据库和云客搜索引擎。PC端主要提供电话任务、销售管理、短信/邮件蓝控等功能。同时学习用户的营销过程。,北京联云天下科技有限公司,北京市朝阳区东三环南路19号院1号楼-2至15层101内七层A603号，北京市朝阳区静安庄一区4号3号楼3层320室,110105019031933,2015-05-04,李豹,302.3431万元人民币,91110105339763736F,www.yunkecn.com
旺销王,福州华天伟业网络科技有限公司,福州华天伟业网络科技有限公司创立于2014年，是从事跨境电商应用软件服务，在2014年初强势推出旺销王软件，秉着以人为本，为客户创造更多的商业价值，面向社会各行业提供定制信息化服务，提供优质的信息化解决方案。,福州华天伟业网络科技有限公司,福建省福州市台江区交通路万科广场B区裙楼S5#栋三层305单元，福建省福州市台江区鳌峰街道鳌江路8号福州金融街万达广场二期A2#写字楼17层16室,350103100087152,2013-04-28,林伟,100万元人民币,913501030665960463,www.wxwerp.com
三维精密,苏州三维精密机械有限公司,苏州三维精密机械有限公司是一家金属成型制造商。公司集精密模具研发和关键零部件冲压为一体。公司自2007年在苏州工业园区唯亭工业坊开业以来，坚持以人为本，重视科技创新，培养了一支顶尖的设计、研发和制造团队，并拥有一批关键的金属成型技术。截至今日，公司已围绕深拉伸连续冲压，精修边连续冲压和冷锻造连续冲压等领域，申请并获批发明专利十余项，实用新型专利二十余项。现在，三维公司制造的产品广泛应用于汽车发动机、变速箱、安全气囊、刹车系统、仪器仪表、电器开关和管道工程等领域。除了在国内销售，部分产品远销日本，墨西哥，美国和欧洲等地。,苏州三维精密机械有限公司,苏州工业园区唯亭唯新路9号唯亭镇工业坊A区B1起第4-7单元,320594400019550,2007-04-12,郭宏林,2400万元人民币,913205946600891784,www.fineforming.com
绿书科技,南京绿书网络科技有限公司,绿书科技对传统说明书进行拆解、重构，并场景化表现，提供给消费者一份极具体验感的电子说明书。将收集到的大量关于产品、用户及其实时行为等数据反馈给制造业。在做好企业服务的基础上，以近乎0成本的方式，获取庞大的C端流量，并价值实现。隶属于南京绿书网络科技有限公司。,南京绿书网络科技有限公司,南京江宁经济技术开发区迎翠路7号105室,320114000185823,未知,贾治虎,500万元人民币,91320114MA1MU381XW,www.ilvshu.cn
*ST 中绒,宁夏中银绒业股份有限公司,"""宁夏中银绒业股份有限公司是宁夏自治区高新技术企业和少数民族用品定点生产企业,主要从事无毛绒、绒条、羊绒纱、羊绒制品的生产及国内外销售.经过十几年的发展,公司产业结构体系日趋合理完善,持续经营能力增强,经营效益逐年提高,依托自身信誉,形成了业界公认的品牌优势,与世界前五大羊绒生产与销售企业均建立了良好的合作关系.公司自2004年起已连续六年无毛绒、绒条出口全国第一,2009年位居全国羊绒制品出口第三大企业,出口创汇位居宁夏20家重点出口企业第一;被中国纺织工业协会评选为2008~2009年度中国纺织服装企业竞""",宁夏中银绒业股份有限公司,灵武生态纺织园区（灵武市南二环北侧经二路东侧）,640000200003419,1998-09-15,战英杰,180504.3279万元人民币,91640000227683862F,www.zhongyincashmere.com
祁连山,甘肃祁连山水泥集团股份有限公司,甘肃祁连山水泥集团股份有限公司是中央企业——中国建材集团有限公司的下属企业、国家支持的12户重点水泥企业之一，甘青两省最大的水泥生产企业、西北地区特种水泥生产基地。公司于1996年在“一五”时期国家重点建设项目之一的永登水泥厂的基础上改制设立，是甘肃省第二家上市公司。,甘肃祁连山水泥集团股份有限公司,兰州市城关区酒泉路,620000000015215,1996-07-17,脱利成,77629.0282万元人民币,916200002243685683,www.qlssn.com
小生活,深圳小生活科技有限公司,小生活成立于2014年10月14日专注于自媒体解决方案，帮助微信自媒体更好的去运营平台，目前为止已经服务过600家地方自媒体平台，同时小生活开通了自媒体电商，自媒体院线等产品。,深圳小生活科技有限公司,深圳市龙岗区横岗街道龙岗大道8288号大运软件小镇3栋,440307111571807,2014-10-31,王志贤,388.8889万元人民币,9144030031945301XU
正达信通,北京正达信通科技有限公司,公司是一家专业从事基于物联网应用的安全监测领域系统集成商，产品主要面向数据中心的基础设施建设和物联网安全监测系统，为用户提供相关产品的研发，生产和销售并提供整体技术服务，公司的产品覆盖了从上层的物联网安全监测综合管理平台，中间层的各种数据的接入智能网关及底层的各种传感器设备和智能仪表装置，提供各行业应用的一揽子解决方案。,北京正达信通科技有限公司,北京市朝阳区立清路7号院2号楼9层2单元1001，北京市朝阳区汤立路218号14层1705,110105013520332,2011-01-13,吴建国,2000万元人民币,91110105567422239Y,www.zedatech.com
海芯科技,海芯科技（厦门）有限公司,海芯科技是一家由留学归国人员在2006年创办的集成电路芯片设计、开发和销售公司。专长于模拟和射频集成电路技术,海芯科技（厦门）有限公司,,350298400002339,2006-08-25,SHAO FENG SHU,22万美元,913502007912545670,www.aviaic.com
步步行程助手,厦门奥洛信息科技有限公司,步步行程助手是一个专为旅游自由行用户量身打造的行程管理工具，让用户一站收纳所有行程信息，结合了清单、备忘、图片及文档，让行程井井有条、一目了然，还可以记花费，分享给同行的小伙伴。,厦门奥洛信息科技有限公司,厦门市集美区杏林湾路464号201单元K02之二,350203200469279,2014-07-22,施贵飞,100万元人民币,913502033029347734,www.bubu.so
袋鼠健保,和泽生物科技有限公司,袋鼠健保是一家健康保障服务平台，专注于为每个家庭提供可触及的健康保障服务。袋鼠健保深度整合“健康”和“保障”两大核心，打造平价优质的PPO健康网络，让健康在每个人的生活中绽放精彩。,和泽生物科技有限公司,,,2009-04-24,李海滨,15000万元人民币,911201166883791423
新顿科技,南昌新顿科技有限公司,公司简介本公司是一家致力于办公设备、金融机具、机房空调、UPS电源及柴油、汽油发电机组的推广、应用，并提供完善技术服务支持的专业技术型公司。,南昌新顿科技有限公司,江西省南昌市西湖区井冈山大道1416号省计算机中心院内五楼518室,360100210171075,2009-12-11,韦岳美,1000万元人民币,91360100698460163U,26468888.b2b.11467.com
应陶康顺,江西应陶康顺实业有限公司,应陶康顺是一家蓄热式蜂窝陶瓷及催化剂载体研发商，主要产品包括RTO蜂窝陶瓷、鸟巢催化剂载体等，同时公司还进行塑料花环、塑料海尔环、高铝球、金属鲍尔环等其他散堆填料业务。,江西应陶康顺实业有限公司,江西省萍乡市开发区高新工业园北区工业大道,360301210000582,2003-11-12,姚光纯,236万美元,91360300667469077J,www.acichemshun.cn
伯格网络,长沙伯格网络科技有限公司,伯格网络是一个微信生态链增强服务平台，其业务范围包含微信小程序、大数据平台、H5页面制作和新媒体托管服务等业务。,长沙伯格网络科技有限公司,长沙市开福区通泰街街道中山路589号开福万达广场C区2号写字楼3508号,430105000278045,2017-07-28,钟敏敏,500万元人民币,91430105MA4LY80Q3U,www.csboge.com
金榜汽车,宁波市金榜汽车电子有限公司,金榜汽车是一家汽车零部件研发商，主要产品包括燃气发动机控制系统、防眩目汽车后视镜、六缸喷射系统、在线测试仪（ICT）、程控快速变温湿热箱、三轴电磁振动试验台、盐雾试验箱等。,宁波市金榜汽车电子有限公司,宁波高新区凌云路1177号2栋1层,330215000003118,未知,吴黎辉,1475万元人民币,91330201772305891W,www.kingband.com
钱方好近,钱方好近科技（天津）股份有限公司,钱方好近是一家专门为小商户提供支付等一系列信息活动的服务平台。平台提供线上线下的聚合支付、营销及商户贷款等系列商业运营方案及增值服务。,钱方好近科技（天津）股份有限公司,,120193000066988,2012-07-09,李英豪,5680.9111万元人民币,91120116598722365H,www.qfpay.com
泰通农业,广东泰通农业发展集团股份有限公司,"""广东泰通农业发展集团有限公司(前身:东莞市泰通科技实业有限公司)是一家投资型的农业高科技实业公司,由数位毕业于美国哈佛大学、耶鲁大学、杜克大学的归国留学生及国内实业投资家于二零零八年八月投资成立。本公司专注于农业科技技术和设备的研发、建立连锁型粮食烘干站点。该项目被列为重点项目引进到国家级东莞市松山湖科技产业园区经营。    本公司以自有粮食烘干设备技术研发为基础,以各地连锁型粮食烘干站点为平台,形成粮食烘干、收储、粮食贸易、种子繁育/销售、育秧、农资销售、农机服务等一体化的现代农业服务体系。经过多年的发展""",广东泰通农业发展集团股份有限公司,东莞松山湖高新技术产业开发区松科苑11号楼第二层,441900000362193,2008-08-04,杨玲,6200万元人民币,914419006788011277,www.gdtaitong.com
集客魔方,杭州小时光电子商务有限公司,集客魔方是一家小程序电商裂变场景服务提供商，主要通过小程序帮助电商商家管理自己的粉丝池，并为商家提供裂变场景，包括免单任务、高额奖励等，帮助商家通过社交工具获取新用户。前期，集客魔方会从工具型产品切入，整合供应链资源，同时帮商家裂变粉丝。有了粉丝基础后，集客魔方会向平台型产品转变。为商家提供各种裂变场景，帮助商家通过社交工具获取新客户。商家间的流量进行互导，帮助商家提高流量利用效率。主要帮助电商商家建立自己的粉丝池，使商家能够直接触达粉丝。通过裂变活动为商家获取新用户。解决了传统电商获取流量难成本高，社交电商裂变能力不足的问题。主要用户为淘宝、京东等平台电商商家等。集客魔方的营收来源分为四部分：第一，为商家建立小程序，收取平台使用费用；第二，为商家提供多样化的裂变场景，帮助他们获取新粉丝，完成交易后抽取佣金；第三，为商家提供广告服务获取的收入；第四，为商家提供个性化裂变方法，收取插件和模板费用。,杭州小时光电子商务有限公司,浙江省杭州市余杭区仓前街道文一西路1324号3号楼501-4室,330102000303178,1970-01-01,单克岩,55.600000万人民币,91330102MA2AX6J745
南域信息,上海南域信息科技有限公司,南域信息是一家海外消费金融服务提供商。通过把中国成熟的互联网消费金融模式和技术输出到东南亚地区，为东南亚地区的用户提供消费金融服务。该公司致力于海外消费金融的业务发展。,上海南域信息科技有限公司,上海市虹口区东大名路391-393号4楼A4214室,310109000852029,2017-08-02,林志彬,588.2353万元人民币,91310109MA1G5CHT9A
侍读教育,西安侍读信息科技有限公司,侍读教育是一家K12在线教育供应链平台，公司的主要业务为K12教育机构提供优秀师资、教学系统以及运营方案，多家投资机构有意向进行首轮投资。,西安侍读信息科技有限公司,陕西省西安市高新区丈八街办高新二路9号1-301-99,,2018-12-20,黄胜蓝,10万元人民币,91610131MA6WAPW54N
指盟网络,深圳指盟网络科技股份有限公司,深圳市指盟网络科技股份有限公司是一家专业从事手机游戏开发与发行的创新型科技公司。位于深圳市龙华新区，其核心团队，主策、主程、主美、 市场运营等是均来自广州大型游戏公司的骨干成员，拥有丰富的手机游戏开发经验。,深圳指盟网络科技股份有限公司,深圳市龙华新区大浪街道华宁路厦门大学龙华产学研基地808室,440301107458423,2013-06-14,刘剑刚,1000万元人民币,914403000711203760
万协通,北京万协通信息技术有限公司,"""万协通是一个信息安全服务平台。隶属于北京万协通信息技术有限公司，该公司专注于信息安全领域的集成电路设计企业,前身为同方股份有限公司计算机产业本部的信息安全事业部，自2008年起，一直致力于高性能信息安全芯片的设计与研发工作。""",北京万协通信息技术有限公司,北京市海淀区上地三街9号A座A801,110108015140595,2012-08-06,宋国琴,1915万元人民币,91110108051403635C,www.wisectech.com.cn
多锐运动,湖南简成信息技术有限公司,多锐运动是一款支持实时在线约跑和3D真人模拟运动的运动软件，提供运动记录、运动指导、运动社交、运动激励和在线比赛等功能和服务，帮助用户在快乐中长期坚持运动。,湖南简成信息技术有限公司,长沙高新开发区麓谷大道627号B－3栋加速器生产车间808,430193000072317,2014-07-22,张戈零,667万元人民币,91430100396855055X,www.12sporting.com
乐目奥赛体育,西安乐目奥赛体育文化传播有限公司,乐目奥赛体育是一家集教训、培训、体育、娱乐为一体的高端体育文化综合体企业，下属乐目奥赛射击文化馆和乐目奥赛培训教育基地。乐目奥赛射击文化馆位于以文化产业和旅游产业为主导的城市发展新区曲江新区，也是西北第一家，全国第三家的室内营业性的文化体育射击馆。,西安乐目奥赛体育文化传播有限公司,,610133100048302,2015-02-15,李智,1000万元人民币,91610104MA6U6AMT2U
锦程国际物流,锦程国际物流在线服务有限公司,锦程国际物流是一家全球物流服务商，主要为客户提供门到门的全程国际物流服务。公司在实体服务网络建设基础上，组建锦程物流全球服务中心，对进出口海运集装箱箱量资源进行整合，实现集中采购。,锦程国际物流在线服务有限公司,辽宁省大连市中山区祝贺街35号锦联大厦2F整层,210200000494876,2012-04-10,李超,10000万元人民币,91210200594400879E,www.jc56.com
城市之光生态环境,北京城市之光生态环境有限公司,城市之光生态环境是一家园林绿化工程承包商，专注于市政园林、公建环境、住宅别墅、生态修复等工程，完成了多项政府重点绿化工程的施工任务，同时还涉及流域生态治理、生态科技研发、水土环境保护等系统工程服务。,北京城市之光生态环境有限公司,,110108000778335,1998-12-16,袁友伦,20000万元人民币,911101167001360641
有巢智能,深圳有巢智能技术有限公司,有巢智能是一家语音智能照明灯具提供商，以智能台灯为切入点，将通过不断创新的智能氛围产品及构建完整的生态链，覆盖家居、办公、汽车等领域。,深圳有巢智能技术有限公司,深圳市龙华区大浪街道浪口社区浪口工业区81栋17层,440301111315064,2014-09-15,皮振兴,584.4246万元人民币,91440300311741420R,www.uchaoit.com
富丽高,北京富丽高体育文化有限公司,富丽高是一个定位于开发和推广冰上娱乐、冰上训练及各种冰上运动比赛的组织和推广、仿真冰板及冰上娱乐设施销售一体的多元化体育文化公司。为中国广大客户提供各类仿冰场地的一站式综合解决方案。,北京富丽高体育文化有限公司,,110113020513018,2016-01-06,王志勇,2000万元人民币,91110113MA0031DX9K
装修哥网络,合肥装修哥网络科技有限责任公司,装修哥装饰网是一个互联网装修招标平台，由合肥装修哥网络科技有限责任公司斥巨资打造的装修哥装饰网是权威的装修行业平台，致力于中国装饰行业电子商务的发展，通过这个平台，业主可以尽快找到性价比最高的装饰公司，规避装修风险，规避合同陷阱。同时，让装修公司在这个舞台上也能够尽情展现自己风采，服务更多的业主！,合肥装修哥网络科技有限责任公司,安徽省合肥市经济技术开发区坝下路82号建业.时光原著7幢2206室,340194000066451,2015-05-25,杜莉,10万元,91340111343778279Q,www.zxge.com
纳迅科技,北京纳迅科技股份有限公司,北京纳迅科技股份有限公司(以下简称纳迅科技) 成立于2010年9月，注册资本6790万元，拥有1000平米的研发及洁净生产车间，是一家专注于免疫诊断的体外诊断试剂和仪器的生物科技公司。公司目前由管理团队10人，销售团队10人，研发团队35人，其中研究生以上学历10人和1位海归，拥有发明专利40余项，并于2015年3月被认定为中关村高新技术企业。,北京纳迅科技股份有限公司,北京市昌平区科技园区兴昌路1号1幢5层,110108013232247,2010-09-19,蓝洋,6790万元人民币,911101145620861099,www.nano-ace.com
爱生气米酒,合肥扑哧电子商务有限公司,扑哧电子商务有限公司成立于2015年，是一家致力于通过现代工艺创新改造传统米酒，以互联网思维颠覆行业、升级品类的集产品研发、品牌包装、社会化营销于一体的用户驱动型公司。,合肥扑哧电子商务有限公司,合肥市瑶海区凤阳路恒丰大厦1504室,340100001603086,2016-05-03,简浩,100万元人民币,91340100MA2MW0PH39,shop124719751.taobao.com
敦煌种业,甘肃省敦煌种业集团股份有限公司,"""甘肃省敦煌种业集团股份有限公司是一家主要从事各类种子的生产、收购、销售和棉花的收购、加工、销售以及棉油、番茄酱、番茄粉的加工、销售的公司.公司的主要产品有粮食、瓜类、蔬菜、花卉、甜菜、油料.本公司所属行业为国家重点扶持的的产业,本公司所投资的项目基本属于国家重点鼓励支持的范畴,并且根据农业部、国家计委、国家经贸委、财政部等9个国家部委机关共同发布的农经发[2002]14号文,本公司已被列入""""第二批农业产业化国家重点龙头企业"""",本公司所处行业和自身发展符合国家宏观经济发展方向,属于国家""""十五""""规划中重点发展的""",甘肃省敦煌种业集团股份有限公司,甘肃省酒泉市肃州区肃州路28号,620000000012665,1998-12-28,马宗海,52780.208万元人民币,916200007102487488,www.dhseed.com
