名字,公司,介绍,公司,地址,身份证,时间,法人,注册金额,编号,网址
柳晶科技,柳州市柳晶科技股份有限公司,柳晶科技是一家铸造废弃物制品提供商，利用铸造废砂、铸造废渣、废灰、废淤泥等铸造废弃物制品再生回用，制作成覆膜砂、透水建材、再生砂、农业保水颗粒以及透水砖等产品，其再生循环利用技术解决了五菱柳机、柳工等铸造企业的排放难题。,柳州市柳晶科技股份有限公司,,450203200020211,2012-08-10,任文强,1165.5万元人民币,91450221052709863H,www.lzfms.com
品骏电子,河南唯品会供应链管理有限公司,品骏电子是一家专门从事运输、快递服务、仓储服务的落地配服务公司。日包裹超过70万，涵盖29个省份，其余省份仍在建立或收购。,河南唯品会供应链管理有限公司,,410198000059290,2015-03-27,孙绮威,300万元人民币,91410100335799600R
找电池网,深圳市找新新信息科技有限公司,找电池网（找锂电网）以撮合交易为切入点，投入了大量的资源开发工厂信息系统，同时聘请了在电池行业有丰富经验的交易员，让交易员通过大数据进行沟通比价，为客户提供免费，专业，高效的交易服务。找电池网（找锂电网）深耕电池行业垂直电商综合行业的大数据通过交易员的线上信息分析，线下与上下游商家洽谈撮合，打通信息的起点到交易的终点，真正节约企业的业务成本。经营理念：免费帮你找到更便宜的货愿景：打造中国最具有价值的电池行业一站式电商平台使命：深度服务电池行业客户，为行业发展营造良性生态环境。价值观：诚信创新责任服务口号：找电池就这么简单！,深圳市找新新信息科技有限公司,,440301117558351,2016-09-26,田陈云,100万元人民币,91440300MA5DLM723P,www.51battery.net
金明精机,广东金明精机股份有限公司,"""广东金明精机股份有限公司是一家集研发、设计、生产和销售于一体的专业塑料机械装备供应商.其主要生产薄膜吹塑设备和中空成型设备.公司是国家级高新技术企业、广东省知识产权优势企业、广东省创新型企业、汕头市装备制造业重点企业,2010年公司薄膜吹塑设备市场占有率居行业同类产品前三名。""",广东金明精机股份有限公司,汕头市濠江区纺织工业园,440500000049227,1987-12-01,马镇鑫,41892.358万元人民币,91440500192983581M,www.jmjj.com
我的麦田,江苏智麦汇科技发展有限公司,我的麦田是一个知识产权互联网公共服务平台，专注于知识产权创造、运用、保护、管理和服务等业务，为中小企业提供知识产权资讯服务平台、知识产权人才服务平台、知识产权服务商供应平台、大众创新万众创业技术服务平台、中小企业科技金融服务平台等。,江苏智麦汇科技发展有限公司,,320111000294681,2017-04-19,程霞,4058万元人民币,91320111MA1NTF0T68,www.wodemaitian.com
风笛电商,成都风笛电子商务股份有限公司,风笛电商是一家以数据驱动、柔性供应链为核心的电子商务综合运营服务商，旨在帮助客户打造从电商体系设计、柔性供应链服务到品牌端对端的闭环系统，向平台商、品牌商、生产商提供技术平台和运营服务，通过成熟的运营服务体系、领先的数据集成技术、一流的供应链系统，传递共享生态及品牌价值。,成都风笛电子商务股份有限公司,中国（四川）自由贸易试验区成都高新区天府大道北段1700号6栋1单元10层1002号,510109000506253,2014-11-19,张立佳,11000万元人民币,91510100394601297W,www.fddiy.com
金豆豆农资网,新疆神农金豆豆电子商务有限公司,金豆豆农资网是一个农用化工产品电商平台。,新疆神农金豆豆电子商务有限公司,新疆巴州库尔勒经济技术开发区开发大道北侧、人才大厦1207室,652800058008330,2015-10-13,朱宝,500万元人民币,91652801MA7750HW3Y,www.snjdd.com
EHAND,上海易韩商贸有限公司,Fedora飞多儿，2012年成立于韩国的综合婴幼儿用品品牌。业务范围主要涵盖婴儿推车、安全座椅、宝宝餐椅、宝宝背带等。在韩国上市18个月后，一举突破同类品牌，成为韩国婴儿推车、安全座椅销量冠军，被韩国媒体誉为“Fedora奇迹”。目前Fedora已在全球12个国家进行销售。2014年，Fedora飞多儿正式进入中国市场，迅速受到众多中国奶爸奶妈和宝宝们的青睐。,上海易韩商贸有限公司,上海市杨浦区伟德路6号1202-19室,310110000654111,2013-12-11,陈近朱,50万元人民币,913101100861653740,chinafedora.com
集素投资,深圳市集素投资管理有限公司,集素资本成立于2015年，是一家新成立的天使投资机构，致力于改善早期创业项目的服务体验。利用互联网思维，结合股权资本、债权资本、实体企业、政府资源，实现早期项目与多方外部资源的有机融合，改善大多数早期基金单一的服务能力，打造投资的产业链生态。,深圳市集素投资管理有限公司,,440301114424925,2015-11-23,叶波,1000万元人民币,91440300358762958C
耐奇电气,广州耐奇电气科技有限公司,耐奇电气是一家专注于电能管理服务的专业公司，为商贸酒店、公共机构、轨道交通、制造业等重点领域提供设备运维、能源保障、安全节能等方面的管理咨询和技术解决方案。,广州耐奇电气科技有限公司,广州高新技术产业开发区科学城科学大道182号创新大厦C1栋第8层804单元,440126000118805,2004-12-04,曾博,1100万元人民币,91440116769510130B,www.nikey-elec.com
添云健,厦门添云健信息科技有限公司,添云健是一个社交零售平台，是一款在手机端开店的APP。添云健的主要产品有母婴用品、美妆护肤、养生保健，生活用品，实现一站式服务。,厦门添云健信息科技有限公司,,350200200099918,2016-02-02,林海燕,5000万元人民币,91350200MA345XHH01
狐狸小妖化妆品连锁,安徽狐狸小妖品牌管理有限公司,狐狸小妖化妆品商贸有限公司2009年成立，注册资金300万，是一家致力于“终身美丽”服务的公司。公司集化妆品代理、加盟、批发、零售和直营等多渠道于一体，旗下有十多个品牌的安徽省代理权及上百个品牌的经销权，同时拥有多家直营店。 公司产品结构采用“名牌产品综合+跨界整合”模式，下设：狐狸小妖化妆品合肥店、狐狸小妖饰品店合肥店、狐狸小妖化妆品南京店、狐狸小妖饰品南京店及多家加盟店，实力雄厚。,安徽狐狸小妖品牌管理有限公司,安徽省合肥市瑶海区芜湖路1号御景湾小区2幢2211室,340100000647766,2012-05-02,王佩佩,500万元人民币,91340100595716971A,www.hulixiaoyao.com
滋农游学,福州滋农网络科技有限公司,滋农游学是一个乡村自然游学服务平台，由游学、民宿、农产品、农村金融四大业务板块构成，旨在通过挖掘和设计游学课程，让用户可以感受乡村自然文化生活，进而深度体验不同地域的地理、文化、美食和手工艺，达到学习目的的游学模式。,福州滋农网络科技有限公司,福建省福州市鼓楼区软件大道89号福州软件园C区3号楼1-30-11室,350102100381736,2015-08-18,张琪,206.2万元人民币,91350102M00014M82P
众恒光电,广州众恒光电科技股份有限公司,公司成立于2008年3月，是以LED芯片、LED灯珠、LED应用光源、LED光源灯具一体化等的研发、生产、销售为一体的大型半导体照明企业。,广州众恒光电科技股份有限公司,广州市白云区集贤路集安街3号609房,440111000068434,2008-03-31,王海汴,6969.3409万元人民币,914401016734697196,dev.api.qimingpian.com
邻几便利店,浙江邻几便利店有限公司,邻几便利店有限公司由多位知名浙商投资人与国内便利店标杆企业的创始管理团队组建而成。公司以城市白领为主要目标顾客群，为客户提供高效、便捷、卫生的购物环境及良好的休闲、交流体验；公司提供顾客需要的饮料、休闲食品及纸巾生活必需品外，同时为顾客提供营养便捷的早餐、卫生健康的午餐、时尚新颖的下午茶，绿色有机的晚餐，美味可口的宵夜，解决顾客一日五餐的生活。公司设立免费休闲区，供顾客免费交流及休闲；公司根据不同的商圈设立：商务版便利店、居民版生鲜便利店、学校版便利店、医学版便利店、交通版便利店等多种店铺类型，邻几便利店是一家社区连锁便利店，主要为用户提供多种生活用品、家用工具、水果生鲜等品类的产品，同时为用户提供红樱花手卷、奥尔良鸡排三明治、红烧牛腩饭等速食便当产品。,浙江邻几便利店有限公司,浙江省杭州市拱墅区湖墅南路260号财贸大楼四楼430室,330105000485795,2017-04-11,刘忠建,1250万元人民币,91330105MA28NPWA75
冬日中医,厦门冬日暖阳网络科技有限公司,冬日中医是一个中医在线问诊平台，致力于打造医患交流平台，为患者用户提供流畅简单的问诊体系，为中医合理利用碎片时间，增加收入，提升个人价值。,厦门冬日暖阳网络科技有限公司,厦门市思明区湖明路79号205,350203200528598,2015-02-12,李祖赟,230.7635万元人民币,913502033030821700,www.idongri.com
伟熹,微熹(武汉)科技有限公司,伟熹前身是华中理工大学的学生创业团队，至今已有15年的互联网行业实战经验。伟熹一直秉承年“以服务客户为宗旨，用心倾听客户需求，专心超越客户要求”的经营理念，始终处于稳健发展的状态。,微熹(武汉)科技有限公司,武汉市东湖高新技术开发区关山大道1号软件产业4.1期A区A1栋18层12号,420100000416367,2014-06-03,宋玮玲,100万元人民币,91420100303401581R,www.w1cn.com
泥巴装,深圳市泥巴装网络科技有限公司,泥巴装——家装行业生态系统倡导者。泥巴装由深圳市泥巴装网络科技有限公司创办，总部位于国家级的高新技术产业园深圳市南山区科技园。 于2015年7月25日正式登场，仅用半年时间与行业内第一品牌共同获得“家装行业十大品牌”称号。同时与淘宝达成战略合作，并且受到国际资本青睐，在青 岛、烟台、大连、茂名、湛江、江门等12个城市已实现战略布局。,深圳市泥巴装网络科技有限公司,深圳市前海深港合作区前湾一路1号A栋201室（入驻深圳市前海商务秘书有限公司）,440301114786252,2015-12-31,杨桂芝,500万元人民币,914403003596681114,www.nibaooo.com
朋游App,上海果粒国际旅行社有限公司,朋游是一个旅行服务的共享经济平台，建立用户与服务提供者之间的联系，一方面帮助用户轻松找到有趣、有才、有魅力的当地人，参加其独特的行程设计，体验地道的当地文化；另一方面帮助服务者提供完全不同于传统旅行社的个性化、创意的旅行产品。,上海果粒国际旅行社有限公司,上海市闸北区江场西路180号4幢1层103室,310108000610063,2015-10-16,俞建权,300万元人民币,91310108MA1G302X2X,www.pengyouapp.cn
帮我把,北京金万维科技有限公司,帮我吧是一个客服管理软件，提供远程协作、远程控制和辅助服务等，隶属于北京金万维科技有限公司。,北京金万维科技有限公司,北京市丰台区南四环西路186号四区3号楼7层01-06单元(园区),110105006987060,2004-05-27,罗群辉,1131.1863万元人民币,91110106762953502Q,www.xuanruanjian.com
基因谱,深圳华大互联网信息服务有限公司,深圳华大互联网信息服务有限公司通过整合专业人群、服务机构等资源形成的生态圈，为用户提供全方位基因健康科普资讯、实时全景健康管理应用及个性化健康解决方案。,深圳华大互联网信息服务有限公司,深圳市盐田区北山路146号北山工业区11栋7楼,440301109848926,2014-07-14,方林,1000万元人民币,91440300398536314J,www.genebook.com.cn
卫云科技,重庆卫云科技股份有限公司,卫云科技是一家智慧病理解决方案提供者。专业从事智慧病理技术研发与应用的高科技企业， 公司秉承“为人民服务”的宗旨，基于人工 智能、云计算、大数据、物联网等技术，专注于智慧“云病理e扫平台+AI辅助诊断平台”建设；平台通过 采用强大的GPU加速器运算的软硬件结合设备，快速分析、提取病理切片中的数据，进行病变特征、位 置标注和细胞计数，最大程度发挥病理医生的能力，打造专业化、网络化和智能化的病理诊断体系。,重庆卫云科技股份有限公司,重庆市渝北区金开大道西段106号12幢,500905009879043,2017-08-28,马宏伟,5000万元人民币,91500000MA5UT0H26B,wykjgf.com
恒顺众昇,青岛中资中程集团股份有限公司,"""青岛市恒顺众昇集团股份有限公司是一家专业从事电网节能、环保及电能质量优化解决方案的电力装备供应商.公司主要产品包括高压并联无功补偿装置、高压滤波成套装置、MSVC及核心器件等.公司拥有核心技术30项,发表专业论文多篇,拥有专利技术9项,专有技术18项,公司是青岛市科学技术局、青岛市财政局、山东省青岛市国家税务局和青岛市地方税务局联合认定的""""高新技术企业"""",并曾获得""""青岛市百强科技型民营企业""""、""""青岛市AAA级优等信誉企业""""、""""青岛市民营企业十家最具成长型中小企业""""、""""纳税贡献突出企业及优秀内资企业""""、""""青岛""",青岛中资中程集团股份有限公司,青岛市城阳区流亭街道双元路西侧（空港工业聚集区）,370214018001595,1998-03-10,贾晓钰,76552.5万元人民币,913702007064604985,www.qdhengshun.com
派雷斯科技,亿客美家(武汉)互联网科技有限公司,派雷斯（武汉）科技有限公司是由一批旨在改变当前装修现状的有志之士共同发起创建的新兴的互联网公司，公司本着“垂直化、专业化、多元化”的发展思路，着力打造中国互联网装修平台的第一门户，成为装修行业、O2O行业、电商行业的第一品牌。,亿客美家(武汉)互联网科技有限公司,武汉市洪山区高新大道116号长航蓝晶国际7号楼5层505室,420100000481850,2015-03-27,刘爽迪,1000万元人民币,9142011133354329XL,www.chinapalace.cc
彩夕阳,北京彩夕阳养老科技有限公司,北京彩夕阳养老科技有限公司主要以“智慧健康养老平台+线下养老驿站+照护服务和培训”三项事业为核心布局养老产业，通过智能终端监护设备，结合物联网、云计算、大数据分析和生命感知技术，配合线下驿站定点服务，实现了从老年护理到生活 ，全方位的一站式服务。让父母享受更健康、更安全、更舒心、更智慧化的晚年生活，让子女穿越时间和空间的界限了解父母的健康情况，及时表达爱心和孝心。智慧养老的官方定义是“以社区为依托，老龄人群为服务对象，企事业服务机构为网点，信息化平台为支撑”，建立全方位的智慧养老服务体系。真正做到：“让老人生活的舒心、安心；让子女放心、省心”，从而推动家庭和谐、社区和谐、社会和谐，是构建中国特色养老服务体系的核心内容。,北京彩夕阳养老科技有限公司,北京市北京经济技术开发区科创十四街99号33幢B栋10层1007室,110302024721311,2018-01-15,陈静,200万人民币,91110302MA019X242D,caixiyang.com
安力斯,北京安力斯环境科技股份有限公司,"""公司成立于 2005 年,是国内产品技术领先的水污染治理设备提供商。    公司主营业务为滤布滤池及深度固液分离设备、赛博曝气及生化去污设备等水污染处理设备的研发、设计,以及设备销售。公司下属一家全资子公司安力斯天津。安力斯天津成立于 2009 年 7 月 22 日,主营业务为母公司水污染处理设备的生产、安装,紫外线消毒设备及配件的研发、生产安装和销售,以及提供上述设备产品的售后服务。""",北京安力斯环境科技股份有限公司,北京市海淀区上地信息路11号一层103室,110108008564901,2005-06-21,蔡晓涌,1000万元人民币,91110108777098107B,www.onyxwater.net
医诺方舟,北京医诺方舟科技有限公司,北京医诺方舟科技有限公司是致力于服务大健康领域的移动互联网技术公司，凭借坚持不懈的创造精神和优秀的技术开发能力，将领先的移动互联技术与医药、保健品、器械等行业的需求完美嫁接，构造移动互联网时代的大健康商务新模式。,北京医诺方舟科技有限公司,北京市丰台区南四环西路188号一区2号楼11层1101-B068,110105020569127,2016-01-19,刘栋,100万元人民币,91110105MA0037F67R,www.1nfz.com
索康医用,上海索康医用材料有限公司,上海索康医用材料有限公司是国内唯一一家从事膨体聚四氟乙烯医用植入材料研发和生产的专业型企业，公司以人工血管为首的一系列医用植入产品全部填补亚洲空白。1996年，公司总裁叶明先生率先从美国引进膨体聚四氟乙烯面部整形材料，通过国内研发团队技术改良，突破了膨体聚四氟乙烯产品不能塑形的局限，结合亚洲人脸部特征，首创了成型的鼻假体、下颌假体，并获得中华人民共和国国家知识产权局颁发的多项发明创造专利证书。索康公司以质量求生存，以信誉求发展，在行业内率先通过了国家的ISO9001和ISO13485以及韩国GMP等质量管理体系认证。同时，索康公司生产的立秀@膨体聚四氟乙烯面部植入物还获得了韩国KFDA和欧盟CE认证，其安全有效性得到了临床充分的证明。,上海索康医用材料有限公司,上海市普陀区绥德路613弄2号,310115000685027,2002-06-20,叶明,1000万元人民币,91310107740286673Y,www.surgithes.com
大津重工,江苏大津重工有限公司,江苏大津重工有限公司为上海佳船企业发展有限公司2013年根据公司远期发展规划，在镇江地区投资收购的中型造船企业。公司可以建造30000吨级散货船、集装箱船、成品油船、化学品船、多用途船、水上工程船舶及海洋工程船等高附加值船等各类船舶。,江苏大津重工有限公司,江苏省扬中市西来桥镇北胜村606号,321182000087373,2017-12-01,占金锋,22727.2727万元人民币,913211820601709922
安盛科技,河南安盛科技股份有限公司,"""公司是国内领先的IT解决方案和行业应用软件设计及服务提供商,国内首批社会保险管理信息系统研发企业,国内首批食品药品安全监管信息化平台研发企业。公司秉承技术创新、引领行业、成就客户、至诚守信的企业理念,致力于为政府、企事业单位等行业信息化提供一体化应用解决方案。深度提供IT咨询规划、软件定制开发、数据增值挖掘、系统集成维护等本地化专业服务。公司拥有一批诚信敬业、专注卓越的技术研发和销售服务团队,始终秉承“为客户创造价值”的服务理念。""",河南安盛科技股份有限公司,郑州市高新区西三环路279号12号楼18层,410100100014609,2000-01-25,朱永胜,1087.5万元人民币,91410100719168541F
e蜂社,深圳市街边网科技有限公司,e蜂社无人微超是以新一代智能零售终端为载体服务社区、商业的的无人微型超市，它采用的是支付宝信用体系，用户通过使用支付宝扫码功能开启无人终端的门，在进行商品选购后，关门的时候系统会自动识别所选商品，并自动在支付宝上进行扣款。,深圳市街边网科技有限公司,深圳市南山区粤海街道深南大道9678号华润城大冲商务中心B座九层-001,440301111706121,2014-11-20,刘建军,52.64万元人民币,91440300319700412A,www.jiebian.me
佳力奇,安徽佳力奇碳纤维科技股份公司,"""公司主要从事活性碳纤维毡、活性碳纤维布以及碳纤维复合材料的研发、生产和销售,专注于向军工企业提供碳纤维复合材料,向民用企业提供活性碳纤维毡布等。公司产品可广泛应用于航空、航天、兵器、电子、船舶、汽车、医疗卫生、环境保护、体育器材等领域。""",安徽佳力奇碳纤维科技股份公司,安徽省宿州市高新技术产业园区朝阳路169号,341300000020032,2004-03-30,路强,4550万元人民币,913413007117898966,www.jlqht.com
景泽生物,上海景泽生物技术有限公司,上海景泽生物技术有限公司（下称景泽生物）是2014年5月由核心技术团队与湖南景峰医药股份有限公司（股票代码：000908）及康景资本共同出资成立的一家生物医药企业。 景泽生物致力于应用生物前沿技术进行创新生物药物、高端生物医学材料的研究开发及产业化。技术涵盖了单克隆抗体、重组蛋白、组织工程生物可降解材料等多个领域。,上海景泽生物技术有限公司,上海市宝山区罗新路50号-1,310113001168897,2014-05-23,孙海胜,1666万元人民币,913101133014257828,shjz.oho168.com
饭秀才,芜湖马上信息科技有限公司,饭秀才是一个餐饮用工对接平台提供商。马上信息是一家互联网信息科技领域项目。,芜湖马上信息科技有限公司,芜湖市镜湖区长江中路92号(雨耕山文化创意产业园F栋5层501)(申报承诺),,2018-12-18,刘兵木,100万元人民币,91340200MA2TBLLLXT
乌鸦救赎,内蒙古现奇文化传媒有限公司,乌鸦救赎是一个情感咨询服务团队，目前拥有系统情感理论系统：恋爱连招以及人格重塑等重要独家系统理论。,内蒙古现奇文化传媒有限公司,,150103000085743,2015-09-25,吕丽萍,10万元人民币,91150103MA0MW08025,www.wuyajiushu.com
Clazio.ai,深圳宽洋网络发展有限公司,Clazio.ai是一家智能触屏音箱研发商，该智能音箱采用了完整的安卓软硬件系统，带有7英寸的触摸屏、近场麦克风、摄像头以及5Wx2的音箱，并且具有HDMI的输出端口可以连接电视机。,深圳宽洋网络发展有限公司,深圳市南山区高新南一道思创科技大厦四楼418室,440301108265787,2013-11-06,刘大可,1111.1万元人民币,91440300082497005D,www.pan-ocean.com.cn
威麦云健,广州威麦云健网络科技股份有限公司,广州威麦云健网络科技股份有限公司主营业务为硫化鞋和冷粘鞋的研发、生产及销售。公司主要产品或服务有VANS、SUPRA硫化鞋、自主品牌产品TWEAK硫化鞋、冷粘鞋。,广州威麦云健网络科技股份有限公司,广州市番禺区东环街迎宾路730号番禺节能科技园内天安科技创新大厦711房,440106000375199,2011-03-02,王奕壮,5300万元人民币,9144010156976569X9,tweakwm.tmall.com
百勤油服,深圳市百勤石油技术有限公司,百勤油服是以钻完井为核心的中国领先独立高端油气田技术服务公司，2013年于香港主板成功上市（股票代号：2178）。,深圳市百勤石油技术有限公司,深圳市南山区后海大道以东天利中央广场7楼0705-0710,440301103073415,2002-04-26,王金龙,7600万元人民币,91440300736297468C,www.petro-king.cn
斯达领科,深圳斯达领科网络科技有限公司,深圳斯达领科网络科技有限公司（以下简称Starlinke/斯达领科），成立于2017年，致力于把中国智造的优质产品，通过自有网站+三方平台的行业新锐模式销售到全世界。总部位于深圳，在成都设有技术团队分部，现拥有一支近200人的年轻精英团队。,深圳斯达领科网络科技有限公司,深圳市前海深港合作区前湾一路1号A栋201室(入驻深圳市前海商务秘书有限公司),440300201741200,2017-07-06,刘新,500万元人民币,91440300MA5ELXMX3F
原亚科技,厦门原亚网络科技有限公司,原亚网络科技有限公司，坐落于软件园二期，位于望海路10号楼大拇哥集团内部，以为中小企业提供软件及人才服务为核心业务，帮助传统企业实现网络咨询、在线营销等一站式电子商务解决方案。公司福利待遇佳，前景发展平台大，原亚科技是大拇哥公司战略投资的高科技企业，是一家综合性软件与信息服务企业，提供从咨询、解决方案、技术服务到IT人才培养的“端到端”软件及信息服务，目前已经覆盖政府、制造流通、金融银行、保险证券、移动应用、电信、高科技、公用事业、能源等多个行业。原亚科技的服务遍布全国，服务于全国各中小企业，员工逾500人，公司经过前期风险投资获得前期100万的种子基金，，公司经过前期风险投资获得前期100万的种子基金，公司经过前期风险投资获得前期100万的种子基金，厦门分区拥有员工超过100人,厦门原亚网络科技有限公司,,350299200140957,2016-11-08,苏惠珠,100万元人民币,91350200MA2XR33W7U
