名字,公司,介绍,公司,地址,身份证,时间,法人,注册金额,编号,网址
格丰科技,格丰科技材料有限公司,格丰科技材料有限公司是由国家特聘“千人计划”专家奉向东博士以“国际领先”的靶向键合功能陶瓷纳米材料（森美思SAMMNS）专利技术而成立的高科技创新型环保企业。主营环境治理新材料和设备，承包包括水处理、土壤修复、大气治理等方面在内的各项环保工程。,格丰科技材料有限公司,,360300510000766,2012-06-07,奉陈旻,9267.44万元人民币,9136030059651065X6,www.gftem.com
几何图像,深圳市几何图像科技有限公司,深圳市几何图像科技有限公司成立于2012年，由深圳市蜗牛窝科技有限公司董事长独立投资，公司主要业务进行模型数据、VR数据内容的处理。现根据公司战略规划，成立了VR行业模型搜索事业部，专注于VR内容平台产品。,深圳市几何图像科技有限公司,深圳市南山区粤海街道高新中三道9号环球数码大厦15楼,440301106425299,2012-07-25,李勤学,160万元人民币,91440300051535865A
村游网络,杭州趣村游文旅集团有限公司,杭州村游网络科技有限公司由村游乡村旅游规划设计研究院、村游APP移动平台组成，是首个“互联网 乡村旅游”内容提供商。,杭州趣村游文旅集团有限公司,杭州市江干区凯旋路208号5楼7506室,330104000292645,2015-07-07,汪崇斌,500万元人民币,913301043418798427,www.cyw.com
艾比森,深圳市艾比森光电股份有限公司,深圳市艾比森光电股份有限公司（股票代码：300389）专注于LED显示屏业务。产品远销美洲、欧洲、澳洲、亚洲、非洲等120多个国家和地区，广泛应用于美国NBA球赛、世俱杯、欧洲杯、总统新闻发布会、高档购物商场、奢侈品牌专卖店、国家电视台等领域。,深圳市艾比森光电股份有限公司,深圳市龙岗区坂田街道雪岗路2018号天安云谷产业园一期3栋A座18、19、20层,440307103064881,2001-08-23,丁彦辉,31965.0445万元人民币,91440300731127582R,www.absen.cn
延长化建,陕西延长石油化建股份有限公司,陕西延长石油化建股份有限公司是一家以工程承包、设备制造、商品流通等为主要业务的上市公司.公司的产品有非标设备制造、技术培训、建筑安装、设备无损检测、小麦等粮食作物种子等。,陕西延长石油化建股份有限公司,陕西省杨凌示范区新桥北路2号,610000100042685,1998-11-30,高建成,91795.2672万元人民币,91610000710097708A,www.ycpcec.com
正丰数控,福建省正丰数控科技有限公司,福建正丰数控科技有限公司是一家数控设备制造商。坐落于福建安溪，是一家集专业研发、生产和销售数控加工中心、多轴数控精密、高速高精等中、高端数控设备厂家，产品主要应用于3C产品、航天航空、汽车模具、医疗器械、五金及工装模具等各个行业领域。,福建省正丰数控科技有限公司,安溪县龙桥工业园A—3地块,350524100081115,2014-07-25,陈志明,10000万元人民币,913505243107130065
趣炒股,华赢科技（北京）有限公司,趣炒股网是一家专业的第三方互联网金融平台，通过“交易账户实时监管+第三方资金托管+大数据风控”的思路来控制平台借贷双方的风险。专注为用户打造一个专业、易用的网上证券金融平台，帮助用户从股市得到更好的资产升值。,华赢科技（北京）有限公司,北京市朝阳区北土城东路4号院1号楼2层011室，北京市朝阳区太阳宫中路12号楼4层402,110105018085355,2014-10-28,黄浩,2000万元人民币,91110105318107983B,www.quchaogu.com
通桥医疗,珠海通桥医疗科技有限公司,通桥医疗成立于2016年，专注于神经血管介入治疗领域，其自主研发产品包括颅内动脉瘤弹簧圈、颅内取栓器、颅内血管载药支架等。公司已提交八项专利申请（其中四项为发明专利），三项已授权，产品研发已取得阶段性成功，并完成动物活体实验，进入临床实验阶段。 为高效推动两家公司的产品发展，归创和通桥完成合并，想要在血管介入领域进行更深的产品开发和市场布局。公司已提交八项专利申请（其中四项为发明专利），三项已授权，产品研发已取得阶段性成功，并完成动物活体实验，进入临床实验阶段,珠海通桥医疗科技有限公司,珠海市香洲区唐家湾镇科技七路1号珠海中电高科技产业园4栋1-B单元,440400400062238,2016-02-26,ZHAO JONATHON ZHONG,650.4546万元人民币,91440400MA4UM7BE5N
盛果信息,盛果信息技术（上海）有限公司,盛果信息是一家计算机硬件及网络技术研发商，主要经营范围是计算机硬件及网络技术的研发，计算机软件的开发、设计、制作、销售，并提供相关的技术咨询和技术服务。,盛果信息技术（上海）有限公司,中国(上海)自由贸易试验区郭守敬路356号3幢107室,310115400263245,2010-09-28,何国俊,133.132万元人民币,91310000561927076A
阿甘生鲜,北京甘先生电子商务有限公司,阿甘生鲜是一家生鲜食品与蔬菜电商平台，主要为用户提供有机蔬菜和全球原产地进口直供海鲜。平台通过自建仓储物流来实现集中配送、自建实验室并定期进行第三方检验来保证食品质量。,北京甘先生电子商务有限公司,北京市朝阳区百子湾东里102号楼1层5单元102,110105019215451,2015-05-29,李逸宁,135.5014万元人民币,91110105344308893G,www.agan365.com
环球石材,环球石材（东莞）股份有限公司,环球石材(东莞)股份有限公司主要从事装饰石材的设计、生产和销售业务。公司自成立以来，主营业务未发生变更，现已具备矿山开采、产品设计、石材加工及石材安装施工的全产业链服务能力。　　公司在2012-2014年“中国房地产开发企业500强首选供应商品牌”（石材类）中的首选率分别为14%、18%和17%，稳居石材行业首位。环球石材（UMGG）先后荣获“中国驰名商标”、“广东省著名商标”、“国家级高新技术企业”等称号。,环球石材（东莞）股份有限公司,东莞市长安镇厦岗村,441900400063075,1994-07-16,朱新胜,35999.761万元人民币,9144190061833079XB,www.umgg.biz
唯美美妆,南京思芙美网络科技有限公司,唯美美妆是一个海外化妆品的电商平台，以香港为基地，为全球顾客提供折扣品牌护肤品、香水及化妆品，提供护理产品的同时，还可以提供个人护理解决方案。,南京思芙美网络科技有限公司,,320123000187583,2017-12-08,刘瑞美,152.7258万元人民币,91320111555511947X,www.vmei.com
优守卫,泉州国光软件开发有限责任公司,泉州国光软件开发有限责任公司，是国内一流的专业无源电子锁研发生产厂家及行业用锁系统解决方案。,泉州国光软件开发有限责任公司,泉州市丰泽区北峰街道拒洪社区博东路101号3栋401室,350503100046655,2008-08-19,傅朝义,4000万元人民币,9135050367847340XC,www.usafeway.com
点线软件,广州市点线软件科技有限公司,点线软件是一家制造行业信息化系统研发商，致力于为用户提供全流程定制家具设计系统、三维建模软件、生产管理系统等，旗下产品有WT企业板。,广州市点线软件科技有限公司,广州高新技术产业开发区科学城科学大道182号创新大厦C2栋第11层1102单元(自主申报),440104000144646,2010-07-26,林丙鑫,60.0024万元人民币,91440116558386731X,www.gzdianxian.com
浙数文化,浙报数字文化集团股份有限公司,浙报传媒是中国报业集团下的的一家上市公司。以投资与经营现代传媒产业为核心业务，负责运营《浙江日报》、《钱江晚报》、《浙江在线》等媒体和边锋网络平台。,浙报数字文化集团股份有限公司,浙江省体育场路178号26-27楼,310000000010005,1992-07-01,张雪南,130192.3953万元人民币,91330000132211766N
华影动漫,武汉华影动漫设计有限责任公司,华影动漫是一个致力于打造以品牌营销为手段的文化创意动漫运营公司，主要有互联网动漫品牌营销、动漫产品研发、文创产品研发、动漫主题商业开发、出版发行、动漫电影开发及销售等业务，目前以制作外包、广告服务、IP转化业务为主。,武汉华影动漫设计有限责任公司,武汉东湖开发区关山大道20号中国光谷创意产业基地二号楼第601－611室,420100000233385,2011-04-11,沈娟,300万元人民币,91420100572024550D,www.whhydm.com
运宝网,北京冏鹿网络科技有限公司,北京冏鹿网络是一家物流O2O服务公司，旗下有鹿鹿管车、鹿鹿司机、鹿鹿调车、易鹿发智能货运移动网、运宝网等产品。,北京冏鹿网络科技有限公司,北京市西城区广义街5号（广益大厦6层B610）,110102013720386,2011-03-29,何剑,10000万元人民币,91110102571212859P,www.58jzx.com
众包客,南京蒽凯网络科技有限公司,南京蒽凯网络科技有限公司10年互联网行业经验，目前拥有互联网大金融领域、互联网大教育领域及互联网细分领域多项产品知识产权！,南京蒽凯网络科技有限公司,南京高新区惠达路6号北斗大厦2楼204室,320191000040841,2015-06-12,陈兴宇,500万元人民币,913201913393798651,www.zbk8.com
中嘻汇,北京仁智信体育文化发展有限公司,中嘻汇是一个街舞培训机构。,北京仁智信体育文化发展有限公司,,110105019328560,2015-06-16,邬明君,5000万元人民币,91110105348274387Y,www.csda.cn.com
磐迅,上海磐迅信息技术有限公司,我们服务于金融、证券、期货行业，从事证券、期货、金融衍生品市场交易类软件开发、研制、销售、和解决方案提供的高科技公司， 公司至始至终励志成为金融、证券、期货行业优秀专业的技术提供商和运营服务合作商。,上海磐迅信息技术有限公司,上海市浦东新区耀华路488号1706室,310115002128422,2013-06-06,钱铮,200万元人民币,91310115071159035A,www.passionsoft.net
幻盈电子,广州市幻盈电子科技有限公司,幻盈电子是一家从事计算机技术开发的公司。主营业务：计算机技术开发、技术服务;计算机零配件批发;办公设备耗材批发;通讯设备及配套设备批发;通用机械设备销售;安全技术防范产品批发;电线、电缆批发;电工器材的批发;防雷设备的销售;监控系统工程安装服务;通信设施安装工程服务;,广州市幻盈电子科技有限公司,,440125000249149,2016-08-24,肖海敏,20万元人民币,91440101MA59EG6E72
时代互动,成都时代互动科技有限公司,成都时代互动科技有限公司成立于2013年，致力于在体感技术、增强现实（AR）、虚拟现实（VR）、机器视觉听觉、机器智能、触摸屏多点、多媒体互动、新媒体，等各类人机交互领，为展览展示、数字新媒体、互动营销、教育、医疗等行业提供更优的解决方案，并在智能硬件、物联网等前沿领域不断拓展。我们利用前沿的技术和硬件平台，致力于解决人们在生活娱乐或商业项目中的各种更高更智能的诉求。,成都时代互动科技有限公司,成都高新区天顺北街39号1层,510109000369968,2013-04-25,龚国栋,30万元人民币,915101000669708513,www.epoching.com
信多帮,信铎邦（北京）网络科技有限公司,信多帮是一个提供信息化解决方案的泛营地行业企业。从营前的报名到营中的管理，再到营后评价，一体化地把泛营地行业公司的线下痛点搬到线上来解决，帮助这些公司提高效率、提升品牌,信铎邦（北京）网络科技有限公司,,110105019695652,2015-08-11,于明,117.6468万元人民币,911101053530041464,www.xinduobang.cn
智达汽车租赁,深圳市智达汽车租赁有限公司,智达汽车租赁是一家专业从事汽车租赁服务的公司，提供的租车方式包括长期租车、短期租车、会议租车、婚礼租车等，也可提供专业司机代驾、陪驾。,深圳市智达汽车租赁有限公司,,440301105443108,2011-05-31,孙忠宝,200万元,9144030057638000XA,qy.58.com
九极,广东九极生物科技有限公司,广东九极生物科技有限公司是一家主营保健食品、保健日用品、美容护肤品和健康食品的研发、生产、销售和服务等业务的公司，多年来一直在抗氧化抗衰老的保健食品领域独有建树，九极产品和服务也获得广大消费者一致厚爱和好评，荣获国家《保健食品GMP证书》等众多殊荣。,广东九极生物科技有限公司,广东省广州市黄埔区广州开发区永和经济区田园西路6号,440000000029625,2003-05-06,王永辉,8000万元人民币,914400007480109897,www.gdjiuji.com
智充科技,北京智充科技有限公司,智充是一家电动汽车共享充电桩研发商。主要产品有智充智能交流充电装置、智能直流快充充电装置、社区基础充电设施配套服务等。通过提供“智能硬件＋去中心化”的一站式解决方案，帮助运营商和用户解决充电难的问题，实现共享充电。,北京智充科技有限公司,北京市海淀区龙岗路51号院7号楼2层C119室,110108019035520,2015-05-04,丁锐,539.6573万美元,911101083397675346,www.xcharge.com
企鹅童话,北京企鹅童话科技有限公司,企鹅童话是腾讯旗下专注于儿童数字内容的互联网企业，以无线互联网人气品牌“袋鼠跳跳”“宝贝听听”儿童应用为载体，以成熟的数字发行渠道和专业的运营经验为保障，为传统出版社，内容工作室和个人原创作者打开无线互联网的开放门户， 并以资源优势打造儿童优质IP及“泛娱乐”全产业链模式。,北京企鹅童话科技有限公司,北京市海淀区东北旺西路8号院37号楼三层317号,110108021691931,2016-07-22,贺亮,1537.94万元人民币,91110108MA0074575G,www.qqikids.com
天天向上马术,济南天天向上骑士会马术俱乐部有限公司,天天向上马术是一家专业英式马术培训机构。目前营业项目包括：马术培训、休闲骑乘、马术表演、活动私人定制、马匹调教、马匹交易、境内外马术交流等。,济南天天向上骑士会马术俱乐部有限公司,,370112200154905,2015-01-20,王静娴,400万元人民币,913701123068811111
东旭光电,东旭光电科技股份有限公司,东旭光电是一家液晶玻璃基板生产商，也是全球领先的光电显示材料供应商。公司从光电显示产业起步，逐渐发展成为集液晶玻璃基板、盖板玻璃、偏光片、彩色滤光片、蓝宝石等光电显示材料、高端装备制造及系统集成、石墨烯产业化应用、新能源汽车研发及制造、智慧城市建设等业务为一体的综合性高新技术企业，产业上下游纵向布局及横向联动不断深化，逐渐形成了具有综合竞争力的新兴产业集群。,东旭光电科技股份有限公司,石家庄市高新区黄河大道9号,130000000001040,1992-12-26,王立鹏,573025.0118万元人民币,911301001043959836,dongxuguangdian.com.cn
九药网,北京国泰永康大药房有限公司,九药网是一个医药电商公司，提供OTC药品，营养保健，成人用品，医疗器械等，药品专区主要提供感冒用药、肠胃用药、皮肤用药等。,北京国泰永康大药房有限公司,北京市丰台区南苑团河路商业街西12号,110106014419793,2011-11-16,包玉龙,200万元人民币,91110106585828195Y,www.guotaiyongkang.com
春秋时代,甘肃春秋时代大漠食材有限公司,春秋时代出品的每一份食材都由甘肃原产地直供。无论新鲜蔬果、营养干货还是特色肉类，件件都是原生态的绿色食材，浓浓健康好滋味。,甘肃春秋时代大漠食材有限公司,,620621200014277,2016-01-05,陈新东,5000万元人民币,91620621MA721Y7C2Y,www.chtimes.com
智诚创梦,成都智诚创梦信息技术有限公司,我们公司目前规划两块核心业务：,成都智诚创梦信息技术有限公司,成都高新区天府四街66号2栋5层4号,510109000567605,2015-04-20,康镜,50万元人民币,9151010033204128XN,www.cdzcit.com
千麦医疗,上海千麦医疗投资管理有限公司,千麦医学检验是一家第三方独立医学实验室。主要从事临床检验服务、药物临床试验服务、科研服务，同时为各医疗机构提供实验室信息管理系统支持、以及ISO15189、美国病理家协会CAP等质量体系咨询服务、SOP流程建设及外审服务。,上海千麦医疗投资管理有限公司,上海市闵行区闵北路88弄1-30号104幢第5层501室,310115001934678,2012-02-29,陈娅妮,6157.6746万元人民币,913101125916080762,www.cmlabs.com.cn
熊管家,杭州熊管佳电子商务有限公司,熊管家是一家提供洗衣服务的O2O服务商，提供在线预约下单、免费上门取送，由杭州熊管佳电子商务有限公司开发，该公司专注于无线生活服务类O2O研发与运营。,杭州熊管佳电子商务有限公司,杭州市余杭区仓前街道绿汀路1号1幢330室,330184000329543,2014-11-26,高涛,117.65万元人民币,913301103219078779
悟空音乐,广州珸空网络科技有限公司,悟空校园是一个基于移动互联网的校园社交生活APP，致力于打造围绕学生真实生活的网络在线社区。广州珸空网络科技有限公司旗下产品。,广州珸空网络科技有限公司,广州市越秀区水荫路29号201、202自编209-212A,440111000659560,2014-07-07,邓金云,200万元人民币,9144010630443908XA
黑石机器人,杭州黑石机器人有限公司,黑石机器人是一家无人奶茶店运营商，主要面向年轻女性群体，基于智能深度学习、语音交互、3D打印等技术，自主研发的机器人能够通过视觉识别用户的身份、行为，获取其购物历史，为用户推荐并制作果汁、奶盖、雪乐等6种系列的奶茶产品。,杭州黑石机器人有限公司,浙江省杭州市余杭区良渚街道七贤桥村7幢1楼南侧102室,330184000260046,2013-09-16,翟永辉,156.25万元人民币,91330110077338173H,www.bsrobots.com
秉钰投资,上海秉钰投资管理有限公司,秉钰投资是一家实业投资与投资咨询服务提供商。主要经营范围：投资管理，实业投资，投资咨询，财务咨询。,上海秉钰投资管理有限公司,浦东新区航头镇航南公路999号7幢395室,310115002470348,2014-10-29,田振华,300万元人民币,91310115320784385L
缀强科技,杭州缀强科技有限公司,杭州缀强科技有限公司，创新专业的电子产品回收及以旧换新服务提供商；缀强科技专注于手机、笔记本、单反等电子数码产品回收业务，致力于做B2C模式中最专业的服务第三方，线上线下同步推广。,杭州缀强科技有限公司,杭州市下城区三塘兰园1幢（商）4号,330103000177521,2013-05-15,郦力,250万元人民币,913301030678723131,www.huishouking.com
轻运动,北京轻蜗科技有限公司,轻运动是一款口袋运动健康管家软件。支持跑步、步行、骑行轨迹定位追踪，里程、速度、海拔等数值精准采集；支持室内平板支撑时长与卡路里记录，云端保存。,北京轻蜗科技有限公司,北京市密云区西大桥路69号密云区投资促进局办公楼305室-1419,110228017796083,2014-08-26,匡迪飞,10万元人民币,91110228306686383X
中科汇康,深圳中科汇康技术有限公司,深圳中科汇康技术有限公司（以下简称“中科汇康”）坐落于福田区华强云产业园区，是一家专业从事健康数据采集、数据分析并据此对人体进行健康监控、管理、疾病预测与预防，同时集智能保健电子设备研发、生产、销售为一体的高科技企业。中科汇康与战略股东中国科学院深圳先进技术研究院（以下简称“先进院”）合作，建立了强大的技术支撑体系。先进院是由中国科学院、深圳市政府协商共建的国家科研机构，是新时期中科院面向国家和区域产业和社会需求进行的重大科技布局，是深圳市建设国家首个创新型试点城市的重要科技支撑平台。,深圳中科汇康技术有限公司,深圳市福田区梅林工业区梅秀路华强云产业园3号厂房6楼606,440301107986633,2013-09-22,冷密清,2250万元人民币,91440300079814364H,www.hk-bithealth.com
吉事多便利店,安徽吉事多便利店有限公司,吉事多便利店是一家24小时营业便利店，一家利用信息技术与互联网技术，采用线上与线下、实体店与虚拟店相结合本地化便利生活与服务的新零售运营管理服务公司。,安徽吉事多便利店有限公司,合肥市高新区柏堰科技园香樟大道168号C6号楼2层,340191000096205,2016-10-08,许昆,500万元人民币,91340100MA2N146F9P,www.juststore.cn
儿歌点点,北京萌宝科技有限公司,儿歌点点是一个中英文儿歌故事的app，提供早教育儿资讯、故事等，隶属于北京萌宝科技有限公司。,北京萌宝科技有限公司,北京市海淀区北三环西路25号2号楼2层201室,110108019080638,2015-05-12,高少星,100万元人民币,9111010833986932X8,ergedd.com
易毫故问,北京易毫故问教育咨询有限公司,北京易毫故问教育咨询有限公司（简称留学好顾问）是隶属于小马过河集团，专注打造成为留学行业的服务平台，为留学行业的合作伙伴提供在线流量分发、大数据管理、移动CRM等服务的一家互联网公司。,北京易毫故问教育咨询有限公司,北京市朝阳区建国门外大街永安东里8号13层1307c-1311,110105018696468,2015-03-02,许建军,10万元人民币,91110105330417087N,www.haogw.com
臻识科技,成都臻识科技发展有限公司,臻识科技是一家计算机视觉技术商用化公司，专注于智能视频、计算机视觉、人工智能领域的前沿探索与研究，研究方向主要包括数字图像与视频处理、图像与视频编码、图像内容理解研究、图像与视频检索研究等。,成都臻识科技发展有限公司,成都高新区交子大道300号3栋22层5号,510109000064255,2009-03-06,任鹏,1111.1112万元人民币,91510100684593707H,www.vzenith.com
众车纷享,杭州众车纷享新能源汽车有限公司,众车纷享是一家汽车销售以及分时租赁服务商。公司主要从事众泰E200在杭州区域的汽车销售业务，公司也从事汽车分时租赁、汽车事务代理、车辆按揭手续办理以及旧机动车交易业务。,杭州众车纷享新能源汽车有限公司,浙江省杭州市拱墅区石祥路688号405室,330105000443072,2016-07-20,姜祖荣,10000万元人民币,91330105MA27Y8GKXD,www.ccclubs.com
爱唯仕,北京嘉腾恒业科技发展有限公司,爱唯仕是一家毛绒玩具生产经销商。,北京嘉腾恒业科技发展有限公司,北京市海淀区蓝靛厂东路2号院2号楼(金源时代商务中心2号楼)3单元(C座)10A2,110108011994065,2009-06-10,宛景宏,5000万元人民币,91110108690838010L
中窑股份,广东中窑窑业股份有限公司,"""公司成立于1997年,于2011年改制为广东中窑窑业股份有限公司.是一家以生产建筑陶瓷用辊道窑为主的民营科技企业.""",广东中窑窑业股份有限公司,佛山市南海区罗村镇下柏工业大道东,440682000047378,2003-03-18,柳丹,7800万元人民币,9144060074803880XF,www.zhongyaokiln.com
一清创新,深圳一清创新科技有限公司,一清创新是一家计算机硬件开发商。,深圳一清创新科技有限公司,深圳市前海深港合作区前湾一路1号A栋201室(入驻深圳市前海商务秘书有限公司),440300204811993,2018-06-28,王鲁佳,588.2352万元人民币,91440300MA5F70KPXT
浩行互联,广州市浩行信息科技有限公司,广州市浩行信息科技有限公司制造的核心业务方面包括了广州网站建设、广州网站制作、广州网站设计、广州网站开发、广州网站推广等。我们的团队是一支专业、朝气、创新、专注、有凝聚力的团队，从而能够为客户提供完善的网站建设方案和优质的服务。我们的宗旨是：力求为客户提供最高品质的服务。 浩行网络由多年从事网站建设策划、设计及开发的专业网站设计开发工程师组成，我们深知，互联网技术的发展是永无止境的，网站的建设更要符合企业和市场的需要。,广州市浩行信息科技有限公司,广州市天河区棠下涌东路306号之二5至6楼511房,440106001009434,2014-08-07,胡武浩,50万元人民币,91440106304735436F,5268w.com
侍埃电商,上海侍埃电子商务有限公司,? ? YES! 2016年2月。我们在汽车互联网行业带来了独角兽文化。我们智慧的将平安文化、众安文化、银联文化通过创始人的魔法结合到了一起。凝结汽车狂人、金融天才，互联网大拿的空间艺术。? ? 我们极为关注未来的分享工作方式，在创始人的花园中头脑风暴，在安亭汽车城世茂孵化空间会议。在任何景区，超五星酒店激荡技术与思想。? ? 侍埃电商致力成为中国领先的全市场全平台O2O汽车车源提供商，以“精于商道，尊重效果”为企业法则。企业从2016年2月14日开始正式运营，截止2016年5月底，侍埃电商已成为业内成长最,上海侍埃电子商务有限公司,上海市奉贤区青村镇光明金钱公路3298号第5幢2087室,310120003030188,2015-12-16,胡磊,1000万人民币,91310120MA1HK9K05L
