名字,公司,介绍,公司,地址,身份证,时间,法人,注册金额,编号,网址
中天迅,深圳市中天迅通信技术股份有限公司,"""深圳市中天迅通信技术股份有限公司主要从事研发、生产、销售移动通讯设备的各类型天线产品与五金冲压配件的开发, 产品主要包括:内置天线(多回路频带天线、PIFA天线、Monopole天线)；外置Stubby天线；无线网卡天线；蓝牙天线；手机GPS天线；数字无绳电话天线；900－1800MHZ、2.4G和5.8G等GSM天线；2G天线、3G天线、4G天线等，无线固话天线、RFID天线等，产品月生产能力120万个天线（目标产能每月300万个天线）。五金模具产品主要：五金手机外壳，屏弊罩，弹片等各种五金冲压件。凭借强""",深圳市中天迅通信技术股份有限公司,深圳市前海深港合作区前湾一路1号A栋201室（入驻深圳市前海商务秘书有限公司）（实际经营场所：深圳宝安石岩街道龙仔路东侧厂房A栋一层西面、二层）,440301109590063,2014-06-13,苏永红,2000万元人民币,91440300306263823P,www.szztx.net
魔芋园,绵阳市安州区网库魔芋科技有限公司,安县网库魔芋科技有限公司是中国网库互联集团在安县基地成立的一家子公司，专注于魔芋产业的营销渠道、供应链的更新，旨在将安县的特色农产品推广到全国、乃至全世界！,绵阳市安州区网库魔芋科技有限公司,安县花荄镇白鹤林社区（工业园区安馨公寓）,510724000034002,2015-10-12,王波,500万元人民币,91510724MA62405F61,www.moyucy.com
科艺新能源,广西科艺新能源有限公司,"""科艺新能源是一家新能源汽车配套产品研发商，包括汽车充电桩、汽车配件、机械配件、模具、机电设备等。经营范围","新能源汽车及配套产品的研发；汽车充电桩、汽车配件、机械配件、模具、机电设备、电子产品、铝制品、节能产品的生产、加工、销售；货物及技术进出口业务（国家法律法规限制或禁止的除外）；房地产开发（凭有效资质经营）；商务信息咨询；互联网信息技术开发；钢材（不设门店，凭订单经营）、煤炭、橡胶制品、化工产品（除危险化学品）、建筑材料、装饰材料、电器、工业自动化设备及配件的销售""",广西科艺新能源有限公司,广西钦州市中马钦州产业园区中马大街1号公共服务中心A105室,450700000159719,2017-11-03,杨华梅,34880万元人民币,91450700MA5MW2153T
富邦印刷,银川市富邦印刷包装有限公司,富邦印刷是一家印刷包装服务提供商，专注于各类清真产品专用包装、纸包装、纸浆模塑包装研发、设计、生产与销售，产品包括工业、农业商品包装、彩印水印纸箱、礼盒、纸浆模塑缓冲材料包装等。,银川市富邦印刷包装有限公司,,641100200032837,2000-10-19,刘式刚,4415万元人民币,9164110071504471XW,www.nxfbbz.com
随客传媒,武汉随客文化传媒有限公司,随客传媒主要是，  桁架：种类众多的桁架可完成各类背景架；舞台：本公司拥有各类活动舞台及舞台搭建；音响：进口灯、进口音响；庆典礼仪：开业典礼、楼盘开盘封顶、新店开张、项目揭牌、体育赛事、通车典礼、车展、颁奖典礼、启动仪式、文化节日、校庆典礼、高端婚庆；会议会务：新品发布、产品推介、企业年会、新闻发布、品牌宣传、客户答谢、巡展活动、商业演出、公益活动、培训研讨。,武汉随客文化传媒有限公司,武昌区南湖街北港村南国南湖城市广场1栋6层1号（善缘商务秘书0084）,420106000572086,2016-09-23,贺先勇,101.0101万元人民币,91420106MA4KNKAF97
诺斯清,上海诺斯清生物科技有限公司,诺斯清是一个鼻腔护理产品品牌。公司以全国自有产品运营为主，上海区域代理为辅。主营产品及品牌有诺斯清系列产品、贝瑞血氧监测系列产品、爱普注药泵系列产品、益生菌系列产品等。其中诺斯清高渗缓冲海水鼻腔护理喷雾器首创从浓度、PH值和缓冲溶液三个方面调节鼻腔功能，并率先提出了“高渗快速缓解+等渗日常护理”的序贯新理念，完善了鼻腔护理不同病程的治疗方案。,上海诺斯清生物科技有限公司,上海市闵行区联航路1188号8幢102室(G单元),310112001071519,2011-05-19,叶建立,5000万元人民币,913101125758007894,www.aponnsq.com
深深宝A,深圳市深粮控股股份有限公司,公司集中资源大力实现产业转型升级，全力发展茶产业，积极探索茶产业链商业模式创新，不断整合从产源端到消费端的产业资源，持续强化以产业链为基础的整体市场价值输出，努力实现从以茶为产品拓展到以茶为媒介的消费型产业生态。目前，公司基本实现了全产业链的整合布局，建立了从茶叶种植、初/精制、茶提取、精品茶销售、茶文化体验、电子商务、茶叶交易服务平台、茶供应链金融等较为完善的茶产业链体系，旗下拥有深宝技术中心和云南普洱茶交易中心两个产业型服务平台，深宝华城和婺源聚芳永两个国家级高新技术企业，并形成了聚芳永、武夷山深宝岩茶,深圳市深粮控股股份有限公司,深圳市南山区粤海街道学府路科技园南区软件产业基地4栋B座8层,440301103223954,1981-07-30,郑煜曦,49678.2303万元人民币,91440300192180754J,www.sbsy.com.cn
创客大数据,广州创客电商科技有限公司,创客大数据是一家大数据精准营销服务商，是最专业的数据分析服务商和管道触达服务商。精准营销获客应用场景：根据企业主提出的用户标签画像，创客大数据通过运营商数据及多方 AI 整合大数据运算分析，筛选出精准目标用户群体，并提供短信、电话、微信三种触达终端用户的方式．帮企业实现精准获客，提升销售业绩。,广州创客电商科技有限公司,广州市白云区永平街丛云路816号七楼A713室,440111000884597,2015-10-12,李伟昂,1000万元人民币,91440111MA59AB56XL,www.ckbigdata.com
蓝领云,北京蓝领云信息技术有限公司,蓝领云是一家蓝领用工O2O服务平台，为用户提供蓝领招聘服务，隶属于北京蓝领云信息技术有限公司。,北京蓝领云信息技术有限公司,北京市海淀区宝盛南路1号院7号楼1层102室,110108020493663,2016-01-06,周建军,10万元人民币,91110108MA002YA12J
瑞卡租车,广州瑞致租车有限公司,瑞卡租车是一个O2O模式的汽车租赁品牌服务公司。瑞卡租车的主打概念为“租车便利店”。瑞卡租车经营短租、自驾租车等业务，客户可以进行自主选择。,广州瑞致租车有限公司,,440108400011682,2011-09-15,周红,24784.38万元人民币,9144011658188048X5,www.reocar.com
青柠智能锁,北京锐拓时代科技有限公司,青柠智能是一家智能门锁研发制造商，产品由实体门锁和App两部分组成，当用户带着手机从外侧接近门时，门锁通过蓝牙与App进行通信认证，用户触摸门锁感应区，即可快捷开锁。目前拥有家用版与公寓版两种产品。,北京锐拓时代科技有限公司,北京市海淀区西北旺镇冷泉南街157号1060,110108017215509,2014-05-15,周建,104.1667万元人民币,91110108399417261W,www.limemory.com
数码引擎,北京数码引擎网络科技有限公司,数码引擎，是一家集研发、管理、市场、运营维护为一体的专业化团队，主要从事互联网数据通信业务。 公司致力于为移动游戏开发商提供一流游戏内置式交互语音服务，为移动游戏用户提供完整的交互体验。,北京数码引擎网络科技有限公司,北京市石景山区实兴大街30号院17号楼5层26号,110107016765758,2014-02-19,聂飞,136.285719万元人民币,,www.bnone.com
闪骑电单车,上海新滔信息技术有限公司,闪骑电单车是一家短途出行电单车共享服务平台，将传统电单车的油门转盘启动改为指拨器启动，可防止因突然制动而导致的翻车、飞车事故，同时为车配置了非零启动装置和两种骑行模式。,上海新滔信息技术有限公司,上海市闵行区莘凌路211号8号楼（集中登记地）,310112001476615,2015-02-27,夏涛,375万元人民币,91310112332812785C,www.flashbike.cn
踢踢足球,厦门促鞠邦信息科技有限公司,踢踢足球，专注于踢踢校园足球及踢踢青训市场，为中国青少年校园足球打造的全方位的校园足球解决方案（含APP软件、硬件及SAAS大数据平台），主要有足球教学辅助系统、足球技能训练考评系统、校园赛事编排系统和足球文化宣传系统，打造中国青少年足球大数据云平台。,厦门促鞠邦信息科技有限公司,厦门市湖里区金泰路318号B栋501-A,350206200460829,2015-08-26,曾婉雅,200万人民币,91350206M0001A919R,www.titiball.com
候鸟岛,海南候鸟岛网络科技有限公司,候鸟岛是针对候鸟人群而建立的信息服务平台，线上提供房源租赁和出售服务，线下提供旅游生活服务，满足候鸟群体“候鸟式”度假需求，为中高端用户提供住处和本地服务。,海南候鸟岛网络科技有限公司,海南省海口市南海大道266号海口国家高新区创业孵化中心A楼5层A1-15室,460100000767719,2015-07-14,刘欣,200万元人民币,91460100324178892T,www.houniaodao.com
德美隆,新疆德美隆新材料股份有限公司,"""公司是在新疆乌鲁木齐国家级高新技术产业开发区注册经营的科技型企业。现注册资金1136.75万元、总资产3250万元。是新疆地区唯一以自主知识产权为主,专业从事高分子材料功能化、改性产品的研究、生产、销售企业。    董事长、总经理张晶女士,中国塑料协会专家委员会专家,新疆塑协专家委员会专家,高级工程师,拥有实用新型专利4项,主持完成自治区科技攻关项目《有色膜的研究及应用》,《色母料研究及在有色膜中的应用》《耐候复配防老化母料》和高技术研究计划《微孔结构材料的研究及应用》《高结晶改性聚丙烯的开发》《外墙保温发""",新疆德美隆新材料股份有限公司,新疆乌鲁木齐高新区（新市区）银藤街709号,650000059012338,2003-11-26,张晶,1611.75万元人民币,916501007545949412
卡伴汽车服务,上海卡伴汽车服务有限公司,上海卡伴汽车服务有限公司是上海市各级政府大力支持的国家环保节能型企业之一；,上海卡伴汽车服务有限公司,上海市宝山区河曲路118号6674室,310113001264258,2014-12-16,龙良志,500万元人民币,913101133243072441,www.carpartner.com.cn
新媒互娱,安徽新媒互娱网络有限公司,是一家集网络游戏研发与发行、新媒体创客教育的综合性互联网公司，一直致力于为互联网用户群打造精彩的互动娱乐平台。目前公司主要业务包括代理及研发多款优秀游戏产品，代理发行《主宰官方正版》、《蒸汽拳皇》、《无限格斗》等多款精品游戏。,安徽新媒互娱网络有限公司,安徽省合肥市包河区经济开发区兰州路88号厂房,340000000058294,2014-06-04,章理中,244万元人民币,91340000399894746A,www.xinuuu.com
灵至科技,上海灵至科技有限公司,灵至科技是一家服务型机器人及智能家居硬件研发商，其主要产品为智能识别门锁、消毒机器人、服务型家用机器人等。产品运用人脸识别、语音识别及手势识别技术，为用户生活带来便利。,上海灵至科技有限公司,上海市浦东新区上丰路977号1幢一层,310115003104248,2016-07-11,苏剑波,569.7676万元人民币,91310115MA1H7YPB47,www.lingzhitech.com
成都碰她网络科技有限公司,成都碰她网络科技有限公司,碰她科技，是一家自研和运营棋牌游戏的网络科技有限公司，致力于为全球移动用户提供全方位的移动娱乐棋牌游戏服务，带给每一个用户随时随地的全方位娱乐。,成都碰她网络科技有限公司,中国（四川）自由贸易试验区成都高新区益州大道中段1800号1栋3层301号,510109000822613,2016-05-18,辜应勇,100万元人民币,91510100MA61URU31E,www.pengta.me
银山股份,合肥银山棉麻股份有限公司,"""1982年8月2日,合肥市棉麻公司成立(后更名为合肥市棉麻总公司),成立时的注册资本为451.2万元,主管部门为合肥市供销合作社。""",合肥银山棉麻股份有限公司,安徽省合肥市长江东路658号,340100000202516,2002-11-20,王为传,4100万元人民币,913401001491052223
颐开科技,杭州颐开科技有限公司,颐开科技是一家大数据、AI、IOT解决方案提供商。该公司通过物联网、大数据和人工智能技术赋能城市、工业、生活。该公司拥有人工智能领域全栈解决方案，在模型、算法、工具、框架、平台等不同方向都有领先的产品和应用经验。百万级海量设备长链接设备数据采集与控制经验，适配多种主流物联网协议，提供安全、稳定、可靠的物联网方案。还拥有海量数据存储与处理能力，极致的数据可视化展示方案，网络运营商、政府等多行业大数据解决方案实战经验。,杭州颐开科技有限公司,浙江省杭州市萧山区河上镇紫霞村杭州雅克林文化创意产业园1028-1室,,2018-10-08,张思思,100万元人民币,91330109MA2CER7B6G,ezcel.com
罗化新材料,江苏罗化新材料有限公司,是集研发、生产、销售于一体的国家高新技术企业，公司始终专注发光材料领域，致力于为全球客户提供高品质发光材料及光源产品的“一体化”解决方案。公司先后通过GMC国内优质制造商联盟、ISO9001、ISO14001、OHSMS18001等一系列管理体系认证，产品均通过新技术新产品鉴定，高新技术产品认证及欧盟ROHS、 SGS等第三方认证。,江苏罗化新材料有限公司,南通高新技术产业开发区青岛路180号,320683000419310,2013-10-28,罗雪方,1133.27万元人民币,913206120815252037,www.lohuaxcl.com
柒水科技,武汉柒水科技有限公司,武汉柒水科技有限公司是一家集研发、设计、监测、销售、培训和技术服务为一体的水利综合型科技公司，目前专注于水下机器人（DTECH-1型ROV）的研发和应用。DTECH-1 型 ROV 是针对水下探测应用而开发的一型遥控式水下机器人，可广泛应用于水下工程作业，同时还可用于水下考古、水下搜救、海洋生物观察、近海油气田勘探与管道调查、水质监测、船体监测等。,武汉柒水科技有限公司,武汉东湖新技术开发区大学园路武汉大学科技园内创业大楼1楼63-1号,420100000606833,2016-03-17,董宗师,127.78万元人民币,91420100MA4KM5EY37,www.severtech.cn
班讯通,北京网途信息技术有限公司,班讯通是一个帮助老师向家长/学生发送推送的移动工具，基于他，老师可以轻松的创建班级，添加家长或学生，并在班级中发布图文、多媒体、文件、调查等多种内容形式的通知，所有家长或学生都通过手机号码绑定，确保真实，防止垃圾信息骚扰，最后他完全免费。,北京网途信息技术有限公司,北京市海淀区上园村3号知行大厦3层302室,110108016640082,2014-01-06,张薇,100万元人民币,91110108089652231M,www.ezoon.cn
朋万科技,成都朋万科技股份有限公司,成都朋万科技股份有限公司主营业务为网页游戏产品的开发。公司主要游戏产品有《满江红》、《神创天下》、《琅琊榜》、《神鬼三国》。公司具有流程化、模块化和成熟的游戏开发流程，积累了多代游戏引擎技术和策划制作方面的经验及在美术方面的图像处理技术，并具备开发和运营产生上亿级流水产品的成功经历。,成都朋万科技股份有限公司,成都高新区天华一路99号8栋8层9号,510109000189650,2011-07-20,刘刚,2817.6万元人民币,915101005773925398,www.pw19.com
百誉评级,百誉联盟（北京）软件有限公司,百誉评级是一个第三方信誉评级平台，为企业或机构、产品等创建信誉名片、提供点评互动等，隶属于百誉联盟(北京)软件有限公司。,百誉联盟（北京）软件有限公司,北京市朝阳区柳芳南里甲5号1号楼1至5层1-1一层1239,110105012884487,2010-05-21,殷勤,100万元人民币,91110105556883734K,www.bestratings.cn
盘锦（新闻）网,盘锦世纪联创网络传媒有限公司,盘锦（新闻）网是经东北新闻网批准成立的盘锦网络媒体，其以打造中国地（市）第一网为目标，以搭建政企对接平台，服务当地经济社会发展为己任，开办商业、文化教育、娱乐、健康、游戏以及电子商务等新闻信息与互动类栏目。,盘锦世纪联创网络传媒有限公司,,211102000018254,2015-09-22,刘雪峰,300万元人民币,91211102319060726A,www.pjxww.com
直路网络,浙江直路网络信息技术有限公司,浙江直路网络信息技术有限公司，专注于面向国内外B端用户，为传统外贸业务实现联网化，为B端用户提供线上外贸培训，线上验货，外贸管理软件，后期订单跟踪，数据统计分析等服务，致力于节约外贸业务订单达成、业务后期跟踪的资金、人员及其他成本，提高企业效率。,浙江直路网络信息技术有限公司,浙江省杭州市拱墅区湖州街36-1号1002室,330105000400962,2016-01-05,何必厅,250万元人民币,91330105MA27WMTY4J,www.unitefactory.com
淘学霸,广州悦兮服装有限公司,是一家经营服装批发;头饰批发;鞋批发;帽批发;钟表批发;眼镜批发;箱、包批发;商品批发贸易（许可审批类商品除外）;服装零售;鞋零售;帽零售;眼镜零售;箱、包零售;钟表零售;商品零售贸易（许可审批类商品除外）;头饰零售;服饰制造;时装设计服务的多元化公司。,广州悦兮服装有限公司,广州市番禺区南村镇里仁洞村环城中路57号704,440111000651235,2014-06-20,林正青,50万元人民币,91440101304368381R,www.usesee.com.cn
来钱快进销存,杭州萨宝科技有限公司,杭州萨宝科技有限公司是一家以软件开发、销售为主的科技型公司。来钱快·进销存市公司旗下产品，来钱快·进销存是一款应用于手机、平板和电脑等多平台上的，管理企业或商户采购（进）—>入库（存）—>销售（销）这一动态过程的移动企业管理软件，是最新的移动互联网和云技术应用于进销存管理软件领域的产物。,杭州萨宝科技有限公司,杭州经济技术开发区白杨街道六号大街452号3幢707、708号房,330198000062978,2013-07-05,洪升,150万元人民币,91330101070988640B,www.91laiqian.com
劲力传动,南京劲力传动技术有限公司,劲力传动是一家车辆变速箱技术研发商，主要经营范围是车辆变速箱技术研发、生产和销售；软件及控制系统研发；铝壳体铸造机械加工、生产；汽车电子产品及相关零部件研发、生产和销售等。,南京劲力传动技术有限公司,南京市高淳区经济开发区古檀大道69号,320125000229406,2017-12-05,杨军虎,5862.069万元人民币,91320118MA1TDWPR39
天图物流,广东天图物流股份有限公司,广东天图物流股份有限公司是一家提供高标准仓储、运输服务的现代第三方物流公司，广东天图物流股份有限公司成立于2010年由天图投资及个人股东投资设立，注册资金为壹亿元，并坐落于广州最繁华的CBD珠江新城。为客户提供卓越的物流全面解决方案及优质高效的综合物流服务。,广东天图物流股份有限公司,广州市从化鳌头镇前进中路3号铺第四幢315房（仅限办公用途）,440115000013995,2010-05-28,吴泽友,12076万元人民币,91440101556658094G,www.honotop.com
北迈网,北京北迈科技股份有限公司,北迈网（北迈汽配网）是一家汽车零配件销售及快装服务（B2C&O2O）平台，凭借自主知识产权的强大数据库支撑，和近乎苛刻的配件供应链体系建设，实时精准实现车主的汽车零配件需求，达到线上销售以及线下服务体验，从而为用户提供优质、省钱、精准、快速和有保障、可追溯的一站式购买、保养、维修及信息服务。提供包括汽车保养件、发动机件、车身件、底盘件、电器、润滑油和各类汽车运行材料以及各种汽车改装件、加装件等，涵盖豪华、大中型、紧凑型、小型车、微型车、SUV、 MPV、跑车、皮卡、微面、电动汽车等各种车型。全部产品经由中华,北京北迈科技股份有限公司,北京市海淀区上地信息路2号（北京实创高科技发展总公司2-1号、2-2号）2-1幢7层C栋7-3，北京市海淀区上地信息路2号(北京实创高科技发展总公司2-1号、2-2号)2-1幢7层C栋7-3,110108004568289,1998-10-21,张洪波,1806.1111万元人民币,91110108700149690L,www.beimai.com
智想新创科技,武汉智想新创科技有限公司,EasyTalk是一款多用户PHP+Mysql开源微博系统，支持网页、手机Wap、手机短信、QQ、Gtalk、飞信等多种方式发表或接收信息。,武汉智想新创科技有限公司,武汉市硚口区桥口路160号武汉城市广场（南）1栋21层13号,420104000181964,2014-07-22,郑君毅,10万元人民币,914201043034594682,www.thinkxc.com
油小秘,太禾链（北京）科技有限公司,快步出行是一款便捷的手机打车软件，用户可以根据自己的需求随时在快步出行APP中输入起点和目的地轻松打车，便捷出行。,太禾链（北京）科技有限公司,北京市海淀区中关村东路18号1号楼17层B-2003-038号,110108022217791,2016-10-19,黄再润,100万元人民币,91110108MA008WC636,www.airkab.com
丰马医药,江西丰马医药有限公司,江西丰马医药有限公司是一家医用药品器械销售生产商，经营范围为中成药、化学药制剂、化学原料药、抗生素、生化药品、生物制品、精神药品（限二类）的销售，Ⅱ、Ⅲ类医疗器械（不含植入体内医疗器械）的销售，预包装食品的批发，日用百货、办公用品、洗涤用品、日用化妆品、润滑油、化工原料、化工产品、家用电器的销售，仓储，自营和代理各类商品及技术的进出口业务。,江西丰马医药有限公司,江西省宜春市丰城市上塘镇阳光大道506号,360981210053196,2017-06-08,吴东根,500万元人民币,91360981MA3618LW0E
衍卓科技,重庆衍卓科技有限公司,衍卓科技主要从事智能视觉检测设备的研发、生产和销售，是行业内最专业的三维数字化设备供应商之一，公司研发团队由海龟博士联手欧洲知名光学计量企业挪威迈卓诺（Metronor）自主研发生产的一系列国内外领先的具有自主知识产权的红蓝激光三维数字检测设备，在三维数字化领域获得广泛关注，产品具备前所未有的极致细节获取能力，和有着远超同类手持式三维扫描仪的体积精度。,重庆衍卓科技有限公司,重庆市九龙坡区科城路166号97幢12-2号,500901008266589,2015-10-09,程丽莉,160万元人民币,91500107MA5U311765,www.cqsbjmyq.com
研发江湖,深圳古枫科技有限公司,"""研发江湖是一个研发人在线学习平台。该平台精心打造的学习体验，专业资深顾问精心录制课程。支持课件浏览与下载,只为给用户极致学习体验，为研发组织及个人的持续增值提供高品质服务，提供最优质的课程，专注专业领域。""",深圳古枫科技有限公司,深圳市南山区粤海街道科苑路15号科兴科学园B栋3单元802,440300205907666,2018-11-27,杨飞,120万元人民币,91440300MA5FDKWA0E,koomaples.com
殷龙科技,深圳市殷龙科技有限公司,深圳市殷龙科技是一家专注于研发生产网络电视机顶盒、飞鼠、无线键盘的科技企业。 现计划拓展B2C业务，包括Amazon、Ebay、Wish等。,深圳市殷龙科技有限公司,深圳市宝安区西乡街道固戍二路第三工业区裕兴科技工业园G栋4楼412室,440301106370119,2012-07-04,肖泽永,100万元人民币,91440300050463492D,www.hkinglong.com
大族三维,深圳市大族三维科技有限公司,大族三维是一家医学整形美容器械研发商，主要从事隆鼻3D设备以及超体鼻假体的研究，通过采用3D蒙孔工艺设计，解决了传统鼻假体存在的透光、变形、移位、收缩等多种问题，并通过整形设计软件、隆鼻设计软件为用户提供达芬奇定制隆鼻服务。产品包含面向整形医院拓客使用的INOVA 3D-AX、面向医生使用的INOVA 3D-TX、面向咨询师使用的INOVA 3D-EX以及面向隆鼻使用的INOVA 3D-VX。,深圳市大族三维科技有限公司,深圳市南山区粤海街道深南大道9988号大族科技中心大厦20楼,440301103770966,2008-12-17,王磊,106.9519万元人民币,914403006837708550,www.3dcosmetic.com
