名字,公司,介绍,公司,地址,身份证,时间,法人,注册金额,编号,网址
悉知科技,郑州悉知信息科技股份有限公司,悉知为用户提供中国境内合法注册的企业查询，为用户提供更真实、更有效的企业信息。目前悉知已收录中国境内合法注册的2000万企业信息。悉知提供的信息由全民共建并由全民共同监督。,郑州悉知信息科技股份有限公司,郑州高新区科学大道169号1幢1号楼,410199000037548,2012-05-30,杨海涛,2700万元人民币,914101005976422320,www.xizhi.com
车e估,广州穗圣信息科技有限公司,车e估是一个第三方汽车估值金融风控平台，专注汽车金融领域，为金融客户、车商及个人提供车辆估值、车辆数据查询、库存监管方案、GPS 车辆管理系统、汽车租赁管理系统等全流程风控服务及解决方案。,广州穗圣信息科技有限公司,广州市越秀区沿江中路298号中区30楼自编3005房（仅限办公用途）,440104000360915,2013-02-18,何炳坤,1000万元人民币,91440104063300414Q,cheegu.com
互动时代,北京互动时代网络技术有限公司,互动时代是一家娱乐设备研发商。,北京互动时代网络技术有限公司,,110105013920126,2011-05-31,李明浩,2500万元人民币,91110105576946915D
KK馆,广东快客电子商务有限公司,KK馆是一家O2O全品类电商平台，拥有线上商城和线下门店，双线购物。线下门店采用“前店后馆”的模式，将线下的消费场景融合进便利店和咖啡馆，通过线上线下结合，用户可以在店内直接消费，也可以扫码下单，将商品直邮到家中。KK馆是一家融合“线上商城+线下门店”的全品类互联网集合店。线上打造爆品拼团、粉丝评价、社交推荐等购物环节，线下是集购物、休闲、社交、互动于一体的互联网集合店。KK馆致力于通过数据化、全渠道化推动进口品乃至泛零售行业的重构，成为拉动国民零售消费分级的新引擎。,广东快客电子商务有限公司,东莞市南城街道袁屋边社区隐山路35号广豪办公大厦3楼302室,441900002425267,2015-04-13,吴悦宁,1759.241万元人民币,91441900338172432T,www.kkguan.com
司太立,浙江司太立制药股份有限公司,浙江司太立制药股份有限公司创建于1997年，2011年3月改制为股份有限公司，是一家从事研发、生产、销售为一体的医药高新技术企业。,浙江司太立制药股份有限公司,浙江省仙居县现代工业集聚区司太立大道1号,331000400001749,1997-09-15,胡锦生,12000万元人民币,91330000704720655L,www.starrypharm.com
中娱时代,北京中娱时代科技有限公司,中娱时代是目前国内为数不多的能够提供高端而全面的车联网服务，同时拥有行业解决方案和全球实施能力的企业之一。中娱时代着眼于为汽车、物流、金融服务等多领域以及电信、政府部门提供行业咨询，R&D，车联网服务，系统集成和业务外包。我们拥有在行业内处于领导地位的技术优势，同时作为财富500强企业的优质合作伙伴，被誉为值得信赖的行业领导者。,北京中娱时代科技有限公司,北京市海淀区苏州街29号维亚大厦12层013,110108016906946,2014-03-24,胡之曦,1000万元人民币,91110108096279105G,www.sino-e.com.cn
康德莱,上海康德莱企业发展集团股份有限公司,上海康德莱企业发展集团股份有限公司（以下简称“公司”）现辖上海康德莱企业发展集团医疗器械有限公司、上海康德莱企业发展集团药业有限公司、上海康德莱医疗器械自动化研究所有限公司、上海康德莱制管有限公司、上海康德莱手岛制管有限公司、上海康德莱国际商贸有限公司、浙江康德莱医疗器械股份有限公司、温州康德莱医疗器械有限公司、珠海康德莱医疗器械有限公司、广东康德莱医疗器械产业服务有限公司、广州市康德莱医疗器械有限公司、南昌康德莱医疗科技有限公司十二家企业。,上海康德莱企业发展集团股份有限公司,上海市嘉定区高潮路658号1幢2楼,310000000063412,1998-07-01,张宪淼,44160.9万元人民币,91310000631191552K,www.kdlchina.cn
嘉美在线,北京嘉美在线科技有限公司,北京嘉美在线科技有限公司是由中信并购投资基金和嘉和美康信息技术公司投资设立的从事软件研发、服务及应用的高科技型企业，成立于2015年初，公司主业聚焦业务方面： 基于云部署和移动互联网医疗信息化院外扩展的应用与发展的互联网医疗产品---移睿云病历。云病历关注医患互动服务、疾病持续管理及养老健康服务，可以帮助用户获取自己的电子病历信息；帮助医生进行患者病历管理和病程回顾。与北京嘉和美康信息技术有限公司共同建立一个可覆盖医疗、健康服务全领域的信息化体系。,北京嘉美在线科技有限公司,北京市海淀区上地信息产业基地开拓路7号1幢2202室,110108018525090,2015-01-21,夏军,8145.4545万元人民币,911101083302864357,www.hscpro.com
求臻医学,求臻医学科技（北京）有限公司,求臻医学致力于成为全球领先的肿瘤全流程产品及服务提供商。求臻医学核心成员均来自国内一流生物医药集团，具有多年的技术研发及管理经验。公司产品覆盖肿瘤早期筛查、预防和诊断、动态监测、用药指导、预后评估及生物信息学大数据分析等领域。他们将布局全产业链肿瘤检测产品，专注于实体瘤靶向用药指导、肿瘤免疫治疗的疗效预测，重点布局非小细胞肺癌的特异性检测及血液系统肿瘤等产品。,求臻医学科技（北京）有限公司,北京市北京经济技术开发区经海四路156号3号楼1层101,110302024486029,2017-11-23,周启明,308.6999万元人民币,91110302MA018YP033,www.chosenmedtech.com
智旅云,湖北智旅云科技有限公司,智旅云是一家从事智慧旅游、全域旅游、旅游互联网+的公司。公司专注于针对旅游行业、旅游景区、旅游局等研发系统产品，公司旗下有智慧旅游、全域旅游、智慧场馆、智慧城市信息化系统建设等方案产品。,湖北智旅云科技有限公司,武汉东湖新技术开发区东信路光谷创业街特1幢3-1301号,420100000212293,2010-10-27,王思维,1000万元人民币,914201005623312908,www.zlyun168.com
北创光电,广东北创光电科技股份有限公司,"""广东北创光电科技股份有限公司主营业务为光学检测仪器、光学镜头的研发、设计、组装和销售,以及精密光学镜片的研发、设计、生产和加工,并配以光学配件销售。公司主要产品包括紫外透过率光谱仪、全自动厚度检测仪、非接触式厚度仪、球面反射式光谱仪、平面反透一体光谱仪、球面透过率光谱仪等。""",广东北创光电科技股份有限公司,佛山市禅城区季华一路28号四座1001房之一,440602000089437,2009-02-26,肖顺东,2380万元人民币,91440604684464120J,www.bcoptical.com
胡须先生,杭州胡须先生电子商务有限公司,胡须先生2014年3月成立于杭州，创始人是廖斌，隶属于杭州胡须先生电子商务有限公司。胡须先生是一家以售卖鲜花为主的鲜花上门服务细分垂直电商品牌。初期胡须先生主要以移动互联网平台订购为主，后期将会对PC端进行相关改版。打开其官方网站的首页，可以看到，胡须先生将其风格定位于泛黄、做旧的复古文艺范儿，呈现古典韵味。此外，亿欧了解到胡须先生提供个性化的定制，供用户自主选择，以满足不同需求。,杭州胡须先生电子商务有限公司,萧山区萧山经济技术开发区启迪路198号A-B102-9室,330181000421910,2014-04-30,郑润斌,600万元人民币,91330109098788296G,www.hxxs.com
智汇云,深圳市智汇云科技有限公司,深圳智汇云致力于智能家居产品的研发及销售，以智能灯光控制系列产品为主打，销售分为线上及线下，线下以代理分销形式开拓市场，其产品跟采用了模块化设计，解决了目前市场上智能家居安装调试复杂，造价昂贵，后期维护成本高等问题，支持手机、遥控器、移动触控面板、传统开关4种控制方式。,深圳市智汇云科技有限公司,深圳市龙岗区平湖街道华南大道一号华南国际印刷纸品包装物流区（二期）2号楼A座17层1712号,440301113598108,2015-08-06,陈荣杰,500万元人民币,914403003497497272,www.znznz.cn
华邦财富,衡水华邦投资管理有限公司,"""衡水华邦投资管理有限公司于2013年3月开始运营华邦财富在衡水的业务,总部位于衡水市。公司充分挖掘互联网市场潜力，为有资金需求和理财需求的客户搭建一个规范、安全、诚信、专业的第三方金融中介平台（P2P）。""",衡水华邦投资管理有限公司,衡水市昌明大街东侧、新华路南侧12号门店,131125000039171,2013-09-24,宋书杰,3000万元人民币,,www.4000318383.com
*ST中基,中基健康产业股份有限公司,"""中基健康产业股份有限公司是一家以番茄制品深加互为主营业务,集番茄种植、生产、加工、贸易、科研开发为一体的农业产业化国家重点龙头企业.公司主要产品有番茄原料酱、番茄制品及蔬菜罐头制品等.公司下辖10个分公司和3个控股子公以及一座红色产业科技园区和一个生物制品公司,拥有参、控股企业16家,拥有现代化番茄制品加工厂16个,拥有世界一流的番茄制品生产线29条,番茄制品综合生产能力60.45万吨,位居世界同行业第二位,产业区域遍布新疆、甘肃、法国、天津、内蒙古等地,产品销往世界七十多个国家和地区。2016-05-11""",中基健康产业股份有限公司,新疆乌鲁木齐市天山区青年路１７号,650000040000642,1994-06-30,李豫,77128.3579万元人民币,916500002285831508,www.chalkistomato.com
冉江金服,上海冉江金融信息服务有限公司,冉江金融信息服务有限公司，专注于外贸大数据分析，结汇，中小企业资金扶持等业务，对外贸型企业提供详细外贸数据分析与企业发展建议，致力于创建一对一的对外贸易服务商以及外贸,上海冉江金融信息服务有限公司,上海市浦东新区杜鹃路265号104室,310115002906573,2015-12-15,罗来全,1000万元人民币,91310115MA1H78TQ1D,www.rjjr66.com
蓝凡网络,上海蓝凡网络科技股份有限公司,上海蓝凡网络科技股份有限公司是一家为面向政府机构及大中型企事业单位提供视频通讯精准信息化服务，包括视频通讯系统的咨询、设计、供货、安装调试和运维服务的公司。公司致力于为客户提供专业化的视频通讯系统整体解决方案。始终坚持在视频通讯产品销售、系统服务、用户增值三方面不断提高水平和积累经验，并充分利用公司内部的先进管理系统规范经营。并获得中国国家强制性产品认证GB4943.1-2011；GB9254-2008（A级）；GB17625.1-2012，电信设备进网许可证等称号。,上海蓝凡网络科技股份有限公司,上海市青浦区徐泾镇沪青平路1919弄3号101室,310120001872770,2011-04-28,车剑,968.5324万元人民币,91310120574126649F,landfar.net
深圳市中科保计算机有限公司,深圳中科保泰科技有限公司,,深圳中科保泰科技有限公司,未知,440301105240080,1998-10-06,李先美,800万元人民币,914403007084536977,www.unisure.com.cn
四方环视,北京四方环视科技有限公司,北京四方环视科技有限公司本着以“VR影像”为核心、以创意作品 互联网 行业应用的发展模式，致力为全景摄影师提供从VR影像制作、存储、交流、分享的一站式应用平台；为文化、教育、娱乐、旅游、地产等行业用户提供最优质的全景解决方案。,北京四方环视科技有限公司,北京市朝阳区樱花园28号楼（樱花集中办公区1349号）,110105018238613,2014-12-01,魏良祥,680万元人民币,911101053183985570,www.ivrpano.com
聚爱聊,北京聚爱聊网络科技有限公司,聚爱聊是一家软件研发商，主要经营范围是技术开发、技术转让、技术咨询、技术服务、技术推广等。,北京聚爱聊网络科技有限公司,北京市海淀区上地东路1号院1号楼6层602号-6023,110108017165926,2014-05-07,王川,942万元人民币,911101080994495283
创旅天下,苏州创旅天下信息技术有限公司,苏州创旅天下信息技术有限公司是一家提供信息传输、软件和信息技术服务业的公司，总部位于江苏省，成立于2015年12月23日。公司主要成员2人，自成立以来，全体员工共同努力，本着诚信为本、积极开拓、优质服务的精神和专业、用心、负责的理念开始了全面发展的新时期，在探索中发展，在创新中前行。在信息传输、软件和信息技术服务业中，我们秉承“分享、协作、进步、未来”的核心文化，用我们的专注和专业为客户带来更多的价值，帮助中国的企业进入“质量”与“品牌”并重的质量时代，业务涵盖旅游信息咨询、设计、制作、代理、发布国内各类广告、网络预约出租汽车经营服务、汽车租赁、并从事上述商品和技术的进出口业务等。,苏州创旅天下信息技术有限公司,苏州工业园区裕新路188号同程大厦A区9F-907室,320594000504644,2015-12-23,叶俊,10万元人民币,91320594MA1MD7FF70,www.tripworld.com
八八科技,广州八八科技有限公司,八八科技是一个投资者活动资讯APP，专为港股、中概股投资者打造的投资者活动资讯平台。八八科技是由买方、卖方和科技行业的资深人士构思并开发的。为了解决由于经常错过业绩会，错失了解上市公司的重要机会的问题，同时缓解由于用于管理企业访问的传统电子邮件和电话呼叫方式耗时且不可靠的情况。,广州八八科技有限公司,广州市天河区天河北路233号中信广场办公楼3903-04A房(仅限办公用途)(自主申报),440106002345178,2018-01-10,王华,142.8571万元人民币,91440101MA5AP1B71G,www.88meeting.com
全国不动产登记专业论坛,成都慧远空间信息技术有限公司,慧远空间一家立足GIS，为国土行业客户提供专业软件、信息技术服务的公司，拥有一套比较成熟的GIS软件产品。隶属于成都慧远空间信息技术有限公司，隶属于成都慧远空间信息技术有限公司。,成都慧远空间信息技术有限公司,成都市青羊北大街19号3栋16层1612号,510105000600482,2016-04-12,刘志远,100万元人民币,91510105MA61U7MNXW,www.huiyuanspace.com
传奇马术,连云港传奇马术运动俱乐部有限公司,暂无信息,连云港传奇马术运动俱乐部有限公司,,320722000080445,2012-07-04,朱艺华,58万元人民币,913207225986358192
天勤盛创,安徽天勤盛创信息科技股份有限公司,安徽天勤盛创信息科技股份有限公司是一家专注于我国电子政务信息化建设的技术咨询服务商，主要致力于政府审计信息化、财政信息化等电子政务领域，为各级政府部门、银行、企事业单位提供信息化软件实施服务、运维服务以及与之相关的软硬件销售等;公司主要产品包括信息化软件实施服务、运维服务、软件研发、硬件销售。,安徽天勤盛创信息科技股份有限公司,合肥市高新区天柱路5号科大讯飞2号楼四层,340100000148804,2008-11-12,王宗亚,500万元人民币,913401006820625901
户动,奇异牛科技（深圳）有限公司,户动是一个地图社交服务平台，以地图展现形式将社交和服务融合为一体，用户在使用社交的过程或者途中不断的产生第三方应用的调用，让服务和应用形成良好的穿插。,奇异牛科技（深圳）有限公司,深圳市前海深港合作区前湾一路1号A栋201室（入驻深圳市前海商务秘书有限公司）,440301503532409,2016-04-01,邹汶坤,429万元人民币,91440300MA5D9XR25Q,www.qiyiniu.cn
栖鸟流媒科技,杭州栖鸟流媒科技有限公司,杭州栖鸟流媒科技有限公司是专注微支付商用自助洗衣机和微支付洗衣液售卖机的软硬件开发、设备的投放及运营的科技型企业，坐落于国际级的高新技术产业开发区——杭州市滨江区。,杭州栖鸟流媒科技有限公司,杭州市滨江区长河街道长河路475号1幢9层910室,330108000295884,2016-08-05,曹纯健,105.2632万元人民币,91330108MA27YCYG2E,www.hzqiniao.com
Akoko,杭州原品餐饮管理有限公司,AKOKO是一家曲奇烘焙品牌，主打短保曲奇品类，因为不添加防腐成分，AKOKO的保质期仅为30天。生产全部在线下的实体店进行，后期订单量的增加，和浙江本地老字号食品制作商思味王进行合作。隶属于杭州原品餐饮管理有限公司。,杭州原品餐饮管理有限公司,浙江省杭州市西湖区西溪新座7幢1号门商铺1号,330106000512601,2016-06-02,柯云霞,980.7478万元人民币,91330106MA27XTK89X,www.akoko.net
福民生物,芜湖福民生物药业股份有限公司,"""公司位于中国安徽省芜湖市国家级高新技术开发区征帆路2号,注册资金2500万人民币。本公司成立之初就自我定位为一家百年规划的开放型企业,团队和制度是我们的核心竞争力。我们拥有一支国家千人计划专家领衔的研发队伍和一支具备丰富生产经验的生产队伍,公司推行现代化企业管理制度,信奉“务实、奋进、共建福民大家园”的企业文化,注重培养员工的主人翁意识、主动思考能力和务实办事能力。""",芜湖福民生物药业股份有限公司,芜湖高新技术开发区星火工业园3号厂房,340200000173427,2013-07-15,苏福男,3682万元人民币,91340200073908060T,www.fomanbiopharma.com
bok,深圳市鑫福斯科技有限公司,深圳鑫福斯科技有限公司是一家专注于汽车后市场互联网+的创新服务型公司，我们致力于将汽车后市场中新型黑科技产品通过本公司平台，利用我们的资源整合能力与互联网+的手段，让广大车主在第一时间享受到高科技产品带来的驾驶乐趣与分享经济带来的收益。,深圳市鑫福斯科技有限公司,深圳市福田区华强北街道福强社区燕南路9号君悦阁2012,,2018-04-18,张猛,100万元人民币,91440300MA5F39AH33
脸蛋,深圳美丽讯网络科技有限公司,深圳美丽讯网络科技有限公司，是一家专注于重塑美容行业的信息服务形态的移动互联网公司。着力于以智能驱动、科学护肤为导向，坚持即时更新、有效跟进、持续推动三原则，为中国女性打造科学、个性、时尚的美肤服务。 致力于为中国美容护肤行业提供完整的移动互联网解决方案，成为行业消费升级、服务升级、营销升级的专业信息系统服务商。,深圳美丽讯网络科技有限公司,深圳市南山区南海大道1031号万海大厦C座702,440301107606058,2013-07-11,段俊涛,151.7857万元人民币,91440300073374484M,www.liandan100.com
淘福,合肥淘旺福网络科技有限公司,合肥淘旺福网络科技有限公司 淘福是一个网络生活社交服务平台，功能涵盖自媒体平台，社交，即时通讯等。,合肥淘旺福网络科技有限公司,,340100000451691,2010-09-30,邹欣胜,100万元人民币,913401005634021343,www.taofour.com
InfoQ中国,极客邦控股（北京）有限公司,InfoQ是一家全球性在线新闻/社区网站，基于实践者驱动的社区模式建立。,极客邦控股（北京）有限公司,北京市朝阳区望京利泽中园二区203号内3号六层1607室,110105010963864,2008-04-18,霍太稳,324.9006万元人民币,91110105674271114W,www.infoq.com
新虹艺教育,苏州新虹艺教育科技有限公司,新虹艺教育是一家儿童艺术培训机构，公司专注于儿童美术教育，根据中国孩子特点和发展需求，对3-16岁不同年龄阶段的孩子设计专门的立体美术教育课程。隶属于苏州新虹艺教育科技有限公司。,苏州新虹艺教育科技有限公司,苏州工业园区中新路8号邻里中心贵都大厦1幢3A4、3A5室,320594000156616,2010-03-15,张国平,1000万元人民币,913205945525153283,www.dyartedu.com
百川电力,宁夏百川电力股份有限公司,宁夏百川电力股份有限公司是一家以电力工程施工、安装、抢修、调试，房屋建筑施工、线路施工、电气设备安装、变电安装、高低压配电系统工程、高低压电气设备维护工程、建筑智能化工程、送配电工程等为主的多元化公司。公司具有国家送变电专业承包三级资质、电力行业承装二级资质、承修三级资质和承试三级资质，可以从事220KV以下电压等级电力设施的安装业务和110KV以下电压等级电力设施的维修和试验业务。,宁夏百川电力股份有限公司,银川市金凤区庆祥街9号柏桂苑1号楼公寓8层,640000200004392,2008-10-17,郑建宝,2500万元人民币,916411006704345299,www.nxbacc.com
小鸟房车,深圳市飞鸟房车有限公司,深圳市飞鸟房车有限公司位于深圳前海自贸区，是一家专注于房车产业链建设的互联网平台运营商；致力于构建一个房车消费平民化的房车“玩”平台，推崇房车露营文化新理念。公司旗下互联网平台“小鸟房车”是目前中国首家房车定制旅游在线平台，平台专注于为广大户外旅游休闲爱好者提供房车租售、房车旅游、房车营地建设及规划一站式服务。小鸟房车还为广大旅游爱好者开发了功能强大的中国房车露营地电子地图，提供实时在i线查询，导航与在线预订功能，真正意义上实现了“专业”“系统”“全方位”的平台服务。在互联网 的时代背景下，飞鸟房车颠覆传统,深圳市飞鸟房车有限公司,深圳市南山区西丽街道沙河西路4881号深港花卉中心J11,440301111799124,2014-12-10,肖敦懿,500万元人民币,91440300319716019C,birdcar.net
恩大施福,浙江恩大施福软件科技有限公司,浙江恩大施福软件科技有限公司，是专注于智能制造技术和产品的研发、生产和服务的高技术企业，致力于通过创新性的技术和产品，为工业用户提供专业化的服务和卓越的智能制造体验。公司核心产品平台为“智慧企业集成管控系统（IEIS）”，包括制造执行系统（MES）、企业资源计划系统（ERP）、高级排程系统（APS）、质量管理系统（QMS）、仓储管理系统（WMS）、统计过程控制系统（SPC）、设备管理系统（DMS）等，以及工厂物联网集成监控平台（SCADA）等主要软件产品及部分智能硬件。,浙江恩大施福软件科技有限公司,临安市青山湖街道大园路958号A座8楼,330185000115563,2015-01-04,周群,3300万元人民币,91330185321923498Y,www.indusfo.com
优宠鲜品,大连优宠电子商务有限公司,优宠鲜品是一个O2O电商平台，专注于深海鲑鱼烘焙犬粮、经典烘焙犬粮等犬粮食品的销售，支持在线支付，提供送货上门服务。,大连优宠电子商务有限公司,"""辽宁省大连高新技术产业园区高新街1号五层520室"
""
""
""
""
""
""
"""",210231000085362,2016-01-27,唐百川,255万元人民币,91210231MA0QD5M565,wap.koudaitong.com
引领信息,上海引领信息科技有限公司,3737K平台致力成为中国第一品牌游戏平台。目前，旗下拥有多款网页游戏。3737K平台以“至诚、专业、品质”为主要经营思路，以“创新、超越、实现”为向导，致力于推动网页游戏发展及打造中国最具代表性的游戏品牌文化。 3737K网页游戏：汇聚全球最顶级的网页游戏大作，囊括各类型的网页游戏精品，3737K平台力求为广大玩家奉献最奢望的网页游戏大餐！ 最勤奋的运营团队： 最顶级的业内精英、最有激情的运营团队、最敬业的服务品质，必将给玩家营造一个快乐轻松的游戏环境。 最贴心的客服团队：给您最贴心的服务。,上海引领信息科技有限公司,上海市浦东新区曹路镇龚丰路661-5号1幢158室,310115001969434,2012-05-20,黄鑫,1010万元人民币,913101155964413917,game.3737k.com
萌帮股份,河北萌帮水溶肥料股份有限公司,河北萌帮水溶肥料有限公司源于1995年所从事的农业植保技术服务，2009年成立，公司坐落于河北省赵县新寨店工业园区，占地41000平方米，集研发、生产、销售、服务于一体是全球专业的水溶肥料制造商和服务商。目前已经发展为一家拥有300多名员工、建有年产10万吨水溶性肥料生产线，并和其他厂家合资、合建、合作生产磷酸二氢钾3万吨、硝酸铵钙6万吨、工业磷酸一铵6万吨。,河北萌帮水溶肥料股份有限公司,赵县新寨店工业园区皇冠路68号,130185000011370,2009-05-31,郭兴龙,3798万元人民币,91130133689283812F,www.monband.com
