名字,公司,介绍,公司,地址,身份证,时间,法人,注册金额,编号,网址
诏安集合,诏安集合创想网络科技有限公司,诏安集合创想网络科技有限公司是立足于县域城市，通过以点带面的形式，从信息传播再到线下服务，通过互联网链接县域城市人民的生活。,诏安集合创想网络科技有限公司,福建省漳州市诏安县南诏镇嘉盛豪园二期泰山楼120号,350624100024914,2014-07-01,李欣,100万元人民币,91350624310647539L,www.fjywg.com
青庐会,济南小马奔腾会议服务有限公司,青庐会是一家企业家社群平台，是山东地区最大的企业家人脉交互和智慧分享平台，不同于线上社群，青庐会更看重线下的互动价值。通过严格的庐友举荐制，以点带面实现裂变，目前青庐会聚合了国内大量优秀企业家资源，已有300多位优秀企业家、100多位专家学者与资深财经媒体人士参与其中。,济南小马奔腾会议服务有限公司,济南市天桥区北坦新菜市17号,370105200063992,2012-04-05,吴阳华,10万元人民币
HOCRES,海客瑞斯（上海）实业有限公司,海客瑞斯是中国最大的酒店用品供应商之一，海客瑞斯的英文名称HOCRES，是取自酒店（Hotel）、食堂（Canteen）、餐厅（Restaurant）和解决方案（Service & Solution）几个词语的英文字母的首写字母。 海客瑞斯向各级酒店、餐饮、配餐公司、食堂等专业酒店餐饮客户提供餐料酒水、餐具器皿、玻璃陶瓷、后厨用品、后厨设备、清洁用品、大堂用品、客房布草及酒店厨房工程项目筹建等产品和服务。目前经营18大类别60000余种商品，涉及多个品牌，旗下自己开发的自有品牌达6个之多，代理的国际品牌50,海客瑞斯（上海）实业有限公司,青浦区联民路1881号1幢一层A区102室,310229001275417,2007-11-19,金浩振,5454万元人民币,91310118667848587P
与时传媒,山东与时文化传媒有限公司,与时传媒是一家移动互联网精准营销企业，旗下业务包括微信朋友圈广告代理、微信小程序开发、微信公众号代运营、今日头条广告代理、O2O场景营销等业务。,山东与时文化传媒有限公司,山东省济南市历下区泉城路264号1006室,370102200252936,2016-01-21,袁玲玲,500万元人民币,91370102MA3C5U0N0U
卡卡车服务平台,上海缘车信息技术有限公司,卡卡车服务平台是一个商用车后市场全生命周期内运营管理平台，隶属于上海缘车信息技术有限公司。总部位于上海宝山物流园，并下设南通运营基地。公司致力于通过车辆全过程管理、改善营运车辆运营效率。服务管理平台：涵盖车辆销售、车辆检测维修、配件开发、物流配送管理、维修管理、运营管理系统的一体化生态圈,上海缘车信息技术有限公司,上海市宝山区友谊路1518弄10号1层G-197室,310113001588436,2016-06-12,陈小军,1500万元人民币,91310113MA1GKKTR2E,www.kakaauto.net
imio labs,积木智能(深圳)科技有限公司,imio labs是一家以AI为源动力，秉承极致匠心打造的全新一代智能硬件云服务平台，探索智能家庭的无限可能性。我们正在为智能家居、智能硬件、智能玩具、消费电子零售店等多个领域及行业提供AI控制、远程管理、设备联动服务，以及随时随地的AI助手和移动应用访问。,积木智能(深圳)科技有限公司,,440300200841372,2017-04-20,袁伟亭,500万元人民币,91440300MA5EGB5085,www.imio.io
物流岛,浙江聚投科技有限公司,,浙江聚投科技有限公司,未知,331102000012251,2016-01-01,金璐,500万元人民币,91331102MA28J2L19Y,www.wuliudao.com
信途教育,北京信途教育科技有限公司,北京信途教育科技有限公司是一家商务培训机构，通过在各地政府及园区落地双创产业综合创新服务平台——“信途创新学院”，达到双创产业深度服务的有效落地和实施。以创新创业企业的核心需求为目标，以教育培训为重点切入，辅以资本及资源，提供深度、精准及系统的服务。,北京信途教育科技有限公司,北京市海淀区海淀大街1号4层4037,110108023519737,2017-05-27,曹亚军,100万元人民币,91110108MA00ETCGX1,www.seetourchina.com
华西易通,重庆华西易通建设股份有限公司,"""公司是大型国有建筑集团企业——四川华西集团下属四川华西绿舍建材有限公司控股、重庆易通商品混凝土工程公司参股合资组建。公司注册资本4500万元,持有二级预拌混凝土资质,主要经营预拌商品混凝土等相关业务。  公司坐落于重庆市南岸区鸡冠石镇和平村新湾组,配备混凝土180专业生产线两条,拥有各类生产、泵送及运输设备41台,具有年产混凝100万立方以上能力。优越的地理位置,保证了重庆主城区建设的全覆盖;先进的生产设备,科学的现代化管理,能同时满足多个工程混凝土的连续供应。  控股母公司四川华西绿舍建材有限公司与参股公""",重庆华西易通建设股份有限公司,重庆市南岸区鸡冠石镇和平村新湾组,500108000131937,2013-06-07,马林,5260万元人民币,915001080703099195,huashiyt.cdphm.com
多能展示,成都多伦展览展示有限公司,多能展览展示有限公司是一家专业从事展览展示器材开发、生产、销售、租凭及大型展示工程施工一体的综合性企业。近年来、随着展览展示行业的发展，我们不断的创新、研发多种优质的展示产品。为客户提供精良耐用的产品和细致周到的服务，公司现在设立成都总公司，重庆分公司。,成都多伦展览展示有限公司,成都市青羊区西珠市街29号附1号,510105000207677,2012-06-21,赵应春,20万元人民币,915101055972544401,www.dnzlzs.com
房利邦,上海紫岩信息科技有限公司,我们的产品与优势:,上海紫岩信息科技有限公司,上海市奉贤区奉城镇新奉公路2313号5幢271室,310120002652718,2015-02-04,吴文立,100万元人民币,,www.flbang.com
图格医疗,南京图格医疗科技有限公司,"""图格医疗，专注于医用内窥镜成像和数字一体化手术室解决方案，利用图像处理算法和FPGA实时处理平台研发超高清医用内窥镜成像设备。主要产品为三晶片、3D和4K内窥镜系统，并与中科院联合开发基于AI+FPGA的方案，提供智能影像诊断服务。2018年4月4K超高清医用内窥镜系统提交CFDA注册，并在CCTV2《创业英雄汇》中获得一致好评，7月获得知名风投机构1100万投资；11月获得全国移动互联网创新大赛社会组特等奖 ,未来公司会陆续展开多个型号的研发，CFDA/CE/FDA注册以及海内外市场的推广。""",南京图格医疗科技有限公司,南京市江宁区滨江经济开发区盛安大道739号,,2018-02-08,汪彦刚,233.8462万元人民币,91320115MA1W3RBK1F,www.tugemedical.com
触握科技,深圳触握科技有限公司,专注精品手游的研发和发行，做中国的NO1公司,深圳触握科技有限公司,深圳市福田区华富街道田面设计之都2栋3B,440307111130595,2014-08-21,魏杰,100万元人民币,91440300311967374M,www.covoart.com
红绿灯自适应控制系统,无锡市慧视科技有限公司,,无锡市慧视科技有限公司,未知,320213000092326,2008-02-27,冯毅坚,200万元人民币,91320214672510716J
东河股份,重庆东河水电股份有限公司,重庆东河水电股份有限公司长期致力于新能源、可再生清洁能源小水电项目开发建设经营管理，目前公司拥有小园一级电站、小园二级电站、在建小园三级电站、四级双河口电站等四座电站。,重庆东河水电股份有限公司,重庆市开州区关面乡双河口,500234000010665,2006-03-07,连星坛,9350万元人民币,91500234784236168W
创为新能源,烟台创为新能源科技有限公司,烟台创为新能源科技有限公司，是集科研开发、技术服务、系统集成、生产经营于一体的高新技术企业。,烟台创为新能源科技有限公司,,370635200088516,2015-11-10,张立磊,647万元人民币,91370600MA3BYX3Y5Y,www.ytcwne.com
腾辰生物,南京腾辰生物科技有限公司,腾辰生物是一家肿瘤早筛服务提供商,南京腾辰生物科技有限公司,,,2018-03-29,杨蓉西,134.2857万元人民币,91320115MA1WA11H0A
唐颐信息技术,上海唐颐信息技术有限公司,唐颐信息技术是一个主营业务为精准医学科研服务，包括精准医学软件产品销售、临床数据与组学数据分析服务、临床试验服务等的公司，在推进中国生物样本资源库规范化建设、精准医学大数据共享平台建设的基础上，致力于解码生物医学大数据，促进精准医疗技术产业化，助力健康中国战略的实现。,上海唐颐信息技术有限公司,上海市徐汇区凌云路396号352室,310104000632140,2015-09-10,唐万,5000万元人民币,91310104350805132Y,www.eternal-health.cn
蓝爸爸,北京智汇博瑞网络科技有限责任公司,蓝爸爸亲子游专注于亲子旅游和亲子教育文化。但又不仅是亲子俱乐部和旅游公司，而是一家做细分垂直的互联网公司。我们让孩子在旅行中通过玩乐和小伙伴、和父母一起得到成长，父母们也可以在此找到志同道合的旅伴。,北京智汇博瑞网络科技有限责任公司,北京市朝阳区黑庄户乡郎辛庄北路58号401楼2单元102号,110104011636291,2009-02-16,安秀荣,100万元人民币,91110105685115344F,www.dadblue.com
伟盛节能,黑龙江伟盛节能股份有限公司,"""公司创建于2006年,公司位于哈尔滨市。成立以来,伟盛节能致力于节能减排、低碳建筑领域,坚持以模式创新、技术创新和理念创新实施既有建筑节能改造。目前已累计完成数百万平方米既有建筑节能改造工程。建立了完善的现场勘查、节能改造、能效评估、售后服务等实施流程和管理规范。    公司是省级建筑节能服务行业的高新技术企业,黑龙江省高性能纤维及先进复合材料产业技术创新战略联盟的成员单位。2010年8月份通过国家发改委和财政部组织的评审,成为第一批国家备案的节能服务公司,是黑龙江省首批备案的节能服务公司中唯一的一个建筑节""",黑龙江伟盛节能股份有限公司,哈尔滨高新区科技创新城创新创业广场3号楼科技一街425号B103室,230100100025431,2006-01-23,耿铁伟,12000万元人民币,912301997813235730,www.weishengjieneng.com
华第时代,深圳市华第时代科技有限公司,华第时代是一家专业提供知识产权解决方案及技术服务的科技服务型企业，致力于为客户提供行业最高品质的知识产权解决方案。,深圳市华第时代科技有限公司,深圳市南山区粤海街道高新技术产业园区迈瑞大厦副楼5层A01室,440301103483203,2003-12-04,王活涛,800万元人民币,91440300755699403D,www.huadee.cn
智德安全,山西智德安全技术股份有限公司,"""公司成立于2004年7月,公司是一家专业从事安全评价以及职业卫生技术服务的第三方评价机构,安全评价服务的行业包括煤炭开采洗选、非煤采选、金属冶炼、公路施工等,职业卫生技术服务的行业包括煤炭采选、非煤采选、冶金、建材、公共服务等多个行业,现为安全评价国家甲级资质、职业卫生技术服务乙级资质、消防检测二级资质。中国安全生产协会安全评价委员会委员单位。公司制定了完整的评价服务体系,运用其专业技术及科学方法对客户委托项目的安全性、职业卫生条件及风险等进行科学评价同时出具专业意见,在法律法规及行业标准下出具专业的第三方""",山西智德安全技术股份有限公司,太原高新区振兴街11号1幢1单元709号,140191205029793,2004-07-28,岳新积,2675.25万元人民币,91140100764665395G
锐志天宏,北京锐志天宏科技股份有限公司,"""公司成立于2003年,一心专注于数字运动控制系统研发,研发的嵌入式手持DSP运动控制系统,为国内数控行业开辟了脱机操作、移动存储的新时代,我公司也成为首家集研发、生产、销售、服务于一体的DSP运动控制系统生产厂家。""",北京锐志天宏科技股份有限公司,北京市昌平区科技园区生命园路4号院4号楼5层501,110114005862028,2003-07-24,黄国庆,2000万元人民币,91110114752619949E,www.richnc.com.cn
迈悦,浙江迈悦净水科技有限公司,迈悦是一个净水器生产商，目前自主开发拥有RO机、管道式、厨上式、全屋式、陶瓷式、壁挂式、厨下式、紫外灯等8大系列，百余款RO机及不锈钢净水产品，并掌握核心超滤膜生产技术，拥有10余条膜丝生产线。,浙江迈悦净水科技有限公司,余姚市陆埠镇五马村工业园区,330281000018152,2007-11-19,李孝君,1000万元人民币,91330281668471443N,www.morejoywater.com
贝尔在线,苏州中资联投资管理有限公司,携手创造未来,苏州中资联投资管理有限公司,苏州市吴中区木渎镇金枫路216号东创科技园3幢D号楼501室,320503000102023,2011-10-28,陈群,5000万元人民币,91320506585501694L,www.zzlrz.com
Segafredo,上海卡缤餐饮有限公司,Segafredo是一个意大利著名的咖啡品牌，已建品牌网络，其产品涵盖咖啡、果汁、软饮、甜点、西式简餐、红酒、鸡尾酒等。,上海卡缤餐饮有限公司,上海市长宁区天山路341号第2幢第109单元,310000400317317,2002-09-25,LEE HYUNSOON,453万美元,913100007426878099,www.segafredocafe.com
丁丁贷,北京宜君技术服务有限公司,丁丁贷是一家集信息咨询、投资咨询、贷款咨询服务于一体的P2P网络金融信息服务平台，通过一个优质的途径让需要理财的客户在获得良好资金回报率的同时帮助有借款需求的客户实现发展和收益。,北京宜君技术服务有限公司,北京市丰台区游泳场北路九号A座608-2室,110106018249628,2014-12-01,张雷,1000万元人民币,91110106318212732C,www.dingdingjinfu.com
邻街,西安微派软件有限公司,西安微派软件有限公司是一家互联网公司，致力于移动互联网研发和市场开拓，主要业务包括：微派云网站、微派云电商、O2O解决方案、微信综合营销解决方案。旗下产品包括商友网、微派网、邻街等，为企业提供移动互联网营销整体解决方案。邻街是一款基于位置的陌生人交友手机通信软件。,西安微派软件有限公司,陕西省西安市长安区郭杜街道文苑中路长安文化中心A座7B-5-2室,610100100630335,2014-04-09,王保健,101万元人民币,91610104097884171C,www.linjie.net
金硕集团,天津金硕信息科技集团股份有限公司,"""公司主要从事教育信息化产品的研发、生产、销售及系统集成服务、建筑智能化工程和学校运动场地建设工程。公司的产品和服务分为三类:1)教育信息化产品和服务,以系统集成为主,大部分设备和材料需要外购,同时公司也有专门的研发部门,研发了一系列的自有产品应用于教育信息化项目中;2)建筑智能化工程,主要为弱电工程项目;3)学校运动场地建设工程。""",天津金硕信息科技集团股份有限公司,华苑产业区科馨公寓24门4层A02号,120000000000518,1997-04-02,张跃,4234万元人民币,911200006008625520
嘿秀直播,哈尔滨嘿秀网络科技有限公司,"""嘿秀直播是一款炫酷的真人视频直播APP、一款超多美女的视频直播平台,每晚还有定时半夜福利,功能强大,界面美观时尚,而且播放高清流畅不卡顿,带给你极致的视频直播体验!""",哈尔滨嘿秀网络科技有限公司,哈尔滨高新技术产业开发区科技创新城创新一路2305号101-211室,230199101048171,2016-07-04,郝琦,100万元人民币,91230199MA18YD2N8Y,www.heyshow.cn
云海通讯,深圳市云海通讯股份有限公司,深圳市云海通讯股份有限公司成立于1990年6月1日，注册资本9858万元，是国家级高新技术企业，是无线网络产品与服务提供商，着力发展自主知识产权和自有品牌的业务，主要从事移动通讯无线覆盖产品的研发、制造、销售与服务。经营的“云海WINHAP”品牌，得到了国内电信运营业的广泛认同。,深圳市云海通讯股份有限公司,深圳市福田区车公庙天安数码城天吉大厦F5.8栋CD座8楼,440301102928188,1990-06-01,胡志强,10008万元人民币,91440300279411236M,www.winhap.com
康臣药业集团,广州康臣药业有限公司,康臣药业是一家肾病药物研发生产商，主要从事现代中成药及医用成像对比剂研发、制造及销售。主要产品尿毒清颗粒，获得国家批准用于治疗慢性肾功能衰竭的纯中药制剂，具有自主知识产权并被列入国家保密品种。,广州康臣药业有限公司,广州萝岗区经济技术开发区东区东鹏大道７１号,440000400007543,1997-12-29,高海恩,30000万元人民币,91440000617431855B,www.chinaconsun.com
语晗,杭州语晗科技有限公司,语晗是一家纳米纤维素材料生产与应用解决方案供应商。通过整合国内外知名科研机构、知名企业等优质资源，结合自主研发，持续为客户提供创新产品和专业服务。,杭州语晗科技有限公司,,330181000482638,2015-01-12,施波波,1000万元人民币,91330109328306281W,www.yeuha.com
打扮家,美屋三六五（天津）科技有限公司,打扮家是一家VR/AR家装可视化系统服务提供商，用户可以在平台上通过VR或者AR技术实现家装搭配与选购、虚拟家庭社交等功能；同时平台为家装设计师提供户型绘制、方案设计、效果表现等服务功能。,美屋三六五（天津）科技有限公司,天津生态城国家动漫园文三路105号读者新媒体大厦A区911房,120110000251010,2015-05-05,崔健,94.5476万元人民币,911201103286319228,www.meiwu365.com
瑾琅,天津瑾琅珠宝有限公司,瑾琅是一家翡翠珠宝设计定制商，涵盖翡翠、彩宝、钻石、珍木、陶瓷等不同文化领域，专注于客户提供全面的搭配设计，致力于成为客户可信赖的私人珠宝顾问。,天津瑾琅珠宝有限公司,天津市和平区劝业场街蒙古路110门105-2,120116000223517,2014-03-18,王睿,500万元人民币,91120116093464882L,www.8jl.com.cn
同方软银,大连同方软银科技股份有限公司,大连同方软银科技股份有限公司是一家专业为银行提供整体解决方案的自主研发型金融软件和咨询服务企业。是金融IT服务与咨询服务为一体的供应商，为众多银行提供了大型应用系统及微小企业贷款咨询服务。并且在自有解决方案的基础上，集成和整合了国内外多家知名企业的产品和解决方案，能够为银行提供全面完整的企业级IT建设支持和咨询服务。,大连同方软银科技股份有限公司,"""辽宁省大连高新技术产业园区软件园东路40号23号楼702A号"
"""",210200000199534,2005-11-18,文高国,4256万元人民币,91210200782451876B,www.tfrunning.com.cn
加一手,厦门清玩雅集文化创意有限公司,加一手是一个基于微信上的C2C/B2C闲置品市场的新电商 （微信闲置品拍卖平台）。分为普通拍卖、一口价、一元拍三种 。设计专场专题，自由定制，节日与场，书店与场，教材与题等 。,厦门清玩雅集文化创意有限公司,,350211200154764,2016-04-13,侯冬梅,100万元人民币,91350211MA347EGP9E
wancup,海南万客食品有限公司,海南万客食品有限公司成立于2014年，是一家专业从事便捷咖啡饮品研发、生产、销售一体化的公司。我司拥有一支年轻、敏锐、朝气蓬勃、勇于创新的团队，将咖啡饮品便捷化是公司的目标；我们秉承着专业、敬业、创新的发展理念，坚持以客户为本以信用为先的服务准则，以优质的产品、先进的技术为消费者提供一种健康、快乐、便捷、美味、品质高的饮品生活方式，专注于满足顾客的各种需求，将咖啡饮品简单快捷的融入人们的生活和工作中。我们的、研发和生产采用一流的设备，一流的技术以及一流的创意，创造出多元化的咖啡饮品，打造出中国独一无二的咖啡设备和咖啡饮品。,海南万客食品有限公司,海南省海口国家高新区药谷工业园药谷一横路16号1#厂房第3层,460100000542901,2014-01-22,谭家民,500万元人民币,91460100090511727A
泰嘉体育,安徽泰嘉体育咨询有限公司,泰嘉体育是一家为健身房提供销售CRM与智能模块数字化改造的科技公司，未来期望通过用户经营性数据分析为客户提供更高价值。同时泰嘉体育依托O2O商业模式，经营范围包含健身服务、体育信息咨询、赛事活动、体育器材等。,安徽泰嘉体育咨询有限公司,合肥市蜀山区东流路西999号新际商务中心C幢2304室,340100001817693,2016-11-04,吴志鹏,845万元人民币,91340100MA2N2DU173
泓创,泓创（深圳）科技开发有限公司,泓创是一家主要致力于信用卡软件的研发、销售及渠道管理的公司。专注于全国范围内信用卡管理软件研发及销售，包括信用卡管理软件销售程序编写、信用卡管理软件公式编写、支付行业通道搭建等。,泓创（深圳）科技开发有限公司,,440301115211168,2016-03-03,李传福,10万元人民币,914403003602419084,www.hcxyka.com
腾冲魅力,腾冲市魅力网络科技有限公司,腾冲魅力是一家集生产、观光、旅游与一体的生态观光农业。在原缅北战争退役老兵改造罂粟田的基础上开发建设，现有良田10000亩，生产纯天然富硒稻米以及其他作物。,腾冲市魅力网络科技有限公司,,530522100017010,2014-05-26,邵宗桂,200万元人民币,91530522399500284G
蓝科讯智能,深圳市蓝科讯智能科技有限公司,"""深圳市蓝科讯智能科技有限公司是一家专业蓝牙,APP解决方案提供商，硬件部分开发出蓝牙4.0智能手环，蓝牙4.0防丢器，蓝牙LED灯泡，蓝牙4.0温度计，蓝牙4.0透传方案等。App部分：蓝牙4.0智能手环App，蓝牙4.0防丢器App，蓝牙4.0LED灯控，蓝牙4.0万用表App，蓝牙4.0血氧计App等。""",深圳市蓝科讯智能科技有限公司,深圳市福田区泰然九路海松大厦B座202-86,440301108408963,2013-11-28,刘志武,60万元人民币,914403000846095924,www.szbfour.com
必博教育,广州管好信息科技有限公司,必博教育是集托辅、兴趣班培训、文化课培训等交流平台为一体的教育培训机构，通过建立课后托辅中心、亲子活动基地、少儿培训超市以及帮帮带信息平台等四位一体的方式，旨在一站式解决孩子托辅与培训的多元化需求。,广州管好信息科技有限公司,广州市南沙区丰泽东路106号（自编1号楼）X1301-H595（仅限办公用途）（JM）,440110000141721,2016-03-28,詹前进,5万元人民币,91440115MA59C8Q82J,www.bibojiaoyu.com
酷享科技,武汉市酷享科技有限公司,酷享科技是一家专注于物联网技术和智能家居系列产品的研发和应用的技术公司。已经开发出众多实用、新颖、高质的智能家居主控平台和外围设备，并拥有多项专利。,武汉市酷享科技有限公司,武汉市东湖新技术开发区两湖大道东山头山水华庭。云顶居8栋2单元1层02号,420100000285134,2011-12-01,袁崟,100万,91420100584890683U,www.qswteck.com
钱大妈,广州市钱大妈农产品有限公司,钱大妈是一家生鲜农产品运营服务商，专注于经营生鲜肉菜市场，企业推广“社区加盟制”商业模式，致力于打造生鲜社区O2O服务，,广州市钱大妈农产品有限公司,广州市海珠区艺泓路22号,440105000367251,2014-05-16,冯冀生,149.8713万元人民币,91440105304504822N,www.qdama.cn
学信贷,广西学信融经济信息咨询有限公司,学信贷是一家致力于大学生金融服务的互联网金融公司，通过大学生消费金融互联网服务模式、互联网企业与传统金融行业的创新结合，为大学生用户提供P2P、投资理财、分期付款、第三方支付等金融服务。,广西学信融经济信息咨询有限公司,南宁市西乡塘区滨河路5号中盟科技园3号楼202号,450111000158595,2015-04-16,曾景,1000万元人民币,91450100340311278L,www.xuexd.com
红豆,南京红豆信息技术有限公司,红豆是一家性垂直手游制作商。公司旗下主要产品为宫系列女性互动游戏，包括《围住神经猫》《全民宫斗》《全民穿越之宫》《女皇陛下》《帝王侧》《青鸾风华录》等，2018年H5游戏尝试小游戏，微端，海外不同平台和推广模式，2019年宫系列新产品推广，完善与女性受众相关的周边社区和工具类产品。,南京红豆信息技术有限公司,南京市雨花经济开发区凤华路18号8幢323室,320114000143486,2015-09-14,秦川,143.472万元人民币,913201143532913252,cb.hdyouxi.com
