名字,公司,介绍,公司,地址,身份证,时间,法人,注册金额,编号,网址
VR实验课,上海梓时数字科技有限公司,VR实验课是通过计算机创建的一种多源信息融合的、交互式的三维动态视景和实体行为的仿真系统，使用户沉浸到该环境，达到跟实际实验室同样的效果，具有多感知性、存在性、交互性、真实性等多种特点。,上海梓时数字科技有限公司,上海市金山区朱泾镇南横街4号4幢1289室A座,310116002951603,2013-09-26,郭圣,1000万元人民币,9131011607819284X9,www.shzishi.com
E药汇,浙江英磊联信息技术有限公司,浙江英磊联信息技术有限公司以打造创新型医药交易和信息服务平台为目标，基于SAAS服务模式向广大连锁及单体药店提供药店管理系统的信息化建设服务；并在此基础上延伸至医药生产厂家、供应商、医保和监管机构、消费者，针对不同对象提供不同的电子商务及移动终端应用服务产品。提高药品零售终端的商品供应链效率，降低运营成本，同时为实体门店开辟更多的网络销售市场，并为供应商的优质产品提供积极推送与展示的平台。公司旗下拥有企业级系统快速开发套件软件V1.0版本，药店在线联盟平台系统V1.0版本，药品监控管理平台V1.0版本等软件,浙江英磊联信息技术有限公司,浙江省杭州市下城区武林新村104号1幢366室,330000000078931,2015-06-24,张锦桦,2400万元人民币,913300003440893282,www.eyaoclub.com
前海供通天下,深圳市前海供通天下供应链管理有限公司,是一家物流供应链服务供应商,深圳市前海供通天下供应链管理有限公司,深圳市前海深港合作区前湾一路1号A栋201室(入驻深圳市前海商务秘书有限公司)实际经营地址:深圳市宝安区海秀路23号龙光世纪大厦A座15楼A06,440301111509941,2014-10-23,伍嘉敏,10000万元人民币,91440300319436295B
田丁科技,杭州田丁科技有限公司,田丁科技是一家专注于中高端APP开发和网站建设的公司，同样也是一家致力于行业软件及解决方案的公司。为政府企业及个人提供基于移动终端的客户端平台开发等各种服务。,杭州田丁科技有限公司,拱墅区和睦路525号一层104室,330105000474123,2017-01-23,盛翔,100万元人民币,91330105MA28LN0567,www.tiandingkeji.com
兔叨叨,杭州大拿科技股份有限公司,兔叨叨是一款儿童语言教育类APP，其应用的核心角色是一只小兔子——“兔叨叨”。应用以核心角色“兔叨叨”直接命名。用户可以与叨叨直接对话，点播经典儿童故事。除此之外，叨叨还会唱儿歌、背古诗。让孩子有个可以说话可以谈心的玩伴。,杭州大拿科技股份有限公司,,330100000206957,2015-07-03,陈明权,600万元人民币,91330100341849088F
逸保,福建逸保网络科技有限公司,逸保是一个基于云计算和大数据分析的2C互联网保险服务平台，旨于通过海量的保险产品数据分析，为用户智能分析和推荐保险产品，结合平台上已接入的各大保险公司的保险产品，实现快速的分析、定制、比对、投保、协助理赔。,福建逸保网络科技有限公司,,350105100165209,2017-02-23,陈平,1000万元人民币,91350105MA2Y10TD88,www.ebao123.com
Gagi人潮汕互联网小食馆,深圳市识潮文化发展有限公司,Gagi人是以互联网、文化、餐饮相结合的小食馆。形成订阅号矩阵，服务号，线下小食体验店三部引擎全面拉动。通过线上订餐系统，建立微信订阅号和服务号，服务号为潮汕用户提供一套集外卖，自提，点菜，下单，支付，排号，分享体验为一体的线上服务，实现“无服务员、无收银员、无就餐区，无专业厨师”的互联网小食馆。,深圳市识潮文化发展有限公司,深圳市南山区南山街道桂庙路福海苑一栋一单元5A,440301116963577,2016-07-28,刘鹏,50万元人民币,91440300MA5DH9H2X3,mp.weixin.qq.com
威盛电子,威盛电子（深圳）有限公司,威盛电子集成嵌入式平台及系统解决方案领导厂商，致力于M2M、物联网及智慧城市领域应用开发，范围包括多屏墙、数字标牌、工业自动化、医疗自动化等。。客户群涵盖全球各大领先高科技、电信、电子消费品牌。,威盛电子（深圳）有限公司,北京市海淀区中关村东路1号院7号楼威盛大厦,440301503369937,2000-08-10,陈主望,2500万港元,91440300723018888L,www.viatech.com
汉固达商城,浙江汉固达网络信息技术有限公司,专业级五金机电厂商直供平台，B2B2C，仓储中心24家，连锁加盟店100+，历史合作品牌200+，注册会员40000+，日活2000+。,浙江汉固达网络信息技术有限公司,,330702000114399,2015-10-15,杨斌,1538.46万元人民币,91330702MA28D18A49,www.hanguda.com
环时互动,环时互动（北京）科技有限公司,环时互动（北京）科技有限公司（S-lab）是一家基于受众洞察，整合多种创意方式，聚焦社交网络，协助品牌和产品扩大其社会化影响力，以创新为生命线和竞争力的新形态传播公司。,环时互动（北京）科技有限公司,北京市房山区良乡长虹西路翠柳东街1号-2157,110111015368975,2012-11-06,金鹏远,1600万元人民币,91110111057383591B,www.socialab.com.cn
松盛机器人,上海松盛机器人系统有限公司,松盛机器人是一家工业机器人系统研发商。旗下产品包括三坐标系统、自动码砖机器人系统、机器人导轨及玻璃挑料手等。主要应用于物料搬运、压铸喷雾取件、点焊、弧焊、等离子切割/气刨、机床设备上下料、研磨抛光、涂胶、拆码垛等。,上海松盛机器人系统有限公司,青浦区华纺路69号3幢3层D区388室,310229001423286,2009-11-26,李强,1266.67万元人民币,913101186972778266,www.jxss88.com
八百里汽车科技有限公司,北京八百里汽车科技有限公司,我要车(隶属于北京八百里汽车科技有限公司)成立于2017年12月，核心团队拥有丰富的汽车销售及互联网运营经验，背靠上市集团，拥有强大的资源，以优质的服务、快速的反馈为特色，上线之后月成交量快速增长，是国内发展最快新车B2B平台。 “我要车”公司是业内人士高度认可的业务布局全、服务能力强的新车B2B平台，考虑到未来新车销售行为将注重消费者行为习惯的分析与洞察，“我要车”公司应用互联网运营思维，不断提升信息流通效率，力争在车源、物流、仓储、交易担保等各方面为各级经销商提供良好、完善的服务。公司总部位于北京，拥有员工900余人，有专门团队深入驻扎全国五十多个城市，包括北京、上海、成都、郑州、深圳、长沙、菏泽、周口等，业务足迹遍布全国，合作4S店、二级经销商近十万家，直接深入连接各级供应商、经销商，并且提供交易过程中货源、物流、营销等一系列问题的解决方案。截止目前，“我要车”公司各项业务持续布局当中。,北京八百里汽车科技有限公司,北京市海淀区羊坊店路18号2幢11层1142-9,110108024195080,2017-09-28,孙瑶,133.3333 万元,91110108MA017W1Y8T,www.wyc.cn
锦仓科技,海南锦仓网络科技有限公司,海南锦仓是一家金融服务区块链应用软件开发商。致力于解决传统金融交易中存在的信任及流通问题，以数据科学应用为核心，行业融合创新为驱动，倾力打造中国最具影响力的大数据产业群落。锦仓科技团队由跨越多个专业、并有不同类型丰富履历的专业人士组成，属于互补复合型团队，技术研发实力雄厚，集合了计算机领域、金融领域专业人士。,海南锦仓网络科技有限公司,海南省海口市龙华区滨海大道32号复兴城A1区A5002号,,2018-04-16,刘洋,230万元人民币,91460100MA5T3Y2JX9,jincang.shop
凯利财富,陕西巨丰投资资讯有限责任公司,凯利景融（北京）投资管理有限公司专注于全球范围内的投资管理和资产管理服务，凯利财富网，是凯利景融（北京）投资管理有限公司全新打造的金融理财平台，致力于成为中国领先的“互联网私人银行”。凯利财富网采取创新的“O2O+P2B”形式，面向国内高净值客户和企业用户，借助PC端平台、移动端APP以及线下面对面等方式，通过多维度的产品筛选及风险控制体系，整合国内“银行、信托、保险、基金（公募私募）、券商、担保公司”各类金融机构资源，提供极具竞争优势的理财产品，让国内的投资者真正体会到“一站式”的安全、稳定、高收益的理财,陕西巨丰投资资讯有限责任公司,陕西省西安市高新区锦业路1号都市之门B座1407室,610000100354756,1997-06-13,马琳,500万元人民币,916100006237502038,www.jfinfo.com
亚士创能,亚士创能科技（上海）股份有限公司,亚士成立于1998年，是一家集涂料、保温装饰成品板、防火保温新材料研发、制造和服务于一体的高新技术企业。经过16年的发展，亚士已成为涂料及节能新材料行业的领导品牌。公司坚守“行业专业化、领域多元化”的发展理念，沿核心竞争能力进行扩张，16年跨越了三大步，成为同时拥有三大业务体系的行业翘楚。 三大业务：亚士功能型建筑涂料、 亚士创能保温装饰成品板、亚士创能真金防火保温 亚士创能科技是亚士集团的核心企业。公司以“人与自然和谐发展”为使命，顺应时势，在能源消耗、资源消耗最大的建筑领域，开创性的研制出了保温装饰成品,亚士创能科技（上海）股份有限公司,上海市青浦工业园区新涛路28号综合楼三层、四层,310229001347433,2009-02-13,李金钟,19480万元人民币,913100006840916863,www.cuanon.com
农医生,中农问科技（北京）有限公司,农医生是一款基于手机移动互联网的农作物病虫害远程诊断应用，致力于解决农业问题，包括食品安全、粮食丰收等。平台通过汇聚国内农业专家、涉及企业和种植大户，为用户提供农作物诊断咨询服务。,中农问科技（北京）有限公司,北京市海淀区马甸七省驻北京办事处大院17号楼三层303室,110105017888222,2014-09-16,简成敏,300万元人民币,91110108318308072U,www.nongyisheng.com
元生科技,武汉元生创新科技有限公司,元生创新专注于运动传感与导航定位技术，提供领先的运动传感技术及产品，应用于消费电子设备和专业应用领域如机器人、无人机和动作捕捉，其自主研发的YFusion?算法技术能够提供物理与数字之间的无缝交互体验。是一家运动传感器研发商，专注于从事运动传感和定位导航技术的研发与应用，旗下产品YIS10姿态传感器主要应用于虚拟现实、无人机、机器人、智能装备等领域。此外，平台还在进行动作捕捉产品的内部研发。,武汉元生创新科技有限公司,武汉市东湖新技术开发区东信路数码港E幢三层3256、3266室,420100000622742,2016-04-22,刘超军,112.7728万元人民币,91420100MA4KME8E6Y,www.yesense.com
微之家,厦门微之家科技有限公司,微之家是一个高校微信第三方平台，致力于为高校微信运营者解决技术、运营、商业化的问题。8个月时间覆盖了全国1000所大学。,厦门微之家科技有限公司,福州市台江区洋中街道广达路378号广达汇多利专业建材装饰城2层378店面,350103100084339,2013-03-12,白荣辉,100万元人民币,913501030641044586,www.iweizhijia.com
JDF金典工场,金典工场（上海）企业发展有限公司,JDF金典工场成立于2014年初，是一家致力于剧目创作与运营的公司，首部音乐剧作品为《上海滩》。,金典工场（上海）企业发展有限公司,,310106000256515,2014-01-23,宋舒彭,1000万元人民币,91310106091810198L,www.jdfshow.com
持正科技,杭州持正科技股份有限公司,"""公司专业从事车用链条的研发、生产和销售,主要生产摩托车链条(包含摩托车发动机链条)和汽车发动机链条产品,并逐渐转向专业车用传动系统的设计、开发、制造与销售。    公司主营产品为摩托车链条(包含摩托车发动机链条)和汽车链条,此类产品广泛应用于国内外摩托车、汽车售后市场并与多家品牌整车制造商建立长期合作关系,产品直接或间接出口南美、拉美、东南亚等地区。现公司已成为北汽集团、四川汽车集团有限公司、华晨集团等多家行业内知名企业的发动机链条的一级供应商。""",杭州持正科技股份有限公司,杭州余杭区仓前街道海曙路12号,330184000167810,2011-05-10,姚胜强,12000万元人民币,91330100574359987R,www.3chain.com
榴莲文化,杭州榴莲文化传媒有限公司,杭州榴莲文化传媒有限公司是一家专注于泛财经新媒体运营的机构，致力于成为草根财经大V。目前运营老斯基漂移（ID：laosijicj）、财经老斯基（ID：cjlaosiji）等微信公众号。,杭州榴莲文化传媒有限公司,浙江省杭州市滨江区西兴街道科技馆街626号寰宇商务中心2幢504室,330108000300630,2016-08-29,何晓春,300万元人民币,91330108MA27YJR069
法天使,法天使（北京）科技有限公司,法天使是一家在线法律服务商。利用自身的合同大数据、智能合同平台、文档协作编辑技术及聚合的优秀法律人团队，提供合同起草、合同审查、合同管理和日常法律顾问等在线法律服务。今年3月，受微软邀请，“法天使”向在场的近300名程序员分享了“法天使律师助手”，这款产品是“法天使”作为微软合作伙伴推出的嵌入在Word中的合同库插件。产品通过切入日常办公使用场景，在Word文档中，用户即可自由调用超过10000份优质合同范本。,法天使（北京）科技有限公司,北京市海淀区上地三街9号A座A912-145,110108018529052,2015-01-22,何力,180.322359万元人民币,91110108330284923X,www.fatianshi.cn
华工安鼎,武汉华工安鼎信息技术有限责任公司,安鼎密级标志生成与管理系统是一款基于密级标志技术的信息安全防护及应用管理系统。该系统采用密级属性信息与电子文档实体安全绑定技术，实现密级属性信息与电子文档不可被非授权分离，其自身不可被非授权篡改；同时该系统采用电子文档安全防护控制技术，保障密级标志文档不可被非授权查阅、复制以及打印，实现对密级文档从产生、定密、流转、使用过程的全生命周期管理，保障密级文档的安全。该产品适用于军工、政府、科研院所、金融机构以及高新技术企业等，为其提供安全的电子文档管理平台。,武汉华工安鼎信息技术有限责任公司,武汉东湖开发区武大园路7号武大科技园3S地球空间信息产业基地三区10栋1　2层01室,420100000037391,1997-09-25,王同洋,2000万元人民币,91420100717912437M,www.82772777.com
兴趣袋,山西伙乐魅客教育科技有限公司,兴趣袋是一个艺体教育资源平台，提供家庭教育、体艺学习、兴趣培养等兴趣类深度内容。,山西伙乐魅客教育科技有限公司,运城市盐湖区文化产业园区学院西路8号三楼3022室,140802100305324,2014-09-17,袁波,1000万元人民币,91140802317081590B,www.onoao.com
上海雅仕,上海雅仕投资发展股份有限公司,雅仕投资发展股份有限公司的主营业务为供应链物流及供应链执行贸易业务，供应链物流可细分为多式联运和第三方物流服务。,上海雅仕投资发展股份有限公司,中国（上海）自由贸易试验区浦东南路855号33H室,310115000762309,2003-05-22,孙望平,13200万元人民币,91310000750551960R,www.aceonline.cn
BoostFuture,云南斯内克教育咨询有限公司,BoostFuture是一个体育留学一站式解决方案。知名欧洲合作伙伴，西班牙、法国、塞尔维亚等体育强国的职业俱乐部加持；以职业培训为背景，可以帮助更,云南斯内克教育咨询有限公司,,530100000485085,2015-09-01,张清任,100万元人民币,915301003518543821
甲子股份,福建甲子信息技术股份有限公司,福建甲子信息技术股份有限公司主营业务是基于北斗及GPS卫星定位技术平台，提供车联网道路运输定位系统专用软件研发、销售和服务以及为出租车（私家车）、客/货运输车等车辆提供车联网车载终端设备的销售和服务。公司主要刹那品和服务有车联网软件研发与销售、九州方圆卫星定位综合服务平台、车载终端设备销售。,福建甲子信息技术股份有限公司,福州市鼓楼区软件大道89号福州软件园B区23号楼503室,350100100285212,2012-07-04,黄解英,1000万元人民币,91350100597895379T,www.jazi.info
本草春,福建本草春石斛股份有限公司,漳州本草春石斛科技股份有限公司主要从事铁皮石斛、金线莲瓶苗种苗的培育、销售和相关初级加工产品的生产和销售以及铁皮石斛、金线莲的规模化种植。公司主要产品有铁皮石斛瓶苗、铁皮石斛种植苗、铁皮石斛鲜品、铁皮石斛干品、金线莲瓶苗、金线莲鲜品、金线莲干品等。　　,福建本草春石斛股份有限公司,,350600400016740,2011-12-23,蔡淑燕,7130.4112万元人民币,9135060058751785XK,bccsh.com
美尼美定制家具4S,广州美尼美家具有限公司,广州美尼美家具有限公司，专业定制家具品牌，成立于2011年，是一家集研发、设计、销售、生产于一体的定制家具企业，生产基地位于广州增城上塘工业区，占地面积多达10万平方米，拥有3万多平方花园式生产车间、数条国际一流先进、数码智能化的进口豪迈设备生产线、1000多平方时尚展厅以及精美的酒店式员工宿舍。,广州美尼美家具有限公司,广州市增城石滩镇上塘村沙庄江龙大道北111号（厂房B1）,440125000071039,2011-09-09,卢琼欢,2000万元人民币,914401835818825573,mnmyg.com
孔明科技,北京中天孔明科技股份有限公司,孔明科技是一家专注于数据基础架构产品研发的公司，主要依托于其大数据能力，为客户（从大品牌商到中小企业）提供数据商业化解决方案，协助客户企业提高销售、降低成本。现有孔明社交管理工具、孔明应用工厂、孔明观察等社会化媒体营销产品。,北京中天孔明科技股份有限公司,北京市朝阳区惠新东街甲2号楼-3至25层101内10层1001室,110105011544524,2008-12-24,鄂威,200万元人民币,9111010568439891XE,www.kongming-inc.com
维艺尔服饰,上海维艺尔服饰有限公司,暂无信息,上海维艺尔服饰有限公司,,310105000281228,2005-05-17,陆芳芳,60万人民币
优童,北京优优童童科技有限公司,北京优优童童科技有限公司致力于传递儿童安全理念，搭建专业儿童安全防护服务平台。公司以国内专业的儿童安全教育专家团队为坚强后盾，历经多年对中国幼儿安全教育的专研汇总，产品涉足多个领域和形式，包括动画片、幼儿园安全教育产品、家庭早教产品、家庭安全防护产品、移动端安全知识服务平台、防护与救助体验平台，等等。公司为广大的家长及儿童教育机构提供中国最专业最全面的儿童安全教育知识及体验，力争打造中国儿童安全第一品牌。,北京优优童童科技有限公司,北京市海淀区信息路22号B座2层02-A030室,110108019865681,2015-09-16,李建平,2000万元人民币,91110108357964208M,www.yootnn.com
皮克斯战记,北京空岛科技有限公司,"""北京空岛科技有限公司，经营范围包括技术开发、技术转让、技术咨询、技术服务、技术培训等。是一个充满活力的创业团队,专注于移动互联网,只做自己喜欢的产品""",北京空岛科技有限公司,北京市海淀区双清路3号3428室,110108017051151,2014-04-17,闫春路,100万元人民币,911101080984899233,www.taptap.com
鸣隆文化,上海鸣隆文化传媒有限公司,鸣隆文化是一个集红人经济网络电商线下店铺为一体的多元化平台。,上海鸣隆文化传媒有限公司,上海市崇明区堡镇堡镇南路58号24幢1楼110-8室(上海堡镇经济小区),,2018-05-24,茅又丹,100万元人民币,91310230MA1K0YKR86
头彩日化,广州头彩日化科技有限公司,头彩日化是一家洗护日化产品生产商。于2011年率先在国内研发推出“水溶性配方”专业洗护—领秀coco。,广州头彩日化科技有限公司,,440106000372918,2011-02-23,张葆旺,100万元人民币,9144011156976171X9,www.topbest-nsol.com
文创文化,保定文创文化艺术咨询服务有限公司,暂无信息,保定文创文化艺术咨询服务有限公司,,130604000033551,2015-05-26,刘彦东,10万元人民币
瑞驰丰达,瑞驰丰达（天津）股份有限公司,瑞驰丰达(天津)股份有限公司的主营业务为汽车零部件的研发、生产与销售。公司主要产品为汽车用内外饰塑料件、模具及其他汽车配件。自成立以来公司生产的汽车用内外饰塑料件及模具等产品陆续通过国内主要汽车零部件供应商及整车厂的认证，销售渠道得到平稳快速扩展，公司产品最终应用于长安汽车、现代摩比斯、丰田汽车、福田戴姆勒、一汽海马、郑州日产、沈阳华晨金杯、大京机械、天汽美亚、一汽夏利、铃木等知名汽车品牌。,瑞驰丰达（天津）股份有限公司,武清区大孟庄镇大程庄村,120222000000903,2004-12-10,程希广,14355万元人民币,911202227676402147
游比阁,杭州游比阁科技有限公司,有情怀，有big，怀揣理想，脚踏实地。游比阁公司创始团队成员均为一线厂商的核心员工，近十载游戏领域从业经验，在杭州这个春暖花开的季节，整装待发，重新上路，专注于精品创新创意类手游的制作。我们不做blizzard，我们也不做supercell，我们是ubig!,杭州游比阁科技有限公司,浙江省杭州市余杭区五常街道西溪八方城5幢717室,330184000447977,2016-03-23,李璋,200万元人民币,91330110MA27X5R10X,www.playbig.cn
兴森快捷,广州兴森快捷电路科技有限公司,兴森快捷电路科技股份有限公司是目前国内规模最大的印制电路板样板快件及中小批量板的设计、制造服务商。公司自成立以来一直秉承“为电子科技的持续创新提供最优最快的服务”的宗旨，以“市场为导向，质量为中心”的经营理念，致力于成为国内第一、全球领先，具备PCB设计—制造—贴装完整产业链的硬件外包设计综合解决方案提供商。公司先后投入巨资从美国、日本、德国、以色列、意大利、台湾等国家和地区，引进了拥有世界先进水平的现代化生产和检测设备及软件，可生产高层背板、HDI板、高频板、高TG板、无卤素板、刚挠板、金属基板、IC载板,广州兴森快捷电路科技有限公司,广州高新技术产业开发区科学城光谱中路33号,440101400035425,2006-09-07,邱醒亚,9504万美元,91440101791033537W,www.chinafastprint.com
咫尺RR,厦门咫尺距离网络科技有限公司,“咫尺”是一个LGBT（指所有非异性恋者）群体专用情趣用品品牌，其目标用户为男同、女同等非异性恋群体。首款产品为男同性恋者专用安全套“咫尺RR”，该产品采用泰国进口橡胶材料和特色“手工刷油+机器滴油”工艺制作，每片含油量可达常规产品的2~3倍。,厦门咫尺距离网络科技有限公司,厦门市湖里区日圆二里3号1106单元,350206200665292,2017-06-12,郑洋,100万元人民币,91350206MA2YAT021Q
云幕链,贵州云幕链创新科技有限公司,,贵州云幕链创新科技有限公司,未知,520115000371273,未知,卢定广,1000万元人民币,91520115MA6E9CTA9W,www.yunmulian.com
盛泰光学,江西盛泰光学有限公司,江西盛泰光学有限公司是一家精密制造+研发 一家领先的中国本土摄像头模组制造商。,江西盛泰光学有限公司,分宜工业园区,360521210005026,2010-07-12,赵伟,7100万元人民币,91360521558456576Y,www.szstgd.net
牵动网络,广州牵动网络科技有限公司,牵动网络成立于2015年7月份，由移动互联网广告巨头公司指点传媒原核心骨干技术人员独立出来共同打造；公司从事移动互联网广告推广服务业务，联合手游发行以及产品研发！,广州牵动网络科技有限公司,广州市天河区棠安路146号6B18房,440106001287879,2015-08-13,梁上超,100万元人民币,91440106353506250J,diandiano.com
神州中联教育,北京神州中联教育科技有限公司,北京神州中联教育科技有限公司（以下简称神州中联）是一家集知识传播和教育模式研究、高端教育资源与现代信息技术整合、多媒体教学技术研发于一体的现代化高科技教育企业，业务涉及多媒体教育产品开发、教育类电子商务平台建设、教育资源信息化产业开发等教育领域。主要从事教育教学产品的研发、生产与发行，并提供教育培训、咨询、信息传播等服务。,北京神州中联教育科技有限公司,北京市海淀区闵庄路3号32栋一层,110108012486710,2009-12-15,胡灏,1200万元人民币,91110108699640318Y,www.zlwh.com.cn
