名字,公司,介绍,公司,地址,身份证,时间,法人,注册金额,编号,网址
天涌科技,广西天涌节能科技股份有限公司,"""公司是一家集研发、生产和节能技术服务为一体,以水源热泵技术推广为主业的节能科技公司,主要涉及建筑节能领域,可广泛用于学校、住宅小区、酒店、度假旅游村等需要生活热水的单位,目前主要以学校为重点服务对象。公司利用自主研发的“EPC再生能热水智能供应系统”,主要为学校学生提供生活热水节能方案,并以合同能源管理方式为其提供节能服务。""",广西天涌节能科技股份有限公司,柳州市柳东新区官塘创业园Ａ区标准厂房Ａ３栋４层东半层,450200200012669,2007-11-12,梁华易,5767.9777万元人民币,91450200667039528Q,www.tyjnkj.com
绚图新材科技,深圳市绚图新材科技有限公司,绚图新材科技是一家环保水性材料及纳米材料研发生产商，主要从事环保水性特效涂料，新型纳米材料及其它环保水性产品研究、生产和销售，并以表面处理、微粒制备及纳米包覆为技术核心，以环保水性产品为市场切入点，目前主要服务的三大细分市场为水性颜料、水性涂料、水性油墨。,深圳市绚图新材科技有限公司,深圳市光明新区观光路3009号招商局光明科技园A3栋C单元408,440301503476467,2014-03-17,HAI HUI LIN,123.9848万元人民币,91440300088569356M,www.shinemaxam.com
百度动漫,华族星文化传媒（北京）有限公司,百度动漫IP版权交易平台是由百度版权管理中心建立并运营旨在促进国内动漫版权交易全流程的信息自由流动和公开透明，降低交易成本，为权利人、投资人和动漫爱好者提供全面的版权信息平台。,华族星文化传媒（北京）有限公司,北京市石景山区石景山路3号玉泉大厦四层常青藤青年创业工作室165号,110107018494297,2015-01-13,夏霓,300万元人民币,91110107327286098T
万互,深圳万互电子有限公司,深圳万互电子有限公司（以下简称“万互”）是一家集智能硬件解决方案及硬件产品设计、研发、生产、销售、运营服务为一体的科技公司。,深圳万互电子有限公司,深圳市南山区科技南十二路18号长虹科技大厦2005室,440307112453177,2015-03-30,刘福生,500万元人民币,91440300335216786G
一米阅读,北京一米蓝科技有限公司,一米阅读是一个中小学生选书、购书、读书一站式服务平台，让孩子可以记录自己的阅读字数和阅读成绩，养成阅读好习惯，为语文主题学习实验区的师生提供定制化的阅读测评服务，并让学校、老师、家长可以直观的了解学生的阅读进度、阅读疏漏，从而有效的提高学生阅读能力。,北京一米蓝科技有限公司,,110108018868046,2015-04-07,徐小平,500万元人民币,911101083355590682,www.zykdb.com
趣享,保定市森和广告传媒有限公司,趣享是一个移动互联时代的本地生活服务平台，通过线上营销整合线下活动及消费的模式，为各类商家提供精准营销的解决方案，为广大用户提供优质优惠的商品信息和消费体验。,保定市森和广告传媒有限公司,,130600000070122,2010-03-09,冯印,201万元人民币,911306065518609716
易莱信科技,北京易莱信科技有限公司,易莱信科技是一家提供大数据分析与挖掘产品的公司，公司致力于为企业提供数据资产价值挖掘的大数据产品加工厂，目前公司的主要业务包括大数据挖掘产品、咨询、培训以及实施服务。,北京易莱信科技有限公司,北京市通州区新华南路39号58幢一层B区036号,110101017155800,2014-05-06,汪珂珂,1800万元人民币,9111011209944791X4,www.elaixin.cn
智童时光,北京智童时光教育科技有限公司,智童时光是一家智童时光致力于2-10岁亲子陪伴式“儿童家庭生活教育”产品的研发，以生活成长中好习惯培养和社会认知的家庭教育内容为核心，通过亲子互动游戏把家庭生活教育内容生动、有趣的表现出来，做好真正适合家庭的亲子陪伴教育APP产品。分年龄体系化课程，课程双学习模式载体，即有更深度的内容壁垒，又实现双端收益。儿童教育+游戏场景+专家妈妈的跨行业创业团队，对用户需求、产品表现形式、用户营销与运营服务等方面都有多年实战经验。“大头儿子”一线IP助力，结合团队多年的推广运营经验，APP产品已经实现低成本快速获客。,北京智童时光教育科技有限公司,北京市朝阳区慈云寺1号院3号楼1层、2层（八里庄孵化器2-1155号）,110105021405708,2016-06-02,崔长友,375万元人民币,91110105MA0064KX8W,www.geniustime.cn
互通车管,海南互通车管科技有限公司,互通车管是一个汽车服务链资源整合平台，是海南互通车管科技有限公司的重点项目。该项目通过对线下汽车后市场的资源整合，重新梳理对车主客户的服务理念，以资源优化配置的优势给车主客户提供超值的车保姆服务，并通过对线上线下资源的互联互通体系来实现资源共享，给车主客户及服务供应商提供一站式的解决方案。,海南互通车管科技有限公司,海南省海口市龙华区滨海大道32号世纪大桥西侧复兴城A1栋二楼2002号,460100000852394,2016-01-12,谢川宁,1000万元人民币,91460100MA5RCCEQ0T
怡林实业,新疆怡林实业股份有限公司,新疆怡林实业股份有限公司始建于1998年12月，主要从事信息技术应用类业务，目前主要服务于水利、安防、农业等行业。　　公司自设立以来，先后获得新疆维吾尔自治区高新技术企业认定管理办公室评定的高新技术企业、创新型企业，公司获得新疆维吾尔自治区计算机信息系统集成企业证书（甲级）、新疆维吾尔自治区安全技术防范行业安防工程企业资质等级证书（安防工程企业一级）、软件企业认定证书、新疆维吾尔自治区有线电视工程设计安装许可证(乙级)、通信用户管线建设企业资质证书、通信建设工程企业安全生产合格证等资质，获得“平安城市”推荐,新疆怡林实业股份有限公司,新疆乌鲁木齐经济技术开发区校园路107号北大科技楼2楼218室,650100050084119,1998-09-08,陈志义,3072万元人民币,91650100710720803F,www.yilin.com.cn
风云科技,江苏风云科技服务有限公司,总公司：风云科技江苏风云科技服务有限公司是专业的软件技术服务公司，是苏州软件园公共技术服务平台的建设、运营机构。公司拥有员工近300人，注册资本3600万人民币，办公面积超过6000平方米，实际投资规模近亿元，控股江苏风云网络服务有限公司、苏州市软件评测中心有限公司、江苏风云科技咨询有限公司和苏州市风云软件职业培训学校等子公司，以云软件平台的研发和运营、软件评测、软件人才培训、移动互联网、动漫游戏等为主要业务点，整合资源，拓展软件服务领域。风云科技及下属子公司的部分重要资质和荣誉国家中小企业公共服务示范平台国家火炬计划苏州软件园SaaS平台国家高新技术企业江苏省“两化融合”试点企业江苏省中小企业技术服务示范平台苏州市中小企业服务示范机构微软创新英雄公司网站：http://www.fengyuntec.com,江苏风云科技服务有限公司,,320594000155103,2010-02-12,戴晔,2000万元人民币,91320594551181055L,www.fengyuntec.com
小鱼网,福建小鱼网络科技股份有限公司,福建小鱼网络科技股份有限公司的主营业务是以品牌宣传服务为核心业务的互联网生活消费社区。小鱼社区由小鱼网WEB端和小鱼网APP两大平台组成。,福建小鱼网络科技股份有限公司,厦门软件园2期望海路59号501单元E区,350298100001205,2012-04-06,吴小婷,4580万元人民币,91350200587893660K
久友电子,陕西久友电子科技有限公司,陕西久友电子科技有限公司是一家电子材料生产商。,陕西久友电子科技有限公司,陕西省商洛市丹凤县中街社区大石桥90号,612523100004987,2015-02-02,陈玉佩,500万元人民币,91611022305698876F
中储股份,中储发展股份有限公司,中储发展股份有限公司（简称中国储运）隶属于国务院国资委所属大型中央企业中国诚通控股集团有限公司，是全国性大型现代综合物流企业，覆盖全国主要城市和全球主要经济区域，业务涵盖期现货交割物流、大宗商品供应链、互联网+物流、工程物流、消费品物流、金融物流等领域。,中储发展股份有限公司,中国天津市北辰经济开发区开发大厦,120000000002074,1997-01-08,韩铁林,219980.1033万元人民币,91120000103070984E,www.zcgf.com.cn
通潮精密,芜湖通潮精密机械股份有限公司,通潮精密是一家致力于集成电路产业关键核心技术的研究与产业化应用的科技型企业，其所生产的核心真空部件主要应用于平板显示和半导体芯片生产关键核心设备，是国内唯一能够提供CVD（化学气相沉积）、DRY（干法刻蚀）设备所需专业高精度电极的公司，技术实力与AKT（美国应用材料）、TEL（日本东电电子）等国际知名公司并驾齐驱，核心产品已达到国际先进水平。,芜湖通潮精密机械股份有限公司,芜湖长江大桥综合经济开发区泥埠路1号1#办公楼,340200000265369,2016-03-10,司奇峰,2233.3333万元人民币,91340200MA2MTNRB33
这一刻,登登动媒科技（北京）有限公司,登登动媒是一家照片信息共享平台提供商，开发了这一刻APP，提供基于地理位置的图片记录和分享功能，每一张照片都携带多重结构化信息，增加了版权照片的应用和变现场景，从而使照片的版权价值最大化。,登登动媒科技（北京）有限公司,北京市朝阳区广渠路28号院401号楼（劲松孵化器2416号）,110105020049936,2015-10-19,郁然,350万元人民币,91110105MA001D8H8C,www.timepics.cn
卡戎科技,南昌卡戎网络科技有限公司,南昌卡戎网络科技是专业从事移动互联网的软件开发、销售及服务的高新技术企业。公司在移动互联网应用和推广方面开辟了新的领域。,南昌卡戎网络科技有限公司,,360125110003906,2016-11-30,魏冲,100万元人民币,91360125MA35LJNT7R
宏博激光科技,安阳市宏博激光科技有限公司,宏博激光科技是一个激光技术周边产品生产商，主营产品包括：激光熔覆粉末、激光合金化粉末、光学镜片、激光熔覆淬火头、激光焊接头、高效激光淬火涂料。,安阳市宏博激光科技有限公司,汤阴县人和路与中华路交叉口西南角,,2018-03-27,王科,100万元人民币,91410523MA451HR619,www.hbjg99.com
千住良品,北京春哲国际贸易有限公司,千住良品旗下品牌“有家舶品”，致力于打造“品质生活典范”，是一个定位于中高端、时尚、精致生活品质的精品百货品牌。,北京春哲国际贸易有限公司,,110000450139118,未知,张杰,428.6432万元人民币,911102285548000501
哎哒医疗,上海哎哒信息技术有限公司,上海哎哒信息技术有限公司（下称“哎哒医疗”）成立于2016年4月，公司位于上海。哎哒医疗致力于通过人工智能技术，构建哎哒医学大脑（AidrBrain）研究智能医疗机器人，实现智能诊断、治疗、护理和医学研究等医学相关工作。,上海哎哒信息技术有限公司,上海市松江区谷阳北路1500号5楼502室,310117003396731,2016-04-26,陈庆坚,100万元人民币,91310117MA1J190B64
赛姆锐,广州晟锐厨房设备制造有限公司,广东省“晟锐”高端西厨产品以及“赛姆锐”大功率商用电磁炉，是由广州鹰锐金属制品有限公司和广州晟锐厨房设备制造有限公司强力打造的厨房设备高端品牌，是一家专业从事商用电磁炉，中西餐电热产品，燃气炉具的设计、研发、制造与销售的高科技创新型企业。,广州晟锐厨房设备制造有限公司,广州市番禺区沙头街莲湖村南片第二工业区北排3号之三,440110000044759,2014-10-28,刘建忠,50万元人民币,91440101320939340D,www.gdsunnyway.cn
独角兽旅行,独角兽商旅服务（深圳）有限公司,独角兽旅行是一家定制化旅游服务提供商。依靠团队的行业人脉和资源，并且与一些海外旅游机构合作，独角兽积累了私人别墅、私人海岛、私人游艇、私人飞机、私人野生动物园等资源。同时，独角兽旅行还提供私人旅行管家、私人保镖、私人厨师、私人摄影师等服务。,独角兽商旅服务（深圳）有限公司,深圳市宝安区福海街道桥头社区同泰总部产业园2A栋701,440300201956160,2017-07-27,彭英元,500万元人民币,91440300MA5EN2Q3XJ,www.doojoy.cn
人人优泊,深圳市人人优泊智能科技有限公司,人人优泊是一个全方位智能停车服务平台，平台以用户体验为核心，以场景服务为基础，为停车场提供数字、化管理、成本控制、增值业务、智慧体接口支撑； 为用户提供无障碍进出停车场、微信支付、查找停车场、预定停车位、反向寻车等便利功能。,深圳市人人优泊智能科技有限公司,深圳市宝安区新安街道裕安一路宝鸿林大厦1401,440306113175826,2015-06-19,刘海峰,200万元人民币,91440300342829492G,www.renrenparking.com
伽马星医疗,上海伽玛星科技发展有限公司,伽玛星医疗集团是一家拥有自主知识产权，在肿瘤治疗技术领域处于国际领先地位的高科技医疗集团。伽玛星医疗集团致力于建设分布全球的连锁肿瘤治疗中心网络和神经外科中心网络。依托领先医疗设备研制技术，为医院提供最先进的肿瘤治疗、神经外科解决方案。,上海伽玛星科技发展有限公司,上海市静安区梅园路228号706室,310108000338564,2004-05-20,朱义文,14000万元人民币,913101087626421730
能贡健康面,诸暨能贡健康管理有限公司,能贡面馆是一家中式面食品牌。能贡面细如发丝，同时每根面条都是中空的，流传于民间已有数百年历史，是有名的传统面食小吃。早在明清时期就以独特工艺和鲜美风味成为贡品。经过数十代人的不断探索和技艺的改进，工艺日趋成熟和完善。贡面馆目前在浙江已开设10于家加盟店，每天去店内就餐的顾客，总是一拨一拨，门厅爆满，独创招牌牛肉拌面，口碑甚好，爽滑筋道的面条，麻辣鲜香的牛肉干是最受追捧的组合。义乌能贡面馆食品管理有限公司以直营、餐饮连锁、半成品加工产业为中心，以双赢共赢为目的，依托互联网产业，大力发展餐饮服务连锁门店+互联网O2O服务平台。,诸暨能贡健康管理有限公司,浙江省诸暨市暨阳街道江东新村40幢1单元201室,,2018-10-24,蔡璐琳,1000万人民币,91330681MA2BG1246E,ngjkm.com
河南先度,河南先度网络科技有限公司,先度科技，移动互联网营销服务商，隶属于河南先度网络科技有限公司。,河南先度网络科技有限公司,郑州市二七区航海中路94号A区D1号楼07号,410104000057354,2012-06-08,袁盎,100万元人民币,91410103597620949U,www.hnxiandu.com
泰德制药,北京泰德制药股份有限公司,泰德制药是一家研发生产和销售系列靶向药物的高科技制药企业。该公司专注于靶向药物的研发、生产和市场推广，生产的脂微球注射液实现国产注射剂出口海外市场，建立有脂微球、脂质体、生物制剂、外用贴剂和固体制剂的高端技术平台。,北京泰德制药股份有限公司,北京市北京经济技术开发区荣京东街8号,110000410102503,1995-05-29,郑翔玲,50000万元人民币,911103026000314683,www.tidepharm.com
东方钽业,宁夏东方钽业股份有限公司,宁夏东方钽业股份有限公司是一家大型稀有金属生产企业，致力于有色金属材料生产与销售等，公司主要从事钽、铌金属及铍合金的冶炼、粉末冶金、人工晶体和制品以及化合物等产品的研究开发和生产。,宁夏东方钽业股份有限公司,,640000000000764,1999-04-30,赵文通,44083.2644万元人民币,916400007106545275
亿进科技,浙江亿进科技有限公司,浙江亿进科技有限公司是一家小型低压电器生产、销售的企业。2009年正式进入互联网，在保持传统业务电器产品生产组装同时，中心业务转向网络游戏研发、推广运营及相关软件开发。以网络游戏开发为主营方向，致力服务于电子商务、网站开发、软件开发、网游开发运营、互联网增值服务等领域。,浙江亿进科技有限公司,乐清市乐成镇乐湖路151号,330382000071971,2009-03-30,陈碎玲,1000万元人民币,91330382686694931H,www.egin.cn
齐家宝,齐家宝支付有限公司,齐家宝是一家专门从事支付工具研发及服务的企业。一直专注于支付工具领域的发展，不断加强自主创新能力，引进国外先进的技术，提供最优质的产品。,齐家宝支付有限公司,贵州省贵安新区电子信息产业园内,520900000039876,2015-07-10,邱振毅,10000万元人民币,915209003470689603
谱蓝,广州潽蓝信息科技有限公司,谱蓝是一站式智能理财平台，自动创建并持续优化投资组合，通过领先的大数据算法和前沿的科技手段，根据客户财务状况，量身定制可执行的全球化资产配置组合，并持续跟踪优化资产配置， 规避风险,广州潽蓝信息科技有限公司,广州市海珠区新港西路135号大院园西区705号楼中大科技园B座部位自编1702、1704、1705、1706、1707房（仅限办公用途）,440106001131164,2015-02-11,张冠英,100万元人民币,9144010633134334XL,www.planplus.cn
Snake电竞俱乐部,上海全竞网络科技有限公司,Snake是一家电子竞技俱乐部，旗下Snake英雄联盟分部于2014年3月组建，2015年8月组建FLFA分部，2016年7月组建守望先锋分部。俱乐部主要从事电竞培训、人才培养以及赛事的参与等，公司参与的赛事主要为英雄联盟等。,上海全竞网络科技有限公司,上海市闵行区东川路555号丙楼1层1136室,310112001709051,2017-01-22,王冶冬,100万元人民币,91310112MA1GBH384M
眸事网,上海脉豪商务信息咨询有限公司,眸事网成立于2016年，是一家大数据人工智能获客平台。与其他大数据营销平台不同，眸事通过线上用户行为数据的采集与标签匹配+线下的互动营销来验证用户需求，做到真正的精准。同时集获客发布平台、智能大数据搜索引擎与互动营销管道功能集于一体，为企业提供一站式定制化大数据营销服务。,上海脉豪商务信息咨询有限公司,上海市静安区江场三路228号207室,310118003050581,2014-10-13,骆艺,50万元人民币,91310118312155693N,www.mso-china.com
哎哟味,清原天丰农业发展有限公司,清原天丰农业发展有限公司是大米生产销售企业。2011年开始，创始人刘达在辽宁抚顺清原县先后包下2500亩地，种植自行培育的水稻品种。连续6年，大米都通过了SGS欧盟认证，193项农残检测无一超标。,清原天丰农业发展有限公司,清原满族自治县清原镇铁北街,210423004518583,2011-12-05,于运华,200万元人民币,91210423587301522C
塑金复合材料,湖北塑金复合材料有限责任公司,塑金复合材料是一家新能源复合材料研发商，主要业务集中于高分子材料产品的开发、设计、加工、制造，并面向笔记本电脑、充电宝等消费电子领域的用户提供锂电池软包铝箔、铝塑复合管用铝带、管用涂胶打孔铝带等产品，已通过ISO9001:2000国际质量体系认证。,湖北塑金复合材料有限责任公司,,421122000030048,2011-08-31,吴立则,1111.111万元人民币,91421122579892553N,www.chinasujin.com
骏配网,杭州世延科技有限公司,“骏配网”是由杭州世延科技有限公司打造的一个互联网+汽车配件的垂直化电商平台。由汽车零配件行业专家和互联网精英强强联合，充分结合了汽车零配件行业与互联网行业的优势，倾力打造一个汽车后市场的专业配件平台，所有零配件产品均采用OEM原产件，保障产品质量，并承诺对配件质量问题提供免费退换货服务；我们已与国内多家物流公司合作，物流体系遍布全国各个角落，让您享受既安全又便捷的购物体验。,杭州世延科技有限公司,浙江省萧山区宁围街道富业巷23号浙江民营企业发展大厦2幢2004室,330181000538997,2015-10-12,孟宏亮,500万元人民币,91330109MA27W1Y27Y,www.jopauto.com
晶讯软件,深圳市晶讯软件通讯技术有限公司,深圳市晶讯软件通讯技术有限公司成立于2003年，多年来主要致力于无线通讯产品的研究与开发，是一家以技术研发为主的开发公司。公司先后被评为深圳市软件企业、深圳市高新技术企业以及中国国家高新技术企业，并通过了CMMI的国际II级资质认证。公司现有数字无线通讯产品（数字无绳电话和数字对讲机等）、智能家居产品、无线音频产品（蓝牙和WIFI耳机和音响等）以及美容美发产品共四大类产品系列，每条产品线均设有独立的软件、硬件及测试部门。公司技术力量雄厚，从业人员经验丰富，研发人员数量占公司员工总人数的75%以上。,深圳市晶讯软件通讯技术有限公司,深圳市南山区学苑大道1001号南山智园A5栋3楼,440301103550097,2003-03-07,宋镭,639.2万元人民币,91440300746634907P
福华股份,东莞市福华健康管理股份有限公司,东莞市福华健康管理股份有限公司是一家健康体检管理专业机构，主营业务是为客户提供健康体检服务，建立健康档案、评估预测健康走向、制定并实施健康计划及健康跟踪管理等服务。,东莞市福华健康管理股份有限公司,东莞市东城区东莞大道19号鼎峰国际广场1栋401-412,441900000913890,2010-10-19,霍锡畴,2913.8998万元人民币,91441900562632069J
eKiss,天津易启时代科技有限公司,天津易启时代科技有限公司，是一家以智能健康产品研发为主的科技创新型企业。开创性的把医疗、生物、电子与生活健康相结合；融合智能检测、生物理疗与互联网信息为一体的解决理念，研发了具有核心技术的多项产品；同时，根据市场需求，发掘具有先进性、前瞻性的智能生物科技产品；打造了健康品牌“eKiss”：包含智能口腔卫士设备、清新抑菌液、口香片和口腔喷雾等口腔健康产品。,天津易启时代科技有限公司,天津滨海高新区华苑产业区兰苑路2号（贰号）3号楼-1-703,120116000542687,2017-03-01,石金,100万人民币,91120116MA05NBF88X
客从何处来,北京安柯道森贸易有限公司,客从何处来是一家创意甜品店，集合日式与西式于一体，主要为用户提供反转分解鱼子柠檬挞、西西里柠檬榛子果蛋糕、开心果柠檬芭芭、薄荷椰奶鸡头米等甜品，在成都、北京等地拥有三家店面。,北京安柯道森贸易有限公司,北京市朝阳区雅成三里19号楼-1至1层03内1层,110105017473213,2014-06-27,刘超,50万元人民币,91110105306404518G
蛙蛙游戏,深圳市金环天朗信息技术服务有限公司,蛙蛙游戏专注于轻度休闲游戏的研发和运营，公司主营业务品牌“蛙蛙游戏”，是跨大陆、香港、台湾和澳门两岸四地的轻度休闲网游社交平台。旗下安卓手机网游“蛙蛙斗地主”、“真人斗地主”、“美女真人麻将馆”、“蛙蛙精品麻将”和“蛙蛙精品掼蛋”等系列。,深圳市金环天朗信息技术服务有限公司,深圳市福田区香蜜湖街道竹子林联泰大厦1501-1503号,440301103026589,2005-06-17,迟海,1000万元人民币,91440300775589201M,www.grmobile.cn
行李侠,上海乐途商务科技有限公司,行李侠是国内首款为旅客提供行李递送服务的APP，隶属于上海乐途商务科技有限公司。,上海乐途商务科技有限公司,浦东新区南汇新城镇芦潮港路1758号1幢A-287室,310115002328218,2014-05-27,陈军,100万元人民币,91310115301442953A,www.letubags.com
龙胤杰建设,四川龙胤杰建设工程有限公司,龙胤杰工程是一家工程施工服务商，主要经营范围是建筑工程、市政公用工程、公路工程、水利水电工程、电力工程、通信工程、机电工程、地基基础工程、电子与智能化工程、消防设施工程、防水防腐保温工程、钢结构工程、建筑装修装饰工程、模板脚手架工程、建筑幕墙工程、古建筑工程、城市及道路照明工程、公路路面工程、公路路基工程、河湖整治工程、输变电工程、环保工程、园林绿化工程、桥梁工程、隧道工程、铁路工程的施工。,四川龙胤杰建设工程有限公司,成都市青羊区顺城大街269号1栋1单元9楼7号,,2018-10-11,束盈,1000万元人民币,91510105MA68DN6X7W
