名字,公司,介绍,公司,地址,身份证,时间,法人,注册金额,编号,网址
青春界公寓,天津市青春界资产管理有限公司,天津市青春界资产管理有限公司是金乐家集团旗下4个子公司之一，主要从事分散式长租公寓运营，公司于2015年7月15日成立，半年来依靠先进的互联网技术已经在天津市河西区、津南区、西青区、河东区、东丽区打造精装公寓500余间，拥有白领租客近700人。,天津市青春界资产管理有限公司,天津市河西区解放南路与浯水道交口西南侧喜年广场6-1201,120103000238833,2015-07-15,李江涛,200万元人民币,911201033410128787,www.young51.com
雨果科技,上海雨果信息科技有限公司,上海雨果信息科技有限公司是一家专业提供各种APP定制开发、技术服务及智能制造移动化解决方案的高科技企业。公司源于美国硅谷，拥有全球移动互联网及物联网开发经验丰富的专业人才和资深管理团队。隶属于上海雨果信息科技有限公司。,上海雨果信息科技有限公司,上海市闵行区莘松路380号206-1室,310112001117766,2011-10-13,李忠蔚,100万元人民币,91310112583466434K,www.ugoodtech.com
邻里邦,广州市时代邻里邦网络科技有限公司,邻里邦APP是一款位于行业前沿的小区生活信息与服务移动应用软件，目前已覆盖全国2000多个小区，可一站式满足用户物业缴费、投诉报修、社区交友、商品购物、智能家居、资产管理、家居装修、家庭出游、社区金融、社区教育等多种生活服务需求，致力于打造舒适优质的社区生活，实现从地产到社区生活服务产业链的延伸，努力为社区用户营造更融洽的邻里关系，提供更高品质的生活，为用户带来更优质的生活体验。,广州市时代邻里邦网络科技有限公司,广州市越秀区东风中路410号自编1205房（仅限办公用途）,440101000297546,2014-09-02,黎燕明,1000万元人民币,914401013046702061,linli580.com
心喜文化,杭州心喜文化发展有限公司,心喜文化是一家音乐厂牌，集音乐、艺人经纪、大型活动、文旅娱乐营销为一体，主要为用户提供版权交易、无线数字领域交易等服务，同时也涉及大型公关及娱乐项目的策划与承接、高端演唱会、以娱乐为题的策展及制作、政府及非营利组织的娱乐营销等方面的服务。,杭州心喜文化发展有限公司,杭州市滨江区长河街道长江路336号5幢410室,330108000318398,2016-12-14,袁涛,1325.2665万元人民币,91330108MA280MJL0K
北京空空科技,北京空空科技有限公司,北京空空科技有限公司是一家手机游戏及娱乐应用开发商，致力于通过互联网技术建立一个提供多方位娱乐服务的平台，旗下产品有基于星座文化的集社交和游戏娱乐为一体的应用《微星座》，用户可以根据星座种类选择交友聊天、享受运势测评等服务。,北京空空科技有限公司,北京市海淀区安宁庄西路9号院25号楼-1层1003室,110108016718526,2014-01-24,刘松,100万元人民币,911101080924457198
云搬家,北京网探网络技术股份有限公司,云搬家是一款跨云盘文件管理软件，利用该软件，用户可以将文件上传到任意网盘上，还可以将任意网盘的文件备份到其他网盘，无需下载也无需使用手机流量，支持Android、iOS等多种智能终端间的互联互通。,北京网探网络技术股份有限公司,北京市海淀区北太平庄路2号21号楼三层306室,110000019473843,2015-07-10,李海波,100万元人民币,911100003483792937,www.imwallet.com
深圳奥林巴斯,奥林巴斯（深圳）工业有限公司,深圳奥林巴斯是一家相机研发商，集研发、设计、生产、销售于一体，其主要产品包括传统相机、数码相机及其相关配件。深圳奥林巴斯成立至今已有超过20年历史，鼎盛时期曾有15000人左右，不仅是奥林巴斯亚太区的总部，也是集团内最大的相机及零部件生产基地之一，当时还在深圳另外设立了分工厂。,奥林巴斯（深圳）工业有限公司,深圳市南山区高新技术产业园北区科技北二路1号,440301503341270,1991-12-04,小松亨,7010万美元,91440300618851974F,www.olympus-global.com
友约,北京联想调频科技有限公司,联想超融合，是利用分布式存储和计算虚拟化技术整合服务器集群、对外提供计算、存储和网络等资源的IT基础架构。联想超融合简化客户的IT基础设施建设、降低硬件配置和管理成本以及基础设施交付成本，同时改善系统平台的可靠性，提供水平扩展的能力，帮助客户大幅度降低各种规模数据中心的复杂性。联想超融合在虚拟化和分布式存储领域有超过十年的技术储备，积累了全球70多项国际技术专利。隶属于北京联想超融合科技有限公司。,北京联想调频科技有限公司,北京市海淀区上地信息产业基地创业路6号4层,110108001248164,2017-01-22,贺志强,1000万元人民币,911101087226020974,www.lenovocloud.com
利八便利店,湖南利八便利店连锁有限公司,利八便利店在全国2-3线城市发展便利店分店，采用“加盟、托管、直营”上方案实行。然后对分店实行统一管理、统一采购、统一配送。,湖南利八便利店连锁有限公司,湖南省湘西土家族苗族自治州龙山县民安街道办事处长沙路下磨盘寨二路27-1号,433130000013770,2015-11-03,田锡江,200万元人民币,91433130MA4L1GHP56,www.liba8.com
优鲜配,江苏海盗软件有限公司,"""助力政府城市智能化进程，提高城市智能化管理水平。让区域农副产品流通，迅速对接全国市场。致力城市食材供应链网络化，实现食品安全管理信息化，提供农副产品的展示、发布、销售等服务。帮扶地方建立农副产品科技创业园区，优鲜配依靠专业的技术实力,先进的技术创新能力和服务社会的价值理念,研发城市智能食材生态链，将把食材供应做到标准化，透明化，把食材溯源技术推广应用到老百姓的餐桌，为实现食品安全标准做贡献。""",江苏海盗软件有限公司,徐州市云龙区绿地世纪城七期LOFT2号楼1-1105,320300000308631,2015-06-11,周新勇,5200万元人民币,9132030034614217XM
膜华材料,苏州膜华材料科技有限公司,膜华科技是一家专门从事微滤、超滤膜的研发与生产应用的高新技术企业，拥有超滤膜、MBR膜及净水器滤芯等多种膜产品。,苏州膜华材料科技有限公司,吴江经济技术开发区柳胥路479号,320584000188305,2008-07-11,杨琴英,4000万元人民币,913205096776421955,www.mohua.com
乐享教室,芜湖奥乐恩教育信息咨询有限公司,"""乐享教室是由芜湖奥乐恩教育信息咨询有限公司打造的教育共享平台，平台专注K12线下培训市场,利用互联网技术通过分时租赁模式实现培训教室的实时共享，帮助采用小班制教学的培训老师降低授课成本，帮助有线下培训需求的学生第一时间找到身边合适的授课老师，实现师生的精准匹配，规范线下培训市场。""",芜湖奥乐恩教育信息咨询有限公司,芜湖市弋江区澛港新区西区社区服务大楼312室,340200000325578,2017-04-20,周新洁,100万元人民币,91340200MA2NJM0J0G,www.all-learn.com
喜得龙,喜得龙（中国）有限公司,喜得龙（中国）有限公司喜得龙（香港）集团有限公司在中国大陆独资成立的集团公司，下辖喜得龙（福建）体育用品有限公司和喜得龙（深圳）服饰有限公司等，中国总部位于中国鞋都—晋江喜得龙工业园。“喜得龙”旅游鞋获得福建名牌产品、福建省著名商标、国家双免检产品（运动鞋、服装）等称号。,喜得龙（中国）有限公司,,350500400009872,2004-04-13,林水盘,39000万港元,913505007593593775,www.xdlong.cn
智树科技,上海智树信息科技有限公司,AtomTree一站式大数据分析服务平台。是以AtomTree Data Hub(简称ADH)企业级Hadoop发行版产品为核心的，支持大数据分析的解决方案、应用、模型、计算、数据、存储等的一站式大数据分析服务平台，该平台也提供大数据分析系统的运营、监测、调优、升级等服务。,上海智树信息科技有限公司,上海市徐汇区漕宝路509号9幢401-15室,310112001412846,2014-08-18,陈诚,500万元人民币,91310104312356487R,www.itreedata.com
能力橙,北京能力橙教育科技有限公司,能力橙是一家K12编程教育提供商，根据不同的年龄阶段定制了个性化培训课程，包含幼儿编程启蒙、机器人编程、少儿创意编程等，通过交互式故事情节、动画、游戏等形式进行教学，致力于培养孩子的逻辑思维能力、激发孩子的创造力。,北京能力橙教育科技有限公司,,110108023583519,2017-06-13,戴小倩,200万元人民币,91110108MA00F7GR0M,www.abcoding.cn
海创药业,成都海创药业有限公司,成都海创药业有限公司（简称：海创药业），是一家致力于药物前沿关键技术创新的高科技企业。由一批拥有世界500强创新药物研发和服务外包管理经验的优秀人才创建。公司坐落于中国西部生命科技产业门户 — 成都高新区“天府生命科技园”，拥有现代化的研发实验室和完善的配套设施。,成都海创药业有限公司,四川省成都市高新区科园南路5号蓉药大厦A栋4层1号,510109000360049,2013-02-05,CHEN Yuanwei(陈元伟),834万元人民币,915101000624182263,www.hinovapharma.com
泽泽通汽车,北京泽泽通汽车租赁有限责任公司,泽泽通汽车租赁成立于2009年，总部设立于北京。拥有国内外各种车型，服务范围遍布北 京、广州、天津、武汉、石家庄等各大城市，是一家覆盖范围广，以高质量服务满足客户各种 用车需求的企业。,北京泽泽通汽车租赁有限责任公司,天津市红桥区小西关青年路85号A座381室,110105011842353,2009-04-15,吕泽琼,1000万元人民币,911101056883953533,www.zezetong.com
萌友圈,糖心（北京）科技有限公司,萌友圈致力于打造一家宠物链条式移动平台服务商。创立私宠定制服务，惠及中高端客户产品即服务需求，将私宠定制服务做好的同时开辟“宠物殡葬”、“宠物医疗”、“宠物寄养”、“宠物洗衣”等服务。,糖心（北京）科技有限公司,北京市朝阳区定福庄西街南口（北花园农工商公司）314室，北京市朝阳区定福庄西街南口(北花园农工商公司)314室,110105020373437,2015-12-11,刘宁,10万元人民币,91110105MA002HAT5C
欧美淘,宁波世纪欧美电子商务有限公司,欧美淘隶属于宁波世纪欧美电子商务有限公司，是一家海外商品跨境网购和海淘网站，主打进口婴幼儿、母婴食品、生活用品等。,宁波世纪欧美电子商务有限公司,浙江省宁波市海曙区集士港镇集仕芯谷2幢302室,330212000396469,2014-05-21,梁天章,1000万元人民币,91330203308968245U,www.omtao.com
美贝家,广州美贝贸易有限公司,广州美贝贸易有限公司是一家医疗技术研发商。公司成立于2015年6月2日，发展至今，已从一个贸易公司发展到拥有强大科研团队、能够自主研发产品的集科研、生产、贸易一体化公司。美贝公司全国独家代理台湾56年历史的厂家品牌产品绮丽美酵素锭，补充人体必需的酵素、维护肠道健康；还有美贝家自主研发、独家拥有的小分子活性肽专利技术：胶原蛋白肽、美肽-18、肽餐营养粉、三瓜肽和牡蛎肽等，不需消化、直接快速以完整的形式100%吸收， 均是效果奇佳、价格亲民、非常适合广大消费者的超级好产品。美贝家——取名灵感源于广州美贝贸易有限公司美贝两个字，美贝顾名思义美丽的宝贝。美贝公司致力于整合最优质的宝贝产品，通过美贝家平台带到千家万户。家是公司的企业文化，弘扬中国国学文化、传统文化、孝道文化，也就是家的文化，通过美贝家平台的打造，让更多的家庭获得健康、美丽、富足和幸福。,广州美贝贸易有限公司,广州市海珠区新港中路艺影街147号1606房之1(仅限办公用途),440106001220559,2015-06-02,曹演鸿,100万元人民币,91440105331479650K,www.meibei333.com
初笋科技,成都初笋科技有限公司,"""成都初笋科技有限公司（Chengdu ChuSun Soft technology co., LTD），于2015年9月，成立于四川成都，主要从事于软件开发，互联网技术与应用等相关的科技公司。成都初笋科技有限公司，目前主要的产品有：微信公众号定制开发，企业电子商务，云服务，商城驱动式消费服务类平台。""",成都初笋科技有限公司,成都高新区世纪城南路599号天府软件园D区6栋505号,510109000640992,2015-09-08,冷治福,500万人民币,91510100350642804H,www.itxiaolaba.cn
贝慧教育,上海贝慧教育科技有限公司,贝慧教育是隶属于上海贝音斯特国际文化交流中心旗下的全国连锁艺术教育品牌，基于贝音斯特在艺术教育领域的巨大优势，得到了众多艺术院校及设计策划公司的支持，为经营者引入更多资源及运营方式。希望艺术教育的目标是打造“艺术家”理念，让孩子在学校能感受到家一样的关爱和理解，通过老师的引导父母在家里创造出像在艺术学校一样的艺术氛围，充分引导和挖掘出孩子的艺术天分，让孩子们都能成为生活的艺术家。,上海贝慧教育科技有限公司,上海市静安区恒通路360号A2301-85室,,2018-02-27,毕然,100万元人民币,91310106MA1FYB104H
搜办,杭州匠人网络科技有限公司,匠人网络于2016年4月正式推出商业不动产资产管理体系——CREAMS。经过近两年的大力推广和市场认证，25个大中城市的地标楼宇均选择了CREAMS；全国已有3820幢写字楼采用CREAMS进行资产管理，管理年租金规模达901亿元，管理楼宇总面积超过1亿方。CREAMS经过多次产品升级和更新迭代，形成了以资产管理为核心的楼宇管理、房源管理、招商管理、租客管理、物业管理、收付款、统计分析、资产评估、权限管理等基础功能，能够帮助楼宇管理人员实现楼宇剖面直观查看、任意组合楼宇信息、一键发布房源、自动生成合同，以及,杭州匠人网络科技有限公司,浙江省杭州市滨江区西兴街道江陵路567号2幢5楼FS50,330108000241628,2015-10-30,项铭,294.4011万元人民币,91330108MA27W5Q431,www.91souban.com
婚礼外办,内蒙古鼎典电子科技有限公司,婚礼外办把让天下人都能办得起婚礼作为使命，为新人打造豪华性价比的婚礼现场。婚礼外办以用户体验为核心，颠覆传统模式，自主研发在线婚礼现场设计解决方案，开发婚庆行业订单可视化综合信息平台。用供应链思维重新定义婚庆行业，以工业化产品的思维做服务，让服务走上生产线。,内蒙古鼎典电子科技有限公司,内蒙古自治区呼和浩特市回民区钢铁路电厂宿舍5号楼4单元7号。,150103000092698,2016-01-19,刘京喆,20万元人民币,91150103MA0MWTC58F,www.weddingoffice.com.cn
平衡新能源,常州平衡新能源科技有限公司,常州平衡新能源科技有限公司是一家新能源汽车动力电池系统研发商，为专注新能源汽车动力电池热管理领域的科技创业公司，公司聚集了多领域的专业化人才，未来几年公司将针对新能源汽车热管理、燃料电池汽车的热换产品的模块化、智能化、节约化的发展方向进行产品聚焦。平衡科技定位于节约化的新能源汽车 & 动力电池的集成产品，公司核心能力在于热系统控制器的集成开发及产品应用，产品主要面向商用车的电池热管理与空调集成、ECC控制模块及其组件、石墨烯发热膜替代热敏陶瓷电池升温技术，以及整车企业提供热管理产品的技术设计服务。,常州平衡新能源科技有限公司,常州西太湖科技产业园兰香路8号10号厂房,320483000657608,2017-11-27,赵磊,1000万元人民币,91320412MA1TC7ERX0,c-etb.com
TURDOVE,上海特豆芙信息科技有限公司,创始团队来自知名互联网公司 行业顶尖时尚技术专家，复合式组合希望能给传统行业带来新的生机和活力。TURDOVE希望打造新的商业化时尚。欢迎优秀人才加入，希望你的能力你的努力都能得到回报和价值成长。,上海特豆芙信息科技有限公司,浦东新区泥城镇云汉路979号2楼,310115003153744,2016-08-29,田静,100万元人民币,91310115MA1H853781,weidian.com
华讯信息,广西华讯信息技术股份有限公司,广西华讯电子商务集团（以下简称“华讯”）是以生物质产业为服务对象，将互联网及现代通讯技术与传统的运营模式紧密结合，为行业全产业链提供市场咨询、行业会展、进出口贸易、电子交易、融投资、物流支持等综合商贸服务的“一站式”行业服务平台。,广西华讯信息技术股份有限公司,,450100200000655,2005-06-13,黄晓东,518万元人民币,9145010377595909XJ,www.sinoinfo.com.cn
天杞园,江苏天杞园网云电子商务有限公司,江苏天杞园网云电子商务有限公司成立于2015年，隶属于红十三资本旗下，拥有万亩枸杞种植基地，整合上中下游枸杞产业链，是中国第一家枸杞新吃法推广者。,江苏天杞园网云电子商务有限公司,,320104000268116,2015-11-06,卢洪波,1562.5万元人民币,91320104MA1MAXFU4T,www.tqy99.com
英华国际旅游,苏州英华国际旅游有限公司,英华国际旅游是一家为用户提供有温度的体验式旅游一站式服务的机构，主要业务是通过线上线下相结合的方式来为用户提供全方位的旅游服务及提供各方面的指导，包含机票和酒店的预定，出境游，国内游，周边游，自由行机加酒套餐等常规旅游业务。,苏州英华国际旅游有限公司,,320594000473907,2015-10-12,张哲,1000万元人民币,91320594MA1M9C49XL
国脉科技,国脉科技股份有限公司,"""国脉科技股份有限公司为专业的第三方电信服务提供商.主要为电信运营商提供电信网络技术服务(包括电信设备系统维护、电信咨询服务和软件业务)及系统集成业务,其中电信网络技术服务为公司的核心业务。""",国脉科技股份有限公司,福州市马尾区江滨东大道116号,350000100002879,2000-12-29,陈学华,100750万元人民币,91350000158173905L,www.guomaitech.com
毒药,北京金影科技有限公司,毒药是一个书影兴趣点评分享平台，提供在线点评图书、影视，分享书单、影单，让用户找到适合自己口味的图书和影视，神人在线点评，及时分享最新优质图书影视信息。,北京金影科技有限公司,北京市海淀区显龙山路19号1幢4层2座422,110108017619431,2014-07-24,韩振东,500万元人民币,911101083066398356,www.duyao001.com
响云电讯,北京响云电讯技术有限公司,北京响云电讯技术有限公司（以下简称响云电讯），是国内领先的综合通信服务提供商，主要向用户提供IDC数据中心、CDN加速、高性能云计算产品。,北京响云电讯技术有限公司,北京市通州区北苑155号2-10幢511B室,110112020186508,2015-11-11,刘光帅,1000万元人民币,91110112MA001UXQ71,www.cachecloud.cn
智讯联创,成都市智讯联创科技有限责任公司,成都市智讯联创科技有限责任公司是一家高速网络数据传输服务商。由某原全军最大研究所有关技术、管理骨干于2014年4月创立，注册现金资本600万元，是成都市武侯区重点支持的电子信息领域的专业化高科技企业之一。公司围绕频谱信号信息感知技术核心，以频谱扫描、信号采集记录、分析处理与综合展示，以及高速网络数据传输为主要专业方向，致力为军队、无委、保密、教考院、安全、公安等行业用户提供电磁频谱感知的相关软硬件产品及系统服务。,成都市智讯联创科技有限责任公司,成都市武侯区武侯新城管委会武青南路33号2层204号,510107000758561,2014-04-28,刘峰,600万元人民币,91510107098313282N,www.wise-signal.com
信儿科技,北京万花童信儿科技有限公司,北京万花童信儿科技有限公司有着多年成功的高端幼儿园直营和国内、国际幼儿园服务经验。身为早期教育从业者，我们时刻记得自己的社会责任之大，也时刻体悟着早期教育的幸福与辛劳，快乐与烦恼。有感于国内长期以来一直缺少一个能够深度而全面地服务于幼儿园、园长及幼儿园教师的专业平台，信儿科技花费巨资打造了全新一代，拥有12大划时代园所服务平台和6大专有智慧体系的“信儿”（更名为“儿童邮局”）儿童成长综合平台。在互联网、云计算、大数据等科技和科技应用不断发展的大时代背景下，信儿科技幼儿园运营专家团队对幼教行业、亲子教育，对家,北京万花童信儿科技有限公司,北京市顺义区天竺空港经济开发区B区融慧园13A楼301-305,110113015784182,2013-04-08,黄曙明,1000万元人民币,9111011306486377X5,www.61post.com
中星科技,广东中星科技股份有限公司,"""公司(广东中星防腐安装工程有限公司)是集科研、生产、工程建设为一体的科技型工程公司。为广东省民营科技企业,具备中国防腐蚀工程施工一级资质和设计资质;具备防腐蚀工程设计和机电设备安装、钢结构制造安装、环保工程等资质;公司通过了IS09001:2000质量管理体系认证和IS014001环境管理体系认证;“中星防腐”为中国自主知名品牌,荣获“2008年度全国防腐蚀行业有特色的优秀企业”称号。公司下设:防腐蚀工程技术研发中心、设计室、防腐公司、安装公司,成都分公司。公司先后承接了多项国家大型投资工程的建设施工及国有""",广东中星科技股份有限公司,韶关市武江区工业东路17号综合旅业楼三层东侧,440200000019511,1997-12-29,张全章,2010万元人民币,91440200727087223F,www.zx92.com
乐活会,深圳市乐活会投资控股有限公司,专注天然健康产品服务、绿色消费乐活新产业【乐活家】享健康 · 快乐活，乐活会员家园； 乐活会机构绿邻里绿社区服务品牌； 专注移动购物，线下实体店体验的天然健康产品生活消费服务；,深圳市乐活会投资控股有限公司,深圳市龙华新区龙悦居二期5栋1320房,440301108588607,2013-12-27,王凤姣,1000万元,91440300068684058L,www.lohaer.com
享7,湖北享七网络科技有限公司,享7是以场景交互及活动植入为核心的互联网餐饮平台，通过平台活动及商家活动增加餐厅与用户之间的交互和粘性。享7致力于为合作餐饮商家提供平台化技术、活动支持、流量、交互等服务，提升合作餐饮商家的品牌度和交易额；同时为平台消费者用户提供物超所值的消费体验，从而解决大型线上平台与中小型餐饮商家之间的空白点。,湖北享七网络科技有限公司,武汉光谷大道光谷总部国际2期时代时代2栋21楼,420100000904783,2017-12-29,李睿,1053万元人民币,91420100MA4KXF2E0F,www.xiang7.net
云图传媒,河南熊猫麦克实业有限公司,云图传媒致力于品牌战略设计，公关咨询传播，媒体运营推广，商业模式研发。隶属于河南熊猫麦克实业有限公司，该公司在南阳地区第一个建立了品牌数据分析中心（BDA），以精确的行业数据为支撑，结合经验丰富的智囊团决策体系，为企业定制专属的品牌战略与媒体公关方案。,河南熊猫麦克实业有限公司,南阳市两相路与回龙路交叉口西南南阳市企业家协会书画院15幢楼101室,411395000001058,2014-05-12,毛静,100万元人民币,914113000998561583,pandamk.com
任达集团,深圳市宝安任达电器实业有限公司,公司简介：,深圳市宝安任达电器实业有限公司,深圳市宝安区石岩街道机荷高速立交北侧、松白公路西侧,440306103499466,1991-04-12,蔡应任,10000万元人民币,91440300X19292365H,www.renda.com.cn
卡团物流,卡团（天津）物流科技有限公司,卡团（天津）物流科技有限公司是创新的互联网+物流公司。公路货运无车承运人、长途货运行业的Uber是对我们的最好描述。卡团通过国内排名前两位的自媒体平台“卡团”公众账号汇聚近10万卡车车主作为运力池的最好储备，通过移动互联网手段将运力整合，为第三方物流企业及生产制造企业的运输需求提供更加高效、更低成本、更为透明的长途干线运输服务。同时，卡团为加盟聚合的卡车车主提供多维度服务来降低他们的运营成本，包括配件及卡车团购，二手车交易信息，法律援助等。,卡团（天津）物流科技有限公司,天津经济技术开发区新城西路52号7-207,120116000434060,2016-02-18,史超,1136.3636万元人民币,91120116MA07K23749,www.ka-tuan.com
