名字,公司,介绍,公司,地址,身份证,时间,法人,注册金额,编号,网址
BlueSmart蓝慧,蓝慧科技（北京）有限公司,BlueSmart是一家为母婴市场提供智能硬件、人工智能设备创业公司。公司致力为未来家庭创造关怀连接器。以帮助年轻一代人用科技更好关爱家人等。BlueSmart隶属于蓝慧科技（北京）有限公司。,蓝慧科技（北京）有限公司,北京市朝阳区酒仙桥北路9号（厂区）10幢二层A5-09,110000450308282,2016-03-16,周登平,200万美元,91110105MA0047CK81,bluesmart.com
浩云科技,浩云科技股份有限公司,"""浩云科技是一家安防整体解决方案提供商,致力于金融行业安全防范产品的研发、生产和系统解决方案，安防工程设计、施工、维护，应用于大型商业银行、股份制商业银行等，以及公安、司法、监狱、教育、交通、边检等领域,，此外还有安防硬件的生产和研发，包括摄像机、显示和存储产品、出入口控制和语音对讲等。""",浩云科技股份有限公司,,440126000005733,2001-03-08,雷洪文,40849.0226万元人民币,914401017268190159,www.haoyuntech.cn
正和药业,吉林省正和药业集团股份有限公司,吉林省正和药业集团股份有限公司是一家中西药研发、制造和销售企业。公司主要业务是中、西药的研发、生产和销售（以中成药为主）。集团公司可生产片剂、胶囊剂、颗粒剂、合剂、糖浆剂、散剂等6大剂型105个品种的药品。公司生产的药品进入国家和省级医保目录的品种共18个。公司生产的药品进入国家基本药物目录的品种共5个。公司生产的药品进入国家低价药品目录的品种共6个。,吉林省正和药业集团股份有限公司,通化市正和路888号,220500400000066,2002-06-13,孟令旭,8400万元人民币,9122050112541184XL,www.zhengheyaoye.com
纽斯郡房地产,上海纽斯郡房地产咨询有限公司,新趋势地产公司是一家新型地产经纪公司。与传统单打独斗的个体经纪不同，新趋势以公司整体服务客户，统一进行市场推广，通过专精于各区域市场的团队之间的紧密协力合作，使房产销售更高效、更专业、更全面、更规范；为客户更好更快买卖房产的同时，更为他们带来前所未有的服务体验。新趋势地产希望通过日益革新的市场与销售创新，以及持之以恒的高标准、高质量的房地产服务规格，推动行业进步。在这个目标的鞭策下，新趋势完成了多项业界史无前例的创举：我们是第一家为客户提供包括专业家居布置等四十项增值服务的地产公司；是第一家为公司团队经纪提供扩充医疗保险的地产公司；是第一家做客户满意度调查且分数接近满分的地产公司。是第一家进行OPEN HOUSE 质量监控的地产公司。新趋势以让客户满意为核心理念，早在2016年公司平台部门就已经开始做售后服务满意度调查。分数一直高居4.85分以上，接近满分5分。2017年四季度完成A轮融资，投资方为IDG资本、小米科技。团队表示，A轮融资资金将用于互联网产品开发、金融业务开拓以及日常运营，并于2018年下半年收购华人温哥华中文购房第一平台----温房网（成立于2012年，立志于做海外第一的中文房地产网络平台，目前致力于服务加拿大温哥华的华人房地产市场。 我们全心全意为海外中文房地产市场服务，业务目前覆盖：新房，二手房，公寓，别墅，联排别墅，土地等交易，将很快拓展到包括土地房产开发，租房，团购等多个领域）。新趋势地产是当前唯一一家结合线上与线下同时开拓温哥华和多伦多市场的华人地产公司，为客户开启了一个跨越加拿大东西部的服务平台。将致力于将这个平台向全球继续扩展，建立一个面向全球华人的国际化地产交易首选平台。,上海纽斯郡房地产咨询有限公司,上海市崇明区港沿镇港沿公路1700号6幢1519室,,2018-11-15,刘宇成,500万美元,91310000MA1K22UT1B,www.johome.com
自然元素,深圳市自然元素农业发展有限公司,"""深圳市自然元素农业科技有限公司成立于2016年2月，位于深圳前海新区，注册资本为500万人民币。由一群富有责任、梦想、具有探索精神的优秀团队创立，公司拥有雄厚的资金实力，先进的管理理念，强大的技术后盾。公司秉承""""创新、实干、发展、共羸""""的经营宗旨，以""""用格局构筑平台，用责任引领行业，用专注落地情怀""""作为发展理念。以""""用良心做良品“作为终身使命。致力于新农业领域的创新与发展。公司前期以其强大的资源整合能力，整合原生态、天然的农产品和农副产品，用匠心精神打造自主的农产品品牌，完善供应链，打通上下游渠道，使每一个""",深圳市自然元素农业发展有限公司,深圳市前海深港合作区前湾一路1号A栋201室（入驻深圳市前海商务秘书有限公司）经营场所:深圳市龙华新区龙华街道清湖社区卫东龙工业区2栋303,440306115166799,2016-02-26,解运泽,500万人民币,91440300360059217N,www.zrysu.com
Unistacks,上海联栈信息科技有限公司,Unistacks是一家面向金融云客户的大数据云服务商，采取运营收益分成的方式为金融云上的客户提供大数据Pass/Saas服务。同时，为了满足特定金融客户需求，帮助其建设私有企业大数据（云）平台。,上海联栈信息科技有限公司,上海市奉贤区青村镇光明东街1号第20幢1031室,310120002703056,2015-03-27,韩启微,670万元人民币,91310120332484099Y,www.unistacks.com
美趣APP,厦门美趣信息科技有限公司,美趣是一家减肥美体方案提供商。主要是针对减肥美体人群，提供一些减肥美体的方案让用户的身材变更好，拥有丰富的瘦身贴士和任务帮助用户逐步达成瘦身目标，而且用户还能够随时把用户的减肥经历记录在美体日记里。,厦门美趣信息科技有限公司,厦门市软件园二期观日路52号401单元A区,350203200440356,2014-04-21,姚博雅,168.7765万元人民币,91350203302984930Q,www.meiquapp.com
镭霆激光,深圳镭霆激光科技有限公司,深圳镭霆激光科技有限公司是国内综合型激光加工系统供应商，公司是集研发、生产、销售及服务为一体科技型企业。公司由我国激光与自动化行业资深专家、资本运营专家和具有丰富投资管理经验的投资专家共同发起成立，现有员工100余人，拥有一支长期从事激光加工系统研发、生产、营销和服务的专业团队。,深圳镭霆激光科技有限公司,深圳市龙岗区坂田街道新雪社区上雪工业城北区8号G栋厂房1楼,440307109199366,2014-04-21,王小兴,500万元人民币,91440300094399699F,www.lightninglaser.cn
张强医生集团,上海张强医疗科技股份有限公司,张强医生集团是一家血管专科医生集团，通过引进AccuVein、Venefit、Vscan等下肢静脉曲张诊疗设备，提供下肢静脉曲张、静脉血栓、下肢动脉硬化闭塞症、颈动脉狭窄症、腹主动脉瘤的诊治。目前该公司将VR场景技术运用到手术中，并根据病人的病情严重程度设计不同时长，依用户反馈和喜好开发不同场景，使病人身体的疼痛和心理的焦虑得到有效缓解。,上海张强医疗科技股份有限公司,中国（上海）自由贸易试验区郭守敬路351号2号楼A639-22室,310115002429379,2014-09-10,张强,598.17万元人民币,91310000312534546G,www.topdoctor100.com
令狐充,广东令狐充科技有限公司,令狐充是一个提供充电桩信息、分享、讨论等功能的平台，专注于电动汽车的充电导向，隶属于广东令狐充科技有限公司。,广东令狐充科技有限公司,中山市火炬开发区会展东路1号德仲广场1幢404室之二,442000001575833,2017-04-21,植治邦,1000万元人民币,91442000MA4WFKU51T,www.linghuchongtech.com
时代怡诺,天津时代怡诺科技股份有限公司,怡诺是一家国内专注于糖尿病移动健康管理的移动互联网高科技企业，成立于2012年9月。公司2013年11月率先获得国家专利授权，并通过了国家食品药品安全监督管理局、工信部的双项认证，推出全球首款“糖友健康管理手机”。,天津时代怡诺科技股份有限公司,北辰区天津医药医疗器械工业园四纬路一号（辰寰星谷孵化器）,120113000147865,2012-09-11,丁治国,3000万元人民币,91120113MA065246X1,www.shidaiyinuo.com
汇新鲜,鲜邻网络科技（上海）有限公司,汇新鲜是一个社区生鲜O2O平台，帮社区百姓购买新鲜实惠生鲜产品的购物平台。,鲜邻网络科技（上海）有限公司,上海市长宁区平武路38号6楼609-8室,310105000491959,2015-07-29,谢常胜,150万元人民币,,hxxapp.com
享玩科技,深圳市享玩科技有限公司,享玩科技是一家AR英语教育产品研发商，主要产品包括AR魔法书、AR英语辅导教材、3D卡通动画等，给3-9岁儿童增加童趣，以3D立体形式呈现并开动儿童的学习能力以及动手能力。同时研发VR旅游系统，可实现720度全景视频观看景区风景。,深圳市享玩科技有限公司,深圳市前海深港合作区前湾一路1号A栋201室（入驻深圳市前海商务秘书有限公司）,440301112707932,2015-04-28,王征,500万元人民币,91440300335267540C,www.arcoloring.com
上海农商银行,上海农村商业银行股份有限公司,上海农商银行是由上海国资控股、总部设在上海的法人银行，是在有着逾50年历史的上海农村信用社基础上整体改制而成的股份制商业银行。以综合的营销手段推动业务发展，以创新的金融产品服务目标客户，以高效的流程管理改善客户体验，全面提升客户服务能力，全力打造服务型银行。,上海农村商业银行股份有限公司,上海市黄浦区中山东二路70号,310000000088142,2005-08-23,冀光恒,800000万元人民币,913100007793473149,www.srcb.com
华材实业,广东华材实业股份有限公司,华材实业是一家低碳能源环保新材料研发商，产品包括热超导陶瓷涂层、石墨烯功能涂层和稀土纳米陶瓷涂层，广泛应用于中石油、中石化、玻璃钢化炉、钢铁、有色及冶金等行业企业。,广东华材实业股份有限公司,,440703000056323,2010-12-01,唐子奉,1000万元人民币,9144070356459406XU,www.wamat.net
金八力,北京金八力教育科技有限公司,金八力（北京）国际教育集团成立于2002年，服务于中国教育服务领域，以“打造高品质的教育智慧传播平台、成为最具国际影响力的教育培训品牌”为发展目标，总部设在北京，经过15年来的不断发展壮大，汇集了一批矢志于幼少儿教育教学研究、儿童智力开发、教育项目推广及教育软件开发的人才。,北京金八力教育科技有限公司,,110108018862463,2015-04-03,赵顺利,1600万元人民币,91110108335568378L,www.jbledu.com
云魂电子商务,云南云魂电子商务有限公司,云魂电子商务是一家专注于从事电子商务、高原特色产品的品牌管理及形象策划的机构，在电子商务的运营和互联网营销上拥有强大的外部资源。,云南云魂电子商务有限公司,,530112000401103,2016-06-27,付文斌,100万元人民币,91530112MA6K6PA6XR
童创童欣,北京童创童欣网络科技股份有限公司,"""公司成立于2009年4月14日,注册资本50万元,隶属于国内一线童装品牌派克兰帝集团旗下,是一家专注于童装批发的专业电商公司,致力于打造一流的中国儿童服装批发电子商务平台。拥有独家授权童装品牌:派克兰帝、BabyMe(贝美依)、加菲猫、MISS SYXTY、咖啡豆、童壹库、李宁童装、探路者童装等;    公司依靠派克兰帝集团一流的设计团队及仓储物流保障,自成立以来,一直致力于童装批发及打造一流的童装网络购物平台。成功的在天猫、淘宝、京东、当当、唯品会、卓越亚马逊等主流电商平台开创了傲人的业绩,经过多年努力,""",北京童创童欣网络科技股份有限公司,北京市大兴区长子营镇企融路1号,110115011836608,2009-04-14,张道安,3000万元人民币,91110115688369198G,paikelanditz.tmall.com
清天金控,清天金控（北京）科技有限公司,清天金控是一家不良资产处置服务提供商。通过简化业务流程，提升资产、资金、信息利用效率，帮助用户解决不良资产非标、债权不清晰、资金方缺乏专业评估和处理能力、以及优质资金方无法对接场外资金方和处置方等痛点。,清天金控（北京）科技有限公司,北京市朝阳区北苑东路19号院1号楼13层（来广营宏源广兴孵化器A588），北京市朝阳区北苑东路19号院1号楼13层(来广营宏源广兴孵化器A588),110105020748957,2016-02-16,刘学兰,500万元人民币,91110105MA003TYM9X
宽正科技,淄博宽正数码网络科技有限公司,宽正科技是教育信息化应用整体解决方案提供商，高新技术企业、双软企业，截止到2015年8月共取得22项软件著作权。形成了平台+应用+教育市场相结合的产品模式，主要产品包括省、市、区县、学校四级标准化部署的基础平台，针对教委、学校、家长的各类应用以及可自由交易的阿拉学产品。经过十二年的努力，宽正科技掌握了大并发量视音频传输的核心技术，直播+互动的教研教学模式。,淄博宽正数码网络科技有限公司,淄博开发区高科技创业园E座427室,370300228057389,2003-12-25,高煜,600万元人民币,913703037574852652,kuanzheng.com
联恒星科技,深圳市联恒星科技有限公司,联恒星科技是一家致力于油田自动化测量技术的研发和产业化的公司。专注于开发数字油田测控装备以及多相流测控技术的研发，该项技术是油气生产物联网的关键技术，将提高石油开采的效率，提升中国石油油气生产物联网建设和应用水平。,深圳市联恒星科技有限公司,深圳市南山区粤海街道科技园北区清华信息港科研楼107H3,440301109896361,2014-07-21,李晓燕,1008.1007万元人民币,91440300311810385X,www.leengstar.com
微美云息,北京微美云息软件有限公司,,北京微美云息软件有限公司,未知,110107019209668,未知,姚招华,515.463917万元人民币,91110107344313561N
华德森,深圳市华德森电子科技有限公司,深圳市华德森电子科技有限公司于2007年10月成立，是一家专业从事数码类CMOS内置摄像模组的开发设计、生产和销售为一体的公司，现公司拥有一流的管理和研发团队。4000平方米全空调动态百级的无尘车间、先进的生产设备、完善的光学与可靠性实验室、以及强大的售后服务技术支持；并通过ISO9001：2008质量管理体系认证。产品主要采用CSP、PLCC、CLCC等生产工艺封装及装配技术。公司具有良好的工作、学习（读书室、培训室、岗位晋升平台）与员工良好生活环境，工业区拥有配套的体育（蓝球、乒乓球、羽毛球等）、娱乐（网吧、歌舞厅）等完备的基础设施。公司以客户要求作为企业之本出发点，以客户满意为准则，不但密切关注客户需求发展变化，把为客户服务的意识贯输到企业经营的每个环节，而且将之转化为企业的产品标准、生产规则和服务行为规范，充分利用ISO9001：2008质理管理体系的管理优势。以确保企业能真正以客户为中心，以优质的产品服务于社会，以优质的产品与服务搏得客户一致认可、好评。,深圳市华德森电子科技有限公司,深圳市光明新区光明街道白花社区第一工业区B10号A栋二层、三(A)层,440306104567366,2010-03-25,王流平,500万人民币,91440300552148492F,www.wdsengroup.com.cn
发现艺术artfaa,北京托普永道广告有限公司,发现艺术是一个您可以授权作品也可以出售原件的平台，如果您选择授权作品，我们会将您的艺术作品生成各种相应产品（如装饰画，手机壳，抱枕，贺卡，钟表，马克杯），如有顾客在平台上选择您的产品，您则可从中获取收益。在此您所需做的仅仅是上传一张作品的高清原图，我们会为您生成效果图以及产品页面。当有订单时，我们将为您制作，包装发货，并支付利润给您。这样您可省下时间，全身心关注于艺术创作。,北京托普永道广告有限公司,北京市朝阳区望京街9号商业楼4层4123,110105014262458,2011-09-20,赵广敏,100万元人民币,91110105582511141A,www.artfaa.com
虹信,武汉虹信技术服务有限责任公司,武汉虹信技术服务有限责任公司（以下简称“虹信服务公司”）为烽火科技集团·武汉邮电科学研究院（WRI）所属的控股公司，企业注册资本1亿元，是国家重点高新技术企业。公司专注于通信网络系统集成、计算机信息系统集成、建筑智能化系统集成、系统维护服务、网络优化服务、运维支撑服务等六大领域，提供咨询、设计、集成和运维的整体解决方案。,武汉虹信技术服务有限责任公司,武汉东湖新技术开发区关东工业园烽火路光通信系统设备及器件生产车间1号4楼,420100000367269,2013-09-29,罗昆初,10000万元人民币,914201000777213088,www.whhxts.com
申安智能,武汉申安智能系统股份有限公司,申安智能是一个工业机器人制造与系统解决方案提供商，通过提供工业机器人、工业自动化以及机器人系统解决方案，并提供安装、调试、售后维护、产品升级等一站式服务，以帮助用户提高劳动生产效率和产品品质，降低人工成本。,武汉申安智能系统股份有限公司,武汉市青山区工人村都市工业园内,420107000015406,1998-01-25,黄勇,1290.9万元人民币,91420107707104989J,www.shen-an.com.cn
天鸟高新技术,江苏天鸟高新技术股份有限公司,江苏天鸟是一家特种纤维材料研发商，主要涉及碳纤维、芳纶纤维、石英纤维等特种纤维的开发及应用，主要为用户提供碳纤维织物、芳纶纤维织物、热结构材料预制件、碳刹车预制件以及高性能碳、碳复合材料等产品，应用于航空、节能减排、新能源等领域。,江苏天鸟高新技术股份有限公司,,320282000082818,1997-01-13,缪云良,3880万元人民币,91320200628408570U,www.jstianniao.com
唐资科技,长沙唐资网络科技有限公司,唐资科技是一家软件外包公司，专注提供软件外包、APP开发、智能硬件开发、O2O平台开发、政企信息化系统、大数据解决方案、物联网等开发外包服务。,长沙唐资网络科技有限公司,,430105000148036,2015-02-03,唐剑波,100万元人民币,91430105329392839E
西游留学,北京悦申网络科技有限公司,西游留学整合了留学行业最资深的顾问群体，运用强大的互联网技术，让客户直接与顾问沟通制定留学申请方案，完成从顾问优选到费用支付的全部工作，并由平台实时管控工作流程。同时，西游留学还将提供全面的境外服务环节，关注留学生群体在境外生活、学术发展和未来职业发展，建立从留学申请、境外学术成长和未来职场规划的完美通道。,北京悦申网络科技有限公司,北京市朝阳区建国路93号院12号楼305号,110105018922858,2015-04-15,任长平,200万元人民币,91110105344231494Y,www.xiyouliuxue.com
天立泰,安徽天立泰科技股份有限公司,安徽天立泰科技股份有限公司成立于2006年2月，注册资金2006万元人民币，经过多年的不懈努力，现已成为一家专业化从事计算机系统集成、智能化、安防的专业咨询、应用软件开发、提供信息化解决方案的高新技术企业。公司拥有建筑智能化设计与施工一体化二级资质、安全技术防范行业资信等级壹级资质、系统集成叁级、声频壹级、ISO9001质量管理体系认证、AAA级信用企业、A级重合同守信用单位和高新技术企业。,安徽天立泰科技股份有限公司,合肥市高新区云飞东路1号,340100000088480,2006-02-09,丁旭东,5657.1万元人民币,913401007849165502,www.ahtelit.com
UCVR游视,深圳游视虚拟现实技术有限公司,深圳游视虚拟现实技术有限公司（简称UCVR，前称为ucglass），成立于2014年11月，专业从事虚拟现实领域硬件研发设计及生产。,深圳游视虚拟现实技术有限公司,深圳市南山区沙河街道沙河西路与茶光路交汇健兴科技大厦C座405,440301111613385,2014-11-07,胡金晖,2000万元人民币,91440300319636377A,www.uc-vr.com
诺飞斯,武汉诺飞斯科技有限公司,"""上海诺飞斯国际物流有限公司成立于2009年12月01日，注册资金500万元人民币，公司坐落于上海，主要经营海上、航空、陆路国际货物运输代理业务,会展会务服务,道路货物运输代理,报关,国际海运辅助业务;销售汽车配件,皮革制品,机电设备,针纺织品,服装鞋帽。 【依法须经批准的项目,经相关部门批准后方可开展经营活动】，上海诺飞斯国际物流有限公司以顾客为中心，以服务为特色；以专业价值追求卓越，创造行业品牌典范，实现价值最大化，回报社会，诚信奉献为企业使命；在上海逐渐树立起公司良好品牌。""",武汉诺飞斯科技有限公司,武昌区中华路57号大成汇孵化器1155室,,2018-11-21,李凤强,500万,91420106MA4K2B1E4Y
万畅汽车,河南万畅汽车销售服务有限公司,集业务汽车销售、金融分期、售后服务为一体的综合性汽车销售服务有限公司。万畅汽车主营华晨金杯品牌的得750系列、小海狮系列、新海狮系列、T30系列、T32系列和上汽依维柯红岩商用车品牌的牵引车、载货车、工程车等；同时公司还提供分期、保险、上牌、二手车置换等业务。,河南万畅汽车销售服务有限公司,,410192000113137,2013-09-25,唐攀攀,1010万元人民币,91410100079419380A
昂迪教育,上海昂迪文化传播有限公司,昂迪教育是一家专注于上海培优市场的校外辅导的机构，本着精英教育的理念，我们结合沪上最优质且稀缺的教育资源，为小学生、中学生提供学科辅导。我们凭借一流的师资队伍、先进的教学服务体系、完善的管理模式，多年来树立了良好的业界口碑，一直占领着校外辅导的高端市场。,上海昂迪文化传播有限公司,上海市金山区枫泾镇环东一路65弄12号2956室,310116002705755,2012-09-24,于祥,20万元人民币,91310116054592603N,www.angdieducation.org
华夏金刚,福建华夏金刚科技股份有限公司,福建华夏金刚科技股份有限公司从事超耐热日用陶瓷、高耐热古建筑陶瓷、超耐热远红外工业陶瓷的研发、生产和销售。公司产品有煲-明火、电磁炉系列、汤煲-酒精加热系列、烧水壶系列、电饭煲系列、瓦片等。公司获得福建省科技型企业、泉州市管理创新示范企业、超高温耐热陶瓷工程技术研究开发中心等荣誉，公司拥有2项发明专利，38项实用新型专利、15项外观设计专利。,福建华夏金刚科技股份有限公司,德化县龙浔镇鹏祥工业区,350526100016250,2009-03-10,林贵基,2616.5464万元人民币,91350526685078328B
江丰实业,广州市江丰实业股份有限公司,江丰实业是国家农业龙头公司。,广州市江丰实业股份有限公司,,440101000019850,1991-01-28,谭钜添,7000万元人民币,91440101191062721G,www.kwangfeng.com
焕维科技,焕维（大连）科技有限公司,焕维(大连)科技有限公司拥有自主研发的深度感知功能 3D 扫描相机，为客户提供从虚拟场景设计、3D建模、VR场景构建，再到产品的最终部署、操作培训等一整套技术支持与行业应用服务。,焕维（大连）科技有限公司,,210202000132394,2017-07-17,张显赫,100万元人民币,91210202MA0UBDKB75,www.kzxia.com
A+直播,西安云景智维科技有限公司,A+直播是一个专注于联接国内学生和海外留学生的高质量内容直播社交平台，以学霸为主播通过直播互动的方式零距离感受世界名校学霸们的学习。,西安云景智维科技有限公司,,610131100183446,2015-02-02,唐皓晨,300万元人民币,9161013132236523X7,www.yunjinginc.com
海南矿业,海南矿业股份有限公司,"""海南矿业股份有限公司主营业务为铁矿石采、选和销售,其所属的石碌铁矿具有50年的开采历史,以富铁矿石储量大、品位高而著称,是我国著名的富铁矿生产基地,被誉为""""亚洲第一富铁矿"""".矿区累计探明铁矿石平均品位46.80%,最高品位68.54%.矿区还赋存氧化铜矿、硫化钴矿等多种矿产资源.主要产品有高炉块矿(甲块、乙块)、铁精矿、粉矿和氯化钴、电积铜等.　　根据中国钢铁工业协会经济运行月报的统计结果，本公司2011、2012和2013年，经济效益综合指数排名均为第一名。公司近年来获得了一系列荣誉，具体包括：2010年""",海南矿业股份有限公司,海南省昌江县石碌镇（海钢办公大楼）,469031000001286,2007-08-22,刘明东,195472.0314万元人民币,914600006651113978,www.hnmining.com
