名字,公司,介绍,公司,地址,身份证,时间,法人,注册金额,编号,网址
江西国化,江西国化实业有限公司,江西国化是国化集团旗下，研发、生产及销售含氟产品的高新技术企业，位于江西省抚州市金溪化工园区。,江西国化实业有限公司,江西省抚州市金溪县香料产业园,361027210003266,2010-06-29,陈红斌,5867.0716万元人民币,9136102755604448XX,groupchem.cn.chemnet.com
圣迪乐村,四川圣迪乐村生态食品股份有限公司,圣迪乐村是一家高品质鸡蛋提供商，致力于蛋鸡育种、营养、商品蛋鸡养殖、蛋品精深加工等领域的全产业链经营，聚焦国内5%高端家庭用户与1%高端工业客户，率先在行业将鸡蛋进行包装化销售、喷码追溯，并对销售渠道进行细化与管理。,四川圣迪乐村生态食品股份有限公司,四川省梓潼县经济技术产业园区圣迪乐村,510725000006126,2003-04-29,冯光德,5041.966万元人民币,915107007496083093,www.sundaily.cn
桑兰特,北京桑兰特科技有限公司,多年来我们专注于质量可靠性领域辛勤耕耘，形成了一整套先进、高效、实用的全寿命周期质量可靠性解决方案，为近百家中国优秀企业提供了各种形式的质量可靠性技术服务，帮助客户以最低的成本、最快的速度提高产品的质量和可靠性，大幅降低产品故障率、降低社会风险，为客户带来巨大的经济价值，同时也为企业培养了大批解决质量可靠性问题的骨干人才。,北京桑兰特科技有限公司,北京市海淀区西直门北大街32号院1号楼8层902,110108008039351,2005-03-15,邵家骏,300万元人民币,91110108773362126N,www.sunlightbj.com
兴奇力,深圳市兴奇力精密模具配件有限公司,"""深圳市兴奇力模具配件公司成立于2005年，是一家专业从事模具配件生产与销售的企业。公司始终坚持“以诚为本，质量第一”的经营理念。经过近多年的努力，公司规模不断扩大,产品销往全国。赢得了广大客户的一致好评，并与他们保持着长期的合作关系。""",深圳市兴奇力精密模具配件有限公司,,440307103513146,2008-07-22,李二毛,100万元人民币,9144030067665301XW,www.qilimoju88.cn
爱哈游,广州爱哈游信息技术有限公司,爱哈游是一个专注打造国内游戏生态，建立垂直游戏交流社区的一个游戏服务平台，主要是服务游戏客户，隶属于广州爱哈游信息技术有限公司。,广州爱哈游信息技术有限公司,广州市天河区科韵路12号之一3A05自编之四室(仅限办公),440106002343776,2018-01-10,王传举,100万元人民币,91440101MA5AP1W245,www.aihayou.com
武汉浩博,武汉浩博国际货运代理有限公司,武汉浩博是一家国际货运物流提供商,武汉浩博国际货运代理有限公司,武汉市东西湖区走马岭街、武汉美安现代物流城第2幢3层137号(13),,2018-04-13,黄宁宁,500万元人民币,91420103MA4KY9EX1X
西安校园微生活,西安众聚力合网络科技有限公司,西安校园微生活于2013年11月筹备创建，是众聚力合网络有限公司最重要的项目。2014年3月1号正式推出上线至今。作为目前已覆盖西安三十九所高校，拥有点对点用户5万人，间接受众几十万学生的校园综合性互联网平台，西安校园微生活的主旨是为学生的学习培训，校园生活，实习求职，社会实践，衣食住行，拓展社交人脉等提供全面服务的综合性平台。我们的目标——服务学生，为商家企业搭建平台，让学生的校园生活日益丰富，社会实践机会增多，在校园生活中得到锻炼，为商家企业解决进入校园市场难、成本高、效率效应低等一系列问题。我们通过个,西安众聚力合网络科技有限公司,西安市高新区新区丈八东路南侧汇鑫IBC第1幢1单元24层12407室,610131100093839,2012-10-29,郭青武,1000万元人民币,91610131051595817D,www.tuanmeidi.cn
德隆股份,江苏苏美达德隆汽车部件股份有限公司,江苏苏美达德隆汽车部件股份有限公司致力于汽车门铰链零件和汽车轮毂（轴承）零件的生产、加工及销售，本着“质量第一、安全生产、持续发展”的宗旨面向广大客户，公司的主要产品有：汽车门铰链精锻件、汽车门铰链机加工成品件以及汽车轮毂（轴承）精锻件、汽车轮毂（轴承）机加工件等，并可针对市场变化和客户需求开发质量可靠的产品。,江苏苏美达德隆汽车部件股份有限公司,南京市六合区雄州工业园高雄路1号,320124000022108,2007-07-10,朱亮,6301.2万元人民币,91320100663757311Q,www.sumec-dl.com
屯社区,深圳市软和区科技有限公司,屯社区是一家智慧社区物联网云平台，专注于从事云停车场、云门禁等系统的研发和应用，旗下APP通过以小区物联网出入口设备为底层架构，来为用户提供社区出入口、基础物业、小区生活及周边商圈等综合服务。,深圳市软和区科技有限公司,深圳市龙华新区龙华街道油松路天汇大厦D栋4楼401室,440301113374131,2015-07-16,王然,1000万元人民币,914403003496154469,www.tunshequ.com
慕咖,北京慕咖科技有限公司,慕咖是一个电子烟品牌。成员有来自阿里巴巴、乐视、有好东西等资深互联网大佬，多次获得IF工业设计大奖的设计师，以及具备全球质量科技代表的苹果生产供应链。,北京慕咖科技有限公司,北京市朝阳区大鲁店文化街16号2幢2层2030,,2018-09-30,李春雪,200万元人民币,91110105MA01EXP38X
吉斯卡,北京快乐智慧科技有限责任公司,北京快乐智慧科技有限责任公司专注于人工智能在儿童领域的研发与应用，目前旗下有一个针对儿童教育娱乐领域的人工智能平台“吉斯卡”。,北京快乐智慧科技有限责任公司,北京市海淀区恩济庄18号院1号楼二层1-2058房间，北京市海淀区知春路113号1号楼7层0805,110108019861068,2015-09-15,莫奇,132.9306万元人民币,91110108358340130L,www.zhixiaole.com
闽太,闽太消防科技股份有限公司,闽太是一家消防器材生产商，该公司的产品包括消防水带、泡沫灭火、气体灭火、消防炮以及相关配件等，具体包括洒水喷头、报警阀、消火栓箱、软管卷盘等，同时公司为用户提供相关技术咨询服务等。,闽太消防科技股份有限公司,福建省南安市仑苍镇美宇阀门工业园,350583100005984,2003-09-08,庄燕红,6019.2万元人民币,913505007531347592,www.mintaicorp.com
炜达科技,炜达科技股份有限公司,"""炜达科技股份有限公司主营业务为电力安装服务、电力抢修维修工程和电力维护与测试工程等专业技术服务。公司的主要产品和服务包括：电力安装服务、电力抢修维修工程、电力维护与测试工程。公司近几年通过优秀的项目获得客户的好评,例如公司2011年1月获得由TCL王牌电器(惠州)有限公司颁发的“合格供应商证书”;公司2012年3月获得中信地产惠州投资有限公司颁发的“优秀合作伙伴奖”;公司2014年获金融街置业有限公司颁发的“优秀合作伙伴奖”;公司2014年、2015年获得深圳市华星光电技术有限公司颁发的“优秀承包商奖”。""",炜达科技股份有限公司,惠州市江北文昌一路7号华贸大厦1单元24层01号,441300000044225,2005-05-27,杨少伟,7000万元人民币,91441300775084078J
芒果网络,呼和浩特市芒果网络服务有限公司,芒果网络是内蒙古较早提供Web开发、品牌体验、应用创新及数字营销的移动互联网整合服务提供商。包括网站建设、移动端H5应用、App 设计开发、品牌数字视觉管理、用户体验咨询 、电子商务到数字营销服务。,呼和浩特市芒果网络服务有限公司,内蒙古呼和浩特市赛罕区昭乌达路心想是城2号楼15层1501室,150105000074899,2013-04-05,张婷婷,100万元人民币,91150105065027140K,www.96649.com
昂林贸烽,北京昂林贸烽科技有限公司,昂林贸烽是一个碳纤维超轻超薄材料研发商，旗下主要产品涵盖碳纤维预浸料、碳纤维平纹编织布、碳纤维预浸料等；主要应用于工业制造、轨道交通、船舶游艇、高端体育休闲用品等领域。,北京昂林贸烽科技有限公司,北京市海淀区农大南路88号1号楼B1-655,110302017141665,2014-05-04,于亮,4545万元人民币,91110108099065380D,www.onlytoptech.com
毕昇云,毕昇云（武汉）信息技术有限公司,毕昇云是一家智慧城市服务商，是一家以数字化工程与计算机仿真技术、智慧城市信息技术为核心的信息系统集成企业。公司以信息系统集成项目为载体，承载智慧街道、智慧医疗、智慧法院、智慧校园等软件研发，逐步形成了自主的核心竞争力，公司有专门的软件研发中心。公司业务覆盖智慧街道、智慧法院、智能交通、智慧校园、智慧园区、智能大厦等行业。公司自主研发的智慧街道平台领先于同行业，智慧街道平台包含红色物业、智慧养老、智慧环卫、阳光信访、智慧精准扶贫、智慧党建、OA协同办公、微街道等，结合公司多年的系统集成经验，形成了一套街道、社区两级单位上下互通的智慧管理模式。,毕昇云（武汉）信息技术有限公司,武汉市江汉区江汉经济开发区江兴路25号A栋新金科技企业孵化器A903-906室,,2018-04-11,赵昕,5000万元人民币,91420103MA4KY8F64X,bisicloud.com
正邦科技,江西正邦科技股份有限公司,正邦集团成立于1996年，是农业产业化国家重点龙头企业，拥有博士后科研工作站，旗下正邦科技于2007年在深交所上市。集团下有农牧、种植、金融、物流四大产业集团，以种猪育种、商品猪养殖、种鸭繁育、农作物优良新品种选育、肉食品加工、饲料、兽药、生物农药、芳樟种植及芳樟产品加工、油茶种植及油茶产品加工、大米加工、相关产品的销售与技术服务以及基于农业产业链的贷款、担保、融资租赁、资产管理为主营业务。,江西正邦科技股份有限公司,,360000511000013,1996-09-26,程凡贵,236387.0773万元人民币,913600006124405335,www.zhengbang.com
普冉半导体,普冉半导体（上海）有限公司,普冉半导体是一家无自有晶圆厂半导体研发商，专注于消费类、工业控制和汽车电子集成电路芯片的设计、销售，产品包括非易失性中小容量存储器、高安全存储器、无刷直流风机以及高性能磁传感芯片，广泛应用于智能电网、汽车前装、工业控制等领域。,普冉半导体（上海）有限公司,,310141000254616,2016-01-04,王楠,2000万元人民币,91310000MA1K35P57Y,www.puyasemi.com
淘颜,岩火科技（杭州）有限公司,淘颜是款与众不同的AR视频聊天软件，随时随地体验趣味的交友方式，内置丰富的可爱、动态头像可以选择。,岩火科技（杭州）有限公司,浙江省杭州市上城区东铁大厦1109室,,2018-02-02,曾雷,100万元人民币,91330106MA2B0NXL5K,www.firerock.tech
新科电器,北京新科电器有限公司,新科电器是一家家用电子设备制造及提供商。,北京新科电器有限公司,北京市昌平区沙河镇于辛庄村西临1号A座5003室,110114016980614,2014-04-01,张印林,888万元人民币,911101140969620436
岚煜生物,南京岚煜生物科技有限公司,南京岚煜生物科技有限公司是一家致力于体外诊断试剂、仪器的研发、生产和销售的生物公司，公司的核心研发团队均来自国内外知名科研机构及生物医药公司，建立了基于主动式微流控技术和智能化仪器平台开发的免疫、分子、细胞学等多种方法学平台集成一体化检验系统的精准医疗体系。岚煜生物以国际领先的技术要求，取得CE和ISO13485质量体系认证，建立起了占地7500平方米的研发基地，其中拥有2400平方米GMP标准的无菌净化生产车间。岚煜始终秉持创新，致力突破，坚持从技术源头开始研发，现已构建好国际领先水平的主动式微流控技术平台，在此基础上，开发了激光诱导的荧光检测、化学发光、电化学检测、分子诊断等产品线。,南京岚煜生物科技有限公司,南京市江宁区科学园乾德路2号,320121000542022,2016-10-19,许行尚,189.4725万元人民币,91320115MA1MXCYR9K,www.lansionbio.com
金印联,北京金印联国际供应链管理股份有限公司,"""公司是一家专注于为印刷企业提供高品质的印刷材料和服务的综合解决方案提供商。经过十多年的发展,公司秉承为客户提供全程专业化服务,以服务拓展销售,“专业服务创造印艺价值”的经营理念,不断发展壮大,在国内胶版印刷材料市场已具有一定影响力,特别是在华北地区中高端印刷领域,赢得了众多大中型印刷企业的认可。公司主要向下游印刷企业销售水性光油、胶印油墨、专色墨、进口白卡纸及与印刷相关的辅助材料橡皮布、润版液等。公司以上产品主要采自国际知名厂商,结合公司在印刷领域的多年经验及专业服务,为下游客户提供与印前、印刷、印后整个印""",北京金印联国际供应链管理股份有限公司,北京市海淀区中关村南大街甲56号B座701室,110108005139719,1998-09-07,徐天平,940万元人民币,91110108633708906M,www.jinyinlian.com
笨鸟影视,西安笨鸟影视文化传播有限公司,西安笨鸟影视文化传播有限公司主营手机游戏开发，影视剧及动画片制作等。,西安笨鸟影视文化传播有限公司,西安经济技术开发区凤城八路158号风景御园16幢2单元20801室,610132100129825,2016-01-11,刘曜维,500万元人民币,91610132MA6TXEK34W
美啦美啦,美啦美啦（北京）科技有限公司,美啦美啦是一家专注为品牌主提供60秒和120秒“短视频原生广告”全案服务的公司，致力于建设一支以“内容创意+技术快手“为核心产品的短视频团队，为客户提供短视频服务。,美啦美啦（北京）科技有限公司,北京市朝阳区酒仙桥北路9号（厂区）10幢二层B5-01，北京市海淀区海淀大街27号1-4层部分3层3-132,110108020998492,2016-04-12,丁晓东,300万元人民币,91110108MA004NTB6R
娘笑笑,江西省纯然实业有限公司,江西纯然实业有限公司是一家养生膏规整化食疗研发商。公司致力打造呵护女性健康全方位调理品牌,江西省纯然实业有限公司,江西省南昌市东湖区福州路309号智通广场1#商业楼1901室(第19层),360102210079042,2015-12-14,陈娟,500万元人民币,91360102MA35FULW6D,www.niangxiaoxiao.com
福建超大集团,福建超大集团有限公司,福建超大集团是国家级农产业化重点龙头企业。超大集团以“走绿色道路，创生态文明”为经营理念，致力于绿色农产业综合开发，包括果蔬良种繁育、绿色农业生产资料开发，绿色农产品基地建设、绿色有机农产品生产与加工、农产品营销网络拓展，成功构建起一条“从土地到餐桌”、自成品牌“绿色生态产业链”。目前，集团已在全国19个省（市、自治区）建立40多个优质农产品生产基地，全面推广应用绿色有机栽培模式、规模化生产蔬菜、水果、茶叶、食用菌等特色农产品。,福建超大集团有限公司,福州市鼓楼区铜盘路29星愿广场3楼A区,350000100008051,1998-02-24,郭浩,2300万元人民币,91350000158177535X,www.chaoda.com
红娘网,合肥红心娘网络婚恋服务科技有限公司,红娘网通过先进的互联网技术和体贴客户的服务帮助寻觅理想伴侣的朋友找到属于自己的情缘，并且在红娘网的社区内自由地交流和沟通。每一位网友可以通过查询功能方便的浏览注册登记会员的资料，包括照片、个人情况和理想对象的介绍。网友还可以通过新加入会员查询、用户名查询、地区查询、婚恋情况查询和收入查询以及不同条件设置的高级搜索功能方便地查找到自己心仪的对象。,合肥红心娘网络婚恋服务科技有限公司,安徽省合肥市瑶海区濉溪路嘉华中心B楼703室,340100000659187,2012-05-30,代健镪,50万元,91340100597093376A,www.7651.com
星环科技,星环信息科技（上海）有限公司,星环科技致力于Hadoop之上的高效计算引擎和数据分析算法的研发。作为一家大数据基础平台产品供应商，星环科技提供一站式的Hadoop商业发行版产品，以及Hadoop之上的分布式分析型数据库、数据挖掘／机器学习工具、NoSQL数据库以及实时流式计算引擎等产品。星环科技同时也提供基于Docker的容器云操作系统（Transwarp Operating System），是大数据和云计算融合的产品，2016年推出了超融合一体机硬件产品。业务模式以产品销售为主。,星环信息科技（上海）有限公司,上海市徐汇区虹漕路88号B栋11-12楼,310104000546962,2013-06-05,孙元浩,6806.7566万元人民币,913101040693974723,www.transwarp.io
易分享科技,深圳易分享科技有限公司,深圳易分享科技有限公司是一家专注移动互联领域的科技公司，愿景通过移动互联让生活和工作更美好。,深圳易分享科技有限公司,深圳市南山区桃源街道平山一路世外桃源创意园C栋301,440301108626297,2014-01-03,丁锦添,1000万元人民币,914403000879685584,www.yisharing.com
米鹰社,杭州米鹰科技有限公司,"""Mission: To foster our students' English communication skills across China using our customised curriculum design, enriching their personal development and propelling their aspirations for a passionate future everywhere in the world.""",杭州米鹰科技有限公司,,330184000480233,2016-06-07,陈海文,100万元人民币,91330110MA27XUD60X,www.yiyaabc.com
球小栈,上海酷多信息技术有限公司,上海酷多信息技术有限公司为闪酷信息技术(上海)有限公司旗下全资子公司，专注于IT技术解决方案，依据多年成功实施电商项目经验，协助传统品牌企业轻松拓展电商销售渠道，从而使品牌企业更容易、更轻松实施全网电商。,上海酷多信息技术有限公司,上海市崇明区庙镇宏海公路98号8595室（上海庙镇经济开发区）,310230001155857,2017-01-19,卢文隆,1125万元人民币,91310230MA1JY12E1Q,www.qiuxiaozhan.com
美凯电子,深圳美凯电子股份有限公司,美凯电子是一家开关电源变压器研发商，专注于从事电子元器件的研发与设计，旗下主要产品包括电子变压器、电源滤波器、电感器及开关电源等，广泛应用于高端视听、信息技术、通讯、汽车等领域。,深圳美凯电子股份有限公司,,440301501128032,2003-06-17,郭冰,7260万元人民币,91440300748881442J,www.meikai-cn.com
科立视,科立视材料科技有限公司,"""科立视材料科技有限公司（KMTC?）成立于2011年，是华映科技集团（股份）有限公司（CPTTG）的子公司，是国内较早利用溢流法工艺生产高铝硅酸盐玻璃的厂商，同时也是全世界屈指可数拥有高铝玻璃基础配方优势往下游整合至3D盖板玻璃加工的厂商。KMTC汇聚了一支拥有数十年显示技术、触控器件产品和高科技材料经验的管理和技术团队，作为国家重点规划产业投资发展项目，KMTC开创了触控显示行业的新篇章。KMTC技术是许多消费类和工业应用的理想之选，应用范围涵盖智慧手机、平板电脑、笔记本电脑、电子手表、POS机、大型触控显示设备，如ATM, 自助值机台、医疗照护设备以及白色家电等。""",科立视材料科技有限公司,福建省福州市马尾区开发区儒江西路12号,350000400003813,2011-08-04,陈伟,39708.7万美元,913500005792794175,www.kornerstonematerials.com
爽快官方海外旗舰店,上海爽快电子商务有限公司,“爽快天猫旗舰店”是日本“爽快药妆”在中国开设的面向中国用户的,上海爽快电子商务有限公司,中国（上海）自由贸易试验区基隆路1号汤臣国际贸易大楼701-2室,310000400667184,2011-11-10,叶健佑,1600万美元,91310000585212518M,www.pinstore.cn
普江科技,杭州普江科技有限公司,是一家专业从事物联网的高科技企业，是浙江条码应用协会的理事单位。公司围绕互联网+，移动物联和条码/RFID自动识别，涵盖应用集成咨询、软件服务、产品增值服务、自主物联产品研发等业务。为供应链管理、质量和安全追溯、智能零售、智慧工厂、现代物流、政府、医疗等领域提供一站式整体解决方案。,杭州普江科技有限公司,浙江省杭州市西湖区文一西路857号2幢265室,330106000109255,2009-10-15,钱斌军,505万元人民币,91330106694584425F,www.hzpuj.com
甘肃银行,甘肃银行股份有限公司,甘肃银行股份有限公司是中国甘肃省唯一一家省级法人城市商业银行。甘肃银行是一家股份制商业银行，以甘肃地区地方经济和三农用户为主，为中小企业和个人用户提供储蓄、转账汇款、融资贷款、理财等服务，并且针对三农用户提供特色借贷服务。公司开设了手机银行、直销银行以及企业交易电子商务平台“珑银商务”。,甘肃银行股份有限公司,甘肃省兰州市城关区甘南路122号,620000000017803,2011-11-18,刘青,1006979.133万元人民币,91620000585910383X,www.gsbankmall.com
巴帝食品,广西桂平市巴帝食品有限责任公司,广西桂平市巴帝食品有限责任公司专业生产和销售各类焦糖色，产品市场遍布全国各地，广泛适用于现在市场上的各个酱油、醋、黄酒、葡萄酒、可乐饮料、止咳糖浆、面包、方便面调味包等各个产品的调色增色。,广西桂平市巴帝食品有限责任公司,广西桂平市长安工业园区（寻旺乡西南村１队）,450881200000368,2007-07-26,沈建西,2334万元人民币,91450881MA5KBX3B36,shop1930978.yellowurl.cn
磨浆农业,云南磨浆农业股份有限公司,磨浆农业是一家主要致力于核桃基地的培育及核桃系列产品的开发与生产。云南磨浆农业股份有限公司成立于2013年11月，云南磨浆农业股份有限公司核桃深加工项目于2014年1月10日在玉溪市易门县龙泉镇曾所食品工业园区投资6000万元，并正式动工。2014年9月19日工厂正式开业投产。云南磨浆农业股份有限公司主营零添加剂磨浆核桃乳、5A磨浆核桃乳、 3A磨浆核桃乳、利乐包磨浆核桃乳、磨浆杏仁核桃乳、磨浆核桃花生乳、磨浆儿童核桃乳等10多个系列产品。,云南磨浆农业股份有限公司,,530425100005002,2013-11-11,周锋,4000万元人民币,915304250804473034,www.ynmjny.com
安洁士,安洁士环保（上海）股份有限公司,安洁士是一家水处理服务提供商，公司专注于从事各种污水处理、市政供水深度膜处理、三次采油工艺技术等，包括油田生产污水处理、压裂返排液处理、油气田废弃物综合处理等，同时公司为用户提供方案设计、技术咨询等解决方案。,安洁士环保（上海）股份有限公司,中国（上海）自由贸易试验区亮秀路112号A座402室,310115001120776,2009-04-07,阮安源,7744.5万元人民币,91310000687359115H,www.aegis-env.com
自然禅,添之乐文化传播（上海）有限公司,自然禅是一个旅游定制平台，为客户提供旅游路线定制等服务。,添之乐文化传播（上海）有限公司,,310115002804478,2015-09-01,汪德军,200万元人民币,91310115350756094Y,www.ziranchan.net
吉安达,北京吉安达仪器设备有限公司,北京吉安达仪器设备有限公司是美国 G&R Technology Inc.在中国大陆地区的总代理商，主要销售G&R品牌的便携硬度仪。,北京吉安达仪器设备有限公司,北京市丰台区西四环南路8-1号1幢1010室,110108004905073,1998-08-06,吴绍志,50万元人民币,91110108634330714E,www.bjjianda.com.cn
HiRead英文原版阅读,北京语响科技有限公司,HiRead英文原版阅读是一家少儿英语在线阅读平台，专注于为5-14岁的儿童提供英文原版精读课程，基于原版阅读的课程体系匹配美国课标CCSS，形成一套体系化的阅读，并最终不断强化和提高学生的认知以及深度学习和思考的能力。,北京语响科技有限公司,,110108024175615,2017-09-25,郑婷婷,119.8753万元人民币,91110108MA017RPY7Y,www.hiread.cn
