名字,公司,介绍,公司,地址,身份证,时间,法人,注册金额,编号,网址
芝麻音乐,上海婉转信息技术有限公司,芝麻音乐是一款让音乐像软文一样授权给企业传播使用的互联网应用。它是一个原创音乐传播，拥有原汁原味的原创音乐，音乐人社区。其次它是有很多的，互动乐趣的歌唱赛、K歌房、K歌榜活动，再者它是企业的文化和试用品、优惠券的派送载体，三位一体、三方全赢的音乐社交，营销宝典，网站+APP。,上海婉转信息技术有限公司,中国（上海）自由贸易试验区浦电路57号3层8374室,310141000313404,2016-01-01,赖远生,20万元人民币,91310115MA1K3DC99H,www.saiyapp.com
华映科技,华映科技（集团）股份有限公司,华映科技(集团)股份有限公司是一家专门从事新型平板显示器件、液晶显示屏、模组及零部件的研发、设计、生产、销售和售后服务的公司.公司目前主要专门从事液晶模组的加工、制造及相关售后服务。,华映科技（集团）股份有限公司,福州市马尾区儒江西路6号，福州市马尾区儒江西路6号1#楼第三、四层,350000100015427,1995-05-25,林盛昌,276603.2803万元人民币,913500001581472218,www.cpttg.com
梦瑞文化,吉安市梦瑞文化传播有限公司,梦瑞文化是吉安市中石化加油站媒体的独家代理商，现在公司运营吉安约200座加油站媒体资源，覆盖吉安市区、吉安县、吉水县、永丰县、安福县、井冈山市、泰和县、永新县等地区黄金地段加油站媒体，达到全市、县无盲点覆盖。拥有受众目标精准、到达率高、广告互动性强、网络覆盖性大等得天独厚的优势。致力于为客户过滤受众目标，锁定目标群体，实现精准传播，提高有效到达率。,吉安市梦瑞文化传播有限公司,,360802210031934,2015-01-16,刘荆辉,100万元人民币,91360802327625424G
候鸟科技,候鸟跨境科技（深圳）有限公司,候鸟跨境科技（深圳）有限公司是一家位于深圳市南山区的高新技术型企业，专注于为用户提供跨境保税供应链等一站式解决方案。我们精心打造集海外采购、品牌引进、保税仓储、国际货运、以及运营平台于一体的综合性平台，致力于为全球商家及消费者提供专业、完整、高效的跨境贸易综合性服务。,候鸟跨境科技（深圳）有限公司,深圳市前海深港合作区前湾一路1号A栋201室（入驻深圳市前海商务秘书有限公司）经营场所：深圳市南山区塘岭路1号金骐智谷2002室，深圳市前海深港合作区前湾一路1号A栋201室（入驻深圳市前海商务秘书有限公司）经营场所：深圳市南山区塘岭路1号金骐智谷1811室,440301114999665,2016-01-25,何理刚,5000万元人民币,9144030035979306X0,www.houniao360.com
伊库伊库,上海伊库伊库网络科技有限公司,上海伊库伊库网络科技有限公司是一家软件开发商，成立于2013年。正在打造的一款移动交友产品全面主要面向 iOS 和 Android 用户，目标市场涵盖国内外，曾被多家知名国际媒体报道和推荐，并登顶多国畅销软件排行榜顶端。目前产品短期内已积累了百万级别用户量，并取得营收。,上海伊库伊库网络科技有限公司,上海市徐汇区漕宝路509号9幢101-41室,310104000547205,2013-06-06,刘婷婷,1000万元人民币,91310104071161813F
巨米智能,广州巨米智能设备有限公司,巨米智能是一个无人售货机的智能化与数据化运营服务商，专注于通过智能贩卖机、微信咖啡机、嵌入式智能互动广告机等物联设备开发、生产、营销，覆盖地铁、写字楼、餐饮连锁等场所，致力于以物联网方式，连接消费者互动的生活圈。,广州巨米智能设备有限公司,上海市徐汇区中山南二路107号1幢8层I单元,440112000071679,2011-12-31,朱林海,1183.33万元人民币,914401115876445175,www.jumi-ai.com
名都置业,西安名都置业有限公司,名都置业是一家集房地产咨询、开发、销售于一体的房地产公司。致力于提供房地产综合开发经营及配套服务;房地产营销策划;建筑材料(除木材）新技术开发、服务;房屋租赁等。,西安名都置业有限公司,西安经济技术开发区凤城八路,610132100010539,2007-03-14,莫剑荣,3000万元人民币,91610132797465963D
华育恒通,天津市华育恒通科技发展有限公司,天津华育恒通科技有限公司是一家致力于研究最新计算机软件开发技术、软件架构、智能手机开发技术、3D展示平台、游戏设计与开发的高科技企业，专注于给IT行业提供综合技术解决方案，包括技术架构设计，项目结构搭建，人员输送，行业信息化解决方案设计等综合业务。,天津市华育恒通科技发展有限公司,天津市河北区昆纬路与东七经路交口西北侧河北新闻大厦附楼五楼508-1室,120105000114616,2013-05-29,李婉秋,100万元人民币,91120105069868326N
纳恩博Ninebo,纳恩博（天津）科技有限公司,Ninebot纳恩博（此前叫风行者）是一个自平衡车及短途代步工具，由纳恩博(天津)科技有限公司开发者，提供集生产、销售、服务于一体的智能代步设备运营服务。  Segway-Ninebot（中文名：赛格威-纳恩博）是全球智能短交通和服务类机器人领域的创新企业。公司以国际化视野立足全球市场，专注于引领智能短交通和服务类机器人产品的创新和变革。  目前，Segway-Ninebot公司旗下拥有四大核心自主品牌：产品品牌Segway和Ninebot，机器人品牌Segway Robotics，服务品牌Segway Discovery，以及技术赋能品牌Segway Inside和定制化品牌Powered by Segway，在智能短交通和机器人两大领域不断发力，以创新技术研发生产具有未来科技体验的产品，持续引领着行业的发展,纳恩博（天津）科技有限公司,天津市武清区汽车产业园天瑞路3号14幢,120222000187701,2013-06-20,高禄峰,2000万元人民币,911202220698929915,www.ninebot.com
萌奇文化,深圳市萌奇文化发展有限公司,深圳市萌奇文化发展有限公司是国内领先的文化衍生品综合服务商，长期致力于对文化品牌和产品的解读及研发，从品牌授权策划与管理、衍生品开发，到市场渠道营销，为客户提供一站式的专业品牌服务。,深圳市萌奇文化发展有限公司,深圳市南山区沙河街道侨城东路99号产业楼一层101-104,440301106965430,2013-03-15,蔡志平,206.1856万元人民币,9144030006386819X3,www.mekiculture.com
剑门旅游,剑门关华侨城旅游开发股份有限公司,剑门关旅游开发股份有限公司的主营业务为旅游资源的开发经营，通过对剑门关景区景点的开发，为游客提供旅游服务，包括索道观光、观光车等服务。公司主要服务为索道业务、观光车业务、游客体验类业务、景区讲解业务。,剑门关华侨城旅游开发股份有限公司,四川省广元市剑阁县下寺镇龙江大道22号剑门大厦16楼,510823000008853,2003-07-19,刘国旌,25000万元人民币,91510823752311442T,www.zgjmly.com
广州齐达材料,广州齐达材料科技有限公司,广州齐达材料科技有限公司是全球大型的声磁防盗产品制造商，2006年在中国广州科学城创立，拥有十多年的专业声磁防盗产品制造经验，是全球唯一拥有声磁防盗完整产业链，产品覆盖高性能新材料、防盗芯片、核心组件及最终产品的先进生产型企业。,广州齐达材料科技有限公司,广州高新技术产业开发区科学城南翔三路52号自编厂房二1-3层,440108000012165,2006-07-10,王志远,2000万元人民币,914401167910095101,www.gzqida-tech.com.cn
奥德加德,深圳市奥德加德咨询有限公司,专注互联网，移动互联网，DT大数据处理,深圳市奥德加德咨询有限公司,深圳市宝安区西乡街道西乡臣田宝民二路伟信达大厦808室,440301114134336,2015-10-19,王漫江,100万元,9144030035910958XL,www.aodjd.cn
闪电蟹,烟台京喜食品科技有限公司,“闪电蟹”专注于即食休闲食品的研发与创新营销。“闪电蟹”系列产品，是由专业产品设计师会同资深研发团队精选原产地新鲜食材，并根据食材的特性，再配以优质香辛料，精心打造的麻辣鲜香、各具特色的休闲食品。目前共有19款产品投放市场。,烟台京喜食品科技有限公司,山东省烟台市芝罘区冰轮路7号,370602200194231,2015-03-30,徐欣,100万,91370602334630109R,www.l-crab.com
车杰约玩,武汉车杰企业咨询服务有限公司,"""车杰约玩是一款由武汉车杰企业咨询服务有限公司所开发的线上游戏娱乐技能交友平台。车杰约玩整合约玩圈内资源,引入时下潮流玩法,打造个全新、有趣、规范的线上游戏约玩、娱乐体验平台,平台涵盖手机APP,PC端,手机网页等多个平台。车杰约玩旨在为互联网爱好者提供个有趣、潮流安全的技能交友平台,提供绝地求生、英雄联盟、王者荣耀和DTA2等游戏陪玩,包含视频互动、语音聊天、线上唱歌,哄睡觉,Morning CALL等多元化的网络生活方式,还有化妆指导,心理咨询等专业线上服务。""",武汉车杰企业咨询服务有限公司,"""武汉东湖新技术开发区华师园北路18号博瀚科技光电子信息产业基地二期2幢A单元7层7号房(入驻武汉众成众享商务秘书服务有限公司,托管号:ZCZX-0063)""",,2018-09-14,杜雨繁,500万,91420100MA4L0QTF1Y,ceje8.com
oplink,珠海保税区光联通讯技术有限公司,oplink是光通信组件、智能模块和子系统的领先供应商。该公司为全球领先和新兴的网络设备制造商提供综合设计和制造解决方案，服务于地铁和长途传输、无线交通运输，数据中心网络和有线电视的多个可寻址基础设施市场。,珠海保税区光联通讯技术有限公司,珠海市保税区联峰路5号,440400400021139,2000-06-06,CHIA-HSIANG LEE,1900万美元,91440400714730961K,www.oplink.com
亿贝卡教育,郑州亿贝卡教育信息咨询有限公司,亿贝卡教育是一家0-12岁教育产品开发服务商。旨在为3-12岁的孩子提供纯英教学的幼儿英语、少儿英语，采用国内顶级多媒体设备及培生BIG系列教材，全程支持教学互动，在全浸入式英语环境中，激发孩子的英语学习兴趣，英语如母语般运用自如。秉承因材施教的教育理论、顺应孩子天性，以快乐为源泉、以语言为媒介，培养国际化思维与视野，打通孩子连接世界的桥梁。,郑州亿贝卡教育信息咨询有限公司,郑州高新技术产业开发区瑞达路39号3-03号铺,,2018-05-11,魏巍,100万元人民币,91410100MA457WH29F,ybckid.com
味游科技,成都味游科技有限公司,在那山的那边海的那边有这样一群人，,成都味游科技有限公司,中国（四川）自由贸易试验区成都高新区吉泰五路88号2栋41层10号,510109000666215,2015-10-29,肖雄,2000万元人民币,91510100MA61RB2F18,www.weiyoums.com
正多科技,吉林正多科技股份有限公司,吉林正多科技股份有限公司主要业务为汽车塑料零部件的研发、生产和销售，主要产品为各种汽车塑料零部件，共分为十大类别75种，主要应用于迈腾、速腾、奔腾、奥迪、华晨中华、宝来、捷达、高尔夫、沃尔沃、福特、长安、宝马等车型。,吉林正多科技股份有限公司,长春九台经济开发区卡伦工业园纬十路009号,220108020003979,2004-09-17,吴刚,4000万元人民币,91220181756199953J
壮龙无人机,辽宁壮龙无人机科技有限公司,辽宁壮龙无人机科技有限公司致力于工业级无人机整机及飞行控制系统的研发与制造，并为客户提供无人机系统行业应用整体解决方案，总部位于辽宁沈阳。壮龙科技所研发的油动直驱多旋翼无人机，具有大载重、长航时、高安全、易操控的特点，产品适用于农林植保、物流运输、航拍航摄、架线巡线、护林防火、遥感测绘、缉毒缉私、国防军事、环保监测等诸多领域。,辽宁壮龙无人机科技有限公司,沈阳市沈北新区沈北路76-43号（A门）,210113000028602,2015-10-16,蔡茂林,1083.3333万元人民币,91210113MA0P419M1M,www.zluav.com
精诚股份,湖北精诚钢结构股份有限公司,"""公司是国家建设部钢结构定点企业,总资产逾2亿元,占地面积75000平方米,地处湖北省黄冈市团风县城南工业园。是湖北省规模较大、设备先进、技术力量雄厚的专业化钢结构生产厂家。专业致力于大跨度工业建筑钢结构、电厂钢结构、桥梁钢结构和民用钢结构及网架的设计、制造和安装及相关配套的大型企业,旗下拥有湖北精远管业有限公司、湖北精远建设工程有限公司、新疆精诚钢结构有限公司。  精诚钢构具备国家钢结构专业承包壹级资质、钢结构制造壹级资质,始终坚持“质量优先、用户至上”的方针,先后被认定为“中国中小企业创新100强”、“钢""",湖北精诚钢结构股份有限公司,团风县城南工业园,421121000004474,2016-11-01,孙秋正,5857万元人民币,914211007932549234,www.hbjcgjg.com
橙旗贷,上海橙旗金融信息服务有限公司,橙旗贷是一个互联网投资理财服务平台，主打P2P借贷服务，以服务小微企业主及高净值精英群体需求的金融产品为市场开拓点，提供资金需求、信息咨询、信用评估、资产配置、理财规划等全方位的金融服务。,上海橙旗金融信息服务有限公司,上海市奉贤区望园路2351弄11号201室,310226000739446,2006-06-29,陈志军,5435万元人民币,91310120789581526T,www.cqdai.com
宏畅生物,广州宏畅生物科技有限公司,宏畅生物是一家生物技术开发服务商。,广州宏畅生物科技有限公司,,440108000047810,2011-09-06,姚军,2000万元人民币,91440116581877889Q
智享科技,北京骑骑智享科技发展有限公司,智享单车是一家共享单车服务提供商，产品可以实现用户在线查找、预约用车、临时锁车和一键还车。并搭载智能车锁与太阳能电力智能系统。同时还在测试静态定位精度更小的定位系统，为实现虚拟站点、虚拟桩、电子围栏等提供技术支撑，来引导用户规范用车、停车。,北京骑骑智享科技发展有限公司,北京市海淀区上地东路1号院1号楼9层902C,110108022569106,2016-12-06,李玉虎,5012.5313万元人民币,91110108MA00A47X70,www.zxbike.cn
助家生活,杭州芸瑾网络科技有限公司,助家生活是一个居家生活服务信息和在线交易的O2O服务平台，包括了整屋清洁及安装服务等服务，后续会增加维修、跑腿等各类服务，隶属于杭州芸瑾网络科技有限公司。,杭州芸瑾网络科技有限公司,杭州市江干区迪凯国际中心2502室.,330104000251662,2014-09-23,汤鹏,1234万元人民币,913301043112937521,www.homepaas.com
门业,江西鼎兴门业科技有限公司,本公司是专业从事门业设计与生产的企业，有良好的市场前景与优越的技术优势！,江西鼎兴门业科技有限公司,江西省上饶市鄱阳县团林乡汪洋村,361128210019172,2016-03-10,吴义发,300万元人民币,91361128MA35GPYQ1F,www.jxdxmy.com
领动运动康复,山东省领动运动康复技术有限公司,山东省领动运动康复技术有限公司是一家致力于健康领域、医疗领域、体育领域发展，集高端医疗设备研发、生产、培训、康复中心建设为一体的科技型公司，公司主营项目为康复医疗器械及运动医学产品，是运动康复系统解决方案供应商。,山东省领动运动康复技术有限公司,山东省青岛市崂山区科苑纬一路1号A座1704 室,370212230137192,2016-02-19,张恭谦,500万元人民币,91370212MA3C6HXF5W,ldrehab.com
盛域医疗,浙江盛域医疗技术有限公司,浙江盛域医疗技术有限公司是一家凝血检测系统和诊断试剂研发商，同时也是大型医疗设备的销售，与菲利普、美国血液技术公司等多家知名企业形成战略合作伙伴关系。盛域医疗在浙江省具有强大的销售网络，是一家具有自主研发能力的高新技术企业。,浙江盛域医疗技术有限公司,浙江省杭州市滨江区六和路368号一幢(北)四楼A4010室,330108000033318,2009-03-30,杨炳飞,1000万元人民币,91330108685823201Q
栗子直播,广州金楚信息技术有限公司,栗子直播是一款极具“在线互动”玩法的综艺直播APP。以综艺直播秀为主，涵盖了多种直播内容。,广州金楚信息技术有限公司,广州市天河区科韵路12号之一205室,440106001060052,2014-11-06,陈鹏,2267.5737万元人民币,91440106320992344X,www.jclive.cn
北矿科技,北矿科技股份有限公司,"""北矿科技股份有限公司是一家主要从事磁性材料及器件的生产和研发的公司.公司主导产品高性能永磁材料(以粘结铁氧体、烧结铁氧体为主)属于新材料范畴,其服务的行业主要有自动控制、计算机及其外围设备和微特电机等.公司已在磁性材料领域荣获国家和部级科技成果奖29项,专利15项,是受原电子部委托制定全国行业标准的单位之一.1997年就在国内同行业中率先通过ISO9002国际质量体系认证,2000年通过了ISO9001认证,2007年公司主要产品又通过了ROSH认证。""",北矿科技股份有限公司,,100000000034250,2000-09-06,夏晓鸥,15220.988万元人民币,911100007109270385
快用云通讯,北京烽火万家科技有限公司,快用云通讯是一家为企业提供一站式全生命周期的云通信服务公司，致力于用科技给通信连接带来便利，产品为SDK/API云通讯接口，提供短信验证、短信通知、云呼叫中心、全球计费等服务，能15分钟让企业具备连接全球的通讯能力。全面覆盖O2O、在线教育、互联网医疗、金融、运营商等众多领域与行业。,北京烽火万家科技有限公司,北京市海淀区安宁庄西路9号院25号楼10层2-1007,110108015713666,2013-03-21,雷燕,1241.9754万元人民币,911101080649193741,www.aipaas.com
明堂唱片,成都明堂文化传播有限公司,明堂唱是一个主打独立电子/说唱领域的国内音乐厂牌，拥有Lu1、Cee、夏之禹等众多说唱艺人，以及白天不亮、Keemo、Vampoleez等一众电子音乐人，出品的音乐作品包括Lu1的《男孩》、Lu1和Cee合作的《午夜列车上的告别》、白天不亮的《时光幻游指南》等等。,成都明堂文化传播有限公司,成都市温江区海峡两岸科技产业园锦绣大道南段99号,510123000031702,2010-06-17,李天杲,62.5万元人民币,91510115556402195M
畅元国讯版权家,北京畅元国讯科技有限公司,北京畅元国讯科技有限公司是一家以领先的数字版权管理技术为基础，提供数字版权技术平台及系统、版权集成、内容分发运营等数字版权服务的公司。,北京畅元国讯科技有限公司,北京市海淀区北四环西路9号14层1402,110116006478001,2004-02-24,黄清华,1357.14万元人民币,91110108758705215L,www.efida.com.cn
美丽邦,广西安盟信息科技有限公司,美丽邦是针对技师服务领域的细分O2O电商平台，整合美容、美发、美体、健身康体、牙医口腔、汽车美容等技师服务行业客户资源及相关资讯，通过线上线下的紧密结合，帮助商家做好长期客户经营（会员制经营），打造移动互联网时代自己的粉丝团，可有效提升线上营销效果，降低中小商户营销成本，以细分客户群共享构建细分市场的生态体系。,广西安盟信息科技有限公司,南宁市高新区滨河路28号中国-东盟企业总部基地三期综合楼A座第9层910号房,450111200069554,2012-05-17,孙怀湘,1000万元人民币,9145010059687498XM,www.safeneeds.com.cn
马各木子文化,厦门马各木子文化传播有限公司,马各木子文化是一个专注于为为高校提供活动策划、会展服务的平台，主要包括企业活动策划、大型会展服务、中脉道和系统品牌推广等一系列赛事活动，并以高校新媒体传播市场为主业务链。,厦门马各木子文化传播有限公司,厦门市思明区莲前西路287-309号201单元N区148室,350203200395978,2013-10-21,骆少东,50万人民币,91350203079355663C,www.11467.com
埃夫特机器人,埃夫特智能装备股份有限公司,"""埃夫特智能装备股份有限公司是一家专门从事工业机器人,大型物流储运设备及非标生产设备设计和制造的高新技术企业""",埃夫特智能装备股份有限公司,,340208000000185,2007-08-02,许礼进,39133.3162万元人民币,91340207664238230M
碧海舟,北京碧海舟腐蚀防护工业股份有限公司,"""京碧海舟腐蚀防护工业股份有限公司（原名：北京碧海舟涂料有限公司）是国家级高新技术企业，总部设在北京,在河北廊坊建有独资工厂。公司主要从事工业重防腐涂料的研发、生产和销售，防腐层涂敷，阴极保护材料及阴极保护工程，腐蚀检测与评价，腐蚀防护新材料和新技术的研究，腐蚀防护施工、咨询及服务。产品主要应用于石油炼化、油气储运、港口码头、电力、钢铁、煤炭、市政等工业重防腐领域，是一家集技术、生产、工程服务为一体的多学科、全产业链的企业。""",北京碧海舟腐蚀防护工业股份有限公司,北京市丰台区科学城星火路11号B座307号（园区）,110106009188420,2005-12-08,邸建军,15500万元人民币,91110106783225854L,www.bss.com.cn
蓝色卡卡,北京蓝色卡卡教育科技有限公司,蓝色卡卡是一家儿童STEAM教育机构，以STEAM素质教育为核心业务，自主研发了乐高教育整套课程与教学，课程包括乐高教育系列课程、脑科学、3D打印、科学实验等，致力于培养儿童的动手操作与头脑建构能力。,北京蓝色卡卡教育科技有限公司,北京市朝阳区望京园610号楼3至4层305内4层02号,110105022355534,2016-11-07,高云智,1000万元人民币,91110105MA009BPC3C,www.bkkedu.cn
电信工程局,北京市电信工程局有限公司,电信工程局是是通信与广电建设领域的综合服务提供商，拥有建筑智能化专业承包壹级资质、安防工程壹级资质、消防设施工程专业承包二级资质、建筑装修装饰工程专业承包二级资质、建筑防水工程专业承包三级资质和通信信息网络系统集成甲级资质。为华为、阿尔卡特、诺西、中兴、烽火等国内外著名电信设备供应提供服务，同时与中国联通、中国移动、中国电信、中国铁塔等通信运营商联系密切。,北京市电信工程局有限公司,北京市东城区夕照寺街2号,110000001001798,1980-12-05,朱宏,10500万元人民币,911101011011333393,www.bteb.cn
天翼碳纤维,慈溪天翼碳纤维科技有限公司,慈溪市天翼碳纤维科技有限公司是主要从事碳纤维制品的开发生产，是专业的碳纤维辊轴制造企业，也是浙江省高科技企业。公司形成了以辊轴为中心，兼顾石油机械、电力设备等行业专用的碳纤维系列产品，拥有多项国家专利，承担了多项科技项目。,慈溪天翼碳纤维科技有限公司,慈溪市新兴产业集群区宗汉街道新兴一路1号,330282000304201,2014-09-15,唐清,210万元人民币,9133028230909659XH
咚咚踢球,苏州黑羊网络科技有限公司,"""咚咚踢球App,一键搞定足球业余联赛。快速查看全国业余足球赛事和新闻；全国校园足球赛事和新闻。互联网与业余足球联赛的强力组合。""",苏州黑羊网络科技有限公司,,320594000447819,2015-07-29,江明春,100万元人民币,913205943463837077,www.e-blacksheep.com
瑞柯恩,上海瑞柯恩激光技术有限公司,上海瑞柯恩激光技术有限公司是专业生产医疗激光的高新技术企业，一直秉承紧密联系临床需求的理念，不忘初心，牢记使命，致力于将临床需求变为现实，不断学习，运用先进的科技，生产出更多更好的产品，为了让中国的医疗专家在国际舞台上使用中国品牌医疗设备展现中国医疗水平，让中国的每一个患者都能享受到同样先进的医疗技术，瑞柯恩公司一直在努力。,上海瑞柯恩激光技术有限公司,,310115000964192,2006-08-07,李会永,1866.6667万元人民币,9131000079147974XB,www.raykeen.com
骐通智能,湖北骐通智能科技股份有限公司,"""公司报告期内主要从事工业机器人的研发、设计、组装、销售和维护,工业自动化控制产品的系统集成、安装、调试、维护以及机器人及自动化控制备件的设计、制作和销售。报告期内,公司主营业务未发生重大变化。""",湖北骐通智能科技股份有限公司,十堰市东城经济开发区东环路109号（湖北龙颂工贸有限公司办公楼一栋）,420382000024423,2011-09-09,赵双庆,2695万元人民币,91420300582451302B
CAREMILLE珂曼,北京子墨志朋科技有限公司,CAREMILLE（珂曼）是来自韩国首尔的全新彩妆品牌，它以多元的产品线和品牌元素，成功将少女的活泼可爱和欧美大牌级的彩妆工艺进行了完美的结合。,北京子墨志朋科技有限公司,,110105017421376,2014-06-18,王新云,100万元人民币,91110105306336033R,caremille.kr
