名字,公司,介绍,公司,地址,身份证,时间,法人,注册金额,编号,网址
玻机智能,上海玻机智能幕墙股份有限公司,"""公司成立于2003年,2008年8月加入润邦集团,玻机智能幕墙于2011年8月引进战略投资者,私募融资1.06亿元,2011年12月底完成股份改制更名为上海玻机智能幕墙股份有限公司,注册资本金为7500万元。公司现为中国装饰装修协会幕墙委副主任委员单位、上海市装饰装修行业协会会员单位、上海市金属结构行业协会理事单位,拥有建设部颁发的建筑幕墙工程、金属门窗工程专业承包壹级资质和建筑幕墙工程设计专项甲级资质。通过IS09001:2000质量管理体系认证,IS014001:2004环璄管理体系认证,职业健康管理体""",上海玻机智能幕墙股份有限公司,上海市闵行区颛兴东路1277弄63号309室,310112000399872,2003-02-27,林磊,15300万元人民币,91310000747618634H,www.brightsh.com.cn
机器人派遣租赁,天津经为科技有限公司,机器人派遣租赁是一个主要从事工业机器人应用技术和系统集成以及智能化设备研发、生产、销售、服务的企业，产品主要涉及涂装、焊装、组装、打磨、检测、无人搬运以及工厂物流系统。,天津经为科技有限公司,,120118000198660,2016-10-31,王宝庄,2000万元人民币,91120118MA05LE5A8A
赣能股份,江西赣能股份有限公司,"""江西赣能股份有限公司是一家主要从事于电力生产及销售的企业.其主营业务范围为火力、水力发电,节能项目开发,锅炉安装及维修等.公司形成了水火并举、以电为主的发展格局,同时积极加快进军路桥等基础行业和高科技领域,实现投资领域的适度多元化。""",江西赣能股份有限公司,江西省南昌市高新区火炬大街１９９号,360000110008001,1997-11-04,揭小健,97567.776万元人民币,913600001583122317,www.000899.com
瑞声科技控股,瑞声声学科技（深圳）有限公司,瑞声声学科技（深圳）有限公司，是瑞声科技控股有限公司（以下简称“瑞声科技”）属下的子公司。瑞声科技以提升用户体验及客户满意度为出发点，以仿真技术为基础，利用强大的研发团队与先进的制造技术，结合大数据管理，持续为移动终端、机器人、无人驾驶汽车等智能设备提供硬件、软件高度结合的技术解决方案。,瑞声声学科技（深圳）有限公司,深圳市南山区科技园南区粤兴三道6号南京大学产学研基地A座6楼(办公)。,440301503263494,2004-01-12,狄建林,10000万美元,91440300755683997C,www.aactechnologies.com
读宠,天津蛋壳网络科技有限公司,读宠,天津蛋壳网络科技有限公司,,120103000328190,未知,刘东东,100万元人民币,91120103MA05WQFU83
拓展我青春,天津开平科技有限公司,"""“拓展我青春”项目是将共享经济的理念引入到大学生的自身素质锻炼提高活动中,通过共享社会资源,使大学生能有机会参加各种拓展训练,达到提高自身的素质能力的目的。并且在互联网上建立起信息交流平台,达到创业合作、技能扶持、优势互助、共同发展的目的。使参加过活动的大学生在未来的工作、生活中具备很高的个人修养和广泛的社会联络,从而达到个人和整体的进步和发展。""",天津开平科技有限公司,,120222000594915,2017-07-07,王邢伟,100万元人民币,91120222MA05TD8M6M
安易信,北京安易信科技有限公司,北京安易信科技有限公司（简称：安易信）是一家从事软件研发和互联网信息服务的公司。安易信利用互联网及大数据的前瞻技术，建立基于互联网的信息服务平台。安易信对互联网大数据有着独到的见解，通过对行业市场信息和海量数据的整合、分析，帮助企业把握外部风险。,北京安易信科技有限公司,北京市海淀区知春路7号致真大厦D座15层1503,110108017352664,2014-06-09,杨志强,750万元人民币,91110108397467740E,www.anytrust.cn
锐文科技,浙江锐文科技有限公司,锐文科技是一家智能光纤网络适配器研发商，支持一系列不同宽带的光纤接口，可以应用于标准的服务器硬件上，以支持现代数据中心的功能需求，比如网络虚拟化、硬件加速等。通过虚拟化网络服务来降低空间占用和能源消耗，通过创建网络抽象层以实现更便捷的网络重组及创新。 该适配器可在不改变数据中心现有构架的前提下，提供高性能低延迟的服务器和网络的接口交互，并可根据客户需求提供定制化应用产品。,浙江锐文科技有限公司,浙江省衢州市柯城区凯旋南路6号2幢B区201-6室,330800000117138,未知,阎燕,2000万元人民币,91330800MA29T9B603
科宏生物,黄山科宏生物香料股份有限公司,"""公司是一家集研发、生产、销售生物系列香料于一体的高新技术企业,成立于2003年元月,现坐落于黄山市歙县循环经济园区.""",黄山科宏生物香料股份有限公司,黄山市歙县循环经济园区纬一路,341021000005441,2003-01-28,程存照,7000万元人民币,91341000746763434X
遇上时光,云南遇上时光科技有限公司,云南遇上时光科技有限公司，是一家旅行体验至上的自由行平台，提供全程省心的一体化自由行服务。采用“互联网 金融 旅游”的全新产业模式，打造高品质的旅行产品，解决传统跟团游和自由行存在的问题，精选出涵盖自由行、搭伙自由行、定制自由行等一系列高性价比的旅行产品，以社群为核心，全方位满足自由行产品咨询、销售、分享、互动等需求，让旅行不只有机票加酒店，更重要的是在旅行中碰撞自己的心灵，让整个旅行的过程中有着完美的体验。,云南遇上时光科技有限公司,云南省昆明市高新区海源北路与科技路交汇处（海源北路M2-9-1地块）云南昊邦医药技术研发基地研发大楼1幢11层1102号,530100000547233,2016-06-20,夏滨,1000万元人民币,91530100MA6K6L7HX2,www.56zuyin.com
锦衣卫资产,四川锦衣卫科技有限公司,四川锦衣卫科技有限公司是一家专注于全产业链金融风险管理整体解决的服务商。公司以大数据为基石，深耕汽车金融贷后风险管理与房产抵押贷款全产业链服务。重点打造了互联网汽车金融 “3+1” 创新服务模式，打通了互联网+不良资产处置的全流程通道。自主研发了多项行业领先的大数据金融风险管理及资产处置一站式服务体系。,四川锦衣卫科技有限公司,,510110000036311,2015-12-01,余洋,1000万元人民币,91510100MA61RQE220,www.jew315.com
大东联,山东大东联石油设备有限公司,山东大东联石油设备有限公司是一家石油设备研发制造商。是封隔器、螺杆泵、声测管、配水器等产品专业生产加工的公司，拥有完整、科学的质量管理体系。,山东大东联石油设备有限公司,利津经济开发区,370500228031808,2007-01-24,马爱荣,3500万元人民币,91370500798658820H,www.ddlmanufacture.com
觉厉云,南京觉厉云电子商务有限公司,JoinLiv生殖营养素自主选择与管理平台是一家生殖营养素及相关生殖健康科普服务提供商，产品分为男性生殖、女性生殖以及日常保养等系列。主要面向不孕症人群，通过自主研发的生殖营养素，帮助用户改善精、卵质量，提高自然妊娠率、提高试管婴儿成功率、降低出生缺陷。,南京觉厉云电子商务有限公司,南京市江宁区东山街道绿地之窗商务广场D2-1122室,320102000377001,2017-09-08,俞刚,800万元人民币,91320102MA1QG1KP4C,www.joinliv.com
一米投资,一米投资管理（北京）有限公司,一米投资专注于资产配置的研究，通过自有的基金评价体系对私募基金管理人及产品进行筛选和评估，挑选出优质的基金产品并通过FOF的形式为客户提供财富管理服务。,一米投资管理（北京）有限公司,北京市朝阳区芍药居北里101号1幢11层1座1212,110105019757257,2015-08-25,孙鹤,1000万元人民币,91110105355303772R,www.yimitouzi.com
寻材问料,深圳市寻材问料网络科技有限公司,寻材问料是国内首家材料解决方案一站式服务平台。寻材问料是制造企业从产品设计、采购、工艺、制造等全流程，和材料方案商、供应商、工程师的连接平台。,深圳市寻材问料网络科技有限公司,深圳市南山区粤海街道华润商务中心3号楼2501,440301112060079,2015-01-14,聂雷,1000万元人民币,91440300326405585C,www.materials.cn
全国宗谱续修云平台,湖北家国文化科技有限公司,湖北家国文化科技有限公司是一家根植于家与国传统文化，融身于现代科技，讲究创新与品质的文化科技型企业。2005至2013年，协助60多个姓氏编辑宗谱，完成家谱有黄姓(8万丁)、曹姓(6万丁)、袁、舒、余、谢等二百多个姓氏，上百万人口的宗谱续修工程。业务遍及湖北，湖南，江西、安徽、河南等华中地区。其间并完成“宗谱数字化特符”字库的开发，宗谱网三次全面升级改版（第四次正在开发之中，由行业宣传门户向行业应用改变）。姓氏321网站平台建设，云码宗谱排版管理系统三次开发。,湖北家国文化科技有限公司,,420112000244567,2014-11-05,曹咏,209万元人民币,91420112303532493Q,x4321.com
港口物流,唐山市港口物流有限公司,港口物流是一家专业的港口物流服务提供公司，是一家集陆路运输、金融服务、代理、加工、信息服务、进出口保税于一体的物流企业。,唐山市港口物流有限公司,,130294000001079,2000-10-30,王泽,5000万元人民币,91130294758928363J
环宇装备,河南环宇石化装备科技股份有限公司,河南环宇石化装备科技股份有限公司是化工装备产品供应商，主营业务为石油化工、煤化工和化工领域使用的变压、变温吸附装置、换热设备等非标压力容器及配套装备的设计、制造与安装。　　公司拥有中华人民共和国特种设备A2级第III类低、中压容器制造许可证；中华人民共和国特种设备D1级第一类压力容器、D2级第二类低、中压容器设计许可证；中华人民共和国特种设备GC2级压力管道安装改造维修许可证。公司通过了北京大陆航星质量认证中心有限公司ISO9001:2008质量管理体系认证。,河南环宇石化装备科技股份有限公司,修武县产业集聚区云翔路中段南侧,410821100001229,2004-07-20,陈志强,5170万元人民币,91410800764877160R
健兴药业,贵州健兴药业有限公司,贵州健兴药业有限公司，成立于1996年，是贵州省高新技术企业。公司位于贵阳国家高新技术产业开发区，占地面积8万平方米，制药厂房等建筑面积9万平方米，建有中药提取、颗粒剂、胶囊剂、合剂、滴丸剂、凝胶剂等制药车间，并全部符合GMP标准。,贵州健兴药业有限公司,,520000000103273,1996-07-10,廖萍,5300万元人民币,91520000622422849P,www.gzjxyy.com
闪电个车,深圳市闪电个车科技有限公司,闪电个车是一家集线上购车比价、汽车金融进件、新能源汽车为一体的综合性汽车消费金融平台。致力于汽车新零售，专注汽车营销软件服务，实现行业在线化数字化。闪电个车采用的是B2B模式，他们通过SaaS数字化整合新能源汽车零售渠道，借助互联网平台构建厂家、分销商的业务平台，以互联网+互动式汽车营销体验，与客户取得实时化的沟通和联系，实现了多维度互动，实现了对资源的有效整合，借助大数据平台来获取客户需求数据，以求更好地开展新能源汽车营销活动的商业模式。未来，闪电个车将在天使轮融资的助力下，开启全新OMO(线上融合线下)战略布局，打造低碳绿色出行的NEV泛生态价值链，解决新能源汽车用户的选车、用车、售后等全流程痛点，进而稳步实现新能源整车零售与服务体验的升级需求。,深圳市闪电个车科技有限公司,深圳市罗湖区南湖街道嘉宾路城市天地广场东座2楼整层,440301109955158,2014-07-29,陈浚彬,200万元,914403003116946528,www.popupcar.com.cn
货大大,西安货达网络科技有限公司,货大大是一家主打煤炭行业的货物运输O2O服务商，主要业务功能是煤炭货运行业的车货匹配，通过自建的网站、微信平台、无线远程打印机、云呼叫中心，为客户提供煤炭运输服务。,西安货达网络科技有限公司,西安国际港务区港务大道99号A座1404-3,610131100186155,2015-02-15,折大伟,745.3014万元人民币,916101313336909192,www.huodada.com
中航智,北京中航智科技有限公司,中航智是一家无人机研发商，公司主营业务为无人机、航空机载设备以及自动激光驱鸟器等机场设备的技术研发、生产、销售及产品服务，产品应用涵盖电力、农业、公安、地质勘探和影视拍摄等多个领域。,北京中航智科技有限公司,北京市北京经济技术开发区同济南路20号1幢1层,110302015358251,2012-11-06,田刚印,10000万元人民币,91110302057391444C,www.zhztech.com
勤易科技,杭州勤易科技有限公司,勤易科技是一家专为服装行业品牌企业、代理商、门店提供全渠道营销解决方案的SAAS服务商。公司拥有强大的技术研发与产品设计力量，团队骨干均具有十年以上大型互联网企业或行业从业经历，积累了丰富的移动应用软件开发与系统实施经验。,杭州勤易科技有限公司,杭州市西湖区深潭口大楼305室,330106000466895,2015-12-25,褚雄伟,190.3553万元人民币,91330106MA27WKCC04,www.qineasy.com
美课,河南美课信息技术有限公司,“睿训课堂”是一款IPAD上使用的教学软件，通过日常教学行为收集数据，达到辅助教师教学、学生学习的目的。,河南美课信息技术有限公司,新乡市柳青路师大佳苑C2-602,410792000019177,2013-04-18,李永波,100万元人民币,914107000675761430,meclass.cn
大旗软件,成都中科大旗软件有限公司,大旗软件是“智慧旅游”具有领先地位的供应商之一，长期专注于旅游信息化领域，成功地为政府部门、旅游企业提供了优秀的、全产业链的行业信息 化解决方案，先后成功研发了“智慧旅游数据中心”、“旅游电子政务门户集群平台（DAQCMS）”、“旅游资讯门户集群平台”、“旅游运行监管及安 全应急管理联动指挥平台”、“旅游业运行统计系统”和“旅游全球分销系统（GDS）”等多个品牌产品，涵盖面向旅游行业的“管理、营销和服务”的全 业务链。,成都中科大旗软件有限公司,中国（四川）自由贸易试验区成都高新区天华二路219号5栋1单元6层1、2、3、4号,510107000369606,2006-04-11,周道华,2584.6678万元人民币,91510100785446829D,www.daqsoft.com
业恒创业,西藏业恒创业投资管理有限公司,业恒创业是一家创业投资管理公司。公司的主营业务包括：创业投资管理，企业管理咨询，经济信息咨询，商务信息咨询，财务顾问等。,西藏业恒创业投资管理有限公司,,540195200019292,2017-03-20,吴学江,100万元人民币,91540195MA6T2AKG0X
泰诺迪生物,广州泰诺迪生物科技有限公司,泰诺迪生物是一家生物仪器提供商。,广州泰诺迪生物科技有限公司,,440101000220002,2012-12-01,何有文,299万元人民币,91440101058912766C
亿进互联,郑州亿进信息技术有限公司,亿进科技是国内领先的管理软件研发公司，一直致力于通过互联网为用户提供多元化的信息咨询、网络游戏产品及相关服务。,郑州亿进信息技术有限公司,,410199000038991,2012-07-23,林杨满,100万元,,www.egin.cn
华盈智能,山西华盈时代智能科技股份有限公司,山西华盈是一家致力于移动互联网、大数据、云服务技术为基础平台互联网+公司，专业从事移动互联网的开发及应用的高新技术企业。公司坚持用智慧创造未来，用科技造福人类的企业使命，致力于使用互联网+的思维 方式和业务创新，为广大老百姓带来便利、快捷的生活，让社会每一个成员都各得所需，各得其所。,山西华盈时代智能科技股份有限公司,山西综改示范区太原学府园区长治路288号五层502室,140100207104365,2007-06-14,华晋,2169万元人民币,91140100662379216T
浙江交科,浙江交通科技股份有限公司,浙江交通科技股份有限公司主营业务为道路、桥梁、隧道等交通工程施工、养护及工程项目管理业务；化工产品的开发、生产和销售双主业共同发展。公司化工产品有DMF、DMAC、顺酐、甲胺、环氧树脂、合成氨、聚碳酸酯等系列产品，交通工程业务主要包括交通工程施工、养护及工程项目管理。,浙江交通科技股份有限公司,浙江省江山市景星东路38号,330000000002425,1998-11-23,邵文年,137563.8998万元人民币,913300007109591285
穆松公考,穆松教育咨询（天津）有限公司,穆松公考是一个公职考试资讯平台，现已集面授培训、网络教学、图书发行于一体，旗下“穆松公考”、“求是教招”两大品牌专注于公务员、事业编、选调生、教师编制类考试的相关培训。,穆松教育咨询（天津）有限公司,,120224000113803,2014-02-20,穆松,100万元人民币,91120224091578210P,www.xueyoushigk.com
材华科技,北京材华科技有限公司,京材华科技有限公司成立于2017年11月，是中国第一家大分子染料的研发及生产制造商，是一家专注于高端涂层技术和功能化学品开发、转化的高新技术企业，团队由清华、浙大、中科大的硕博士组成。材华科技所有产品均基于水性高分子核心技术，产品涵盖有荧光、彩色等功能特性的环保功能涂层，在航天、医疗、日化、家装等领域有巨大的应用前景。团队拥有功能单体、水性功能高分子树脂等产品领域的核心技术并申请逾20多件的国家发明专利；团队及其主导研发的“高端涂层技术”项目获得国内和国际多项荣誉。此外，团队已获得540万种子轮投资，投资方为香港漆宝国际集团、启迪种子、勰合资本。,北京材华科技有限公司,北京市海淀区中关村东路1号院8号楼CG05-226号,110108024465067,2017-11-21,李军配,1000万元人民币,91110108MA018W9E0N,www.tsaihua.com
优百拓,深圳市优百拓科技有限公司,"""深圳市百拓科技有限公司具有多年开关插座的生产历史，在中国香港和深圳分别设立伟拓实业(香港)有限公司和深圳市百拓科技有限公司,负责国内外客户的产品销售服务.主要产品有：轻触开关、自锁开关、耳机插座、拨动开关、按钮开关、船形开关、DC、AC插座、S端子等系列产品。广泛应用于VCD、DVD、电脑、家用电器、通讯器材及其它精密电子仪器设备等各种产品。""",深圳市优百拓科技有限公司,深圳市龙岗区横岗街道六约社区深惠路536号407室,440301105846036,2011-11-22,葛杨,10万元人民币,914403005867454045,www.usbright.com
杭电股份,杭州电缆股份有限公司,"""杭州电缆股份有限公司是富春江通信集团有限公司的核心企业,始建于一九五八年,是浙江省电线电缆行业协会理事长单位.""",杭州电缆股份有限公司,杭州经济技术开发区6号大街68-1号,330198000003854,2002-04-17,华建飞,68687.8908万元人民币,91330000609120811K,www.hzcables.com
teamin,北京圈动科技有限公司,Teamin是一款基于目标管理的团队协作工具，通过把大目标分解成明确的、可实现的短期目标，让团队工作变得更加专注和高效。,北京圈动科技有限公司,北京市昌平区回龙观东大街338号创客广场B3-05-010，北京市石景山区石景山路乙18号院5号楼10层1108,110107014280195,2011-09-27,李云军,15.625万元人民币,91110107582501752M,www.teamin.cc
BerryBeans,北京上创核果餐饮管理有限公司,BerryBeans由三个咖啡师创立的独立精品咖啡品牌，隶属于北京上创核果餐饮管理有限公司。门店经营精品咖啡，意式花式咖啡，西餐简餐。,北京上创核果餐饮管理有限公司,,110106018111321,2014-11-02,韦寒夜,30万元人民币,91110106318155002K
云将智能,上海云将智能科技有限公司,云将智能是一家机器人大数据解决方案提供商，产品兼容所有主流机器人公司产品，为客户提供实时监管机器人设备的通信工具。让用户享有机器人数据管理，查看数据分析结果，报警信息实时通知，提前预知设备故障等体验。,上海云将智能科技有限公司,,310113001782978,2017-01-06,赵勇,50万元人民币,91310113MA1GL9R04L,www.cloudoit.com
龙源技术,烟台龙源电力技术股份有限公司,"""烟台龙源电力技术股份有限公司是一家从事电力领域燃烧控制设备及系统的研究开发、设计制造、现场调试、人员培训、技术咨询等业务的企业.其主要产品为等离子体点火设备、微油点火设备.公司是首家开发和推广应用电站锅炉等离子点及稳燃技术的高科技企业,是中国乃至世界等离子体点火设备的主要生产厂家,产品约占国内等离子体点火设备90%左右的市场份额,技术水平居世界领先地位.拥有煤粉锅炉等离子体点火及稳燃技术的完全知识产权,是整个行业的技术领导者。""",烟台龙源电力技术股份有限公司,烟台经济技术开发区衡山路9号,370600400006918,1998-12-26,唐超雄,51321.6万元人民币,91370600705877689M,www.lypower.com
华盛影视,浙江华盛影视传媒有限公司,浙江华盛影视传媒有限公司是美国3ality中国公司，是一家专业致力于3D影视拍摄、3D频道建设、3D广告创意策划、3D技术外包的影视技术公司，浙江华盛影视传媒有限公司依托美国3ality公司在全球顶尖的3D技术，开拓了一条适合中国影视人的新“影”路。,浙江华盛影视传媒有限公司,杭州市下城区颜三路116号401室,330100000191868,2014-05-19,吕祥兵,10000万元人民币,91330100099988847R
吾影掌,时代影业（天津）有限公司,吾影掌是一款影视垂直类APP，集影视行业资源共享、影迷线上线下互动、影视作品披露和影视版权交易等为一体的影视交流互动平台，让更多有志从事影视行业的人和热爱影视行业的人提供一个交流和展现的平台，让更多的人参与到影视行业中来。,时代影业（天津）有限公司,,120116000479522,2016-07-12,汪航涛,1000万元人民币,91120116MA05KDTB0X
Lvpad旅伴网络,西安旅伴文化创意有限公司,Lvpad旅伴网络是一家为海外游客提供入境游的服务平台，为来华旅游提供P2P模式的私人导游对接服务，西安旅伴网络科技有限公司旗下产品。,西安旅伴文化创意有限公司,西安市高新区高新路凯创国际1幢1单元15层11508室,610131100116050,2013-12-20,李凤琴,1000万元人民币,91610131081034447D,lvpad.com
美顾问,湖南美帮网络科技有限公司,美帮是一家致力于为全国美容美发沙龙和商业企业提供最专业的一体化解决方案的领先级高新集团公司，创立品牌“美顾问”，旗下提供了包括“美顾问财富系统”“美顾问财务管家”，“美顾问现场服务系统”，“美顾问沙龙网站”，“美顾问会员商城”“美顾问万众联盟”等在内的系列综合服务体。,湖南美帮网络科技有限公司,湖南省长沙市芙蓉区五一大道59号长沙大厦商务楼四楼,430102000113569,2010-08-13,林金秋,1000万元人民币,91430102559537642T,www.miboon.com
易信科技,深圳易信科技股份有限公司,公司简介：,深圳易信科技股份有限公司,深圳市南山区西丽街道百旺信工业区A区（一区）一栋二楼,440301104027749,2004-07-05,白本通,2545.4545万元人民币,914403007634976253
五八汽车,北京五八汽车科技股份有限公司,“58 车” 主要提供与车相关的营销解决方案，从用车生活的前端需求出发，串联起学车、租车、陪练、买车、违章查询、洗车、代驾、车分期、二手车置换等汽车使用生命周期的各部分服务，从而形成 “58 车” 的闭环生态产品体系。,北京五八汽车科技股份有限公司,北京市海淀区学清路甲18号中关村东升科技园学院园四层401室,110108010467720,2007-09-06,丛林,7843.1373万元人民币,91110108666933421W,www.58che.com
上海远洋,上海远洋运输有限公司,胡经理：130-406-332-86,上海远洋运输有限公司,上海市东大名路378号,310109000010470,1984-08-29,辜忠东,48284.345万元人民币,91310109132203758H,www.coscoshanghai.com
