名字,公司,介绍,公司,地址,身份证,时间,法人,注册金额,编号,网址
飞猴电商,长治市飞猴电子商务有限公司,飞猴电商是一个本地O2O汽车服务平台，旗下“洗车啦”全城洗车e卡通主要提供全城洗车、养车会员价服务、本地汽车服务商品搜索与比价、周边洗车行和汽车服务商搜索及车主微社区等功能。,长治市飞猴电子商务有限公司,,140402100297625,2014-11-03,刘晓宇,50万元人民币,91140402397928850F,changzhi.ganji.com
爱迹记录爱,杭州米秀信息技术有限公司,杭州米秀信息技术有限公司总部位于杭州西湖区，是一家创新型的新兴互联网公司。旗下产品“爱迹”是国内最温暖的亲子图片社交服务平台，通过记录宝宝点滴瞬间，分享孩子成长快乐。,杭州米秀信息技术有限公司,杭州市西湖区留下街道留下村工业区块7号2幢527室,330106000391827,2015-03-09,余湘平,100万元人民币,91330106328122714D
微笑网络科技,深圳市百特尔微笑网络科技有限公司,我们是—,深圳市百特尔微笑网络科技有限公司,深圳市宝安区宝安中心区西城上筑3A2205室,440306107876749,2013-09-02,刘海兰,100万元人民币,91440300077538589N
上海史伟莎,上海史伟莎清洁灭虫服务有限公司,LBS Hygiene 史伟莎 – 提供全面卫生解决方案，包括洗手间卫生、商业及家居灭虫、纸类及垃圾袋、清洁剂及一众手部清洁及消毒产品，成为您的卫生专家，LBS Air Purification Services 史伟莎空气净化服务 – 采用光等离子技术，捕捉空气中的污染物，包括甲醛、挥发性有机化合物、臭味、细菌、病毒、霉菌、烟气及烟味，迅速分解并转化为二氧化碳及水分等无害物质，保障客户健康,上海史伟莎清洁灭虫服务有限公司,上海市嘉定工业区洪德路1365号6幢底层,310000400459958,2006-03-20,黄莉,14万美元,913100007858872299,www.lbshygiene.com.cn
紫鹿定位,深圳市紫鹿文化创意有限公司,紫鹿定位是一家VR/AR精准定位解决方案提供商。公司营业高技术壁垒的VR/AR，可以精准定位企业VR/AR技术及方向并提供解决方案。,深圳市紫鹿文化创意有限公司,深圳市福田区华强北街道深南中路2008号华联大厦12楼1208,440306109951992,2014-07-29,肖勇,100万人民币,91440300311700151Q,www.ziluculture.com
大师保养,上海宽世易汽车服务有限公司,大师保养是一家汽车上门保养O2O服务提供商，支持用户在线预约，可通过微信、电话预定，技师上门至任意停车位保养车辆，改变用户到门店保养的模式，上海宽世易汽车服务有限公司旗下产品。,上海宽世易汽车服务有限公司,上海市嘉定区嘉戬公路500号22幢3016室,310114002926251,2015-06-23,杨昊,300万元人民币,91310114342162800X,233921.kuaizhan.com
荟仁堂,河南荟仁堂生物科技有限公司,河南荟仁堂生物科技有限公司成立于2008年，是中国芦荟专业委员会的理事单位，多年来一直处于国内芦荟产品研发的前沿，是中原地区唯一研发、生产芦荟系列产品的专业厂家。主要研发生产“荟仁堂”品牌系列化妆品。产品畅销河南、山东、陕西、山西、河北、甘肃、新疆、安徽、北京、天津等省市；部分产品销往南非、泰国、马来西亚、新加坡、香港、澳门、台湾等国家和地区。公司被科技部命名为“中国芦荟产业科技创新示范基地”。,河南荟仁堂生物科技有限公司,漯河市郾城区龙江路与太白山路交叉口东南角1幢,411100000025753,2012-07-04,乔海志,1356万元人民币,91411103599143429E,www.hnhuirentang.com
优而生物,南京优而生物科技发展有限公司,南京优而生物科技发展有限公司是专业致力于人类辅助生殖技术的相关产品的研发，成体干细胞，染色体端粒技术在抗衰老及严重疾病防治中的应用，和大数据分析应用于新药开发的高潜力的高科技生物医学企业。,南京优而生物科技发展有限公司,南京市江北新区新锦湖路3-1号中丹生态生命科学产业园C栋2层,320121000237157,2012-10-15,JINXINGLIANG,2800万元人民币,9132011505327753X1,www.njyournewlife.com
土星网络,深圳市土星网络有限公司,土星网络是一家移动游戏开发商和运营商，专注于手机网络游戏的研发及运营，企业开发RPG手游《光明传说》等产品，致力于打造精品游戏。,深圳市土星网络有限公司,深圳市南山区粤海街道深南大道北科技路西桑达科技大厦602,440301111659814,2014-11-14,郭国平,200万元人民币,91440300319552528K,www.saturngame.com.cn
华美敦,华美敦贸易（上海）有限公司,华美敦贸易（上海）有限公司隶属于华敦国际集团(Fairton)于1955年在香港创立，现已发展成为实力雄厚的国际时装品牌管理公司，业务遍布整个大中华区——香港、中国内地及台湾。目前，旗下品牌共有8个。分别是iBLUES、Marella、Marina Rinaldi、MAX&Co.、Max Mara、PennyBlack、Sportmax、Weekend by Max Mara。除了在亚洲区主要潮流之都的香港设有总部，集团的业务版图亦不断扩张，在北京、上海、广州、深圳沈阳及台北等主要城市均设有地区分公司及货仓,华美敦贸易（上海）有限公司,上海市普陀区真北路915号7层812室,310000400569260,2008-04-16,钟少坚,5000万元人民币,91310000672728969B,www.fairton.com
宏源药业,湖北省宏源药业科技股份有限公司,湖北省宏源药业科技股份有限公司主要业务是乙二醛等有机化学原料，乙醛酸、2-甲基咪唑、2-甲基-5-硝基咪唑等医药中间体，甲硝唑、苯酰甲硝唑等原料药的研发、生产和销售。,湖北省宏源药业科技股份有限公司,,421123000005111,2002-01-21,尹国平,35274.96万元人民币,9142110073519634XF,www.hbhypharm.com
诚烨股份,上海诚烨汽车零部件有限公司,"""公司自成立以来一直专注于汽车零部件的研发、生产、销售,通过多年的技术积累,拥有辊压、拉弯、冲压、焊接、注塑等工艺的加工中心,可以为上海大众、上海汽车等整车厂及其模块供应商提供相应的汽车零部件。""",上海诚烨汽车零部件有限公司,,310114000724809,2003-05-27,钱雪明,5120万元人民币,91310000750565270P,www.schengye.com
环宇汽车,江苏环宇汽车零部件有限公司,环宇汽车是一家汽车降噪产品提供商。,江苏环宇汽车零部件有限公司,宜兴市高塍镇南工业区,320282000093773,2001-06-26,王祖云,1000万元人民币,91320282728997253H,www.huanyu.com.cn
聚惠车,成都聚惠车网络科技有限公司,成都聚惠车网络科技有限公司旗下的聚惠车是汽车行业的一家专注于特价、特惠新车的O2O移动互联网平台，帮助客户找到特价新车，实现线上选车，线下4S店看车、试车，订车、车贷金融、保险、二手车、精品装饰等站式购车全新体验。用户凡在聚惠车平台下单并完成买车，如果买车后发现成交价不是当前4S店最低，聚惠车将赔付双倍补差。,成都聚惠车网络科技有限公司,成都高新区新雅中街26号附2号3层,510109000541314,2015-02-06,卓蕾,50万人民币,,www.juhuiauto.com
NIWO,合肥你家我装网络科技有限公司,NIWO是一款社交O2O服务APP，用户通过实名认证后，可以在APP上交朋友，同时APP为用户促进线下交流活动，致力于为单身狗、宅男、宅女等缺乏社交和渴望社交的用户提供交流的平台。,合肥你家我装网络科技有限公司,合肥市包河经济开发区花园大道17号互联网产业园8#三层,340100001254590,2015-05-13,王钰,200万元人民币,91340100343811059Y,www.niwoapp.com
东方吉祥,天津东方吉祥国际货运代理有限公司,东方吉祥成为中国与其他国家经贸往来的Top服务商，隶属于天津东方吉祥国际货运代理有限公司，该公司专注于国际货运代理（海、陆、空）等服务。专注于给客户最专业的服务理念并结合着综合化、国际化、信息化、系统化的发展目标。目前已经在日本韩国有着完善、强大的代理网络。,天津东方吉祥国际货运代理有限公司,天津市河东区津塘路174号（C座335房间）,120102000135691,2013-08-30,姚亮,500万元人民币,91120102075925665L
聚网优速,深圳聚网优速科技有限公司,聚网优速拥有十年以上的IDC运维经验，在多点多地都有网络节点布局，为用户提供一站式IDC，CDN服务。,深圳聚网优速科技有限公司,深圳市前海深港合作区前湾一路1号A栋201室（入驻深圳市前海商务秘书有限公司）,440301113267308,2015-07-02,张驰欣,1000万元人民币,91440300335379921W,www.chinanetcdn.com
E伴孝芯,亦伴（北京）信息科技有限公司,远程照护爸妈智能终端——“e伴孝芯”，创造了世界领先水平的老人行为识别技术及亲情服务应用系统。未来，亦伴科技将致力于打造中国老年人的居家养老生态服务平台，用更多周到的关爱服务，为使用e伴孝芯的儿女、老人提供更多帮助，实现“让孝爱触手可及”的企业愿景。,亦伴（北京）信息科技有限公司,北京市朝阳区北苑路170号3号楼12层1单元1502,110105017929858,2014-09-23,张杰,1000万元人民币,91110105317947980F,www.91eban.com
舜大新能源,江苏舜大新能源股份有限公司,江苏舜大新能源股份有限公司主要从事新能源光伏发电项目的投资、开发和运营。公司自设立以来，主营业务未发生重大变化，业务结构较为稳定。公司立足于太阳能发电行业，依靠多年的太阳能光伏发电领域积累沉淀，按照前期调研论证、项目核准备案、投资建设电站、项目验收（并网）、运营维护等一系列流程，努力打造优质新能源光伏电站。公司能够以客户需求、项目实际条件为基础，提供一揽子多元化、个性化的太阳能发电解决方案。,江苏舜大新能源股份有限公司,扬州市扬子江中路186号智谷大厦A座21层,321027000098002,2009-05-15,李进,20260万元人民币,913210916907697483,www.jssunda.cn
花哪儿,北京全知科技有限公司,全知科技是由一群独立开发者组成的高端软件定制服务商，不同于行业内普遍嵌套模板并二次修改的做法，我们坚持为每一位客户定制开发。深入行业，分析需求，为客户提供最佳的实现方案。 一流的用户体验，以及绝佳的设计和可靠性，是我们考量的重点。毕竟，如果只是为了做一款操作繁琐、功能凑合、设计简陋的软件，根本不用选择我们。 在追求最高品质和极致精巧方面，很多公司都会因为耗费时间或增加成本而妥协，甚至根本不在意。 但我们会比合作方还过分执着于细节，以认真的态度，做出与众不同的产品，这就是我们所坚持的工匠精神。,北京全知科技有限公司,北京市朝阳区来广营西路国创产业园6号楼三层东壹区302-166号,110105023176643,2017-03-21,莫凡,500万元人民币,91110105MA00D0P4X4,www.imuuzi.com
迈新生物,福州迈新生物技术开发有限公司,福州迈新生物技术开发有限公司是中国肿瘤病理免疫组化诊断试剂的领先者、生物医药高新技术企业。业务覆盖肿瘤病理诊断、免疫细胞化学诊断、分子病理诊断、精准医学诊断四大领域，主导产品为免疫组化检测仪器和系列试剂，营销网络遍布全国。,福州迈新生物技术开发有限公司,福建省福州市闽侯县科技东路3号福州高新区海西高新技术产业园创新园12号楼,350100100033983,1993-02-16,王小亚,5000万元人民币,913501001546216270,maxim.com.cn
花蜜信息网,广州花蜜信息科技有限公司,"""这是一个 电子商务,O2O 领域的项目。""",广州花蜜信息科技有限公司,,440106001034206,2014-09-19,张云,125.5956万元人民币,91440106304705923A,huamiwang.com
中城智慧,浙江中城智慧城市规划咨询有限公司,中城智慧是一家全域旅游目的地系统建设运营商。专注智慧旅游行业的高科技公司，业务范围包括智慧旅游规划咨询、投资建设、软件开发、系统集成、运营服务等；为乡村旅游、智慧景区、旅游目的地城市提供一体化解决方案，并运营自有乡美旅游、目的地城市旅游等多个平台。,浙江中城智慧城市规划咨询有限公司,杭州市西湖区文三路251号203室,330000000072885,2014-02-13,廖维宇,2100万元人民币,9133000009169764XL
点点乐,上海点点乐信息科技有限公司,恋舞OL隶属于上海点点乐信息科技有限公司，是一款音乐舞蹈3D手游。,上海点点乐信息科技有限公司,中国（上海）自由贸易试验区春晓路439号4幢,310115002018407,2012-09-11,汪世俊,246万元人民币,913101150545622607,www.ddianle.com
瑜伽你好,西安众享网络信息技术有限公司,瑜伽你好是一家互联网+瑜伽馆的重线下教学平台。通过整合西安市当地的线下瑜伽馆资源，让用户可以通过瑜伽你好这个平台可以实现自由选择课程的按次收费。,西安众享网络信息技术有限公司,西安市高新区丈八五路高科尚都摩卡第4幢1单元23层12301号房,610131100182515,2015-01-27,张旭,100万元人民币,91610131322362207A,www.helloyg.com
独角兽创业课,上海秦誓网络科技有限公司,独角兽创业课是为新兴企业提供创业培训服务的项目，包括活动推广、合作对接、本地社群、线上推广、人才招募等一系列相关服务。,上海秦誓网络科技有限公司,,310110000686833,2014-07-08,笪兴,137.1728万元人民币,91310110398791809Y,unicornstartup.me
奇游旅行,深圳市奇游天地信息技术有限公司,“奇游旅行”是基于旅游大数据挖掘的推荐引擎产品，为梦想出境的驴友提供一站式目的地、游记搜索和服务推荐的旅游导航站点。,深圳市奇游天地信息技术有限公司,深圳市南山区科技园虚拟大学园A座三层,440301109726417,2014-06-30,区俊杰,300万元人民币,91440300398464090K,www.qiyou365.com
蜂巢互联科技,深圳蜂巢互联科技有限公司,蜂巢互联是一家物联网技术研发商，主要经营范围是物联网、计算机信息系统的技术推广、技术研发、技术咨询、技术转让与技术服务等。,深圳蜂巢互联科技有限公司,深圳市福田区福田街道圩镇社区福田路24号海岸环庆大厦24层2408B,440300207017504,2019-05-07,马震,5000万元人民币,91440300MA5FLFKW4K
趣充电,趣充电（北京）科技有限公司,趣充电是一个共享电动车充电服务提供商，其电动车充电端口使用率达45%。公司致力于为用户提供绿色、安全(SAFE)、便捷(CONVENIENT)、负担得起(AFFORDABLE)的全场景电动出行基础设施及服务；公司的“互联网+”及“物联网+”解决方案契合国家的“智慧城市”及“美丽中国”之战略。公司拥有一批技术娴熟，经验丰富，责任心强的员工队伍，技术实力雄厚，形成了“以顾客为关注焦点、全员参与、持续改进”的质量管理体系并已通过ISO9001质量体系及研发体CMMI-L3认证；经过研发队伍的不断创新和长期工程经验积累，公司陆续推出了小区智能充电管理站、电池充换电站、电动汽车交、直流充电桩等产品并已实现标准化、规模化生产。,趣充电（北京）科技有限公司,"""北京市海淀区上地信息路1号(北京实创高科技发展总公司1-1,1-2号)1-1幢5层A栋5层029号""",110108023293769,2017-04-17,彭福根,100万元人民币,91110108MA00DKAM69,www.qpower.cc
丰盛装备,深圳丰盛装备股份有限公司,深圳丰盛装备股份有限公司位于深圳高新技术产业园，由一批一流的资深电子装备专家创办，拥有多项国家发明专利和计算机软件著作版权，是国家科委认定的专注于太阳电池生产设备、半导体设备、LED设备及自动化设备研发生产销售的国家级高新技术企业。,深圳丰盛装备股份有限公司,深圳市南山区高新区北区北环大道9018号大族创新大厦A区2楼,440301104515403,2010-02-10,王斌,5000万元人民币,91440300550340106G,www.fullshareep.com
乐宝游乐,成都乐宝游乐设备有限公司,乐宝游乐是一家集研发、生产、销售、服务于一体的综合型儿童游乐设备企业，是中国游乐设施、设备的生产商和供应商。,成都乐宝游乐设备有限公司,成都市温江区成都海峡两岸科技产业开发园科林西路618号20区202号,510123000107481,2014-12-30,赵波,200万元人民币,915101153274337649,www.lebaoyoule.com
钢研功能,西安钢研功能材料股份有限公司,"""公司是中国著名的精密合金制造骨干企业。专业研发、生产、销售精密合金、高温合金、耐蚀合金等优质金属。公司位于国家经济开发区——西咸新区,占地60余亩,生产、科研建筑面积18000度平方米,固定资产2.3亿多元。是一家集生产、科研于一体的高新技术企业。企业通过ISO9001-2008(GB/T19001-2008)质量体系认证。2006年被陕西省科技厅认证为高新技术企业。2005年公司主营业务被陕西省发展和改革委员会确认为国家重点鼓励和发展的产业。""",西安钢研功能材料股份有限公司,西安市邓六路88号,610112100009857,2001-04-20,李博,1171.097万元人民币,91610112220709601L
宜客莱,宜客莱（上海）电脑科技有限公司,ECOLA是全球3C数码周边配件领先品牌，为电脑、数码和智能移动产品提供创新的增值辅助类周边产品，以进一步提高移动技术的便捷性、高效性和愉悦感，从最初大众印象深刻的清洁保护膜、时尚USB集线器、鼠标垫、电脑包等电脑周边品类，发展到AV音频娱乐、桌面支架、智能手机周边配件、平板电脑保护套、蓝牙、充电器等十多个品类近500个单品。,宜客莱（上海）电脑科技有限公司,青浦区北青公路9138号1幢3层C区354室,310118002596713,2011-02-22,荐保亚,150万元人民币,913101185696026203,www.ecolachina.com
翔港科技,上海翔港包装科技股份有限公司,上海翔港科技包装股份有限公司，成立于2006年，注册资本7500万元人民币。公司位在浦东新区康桥工业园区。公司以质高价廉的产品、灵活快捷的服务，赢得联合利华、雅诗兰黛、Dior、欧莱雅、辉瑞制药、好时、雅培、相宜本草、百雀羚等众多国际著名品牌企业的青睐。公司拥有全新曼罗兰5色、6色、7色UV印刷机等多台国际顶级印刷包装生产线、以及目前亚洲第一台高科技高配置曼罗兰8色+2UV+联机冷烫+联线自动检测印刷机，并配套多条BOBST全自动模切机、高速糊盒机等后道生产加工设备。有力的填补了中国印刷行业高端冷烫及印刷包,上海翔港包装科技股份有限公司,上海市浦东新区泥城镇翠波路299号,310225000525832,2006-08-30,董建军,10132.04万元人民币,91310115792736664G,www.sunglow-tec.com
赛了吗,上海奔流电子有限公司,赛了吗是一个在线答题竞赛的平台，主要为个人、企业、政府机关等单位服务。是国内知名的抢答器及数码语音产品生产研发企业，拥有博士领衔的研发团队。公司秉承“技术创新、质量更好、服务更优”的宗旨，与客户精诚合作，互惠双赢，共同发展。公司研发的多种产品均得到了广大客户的好评主要产品有奔流牌系列高级电子抢答器、无线电脑抢答器、无线带电子记分抢答系统、专业抢答题库软件系统等。,上海奔流电子有限公司,上海市宝山区真陈路1398弄16号,310113000150804,1996-02-07,孙焕挺,50万元人民币,91310113630346129U,www.qiangdaqi.net.cn
鼎天体育,四川鼎天体育产业发展有限公司,鼎天体育是一家体育产品生产商，专业从事体育产品的生产、销售、安装及体育项目的策划、推动于一体的全方位、综合性的体育企业。公司在成立伊始就本着让“运动  无所不在”的经营理念，积极的将国内外各种性价比高的优质运动材料和场地提供给社会各界用户。公司目前拥有自主的橡胶卷材和人造草生产基地，其雄厚的研发、生产、设计、安装能力均得到了国外知名体育品牌公司的高度评价和赞扬。公司拥有国家质量认证中心颁发的 IS09001质量认证证书和国家建设部颁发的体育场地二级施工资质。鼎天体育愿为您带来具有国际先进水平的运动材料和场地。,四川鼎天体育产业发展有限公司,成都市武侯区玉林一巷3号,510000000138563,2006-02-15,刘洪蓉,500万元人民币,91510000785400038E,www.scjcdt.cn
贵州微联盟,贵州微联盟信息科技有限公司,贵州微联盟是本土移动互联网传播行业领导者。依托千万级粉丝的微信公众号运营，聚合平台级新媒体矩阵，为优质品牌定制互动营销解决方案，并开创众创云创客/大数据计划，创建互联网+本土生活服务闭环。贵州微联盟在贵州本地自营20多个微信公众号，积累粉丝数超过200万，并保持快速增长，各项影响力排名名列前茅，初步形成重点影响贵州、遵义、毕节，覆盖全省，连接天南地北贵州人的传播格局。 在全国自营30多个微信公众号，积累粉丝数超过800万。在全国微传播广告市场，我们稳步前行，并对助力贵州优质产品“出山”探索出快捷高效路径。贵,贵州微联盟信息科技有限公司,"""贵州省贵阳市南明区春蚕巷1号B座5,6单元1层[湘雅社区]""",520102000818956,2015-10-16,刘小翔,1500万元人民币,91520102MA6DJ7R71F,www.暂无.cn
东菱,苏州东菱振动试验仪器有限公司,苏州东菱振动试验仪器有限公司是全球知名力学环境与可靠性试验设备专业制造商和测试服务商之一，创建于1995年，是国家博士后科研工作站、国家火炬计划重点高新技术企业、国家知识产权优势企业、中国质量诚信企业等。东菱集研发、制造、销售、服务于一体，涵盖机、电、仪、软件、硬件等各种领域技术的综合应用和集成，各类试验设备100多款。产品广泛应用于国防、军工、航天、航空、船舶、轨道交通、汽车、电子等国民经济主要领域，参与了神舟系列、天宫系列、探月工程、风云系列等国家重大项目的研制建设试验相关配套工作，为国防工业和现代化建,苏州东菱振动试验仪器有限公司,,320512000013192,1996-08-08,王孝忠,2100万元人民币,91320505608240096P,www.donglingtech.com
小鹰科技,四川小鹰科技有限公司,四川小鹰科技有限公司，是一家专注于海外同城配送的互联网公司。  公司旗下产品飞带，是一个智慧物流平台，通过对国际航线的整合，结合自身数据算法提供全面的航线运力展示，根据寄户需要匹配出最佳航运渠道，简化流程，最终实现全球48小时到达，为企业和个人提供高校，快捷的物流服务。,四川小鹰科技有限公司,成都高新区紫杉路64号,510109000193521,2011-08-25,罗亮,222万元人民币,91510100580036201Q,www.feedel.net
第一通信,德仲通信科技（上海）有限公司,第一通信是一家中小企业通信及服务B2B平台。,德仲通信科技（上海）有限公司,,310110000594400,2012-05-31,顾颖,1000万元人民币,91310110596487349W
易文赛生物技术,杭州易文赛生物技术有限公司,杭州易文赛生物技术有限公司致力于研究干细胞生物技术；涉及生物医疗、生物美容、细胞培养采集等多项研究。在干细胞的储存、应用和人类基因检测方面，将与国际同步发展。,杭州易文赛生物技术有限公司,杭州市余杭区仓前街道文一西路1500号3幢402室,330184000096347,2009-09-03,戴玲华,3000万元人民币,91330110691728120Q,www.sebio.net.cn
小马创投,北京小马创业投资管理有限公司,小马创投是一个创新型的、开放的创业服务平台， 通过架构创业者、消费者以及人才之间的桥梁，打造一数据资本为基础的网络，为早期创业者提供靠谱的合伙人资源、多阶段的有价值投资、深社交的互助圈子等综合服务体系，立志成为影响世界的企业和企业家的摇篮。?,北京小马创业投资管理有限公司,北京市海淀区善缘街1号8层3-817,110108015782151,2013-04-12,马卫东,3000万元人民币,91110108067332878R,www.jinjiedao.cn
神行主驾,北京神行主驾互联科技有限公司,暂无信息,北京神行主驾互联科技有限公司,,,2018-02-26,李卫春,10万元人民币,91110106MA01AGG325
智同生物,河北智同生物制药股份有限公司,河北智同生物制药股份有限公司成立于2006年7月5日，注册资本：6000万元。定位于中国医药高科技行业尤其是高科技成果转化的专业投资业务，旨在整合科研、生产、销售方面的优势，利用团队的专业经验和优秀的投资理念，力争发展成为中国最大、最专业的医药高科技投资公司。,河北智同生物制药股份有限公司,河北省定兴县固城一号,130626000000119,未知,夏彤,12750万元人民币,91130600108345190C,www.zhitongshengwu.com
