名字,公司,介绍,公司,地址,身份证,时间,法人,注册金额,编号,网址
创冠智能,深圳市创冠智能网络技术有限公司,深圳市创冠智能网络技术有限公司是一家机器人系统集成的研发及销售商。,深圳市创冠智能网络技术有限公司,深圳市南山区北环路与深云路交汇智慧广场C栋3楼(办公场所),440301103881303,1997-11-19,李月花,5010万元人民币,91440300279439431T,www.cgzn.com
视云融聚,视云融聚（广州）科技有限公司,视云融聚（广州）科技有限公司（简称：视云融聚）成立于2017年，是一家云视频应用领域的高科技创新企业，探索和开发云视频应用领域各项前沿技术，公司围绕CLOUDVOS（cloud video os）云视频操作系统，研究大数据与行业应用、AI与业务场景结合的落地解决方案，拥有的主要技术包括AR增强现实、人工智能、云计算、大数据、数据可视化等。公司成立之初，以其创新的技术理念获得了东方网力等多个资方的战略投资，目前，公司与东方网力、阿里云等知名企业达成战略合作伙伴关系，在产品和商业上深度融合，面向公安、交通、教育、旅游等多个行业提供优秀的解决方案和服务，以视频作为信息和服务的入口，梳理、改善、深化行业业务应用，通过视频即应用，视频即服务，再造用户价值。,视云融聚（广州）科技有限公司,广州高新技术产业开发区南翔二路1号自编一栋201房之A10,440112000223740,2017-12-22,宋建江,2070.67万元人民币,91440101MA5ANCTX8R,www.cloudvos.com
聚看点,霍尔果斯驰文网络科技有限公司,聚看点是一款基于数据挖掘的内容推荐型产品，旨在为用户提供有效的新闻资讯、热门话题、视频等。一方面能为用户带来零钱收益，另一方面还可以为广告主提供高效，精准，优质的广告营销服务。,霍尔果斯驰文网络科技有限公司,新疆伊犁州霍尔果斯经济开发区伊宁园区惠远路以西伊宁大街以南52号帅府公司办公楼101室,654000055160385,2017-12-13,朱晶微,100万元人民币,91654004MA77RJH97F
德视佳,北京德视佳眼科诊所有限公司,德视佳眼科（EuroEyes）是一家来自德国的眼科激光手术中心，专注于眼科手术诊疗各种屈光不正（近视、远视、散光、老花、白内障）。其位于德国、丹麦及中国的眼科手术中心共有20多家，迄今已成为德国乃至欧洲连锁的眼科激光手术中心。1993年至今，德视佳眼科（EuroEyes）已经成功实施超过40万例眼科手术，为近视、远视、散光及高度近视（ICL人工晶体），老花眼 （三焦人工晶体）、白内障患者提供专业可靠的手术方案。,北京德视佳眼科诊所有限公司,北京市西城区金城坊街2号楼03层302区-L319,110000450287637,2015-05-28,J rn Slot J rgensen,2000万元人民币,911101023222090183,www.euroeyes.cn
南方网通,深圳市南方网通网络技术开发有限公司,深圳市南方网通网络技术开发有限公司（简称南方网通集团）创立于2007年，集产品研发、销售、服务为一体，是一家拥有自主知识产权的创新型公司。南方网通集团专注于互联网+全网营销服务，其自主研发G3云推广全网营销自助应用平台，开创了PC互联网与移动互联网双模整合网络营销时代，曾获评“2017年广东省佳自主品牌”荣誉榜单、2017中阿博览会“中国自主品牌创新贡献奖”等。南方网通致力于全网营销推广和计算机互联网信息技术领域，帮助中小型企业从产品策划、网站建设、品牌运营、营销推广、低成本精准获客、提升转化率等方面提供一站式全网营销服务，真正落地解决中小企业经营管理危机难题，助力企业品牌创新持续性发展。,深圳市南方网通网络技术开发有限公司,深圳市南山区南头关口二路智恒战略性新兴产业园16栋3楼,440301103615821,2008-09-11,费勇,114.9425万元人民币,914403006803770545,www.51g3.net
慧煜,北京慧煜纳米科技有限公司,慧煜是一家纳米材料研发商,北京慧煜纳米科技有限公司,北京市北京经济技术开发区荣华南路9号院3号楼8层802室,110302019420068,2015-06-30,任伟,1000万元人民币,91110302348442432E
开店APP,西安开好店网络科技有限公司,开店APP是一家专注于实体店开店服务的多功能一站式开店服务平台。目前以微信小程序作为运营端口，主要功能板块包括开店问答、合伙开店、新店筹备、老店转让、新铺招租、项目加盟、求职招聘、二手物品和积分商城。,西安开好店网络科技有限公司,陕西省西安市莲湖区丰庆路东口景寓学府东区16单元1802室,,2018-03-21,乔景斌,111.1111万元人民币,91610104MA6URH7C1G,www.kaidianapp.com
翎云思创网络科技,深圳翎云思创网络科技有限公司,闪电熊主打24小时健身，并通过连接App实现‘智能健身’。用户用智能手环开启门禁，健身房的灯光、空调、窗帘自动打开；用户走进健身房，根据闪电熊App推送的健身计划，逐一扫码器械进行锻炼，锻炼中器材教学视频会跟着用户的运动节奏改变，人动机动人停机停，保证运动的有效性，运动完用户健身数据会实时上传并做效果评估。,深圳翎云思创网络科技有限公司,深圳市前海深港合作区前湾一路1号A栋201室（入驻深圳市前海商务秘书有限公司）,440301112894487,2015-05-18,雷敏,500万元,91440300342516031B,www.lightningbears.com
科微智能,安徽科微智能科技有限公司,安徽科微智能科技有限公司是一家国内领先的，专业从事水上机器人及水上无人船系统研发、生产、销售、服务为一体化的国家级高新技术企业，已获得中海达（300177）、高捷资本、艾瑞资本等国内知名产业基金和风投基金的战略投资。,安徽科微智能科技有限公司,安徽省合肥市高新区创新大道2800号合肥创新产业园二期F3楼2层,340191000012818,2012-07-17,张新钊,1139.94万元人民币,91340100050185699K,www.cowis.cn
熊爸爸,熊爸爸(武汉)教育科技有限公司,"""他们一个来自IBM，一个来自UC优视，因为孩子走上了亲子创业之路，创办了熊爸爸这家亲子互联网公司，他们的想法很简单，希望通过熊爸爸的服务，让更多中国家庭，尤其是爸爸们在节假日放下加班应酬，走出房间，陪伴自己的孩子去玩耍，去探索这个未知的世界，把时间浪费在这美好的“事物”上。, 他们就是“熊爸爸”创始人徐昭，张钰慧。, 他们的使命：, 从玩沙开始，通过价格革命，让亲子游乐不再昂贵奢侈。, 从玩沙开始，通过个性推荐，让亲子生活真正丰富多彩。, 从玩沙开始，陪伴孩子，一起把时间浪费在美好事物上。, 熊爸爸的核心价值观：陪伴！（没有什么比陪伴更宝贵，因为那才是孩子要的）, 熊爸爸的企业文化：永不加班！（高效，主观能动性，超强执行力，没错，我们要打造的团队就是这样，高效的工作，按时回家好好陪伴家人，孩子，这才是我们要的生活）, 我们期待更多的人才成为我们亲子事业的合伙人，我们不仅提供非常有竞争力的薪资待遇和超前的人性化制度，最关键，我们会提供你们更多的时间去陪伴家人，孩子，你们可以做到，熊爸爸可以做到。""",熊爸爸(武汉)教育科技有限公司,,420100000464261,2015-01-13,徐昭,11.1111万元人民币,,www.xiongbaba.com.cn
托呗APP,赤峰托呗科技有限责任公司,托呗APP是一个可以在线发布需求，并且其他人可以在线接任务的服务技能交易平台。如果用户有什么自己满足不了的需求，可以在平台上发布需求，并给出悬赏，等待服务者接单。服务者也可以根据自身的条件，选择可以接的任务或者发布自己会的技能，赚取零花钱。,赤峰托呗科技有限责任公司,赤峰市松山区新天地商务楼A座7楼80725（8#楼020725号）,150404000055551,2015-02-12,战海鹏,100万元人民币,91150404328932637W,www.tuobei.top
晶钻科技,郑州晶钻科技有限公司,晶钻科技是一家专业的数字创意服务提供商和解决方案提供商。公司涉足的领域包括科博馆数字影视内容、立体电影开发、数字城市规划演示、建筑虚拟现实表现、虚拟现实教育、军事仿真、数字城市系统等。服务的客户涵盖科博馆、规划馆、军方公安、政府规划部门、房地产开发商、文博展览、院校等。,郑州晶钻科技有限公司,,410105000195634,2011-06-10,张振东,1020万元人民币,91410105576329001P
大账户,杭州聚源金融信息服务有限公司,大账户是国内首个提出“P2F云端智能财富管家理念”的互金平台，是杭州市上城区政府重点扶持的金融企业，平台与上市公司、银行、国资等背景雄厚的金融机构合作，保障用户资金安全，降低传统金融产品投资门槛。,杭州聚源金融信息服务有限公司,上城区凤山新村217号159室,330102000140249,2015-03-23,史何富,5000万元人民币,913301023281998269,www.omniaccount.com
方由体育,上海方由体育文化发展有限公司,方由体育是一家综合性的体育服务平台，提供赛事运营，场馆运营、体育产业投资等综合性体育服务.公司拥有一支专业化、经验丰富的体育运营人才队伍，并建立完善的赛事包装推广、组织承办、管理控制等全方位的高效业务运营机制。 公司目前已拥有唐山国际马拉松，日照沙滩马拉松，日照国际马拉松等赛事。,上海方由体育文化发展有限公司,上海市金山工业区亭卫公路6495弄168号5幢1楼017室,310116003520834,2016-06-07,周赛,500万元人民币,91310116MA1J8GN187,www.rzsport.gov.cn
丫米厨房,上海贝萌网络科技有限公司,丫米厨房是一个美食界版的Airbnb，通过整合家厨资源，同时提供油米等原材料保证食材品质，让白领的吃到放心的工作餐。,上海贝萌网络科技有限公司,上海市虹口区新建路203号底层7090室,310109000693044,2014-12-16,丁其骏,12.5万元人民币,,www.iqiyi.com
柏康机电,南京柏康机电科技有限公司,柏康机电是一家研发、设计、生产、销售（渠道）于一体的高新技术企业，专注于“手机信号侦测管理控制系统”等产品。,南京柏康机电科技有限公司,南京市江宁经济技术开发区芳园中路1号,320121000066644,2005-01-07,翟明圣,300万元人民币,913201157681699466,www.bokangtech.com
芯碁,合肥芯碁微电子装备有限公司,"""合肥芯碁微电子装备有限公司于2015年合肥市国家级高新技术开发区成立,是一家专业致力于半导体无掩膜光刻设备、检测设备、高端PCB专用激光直接成像设备（LDI）研发和生产的高科技企业。""",合肥芯碁微电子装备有限公司,合肥市高新区创新大道2800号创新产业园二期F3楼11层,340191000056216,2015-06-30,程卓,7651.8721万元人民币,91340100348841353K,www.cfmee.cn
龙猫科技,长沙市龙猫信息科技有限公司,"""长沙市龙猫信息科技有限公司拥有雄厚政府资源,丰富的市场关系,从事政府企业应用服务、 商业智能、应用开发与维护、移动解决方案、软件开发与业务流程一站式服务，满足客户对无缝交 付和技术支持的需求,为客户提供零障碍沟通的个性化定制与最佳经济收益完美结合的优质服务,支 持客户的业务发展战略。 公司以人为本，尊重人才，重视人才，为您展现个人能力提供广阔平台。""",长沙市龙猫信息科技有限公司,长沙高新开发区谷苑路186号湖南大学科技园有限公司创业大厦401A24室,430193000067725,2014-05-15,洪阳,100万元人民币,914301000998663059,longmao.sinacorp.cn
小芽启萌,广州萌小芽信息科技有限公司,萌芽研究所BUD是一个母婴原创自媒体平台，平台提倡科学育儿，关注０到６岁宝宝的中西文化教育、生活养育和同龄妈妈备孕、孕期健康等，致力于为用户提供有关母婴方面的优质内容。,广州萌小芽信息科技有限公司,广州市天河区华强路3号之一2204房（仅限办公用途），广州市天河区华强路2号2914房（仅限办公用途）,440106001195561,2015-05-08,罗利娜,300万元人民币,91440106340190461D,www.mymengya.com
海存志合,北京海存志合科技股份有限公司,海存志合是一家专业从事私有云解决方案产品研发与推广的高科技企业，凭借多年来对行业的认知和探索，致力于打造教育云解决方案第一品牌。本着“安全、绿色、创新”的理念，公司围绕私有云建设打造了数据存储、容灾备份、虚拟化、云桌面、智慧课堂、超融合一体机、电子档案袋存储系统等一系列产品。,北京海存志合科技股份有限公司,北京市海淀区信息路甲28号7层D座07A28,110108008010665,2005-03-08,游波,670.588万元人民币,91110108771957900Y,www.seastor.com.cn
郑州西工,河南省西工机电设备有限公司,河南省西工机电设备有限公司成立于2002年，位于河南省郑州市，占地面积约4万平方米，现拥有5000余万元资产，专业从事焊丝生产设备及非标准生产设备的开发研制、生产和技术服务，拥有自已的技术研发中心、一流的管理团队、先进的生产加工设备和专业的、高素质的一线生产队伍。2004年通过ISO9000认证，业绩每年都保持着高速增长，2010年产值达到1亿元人民币。,河南省西工机电设备有限公司,郑州经济技术开发区(郑州国际物流园区)梅香路西段路南,410102000024869,2002-06-06,朱庆德,3600万元,91410100739078105A,www.xigong.com.cn
掌上纵横,掌上纵横信息技术（北京）股份有限公司,掌上纵横信息技术(北京)股份有限公司主营业务为影视、明星版权运营，影视、明星版权游戏研发和发行。公司以市场需求为导向和创新的跨界思维整合影视、明星、游戏、渠道等多方资源，致力于为影视作品、明星打造专属游戏，开创IP游戏O2O模式，即充分利用影视、明星IP的粉丝效应助推游戏发行，同时将线下票务、明星见面会、衍生品等娱乐权益增值服务回馈给游戏玩家。　　目前，公司已经初步搭建了“IP+自研+SDK+发行+渠道”产业生态圈，并打造了“好游戏，Gamedo”业务品牌。公司在实现影视、明星与游戏跨界融合之际，形成了一条,掌上纵横信息技术（北京）股份有限公司,北京市海淀区花园路13号129楼210室,110108010450889,2007-08-30,刘仕儒,7680.6131万元人民币,91110108666946070M,www.gamedo.com.cn
便利客,山东便利客智能科技有限公司,便利客是一家专注于移动互联网应用以及智能物联网软硬件技术研发的企业。其自行研发的智能售货机和网络系统平台，可以为企业、学校以及公共场所，提供各类基于智能零售的便利自助服务解决方案，同时为针对快消品、实体产业、互联网机构等品牌的媒体推广、品牌宣传等提供全新的基于智能零售的新型互动营销解决方案。,山东便利客智能科技有限公司,山东省济南市市中区万寿路2号园区2-13、2-14,370100200285244,2015-08-12,孙亮,2000万元人民币,91370100353479352N,www.blkee.com
莱斯特,青岛莱斯特智能科技有限公司,莱思特智能科技是一家专业研发设计生产室内/外LED照明传感器产品的高科技企业，2013年研发的室内LED照明传感器具有相关发明和实用实型专利，广泛使用于办公室、会议室、图书室、工埸车间、洗手间等室内场所，真正实现人在灯亮，人走灯暗的功能。,青岛莱斯特智能科技有限公司,山东省青岛市崂山区科苑纬一路1号B座22层2201室,370202230215852,2015-04-01,杨磊,100万元人民币,913702123214218773,www.lifesmartt.com
飞康生物医药,苏州飞康生物医药有限公司,飞康生物医药是一家POCT体外诊断试剂和智能健康设备研发商，主要产品包括便携式智能健康设备和具有自主知识产权的新型体外诊断试剂。,苏州飞康生物医药有限公司,太仓港经济技术开发区银港路52号,320585000212566,未知,王锋,555.5556万元人民币,9132058531414981XM,www.facon-biomed.com
育豚网络,上海育豚网络科技有限公司,育豚网络是一个由微软、盛大团队打造的线上投资者教育平台.,上海育豚网络科技有限公司,上海市嘉定区科福路358_368号4幢1层E区J3067室,310114003404368,2018-01-08,姚斌,1000万元人民币,91310114MA1GUF1L67,www.redolphin.cn
尤利特,成都尤利特光电科技股份有限公司,成都尤利特光电科技股份有限公司的主营业务为无色光学玻璃的研发、生产、加工和销售，目前，公司主要产品为镧冕玻璃(H-LaK)、镧火石玻璃(H-LaF)、重镧火石玻璃(H-ZLaSF)、重火石玻璃(H-SF)、低熔点玻璃(D-)和眼镜片玻璃(SLW)。　　公司成立初期，主要以镧系（稀土）光学玻璃产品的研发、生产、加工和销售为主，提供给中游生产商，进一步加工后销售给下游终端厂商，最终应用于消费类电子产品，例如单反数码相机镜头。镧系（稀土）光学玻璃是一种组份中含有较多氧化镧(La2O3）及其他稀土元素的高档玻璃，是,成都尤利特光电科技股份有限公司,成都市双流区西航港街道空港三路629号,510122000100293,2011-12-23,王自力,3620万元人民币,915101005875517244
我爱丹青,我爱丹青(北京)艺术经纪有限公司,“我爱丹青”是以“我爱丹青艺术大数据库”，以“我爱丹青电商平台”为纽带，通过加盟全国范围内的画廊、美术馆、艺术机构来实现资源共享、共谋发展；以规范艺术品市场、提倡艺术作品为唯一话语权的艺术产业机构。，隶属于我爱丹青(北京)艺术经纪有限公司 ，公司从事文化经纪业务;组织文化艺术交流活动(不含演出);承办展览展示活动;会议服务;技术推广服务;设计、制作、代理、发布广告;电脑图文设计;文学创作;绘画技术培训(不得面向全国招生);书法技术培训(不得面向全国招生);声乐技术培训(不得面向全国招生);舞蹈技术培训(不得面向全国招生);版权贸易;舞台灯光、音响设计;企业策划;经济贸易咨询;公共关系服务;销售工艺品、日用品、玩具、文具用品、体育用品、珠宝首饰。,我爱丹青(北京)艺术经纪有限公司,北京市朝阳区酒仙桥路4号院内(国营第七九八厂中区)第62幢4号,110105019974979,2015-10-12,齐强得,500万元人民币,91110105MA00160Y7N,m.woaidanqing.cn
火蝠电商,武汉火蝠电子商务有限公司,火蝠电商为客户提供电商运营托管，品牌运营，视觉设计，新媒体运营，客服外包等服务，一站式解决客户从产品定位，包装，设计，再到运营，营销，品牌建设等多方面问题。,武汉火蝠电子商务有限公司,洪山区卓刀泉路108号凯乐桂园S-1栋A单元11层1室,420106000366468,2014-07-29,钟雨清,500万元人民币,91420106303501275D,huofutp.com
鹰卫浴,新乐卫浴（佛山）有限公司,新乐卫浴（佛山）有限公司生产及经营鹰卫浴（YING）品牌产品，是西班牙乐家集团（ROCA GROUP）全资附属公司。YING创建于素有“南国陶都”之称的佛山，其前身石湾工艺美术厂成立于1974年，以从事生产美术陶瓷而久负盛名，在不断发展壮大中积累精湛的陶瓷工艺技术，并于1994年创立YING品牌，成为国内历史悠久、具有深厚实力的卫浴品牌。2006年，YING成为乐家卫浴集团旗下品牌，目前，YING卫浴产品体系涵盖智能坐便器、陶瓷件、龙头、浴室柜、淋浴房、浴缸、厨房水槽、五金配件及公共产品等近十个品类；全国八大生产基地分布于台湾、佛山、唐山、江门和苏州等地，配置德国、意大利进口生产制造设备，确保质量和安全各项指标符合甚至超出欧洲标准。,新乐卫浴（佛山）有限公司,佛山市禅城区石湾来长岗工农新村2号厂内1幢E座,440600400006791,2006-06-29,JAVIER IGLESIAS PARADINAS,3770万美元,91440600789482245B,www.ying-sw.com
i换,江西蓝众信息技术有限公司,"""i换隶属江西蓝众信息技术有限公司,专注上门手机快修的服务平台深耕行业10余年，线上系统线下门店结合,为用户提供30分钟手机快修,免费上门、低价透明、全程录像、质保180天。""",江西蓝众信息技术有限公司,江西省南昌市西湖区广场南路205号恒茂国际华城16栋B座1306室,360100210401092,2015-05-22,黄良斌,1000万元人民币,913601003432044866,www.inghuan.com
友谊集团,广州友谊集团有限公司,友谊集团是一家百货商场运营商，以高级百货商店为定位，拥有逾10万平方米自有物业、4家门店，分别为环市东商店、正佳商店、国金商店和友谊OUTLETS购物中心，为用户提供国内外品牌商品以及线上购物服务。,广州友谊集团有限公司,广州市越秀区环市东路369号自编2号楼,440101000392205,2015-12-09,江国源,10000万元人民币,91440101MA59B3DT2H,www.cgzfs.com
百力司康,百力司康生物医药（杭州）有限公司,百力司康是一家肿瘤靶向和免疫治疗药物研发商，致力于肿瘤靶向和免疫治疗的生物制药的研发和产业化，产品涉及与日本卫材Morphotek合作开发的抗体偶联药物ADC的产品管线，其中第一个ADC项目将于2019年初进入FDA临床试验IND申报阶段。,百力司康生物医药（杭州）有限公司,浙江省杭州经济技术开发区白杨街道6号大街452号2幢C2202-2203号房,330100400063523,2017-12-07,ZIPING WEI,129.1666万元人民币,91330100MA2AYKP17D
云鹰智能,长春凤凰惠邦科技有限责任公司,云鹰商业防损及行为管理分析系统是基于行为分析技术面向商超推出的防损监管服务。系统与商超收银POS系统绑定，锁定漏扫商品，利用行为分析技术实时监控和分析收银员行为与商品信息，完成收银行为监管，系统可根据客户需要，生成分析报告。云鹰系统在降低收银损耗、减少防损员成本的基础上，帮助用户规范收银员行为，减少管理漏洞，使管理更加规范化、程序化，进而提高用户的整体管理水平。,长春凤凰惠邦科技有限责任公司,,22010702000578X,2002-01-21,战国新,1900万元人民币,91220101730780977J,ccfhhb5655755.cn.gongchang.com
中梁和置业,九江市中梁和置业有限公司,中梁和置业是一家房地产开发服务商，主营房地产开发与经营以及商品房销售、基础设施建设投资、土地开发建设等领域的业务，致力于提供房产建筑领域的综合解决方案，旗下代表项目为住宅楼盘中梁首府。,九江市中梁和置业有限公司,江西省九江市九江经济技术开发区前进西路奥林匹克花园43幢一单元1002,360406110000823,2017-02-14,何银辉,2000万元人民币,91360406MA35PQQE41
泽东服饰,上海泽东服饰有限公司,上海泽东服饰有限公司目前旗下拥有本土潮流品牌HIPANDA、高端暗黑系列品牌UNDEROATH、生活方式品牌BLANK以及国内尖端潮流眼镜品牌POPEYE。,上海泽东服饰有限公司,,310118002203702,2004-02-26,何靓,500万元人民币,91310118759554252W,www.hipanda.org
必爱旅行网,广东穗阳商务服务股份有限公司,必爱旅行网是一家在线旅游服务提供商，提供旅游预订、酒店订房、景区门票预订、租车等服务，广东穗阳商务服务股份有限公司旗下网站。,广东穗阳商务服务股份有限公司,广州市天河区珠江东路30号601（自编601-B）（仅限办公用途）,440101000245736,2013-09-30,杨斌昌,1021万元人民币,91440101080354713G,www.beiii.com
件婆婆,贵州件婆婆信息技术有限公司,件婆婆是一个汽车原厂配件B2C网站，进行零件需求大数据的收集和整理，致力于为车主们提供一个值得信赖的原厂零件外销平台。,贵州件婆婆信息技术有限公司,贵州省贵安新区贵安电商生态城京安大道中国贵安电商生态城内,520900000043320,2015-09-07,杨精博,75万元人民币,91520900356416234M,www.jianpopo.com
大库存,浙江库哥网络科技有限公司,大库存是库存产业的服务商，服务全国400万库存经营商户，与三亿零售商，2017年，大库存与义乌市库存品协会，奥特莱斯、内衣风杂志、百度 公司、腾讯、阿里巴巴、微商创业园等多家大型产业服务公司达成战略合作，深入产业内核，对服务进行升级，做 中国最大最好用的库存服务商而努力。 迄今为止，大库存作为国内领先的库存贸易服务商，服务的商家涵盖28个大类，上千种品类，成功撮合成交超 3.8万笔交易，总金额超2亿，泛覆盖区域超过28个省，超过2000万影响用户。,浙江库哥网络科技有限公司,,330782000637242,2015-12-30,曾义雄,1000万元人民币,91330782MA28D8828U,www.dakucun.com
