名字,公司,介绍,公司,地址,身份证,时间,法人,注册金额,编号,网址
兴康信,厦门兴康信科技股份有限公司,"""公司从1996年的“南京挪康机电”到如今的“厦门兴康信电子有限公司”,兴康信经历了二十年的发展,从开始的服务商转变成了目前中国大陆专业的船舶交通管理系统(简称VTS系统)集成商。随着中国交通部对船舶交通安全的日益重视,中国政府近几年陆续投资建设了40多个大型的VTS系统,该系统广泛用于近海海域和内河上的船舶交通航行的指挥和管理,厦门兴康信公司已在这个领域崭露头角。    2005年,我们承接了连云港海事局船舶管理信息系统(VTS系统)的工程建设、设备调试、系统验收和设备运维服务。2006年,我们承接了天津海""",厦门兴康信科技股份有限公司,厦门市软件园望海路55号A201单元,350298200005548,2004-09-28,陈灿斌,1280万元人民币,91350200761738536X,www.citxm.com
国民健康云,深圳海王集团股份有限公司,海王集团（深圳海王集团股份有限公司）成立于1989年，总部位于广东深圳，多年来专注于医药产业发展，已形成涵盖医药产品研发、制造、流通和零售的完整医药产业链，是国内知名的大型综合性医药企业集团，目前拥有海王生物（深圳）、海王英特龙（香港）、海王星辰（纽约）三家规范运作的上市公司，多年来名列“中国民营企业500强”和“中国民营制造业500强”排行榜前列。,深圳海王集团股份有限公司,深圳市南山区科技中三路1号海王银河科技大厦27层,440301501135110,1994-06-27,张思民,12051.62万元人民币,91440300192214061U,www.neptunus.com
闪连,天津闪连电子商务有限公司,"""天津闪连电子商务有限公司（www.84858687.com） 位于天津市东丽经济开发区五经路帝达东谷国际2号楼10楼全层，是一家以航旅业电子商务为契机，集研发、运营为一体的航旅电子商务公司。公司预打造一个集团化、综合型航旅电子商务平台,并成立企业五大建设事业部，分别为：航空事业部、物流事业部、旅游事业部、酒店事业部、网上商城事业部。 一直以来，我们始终秉承“用心服务、热情真诚、善良感恩、严谨细致”的企业理念，全方位涵盖机票代理人采购平台、分销平台、呼叫中心平台、B2B/B2C商旅平台，并提供如酒店、会议、行""",天津闪连电子商务有限公司,天津市东丽区东丽开发区一纬路24号东谷中心2号楼906室,120110000229042,2014-11-05,汤文革,200万元人民币,91120110300514820A,www.84858687.com
杰夫与友,重庆杰夫与友文化创意有限公司,杰夫与友，隶属于重庆杰夫与友文化创意有限公司，是一个室内空间智能营销墙运营商，专注于墙面动态软装。产品定位：实体商业空间的数字化装饰 - 结合技术和艺术改变生活，实现实体空间内容远程快速控制。,重庆杰夫与友文化创意有限公司,重庆市渝中区中山四路89号8幢8-614,500107007575195,2014-12-12,熊义辉,65.7896万元人民币,91500107327787351W,www.jeff1992.cn
澍矩视觉,重庆市澍矩动画制作有限责任公司,“澍矩动画制作有限责任公司”及子公司“澍矩视觉科技有限公司”以下简称“澍矩视觉”——是一家专业的视觉科技企业。本着创意为先，服务为本的理念为客户提供数字视觉创意综合解决方案，致力于把艺术与科技完美融合，为客户创造更高的价值。,重庆市澍矩动画制作有限责任公司,重庆市九龙坡区黄桷坪街126号（501艺术基地1号楼3层1011号）,500237000004446,2009-12-09,陶澍,500万元人民币,91500107696596964Y,www.sj501.com
天津科源,天津科源创业投资管理有限公司,天津科源是一个投资管理服务商，主要从事创业投资、投资咨询、管理咨询等业务。公司股东实力雄厚，在能源投资与创业投资领域影响力较大，为公司运营提供坚实保障。,天津科源创业投资管理有限公司,天津市河西区台儿庄南路118号327-B,120103000136818,2010-09-13,张瀛,300万元人民币,9112010355949649X3
云宣众行,北京云宣众行信息咨询有限公司,云宣众行是一家基于大数据背景下的婴童产业动销策略研究机构，致力于为婴童产业品牌商提供切实可行的动销策略，帮助上下游产业链之间的资源及渠道对接，为婴童产业企业提供市场研究报告、整合传播策略、渠道策略、终端零售策略、消费趋势报告及消费者精准研究等数据分析和动销项目服务。,北京云宣众行信息咨询有限公司,北京市朝阳区东四环中路39号3层B单元325,110105016546694,2013-12-09,张勇,100万元人民币,911101050855173154,www.osharely.com
中科智巡,广州中科智巡科技有限公司,中科智巡是一家致力于为能源行业提供人工智能和空间数据信息产品研发及技术服务的高科技企业。公司依托中国科学院计算技术研究所、武汉大学、同济大学等科研机构的技术和人才优势，在无人机图像信息处理、人工智能、机器视觉、三维可视化等领域具有丰富的技术储备。公司以“用智能科技让能源巡检工作更安全、更高效、更美好”为使命，研发了电力巡检智能缺陷识别系统、无人机电力巡检自动驾驶系统、全维度大数据管理平台等一系列智能巡检产品，为实现能源行业装备智能化和运行智慧化提供全方位的解决方案。目前公司客户主要有国家电网有限公司、中国南方电网有限责任公司、中国石油化工集团等。,广州中科智巡科技有限公司,广州市南沙区成汇街1号商务办公B栋西梯1109房(仅限办公用途),440110000044365,2014-10-17,汤坚,2000万元人民币,9144010130458229X5
洲信,上海洲信信息技术有限公司,洲信是一家从事互联网及电信增值服务业务的科技企业。公司产品涉及了涉及了休闲娱乐、信息咨询、电子商务应用等各个领域。形成以洲信聚优惠、淘宝家园，优生活业务、通信助理、铃音盒手机杂志业务、及文化基地，智能城市等服务平台。,上海洲信信息技术有限公司,上海市静安区共和新路912号1810室,310108000277446,2002-04-30,陈平,1000万元人民币,91310108738530366R,www.trasin.net
食全食美,食全食美（上海）农业科技股份有限公司,食全食美（上海）农业科技发展有限公司运用先进的美国有机生产、管理技术进行有机生产，与全国各大生态、有机种植生产基地建立紧密合作，以营养学为指导科学搭配膳食，为客户提供专业的饮食咨询服务；遵行笃行天然、有机农产品永续的生产理念，运用先进的物流管理系统，在第一时间将产品送达客户，打造生态、有机食品的会员制销售配送平台。,食全食美（上海）农业科技股份有限公司,上海市嘉定区嘉松北路6988号103室,310114001852881,2008-01-21,代福平,1310万元人民币,91310000671129841C,www.shijialife.com
沃得尔,浙江沃得尔科技股份有限公司,浙江沃得尔科技股份有限公司旨在研发，生产，销售汽车电子传感器及电磁模块等产品。公司的主要产品有汽车动力总成的各类传感器包括温度传感器（水温和油温）、凸轮轴相位传感器、曲轴转速传感器、变速器转速传感器、拨叉位置传感器、PRND挡位传感器、空档位传感器；点火线圈及电子节气门体、磁信号轮。,浙江沃得尔科技股份有限公司,台州市开发大道东段818号一幢一楼,331002000056435,2012-01-10,黄留肖,6500万元人民币,913310005890238885,www.wodell.com.cn
闽通天下,莆田市闽通天下信息技术有限公司,闽通天下是一个第三方金融服务平台，业务包含两部分：第三方支付（拉卡拉，速刷）全省代理、金融业务是宜信、平安新一贷、陆金所、浦发、兴业银行的全省及市级渠道商。,莆田市闽通天下信息技术有限公司,,350302100071804,2014-09-25,陈兆宇,200万元人民币,91350302315528838B
纳美牙膏,杭州纳美科技有限公司,杭州纳美科技有限公司是一直专注于将高科技应用于口腔护理产品的高端口腔护理品牌。,杭州纳美科技有限公司,浙江省杭州市余杭区闲林街道闲兴路35号,330106000008796,2003-05-13,贾英,10100万元人民币,913301107494693884,namei.tmall.com
壹写作,深圳市赛雅科技有限公司,壹剧本是一个开放平台，是为编剧与传媒提供交流与展示的平台，通过大量的技术创新提供剧本创作极低的准入门槛，提供最新原创剧本的阅读，推荐及新生代编剧的培养，一键生成电影，微电影，电视等产品雏形。,深圳市赛雅科技有限公司,深圳市福田区莲花街道莲花北村1-27G,440301112837052,2006-11-09,付林争,50万元人民币,91440300795424324M,www.ciiat.com
京庆重型机械,重庆京庆重型机械股份有限公司,重庆京庆重型机械股份有限公司是专业从事选矿生产线技术及设备集成、建材生产线技术及设备集成、高精度、硬齿面系列工业大型非标传动装置、破碎系统及烧成系统集成等系列产品研发，集研发、设计、生产与销售为一体的国家高新技术企业。,重庆京庆重型机械股份有限公司,重庆市渝中区新华路220号16-14#,500103000015268,2000-02-14,张进才,3780万元人民币,91500103203938154E,www.cqjqhm.com
易相互,易相互投资管理（北京）有限公司,易相互是一家主打互助保险的创新型保险服务商，隶属于易相互投资管理（北京）有限公司。,易相互投资管理（北京）有限公司,北京市朝阳区光华东里8号院1号楼1层101内F3-S-01,110105020786670,2016-03-08,易辉,1811.5383万元人民币,91110105MA00402877
柚动,江西卡乐体育产业有限公司,柚动是一家赛事运营服务提供商，公司为用户提供路跑赛事、定向越野、球类等赛事运营服务，包括赛事报名、赛事定制、照片展示等一系列服务，旨在为用户提供优质的体育赛事运营和娱乐平台。,江西卡乐体育产业有限公司,江西省南昌市南昌高新技术产业开发区紫阳大道988号酷加天虹6楼601,360106210043992,2015-07-14,李云峰,200万元人民币,91360106343358397H,www.yoezan.com
Jown Sport,北京卓望体育文化有限责任公司,Jown Sport是一家智能数据掌控的足球训练服务商。全实景模拟、专业多模式控制、大数据分析；有效提升停球、视野、传球、射门、反应、战术配合、体能能力；10分钟的触球量大于1场比赛的触球量，严酷训练模式让球员从容应对比赛场景；适用业余爱好者、青少年球员、职业球员。,北京卓望体育文化有限责任公司,北京市海淀区北洼西里19号A507,110108020559858,2016-01-18,宋荣昌,200万元人民币,91110108MA0036FC3P
高勤信科,北京浩运金能科技有限公司,浩运金能致力于新型能源转换材料的研发和产业化工作，是专业的镍氢电池、锂离子电池、燃料电池等新型电池和相关的能源转换材料及氢制备、储存和应用相关产品的研发和生产企业，拥有国内顶级的专业技术开发队伍，具备全套的生产技术和持续研发能力，并有多年的生产运营经验。,北京浩运金能科技有限公司,深圳市南山区桃源街道留仙大道1183号南山云谷创新产业园山水楼5楼A1,110108001486577,2000-08-02,张沛龙,3500万元人民币,9111010872396097X7,www.bjhaoyun.com
恒耐陶瓷,上海恒耐陶瓷技术有限公司,恒耐陶瓷是一家集科研、生产、经营于一体的先进陶瓷企业，致力于将纳米技术与凝胶注模成型技术相结合，研发了高精度高压陶瓷柱塞泵，高压陶瓷阀门，多孔陶瓷吸盘，高精度陶瓷导轮等结构陶瓷件及功能陶瓷。,上海恒耐陶瓷技术有限公司,上海市松江区车墩镇联民村188号1号楼一层102室,310227001526716,2010-04-20,陈凤宇,450万元人民币,91310117554264737J,www.hncera.com
派途科技,派途科技成都有限公司,公司是一家专注于大型电子商务平台系统和购物中心全渠道IT解决方案的研究与开发。,派途科技成都有限公司,成都高新区盛和一路88号1栋2单元18层1811号,,未知,黄琳,100万人民币,91510100MA61RTL5X7,www.pai2.cn
成都银行,成都银行股份有限公司,成都银行成立于1996年，是一家由地方政府、企业法人和境外投资者共同参股的新型股份制商业银行。自成立以来，成都银行始终坚持“立足地方经济，立足中小企业，立足广大居民”的市场定位，依法稳健经营，严格规范管理，实现了持续稳定的发展。尤其是近年来，伴随着中国经济的快速增长，成都银行取得了长足的发展。,成都银行股份有限公司,成都市西御街16号,510100000040263,1997-05-08,王晖,361225.1334万元人民币,91510100633142770A,www.bocd.com.cn
双洲科技,北京双洲科技有限公司,"""北京双洲科技有限公司的前身成立于1992年，当时主要为中央机要局、国家安全部、人民银行、中国民航、电信总局、北京市奥运项目等核心单位提供定制安全产品及方案设计、研发及运维技术支持。公司与2006年更名为双洲科技，公司自创立伊始，时刻关注信息安全行业最新需求，创新发展应用安全理念，立足于核心技术全部自主研发，公司产品及解决方案获得了国内最高等级的安全认证，并经受了党政军核心部门的实践检验。双洲创新提出了""""集中应用、终端无痕""""的安全理念，并由技术层面的安全支持管理层面的安全，即建、管、用三权分立。基于上述理念，公司创新发展应用安全理论，在IP阻断、加密存储等多项技术方面都有突破。在等级保护和分级保护的基础之上，系统化的融合了孤立的安全技术手段，达到了全面防 止涉密信息泄漏的安全效果。由双洲自主研发的uniLink应用安全管理系统，已获得解放军测评中心军B+级认证。该产品不但能解决信息安全核心问题-文档泄密问题，还能够与内网、OA系统及多种业务应用相结 合使用，为题提供安全保障。进而在uniLink安全架构基础上，公司提出了整体安全解决方案，在全国网、省部委纵向网、单位局域网等多种网络和应用环境下，得到了实践的认可。自成立以来，双洲公司一直坚持走中国人自己的独立创新之路，建设不依赖于数据库和操作系统的安全产品和方案，我们将携手各方合作伙伴，共同创建一个属于中国人自己的信息安 全新天地，为党和国家的信息安全做出贡献""",北京双洲科技有限公司,北京市朝阳区安立路66号4号楼III段11层,110108001054959,2006-11-09,章翔凌,1166.6667万元人民币,91110105795987071Y,www.z2sci.com
朗汉传动,上海朗汉传动科技有限公司,朗汉传动是一家电机产品研发商，主要产品包括柔性电机、柔性调速电机、变频减速电机以及变磁减速电机等，旗下拥有品牌“锘威”，产品主要应用于电子、印刷以及包装等领域，同时还为用户提供电机定制服务。,上海朗汉传动科技有限公司,上海市浦东新区秀浦路2388号2幢1210室,310115002497687,2014-11-24,劳宁宁,450万元人民币,91310115323182574G
金煤科技,北京金煤创业科技股份有限公司,"""公司致力于耐磨材料、复合材料及新材料产品的开发,向冶金、矿山、热电、铁路、农业机械等行业用户提供高效耐磨耐热铸件产品。公司主营业务为耐磨铸件产品的研发、设计和销售,公司产品涵盖高锰钢,高铬铸铁,镍硬铸铁及铁基陶瓷复合材料类产品。现阶段公司的耐磨铸件产品主要出口欧美市场。""",北京金煤创业科技股份有限公司,北京市石景山区古城西街19号研发生产楼D座南楼二层202室,110107009425835,2006-03-23,李刚,800万元人民币,91110107786895116M,www.djm-bj.com
喜吧科技,上海喜吧信息科技有限公司,喜吧科技是一家致力于从事网络科技、信息科技、计算机科技技术领域内的技术开发、技术咨询的公司，提供货物及技术的进出口业务，转口贸易相关服务，为企业提供信息化解决方案。,上海喜吧信息科技有限公司,中国（上海）自由贸易试验区加太路29号2号楼东部503-A06室,310141000100026,2014-08-01,田中君,1200万元人民币,91310115312395419E
小资吉安,吉安市知造信息技术有限公司,小资吉安产品定位：本地信息聚合平台、本地商家用户联动社交平台、本地新媒体运营平台。,吉安市知造信息技术有限公司,,360802210033399,2015-04-16,刘家忠,100万元人民币,91360802332937959G,www.timeifly.com
康英,深圳市康英科技有限公司,深圳市康英科技有限公司位于深圳市高新技术产业园，是专业从事医疗物联网和医疗专用无线网络研究开发的高新技术企业。康英科技依托自身的行业经验，自主研发了医疗专用无线网络、母婴安全管理系统、物联网手术室管理系统、物联网病患监护系统、物联网资产安全管理系统、医疗冷链监测系统等多种医疗物联网应用系统，以及物联网智能腕表、医用PDA等医疗级的移动终端。目前，康英科技各类应用系统产品均已经广泛应用于全国多所医院的医疗业务中，为医院实现移动医疗、智慧医疗提供了完善的服务与支持，并获得了良好的用户反响。,深圳市康英科技有限公司,深圳市南山区高新技术产业园北区朗山2路6号赛霸电子大厦608单位,440301501150297,2015-03-30,LIU YUNQI,1145.4754万元人民币,914403003296116401,www.konying.com
思琪丽华,深圳市思琪丽华数码科技有限公司,深圳市思琪丽华数码科技有限公司成立于2009年，公司主要依托亚马逊，eBay，速卖通，Lazada，阿里巴巴国际站等第三方电子商务平台，从事跨境电子商务（B2C）及国际贸易（B2B）经营活动，产品涵盖电子、数码、玩具、工具等等，畅销世界各个国家。,深圳市思琪丽华数码科技有限公司,深圳市龙华新区民治街道民治大道与民康路交汇处东浩大厦2楼D单位,440301103813030,2009-01-13,刘瑞创,500万元人民币,91440300683786961D
精时精模,广东精时精模科技股份有限公司,精时精模是一款整合模具制造商、原材料供应商、模具设计师等各方面资源，模具行业在线定制B2B电子商务平台，致力于升级传统企业经营模式，为全球中小型制造企业提供与大型制造企业同等水准的模具设计、开发、加工等服务及成套的解决方案。,广东精时精模科技股份有限公司,东莞市黄江镇田美村长盛工业园A栋1楼,441900002485976,2015-05-19,袁巍林,1000万元人民币,91441900337953392H,www.jsjmo.com
超极袋鼠,北京超极袋鼠互联网科技有限公司,超极袋鼠是一家医疗科技产品研发生产一站式服务商，主要经营范围包括染色体分析技术、基因诊断技术以及生物科学等的应用与推广，通过投资组建现代化大型医学检验实验室，致力于为客户提供医疗设备和医疗检测等服务。,北京超极袋鼠互联网科技有限公司,北京市丰台区外环西路26号院53号楼-1至4层1201内4层401-402（园区）,110106018891512,2015-04-08,史剑雄,1865.68万元人民币,911101063182267712,www.fmr1-test.com
大壮电子商务,山东大壮电子商务有限公司,山东大壮电子商务有限公司，是一家新型的电子商务公司，旗下有天润嘉合商城，山东购奥德商贸有限公司。,山东大壮电子商务有限公司,山东省济南市高新区经十路6599号普利广场三楼301室,370102200253652,2016-01-22,亓春涛,3000万元人民币,91370102MA3C5XQ73C,www.igo-mall.cn
三方新华,三方新华控股（北京）有限公司,三匚创意是一家创意产业服务提供商，致力于为设计、演出、电子商务等行业建设创意产业生态链，以文化产业领域为切入点，集创意、娱乐、演出、新型院线布局运营于一体，为用户搭建创意服务平台，业务主要包括主题秀、浸入秀、表演秀、微秀四个板块。,三方新华控股（北京）有限公司,北京市朝阳区酒仙桥路2号院内(国营第706厂北厂区)第24幢一层112号,110107015024788,2012-06-26,周可为,1055.55万元人民币,911101055976708231,www.3cholding.cn
唐人通服,唐人通信技术服务股份有限公司,"""江西唐人通信技术服务股份有限公司是一家提供通信网络技术服务的高新技术企业,是国内领先的通信技术服务商,具备工信部颁发的通信信息网络系统集成甲级资质,主要为运营商提供包括核心网、无线网、传输网等全网络层次的通信网络技术服务和通信网络工程等服务。    公司业务领域覆盖通信网络设计优化、通信管道建设、光电缆线路工程、通信设备安装与调试、移动铁塔基站建设、网络系统集成、网络运维与保障、建筑智能化、城市轨道通信网络建设等方面。公司具有丰富的施工经验和雄厚的技术实力,承建过多项重大工程项目,能够为电信运营商提供优质的""",唐人通信技术服务股份有限公司,江西省南昌市高新区高新七路918号综合办公楼10楼,360111210001759,2008-03-10,方国栋,9693.3332万元人民币,91360106672409538Y,www.trkj.com
智慧酒店联盟,成都创视启辰文化传媒有限公司,智慧酒店联盟项目是全国首个采用VR展示的酒店订购服务平台。平台以VR展示技术为切入点，利用VR展示技术，为客户提供订购快的直联式酒店订购服务。创视启辰是一家专门从事针对本土中小企业的创新型电视广告及户外广告媒体制作发布公司。,成都创视启辰文化传媒有限公司,,510107001096214,2016-04-01,邓俊杰,300万元人民币,91510107MA61UT0B1R,www.cdcsqc.com
BD贵宾卡,苏州无线生活网络科技有限公司,苏州无线生活致力于本地生活信息化的产品设计，公司利用互联网技术，集便捷化、多功能化、安全性高、低成本等优势为一体，研发并向市场推出了一种新型电子会员卡—BD贵宾卡。,苏州无线生活网络科技有限公司,昆山市玉山镇城北路5号4号房,320583000760043,未知,许罡,200万元人民币,913205833238567788,www.bdvip.net
易物研选,广州易物研选网络科技有限公司,易物研选是一个基于移动互联网和自身供应链的生活类品牌，一家综合类电商平台。现在已经建立自营产品、返利商城、京东唯品合作产品，易物全球购四大业务板块，将能出售海量国内外的商品。,广州易物研选网络科技有限公司,广州市海珠区新港东路51号之五整栋自编3318号（仅限办公用途）,440105000618214,2017-05-23,曾翔瑜,1000万元人民币,91440101MA59N93U90,www.yiwuyanxuan.com
贝斯特实业,安徽贝斯特实业发展有限公司,安徽贝斯特实业发展有限公司位于合肥市高新区，是由上市公司安徽水利开发股份有限公司投资创立。公司矢志于住宅产业化，率先引进北美先进的成套轻钢体系，通过引进、消化、再创新，现已开发出具有国际专利的贝斯住宅体系，已获得建设部高新技术认定，并获科技地产优选技术品牌、华夏杯建筑科技奖、节能环境生态先进技术与产品奖等众多认定与奖项。,安徽贝斯特实业发展有限公司,,340106000011590,2003-06-16,张东海,3000万元人民币,91340100750971359X
超帆信息,广州超帆信息科技有限公司,北京超帆是一个社交媒体营销策略公司，专注于社交媒体、口碑营销、网络公关、视频营销策略等领域，是新浪微博平台首款品牌商业应用APP的提供者。GuruOnline是旗下产品。,广州超帆信息科技有限公司,,440101400126364,2012-11-22,陈龙,700万港元,91440101056575508E,www.guruonline.com.cn
云创文化,深圳云创文化科技有限公司,云创文化是一家包装及商业办公印刷集成服务商，致力于为客户提供产品的集成服务，专为用户提供定制化文创商品的平台，基于“大印刷”产业通过云计算与大数据的结合，让互联网与传统印刷及其关联行业融合的产业生态圈。,深圳云创文化科技有限公司,深圳市南山区桃源街道塘岭路1号金骐智谷大厦1001，1012房,440301114356236,2015-11-13,王少平,6000万元人民币,9144030035932110XG,www.inup.me
拉阔（Lakoo）,广州拉阔网络科技有限公司,拉阔游戏成立于香港，自手机游戏市场还没出现的1999年起，从2G到4G、离线到在线、功能手机到智能手机，梦想开辟出带粤语文化色彩的canto-game，拉阔游戏光谱，补完本土文化，隶属于广州拉阔网络科技有限公司。,广州拉阔网络科技有限公司,广州市天河区林和中路136号二层自编205单元032（仅限办公用途）,440106000049936,2009-03-19,吴健锋,1000万元人民币,914401066852388116,lakoo.com
