名字,公司,介绍,公司,地址,身份证,时间,法人,注册金额,编号,网址
航讯科技,杭州航讯科技有限公司,铜人宝是以解决恶性医患冲突为切入点的项目。整个“铜人宝”系统包括三部分，第一部分是报警系统，第二部分是预警系统，第三部分就是跟医院的系统进行关联。,杭州航讯科技有限公司,西湖区文二西路820号3幢1016室,330105000135648,2010-01-26,邱志永,596万元人民币,913301066998179454,www.hangxunzj.com
国中水务,黑龙江国中水务股份有限公司,"""黑龙江国中水务股份有限公司是一家在中国境内从事投资收购或建设污水处理、自来水厂的公司.主要经营供水及水务工程、污水处理、技术服务、运营服务及工程服务等.公司先后投资建设的多个水务项目均进展良好,同时还成功收购了多个水务项目及公司,已投资或接受委托投资包括河北秦皇岛海港区污水处理项目、河北昌黎污水处理项目、安徽马鞍山王家山污水处理项目、陕西汉中石门供水项目、陕西汉中兴元自来水有限公司、陕西西安闾良供水项目、青海西宁第二污水处理项目等。""",黑龙江国中水务股份有限公司,黑龙江省齐齐哈尔市龙沙区卜奎大街与龙华路交汇处（新玛特购物休闲广场）3单元25层8号,230000100002141,1998-11-03,尹峻,165393.5128万元人民币,91230200702847345E,www.interchinawater.com
软范,上海众装网络科技有限公司,上海众装网络科技有限公司（众装科技）是一家专注于房地产全产业链VR+AR技术应用的创新科技公司，在房地产领域的VR虚拟场景及房地产AR增强现实技术应用领域取得了不俗的成绩,上海众装网络科技有限公司,上海市杨浦区民京路853号1幢4123室,310101000656334,2014-10-13,沈杰,2000万元人民币,913101103207323075
凯莱英,凯莱英医药集团（天津）股份有限公司,凯莱英主要从事临床研究阶段的新药和新上市药物原料药和cGMP标准中间体的研究开发、工艺优化和规模化生产，绿色制药工艺创新研发为驱动，为客户提供化学、生产和控制（CMC，Chemical Manufacturing & Control）解决方案的一体化服务。,凯莱英医药集团（天津）股份有限公司,天津经济技术开发区洞庭三街６号,120000400035153,1998-10-07,HAO HONG,23011.0706万元人民币,91120116700570514A,www.asymchem.com.cn
塔人网络,上海塔人网络科技股份有限公司,上海塔人网络科技股份有限公司拥有专业的网络游戏研发、策划、运营团队。公司基本形成“IP推广维护+网络游戏开发+网络游戏运营”这一成熟的商业模式，通过IP联合授权或自主改编网络游戏并管理、推广IP；通过自有运营平台自主运营或与其他优秀网络游戏运营商合作运营，推广公司的网络游戏产品；通过代理或联运的方式运营其他游戏开发商研发的优质网络游戏，为游戏用户提供丰富的增值服务。　　公司拥有多年的IP管理和维护经验，拥有《奇迹》中国大陆及部分海外地区的多项独占性权利（除端游外），是国内《奇迹》改编页游的首个权利人，并且是,上海塔人网络科技股份有限公司,上海市徐汇区漕宝路320号二号楼2021室,310230000363283,2008-09-25,谈黎刚,1098.901万元人民币,913101046809614104,www.tarenwang.com
百汇科技,深圳市前海百汇科技有限公司,深圳前海百汇科技有限公司核心管理层来自业内各知名消费金融公司，深耕细作消费金融行业近8年，具备深厚的管理和实操经验，立志于打造中国最优的消费金融生态圈模式。公司依托雄厚的金融背景，以“便捷、安心、贴心”为服务宗旨，通过科技化的技术手段及多维度的场景化打造，为用户提供安全、便捷的消费体验，满足消费者和商户的个性化需求。 公司初创期依托于消费金融医疗和教育业务板块产品，目前已开通国内16个省份，92个城市。 未来3年全面扩充业务板块，加大创新力度，建立家装家居、租房、婚庆、出行、购物、商场、社区为一体的“消费+场景+金融”生态圈。,深圳市前海百汇科技有限公司,深圳市前海深港合作区前湾一路1号A栋201室(入驻深圳市前海商务秘书有限公司),440300202014348,2017-08-02,贾书豪,500万元人民币,91440300MA5ENDN73A
斯格威,昆山斯格威电子科技有限公司,斯格威是一家自动化焊接技术研发商。立足于对新型绿色自动化焊接技术的研发及产业化应用推广的高新技术企业。企业拥有30余项核心专利，致力于开展微搅拌摩擦焊及其自动化技术的基础研究、样机及产品研发、产业化推广等，努力占据搅拌摩擦焊技术的高端应用领域。,昆山斯格威电子科技有限公司,高新区元丰路232号,320583000724197,2014-08-14,李彦国,500万元人民币,91320583313906268L
闻康云医,闻康云医（北京）科技有限公司,闻康云医移动医院——专注为医院提供移动互联网化医院信息系统整体解决方案，实现与医院现有业务系统无缝对接，围绕患者就诊提供院前、院中、院后全方位服务，优化就医流程，缓解医院窗口排队压力，提高患者满意度。,闻康云医（北京）科技有限公司,北京市顺义区临空经济核心区融慧园6号楼7-01，北京市海淀区学院路35号世宁大厦1701,110108019271574,2015-06-09,门雨,1000万元人民币,91110108344365660W,www.wkmhs.com
车卜卜,西安车卜卜电子商务有限公司,车卜卜网是一个囊括汽车后市场所有相关产品和服务的现代信息“国际汽车（后市场）产品网络商城”，网络功能结构完全根据线下专业消费者（汽车服务商）和消费者（车主）购买习惯，结合现代网络购物的成熟经验而开发的一个“车卜卜汽车后市场网络交易平台”。商业模式借鉴于B2B、B2C、O2O和C2C，在这个基础上，車卜卜开发了一套完整的、适合汽车后市场相关产品或服务交易的商业模式，即称作“車卜卜模式，线上为：B2B2C、AO2O，移动为：APP之谁帮我养车”，网上我们明晰的将汽车后市场相关产品和服务进行了细分归类，更便于消费,西安车卜卜电子商务有限公司,西安凤城二路北侧0号经发大厦1幢1单元5层504室,610135100025974,2015-01-04,张军,1000万元人民币,916101353219587549,www.bobo1688.com
涵象文化,青岛涵象文化传媒有限公司,涵象文化是一个IP孵化、影视制作公司，2017年制作了旗下第一部原创网络电影作品《海带》，在爱奇艺独家上线。这是一部带着现实主义色彩、实验电影美学、还有些精神分析内容的科幻片，和一般认知的网大气质南辕北辙。目前《海带》的点击量近千万，在豆瓣的评分是6.8。,青岛涵象文化传媒有限公司,山东省青岛市崂山区苗岭路36号-1号101,370212230143996,2016-04-27,刘镜心,375万元人民币,91370212MA3C9NEQ7J
探海智能,探海（上海）智能科技有限公司,探海智能是一家专注于提供物联网智能产品软硬件解决方案和物联网云平台的科技公司，致力于打造集移动互联、云计算、物联网、大数据为一体的智能化科技生态链。,探海（上海）智能科技有限公司,上海市闵行区元江路5500号第1幢F116室,310112001592758,2015-12-25,陈达,500万元人民币,91310112MA1GB3JR34,www.oceanx.cc
泊林商业,深圳市泊林商业经营管理股份有限公司,"""公司是一家以提供国际珠宝交易中心市场管理为主营业务的现代化服务企业。珠宝市场是为珠宝首饰产品集中交易提供场所的有形市场,是珠宝首饰流通体系与营销体系的重要环节。珠宝交易市场是以黄金铂金、镶嵌、银饰、翡翠、珍珠、宝石、世界名表、首饰器材等产品及其加工品为交易对象,为买卖双方提供长期、固定、公开的交易设施设备,并具备商品集散、信息公示、结算、价格形成等服务功能的交易场所。""",深圳市泊林商业经营管理股份有限公司,深圳市罗湖区翠竹街道水贝二路泊林国际珠宝交易中心2楼,440301105542608,2006-07-25,廖俊发,3000万元人民币,91440300791749420H,www.bolinol.com
触手TV,杭州开迅科技有限公司,触手直播是一个专注移动游戏的弹幕式直播平台。网站分为王者荣耀专区、火影忍者专区、阴阳师专区等各类游戏专区，主播只需手机便可以在线直播。其他用户可以在线观看主播直播并可以送主播虚拟礼物。,杭州开迅科技有限公司,杭州市西湖区文一西路830号蒋村商务中心B楼1-304室,330102000069416,2011-01-28,李强,1200万元人民币,913301065687592716,chushou.tv
小云雀,凌禾（上海）网络科技有限公司,小云雀是凌禾（上海）网络科技有限公司旗下产品，是基于移动互联网的全流程线上网络借款平台， 主要解决都市年轻白领与蓝领在日常生活中的小额借款需求，提供1000元“小额度”，7天、14天“短周期”的灵活借款。用户可以在范围内自主定义借款金额、还款周期。小云雀采用互联网大数据方式，省去了传统金融服务的繁琐流程及手续，旨在提供一个简单方便、灵活快捷的借款新模式。,凌禾（上海）网络科技有限公司,,310120002452051,2014-08-04,曾杰文,3000万元人民币,913101143122155889,www.linksh.cn
星空钠电,辽宁星空钠电电池有限公司,辽宁星空钠电电池有限公司是一家钠离子电池及钠离子电池储能系统生产商。星空钠电成立至今，致力于研发生产钠离子电池及钠离子电池储能系统，是辽宁宏成集团的一家子公司。星空钠电的钠离子电池具有安全、经济、环保三大特性，可循环使用4000多次。不仅可以在电力的发、输、配、送、用等各个环节均可得到应用，实现智能电力系统的合理优化配置，还可广泛应用于生产生活的各个领域。,辽宁星空钠电电池有限公司,辽宁省鞍山市高新区越岭路267号,210300005258988,2018-01-24,李用成,100000万元人民币,91210300MA0UX0AG93
富维诗,鄂尔多斯市鼎福隆商贸有限公司,鼎福隆商贸经过多年的西服高级定制设计、生产、销售，我们已经累积了丰富的西服高级定制经验，我们也在不断的改良和实践，一直得到广大新老客户的支持和建议。,鄂尔多斯市鼎福隆商贸有限公司,内蒙古自治区鄂尔多斯市东胜区迎宾路3号街坊威泰家园小区12号楼1013,350203200153374,2013-03-19,李福锁,300万元人民币,91350211678262629T
球冠电缆,宁波球冠电缆股份有限公司,"""公司坐落于美丽的东海之滨----宁波北仑港,拥有20多年创业发展历程,是一家集科研、制造、工程服务于一体的国家级高新技术企业和国际性电缆服务商。""",宁波球冠电缆股份有限公司,宁波市北仑区小港街道姚墅,330200400021809,2006-12-22,陈永明,12000万元人民币,913302007960175287,qrunning.com
Colormore沙拉,北京悦盒优品餐饮管理有限公司,Colormore沙拉成于2015年9月，隶属于北京悦盒优品餐饮管理有限公司。 品牌致力于给大众提供健康时尚安全的食物。配以可爱的卡通形象为包装，打造出最健康，最专业，最有趣的沙拉品牌。,北京悦盒优品餐饮管理有限公司,北京市朝阳区百子湾东里403号楼1层107,110105019919271,2015-09-24,曹骁,400万元人民币,91110105MA0010P79C
慧眼驾车,青岛慧眼信息科技有限公司,慧眼驾车是一款智能行车系统，通过单目摄像头，运用计算机视觉、模式识别、机器学习、人工智能等技术，在车辆行驶过程中全程帮助驾驶员的主动安全辅助系统，提供包括车道偏移预警、前向碰撞预警、行人检测、车距监测、自动大灯控制等功能，从而可以有效降低多数事故类型的发生频率。,青岛慧眼信息科技有限公司,青岛高新技术产业开发区秀园路1号科创慧谷（青岛）科技园D-2-523室,370222230009412,2015-01-29,单霆,111.11万元人民币,913702223259577081,drivingeye.com
武汉鑫四方科技,武汉鑫四方科技股份有限公司,武汉鑫四方科技股份有限公司成立于2003年，原名武汉鑫四方通信工程有限公司，注册资金500万元，现有员工250余人。作为优秀通信设计技术服务公司，是目前湖北省同类行业较大企业之一。公司被授予“武汉市信用单位”、“湖北省精神文明建设突出贡献单位”等荣誉称号。秉承创新精神，充分发挥自身在行业内优势和专业经验，坚持“以质量求生存，以信誉求发展”的经营理念和宗旨，向各界提供优质服务。随着中国电信、移动、联通移动网络的建设，数字新媒体的兴起及云计算时代的来临给通信行业带来了前所未有的大好机遇。公司业务遍及湖北、云南、广东、贵州、江苏等省市。主要从事有线传输、通信管道、无线室分、视频监控、系统集成、智慧社区、智慧家庭、智慧农业、智慧园区等工程项目的设计。公司拥有《通信用户管线建设资质》和《系统集成丙级资质》等多个资质。,武汉鑫四方科技股份有限公司,武汉市东西湖区新沟镇办事处纺新街41号(14),420102000060643,2003-11-04,袁廷先,2000万元人民币,914201127551022161,www.whxsf.com
风华秋实,上海风华秋实文化传媒有限公司,风华秋实主要业务已发展为包括基础音乐事业与互动音乐事业两部分。基础音乐事业包括音乐演出产品与品牌开发：规模化演唱会的策划、营销和执行业务，艺人经纪的相关服务以及音乐版权的制作、发行等业务。而互动娱乐事业包括线上音乐选秀、演唱会直播、视频音乐娱乐节目、周边商品电商和数字版权等服务。,上海风华秋实文化传媒有限公司,上海市嘉定工业区叶城路1630号8幢2325室,310114002796669,2014-10-11,李辉,1000万元人民币,913101143124549338
吉磊资产管理,浙江吉磊资产管理有限公司,吉磊资产管理是一家专业的汽车融资租赁公司。在传统融资租赁业务的基础上，不断拓展以租代售、售后回租等多种模式的汽车金融业务。,浙江吉磊资产管理有限公司,浙江省杭州市滨江区长河街道山一社区陈家村114-1号,330106000345022,2014-08-04,丁景龙,1000万元人民币,913301063113117700,www.self-culture.cn
AB再制造高效电机,杭州奇虎节能技术有限公司,杭州奇虎节能技术有限公司是一家集科研、制造、营销为一体的科技型企业，是一家专业从事高效节能稀土永磁同步电机的高端智能机电一体化企业。,杭州奇虎节能技术有限公司,浙江省杭州市拱墅区香槟之约园D幢428（办公）室，拱墅区香槟之约园D幢428（办公）室,330103000023156,2008-01-30,张志军,500万元人民币,913301056706185631,www.dianji.vip
定定搜车,杭州定定科技有限公司,定定搜车是一家汽车不良资产服务平台。定定科技是一家依托科技手段，为清收汽车相关不良资产的综合性服务平台，平台致力于用高科技手段让寻车变得简单，同时平台整合了全国数百家清收机构，覆盖全国，为金融方提供有效降低不良率的专业解决方案。定定科技未来将凭借开放共享式平台和多样化的科技手段，以及衍生的系列服务，推动传统汽车不良资产产业升级和全方位资源整合。,杭州定定科技有限公司,浙江省杭州市淳安县千岛湖镇鼓山大道186号431-9室,,2018-08-20,沈海波,1000万元人民币,91330104MA2CDRC53D,www.dingdingchina.com
磊明科技,深圳磊明科技有限公司,磊明科技是一家专注于城市景观照明和室内外建筑照明系统解决方案企业。旗下三大品牌：LiteMagic?、LiteMatrix?、LiteMeta?，分别提供室外、室内灯具和城市智慧照明控制系统产品，共同组成了完整的产品和服务组合。凭借全面的产品线、强大的研发实力和丰富的大型项目经验，磊明照明为城市照明管理者、景观和室内设计师、照明设计师、照明工程商提供优质的产品和服务。,深圳磊明科技有限公司,,440301104623360,2004-04-09,刘晓光,1000万元人民币,91440300758617039J,www.lite-magic.com
款宝股份,四川款宝股份有限公司,款宝股份是一家科技金融及互联网金融控股公司，主要经营付款宝、款宝金融。,四川款宝股份有限公司,,510100000352891,2015-05-21,杨飞,10000000万元人民币,91510100342983377X
云医声,安徽科大讯飞医疗信息技术有限公司,云医声是集病历、医嘱、备忘于一身的医疗软件，支持语音操作，可以查看病人信息，检查、检验报告，提高了医生的工作效率。该产品以语音识别为基础，能将医生说出来的医嘱直接记录整理成电子病历，大大减轻了医生的工作量；其智能语音转录系统的准确率在97%，并且适用于医院所有科室。,安徽科大讯飞医疗信息技术有限公司,合肥市高新区望江西路666号A5楼18层,340191000082134,2016-05-13,赵志伟,2696万元人民币,91340100MA2MW85E3R,www.xfyun.cn
欧鹏巴赫,北京欧鹏巴赫新能源科技股份有限公司,"""公司成立于2012年12月,注册在中关村昌平园,注册资金3600万元,是国家高新技术企业。公司主营新能源汽车三大核心业务:动力电池及管理系统、整车控制系统、电机控制系统的研发、生产和销售。""",北京欧鹏巴赫新能源科技股份有限公司,北京市昌平区沙河镇昌平路97号6幢3层303,110114015490286,2012-12-21,吴德贵,3600万元人民币,9111011406134398X1,offnenbach.com
战斗装甲钢羽,北京温格斯动漫文化有限公司,温格斯动漫是一个动漫研发商，公司主要作品动漫《战斗装甲钢羽》是一个以雇佣军战争为形式的新型战争为动漫背景的国产动画，钢羽的剧情，走了较为严肃的、现实的，军事系的作品路线。,北京温格斯动漫文化有限公司,北京市朝阳区广渠路28号院401号楼（劲松孵化器2553号）,110105020144802,2015-11-06,孙悦,10万元人民币,91110105MA001P9591
日志易,北京优特捷信息技术有限公司,北京优特捷信息技术有限公司是国内从事IT运维日志、业务日志实时采集、搜索、分析、可视化系统研发的大数据公司，提供部署版软件和SaaS服务，同时面向金融、运营商、能源、互联网等不同行业提供专业的日志分析解决方案。,北京优特捷信息技术有限公司,北京市朝阳区阜通东大街1号院6号楼2单元14层221707,110105017068464,2014-04-18,陈军,1868万元人民币,9111010509816175XY,www.rizhiyi.com
华微中测,北京华微中测科技有限公司,北京华微中测科技有限公司是一家致力于惯性定向测姿、卫星导航定位等高新技术领域的新产品推广，销售和技术服务的高科技民营企业。,北京华微中测科技有限公司,北京市朝阳区建国路15号院甲1号北岸1292三间房创意生活园区底商5-05,110105021095705,2016-04-25,吴军励,100万元人民币,91110105MA0052B50P,cnsens.com
协和干细胞,协和干细胞基因工程有限公司,"""? ? 协和干细胞基因工程有限公司由血研所与中源协和细胞基因工程股份有限公司共同出资设立,注册于天津高新技术产业园区,注册资本金1亿元人民币。公司主营业务为干细胞资源保存、干细胞工程系列产品的技术开发及产业化、干细胞临床移植；单克隆抗体诊疗技术研究开发和应用；基因药物和基因芯片的研发、生产和销售等。""",协和干细胞基因工程有限公司,华苑产业区梅苑路12号,120193000001019,2001-02-16,王勇,10000万元人民币,9112011672573313X2,www.chinastemcell.com
同力达,秦皇岛同力达环保能源股份有限公司,"""公司位于开发区金山北路,是以环保水处理设备、水处理工程、冶金成套设备、化工机械、压力容器、换热器的知名骨干企业;公司集工程设计、设备制造、工程总承包一体,开展全方位服务,拥有一批实践经验丰富的工程技术人员。    公司已通过ISO9001:2000质量体系认证,是河北省高新 技术企业、重合同守信用企业,具有D2级压力容器设计及制造资质。是中国锅炉水处理协会,特种设备协会,环保工业协会会员单位。    公司具有年产值达数亿元的生产能力,拥有大型吊机、自动焊接、卷板机、林肯焊机、等离子切割机、专用车床等大中型生""",秦皇岛同力达环保能源股份有限公司,秦皇岛市经济技术开发区金山北路8号,130301000013185,1998-07-15,罗军杰,5560万元人民币,911303007008035766,www.tldjt.com
闺蜜瓣,北京闺蜜瓣科技发展有限公司,闺蜜瓣是一个纯为女性打造的社交平台，致力于以高频多元便捷的社交活动、稳定私密的小圈文化、鼓励成长的积分体系、高端舒适的体验性消费，满足女性对社交安全感的追求。隶属于北京闺蜜瓣科技发展有限公司。,北京闺蜜瓣科技发展有限公司,北京市丰台区造甲街110号2号平房（新村集中办区），北京市丰台区造甲街110号2号平房(新村集中办区),110106018578901,2015-01-29,韩海京,900万元人民币
米健信息,上海米健信息技术有限公司,米健信息（米健医疗）是一家医疗信息化解决方案供应商，旗下开发有拥有自主知识产权的”手术麻醉临床信息系统、重症医学临床信息系统、急诊临床信息系统、移动临床信息系统、临床数据中心、基于影像及视频的数字化手术室”等临床应用系统解决方案。,上海米健信息技术有限公司,上海市浦东新区周祝公路337号9幢279室,310110000590306,2012-04-27,张继武,2000万元人民币,913101155947656242,www.meehealth.com
石榴拼拼,深圳寻找母星网络科技有限公司,石榴拼拼是一个全新的本地生活服务营销平台，致力于为用户提供更美好、更优质、更有趣的生活方式。,深圳寻找母星网络科技有限公司,,440300204656924,2018-06-08,刁硕,100万元人民币,91440300MA5F64BM30,www.16pinpin.com
广州万科物业,广州市万科物业服务有限公司,"""广州市万科物业服务有限公司,万科企业股份有限公司成立于1984年5月，是目前中国最大的专业住宅开发企业。2007年公司完成新开工面积776.7万平方米，竣工面积445.3万平方米，实现销售金额523.6亿元，结算收入351.8亿元，净利润48.4亿元，纳税53.2亿元。公司致力于通过规范、透明的企业文化和稳健、专注的发展模式，成为最受客户、最受投资者、最受员工欢迎，最受社会尊重的企业。凭借公司治理和道德准则上的表现，公司连续五年入选“中国最受尊敬企业”，连续第四年获得“中国最佳企业公民”称号。, 广州市万科物业服务有限公司为万科企业股份有限公司全资附属机构，2004年万科物业进入广州。目前在管项目有万科四季花城、城市花园、蓝山花园、万科城花园、天景花园、金色家园、云山花园等高档社区，随着公司的快速发展，配合广州万科地产的“4+X”大广州战略布局，公司将陆续接管更多物业项目。, 人才是万科的根本。经过五年多的发展，广州万科物业已拥有安全、工程、客服、环境等领域的高素质人才近1000人，打造了一支富有理想和激情的优秀团队。, 作为年度中国最受尊敬企业和年度最佳雇主，万科的优秀企业文化、用心尊重人的价值、简单的人际关系吸引了众多优秀人才的加盟，现诚邀具有良好职业素养的您加入“永怀理想与激情”的我们的团队！""",广州市万科物业服务有限公司,,440101000069211,2004-11-17,聂金伟,500万元人民币,914401017676955062,www.vanke.com
打工快线,涞亿稻赢网络科技（苏州）有限责任公司,打工快线是一个互联网招聘平台。,涞亿稻赢网络科技（苏州）有限责任公司,苏州工业园区葑亭大道666号天翔智能产业园2幢203室,,2018-12-24,赵海晶,700万元人民币,91320594MA1XNC5D5D,www.dagongkuaixian.com
西部服饰网,陕西绿夏服饰有限公司,西部服饰网一款集行业信息资讯、服饰产品、机械加工、原材料为一体的综合服务平台，为商家提供移动端营销推广渠道和交流合作平台，为买家提供购物选货平台。,陕西绿夏服饰有限公司,陕西省宝鸡市渭滨区巨福东路23号,610300100027994,2001-05-10,王可立,1000万元人民币,9161030272736485XT,www.sxlxfs.cn
鼎润网络,昌邑市鼎润网络科技有限公司,鼎润网络是一个线上电竞游戏社交平台，主要服务于网络游戏用户，帮助用户找到志趣相投的人一起玩游戏，将游戏与社交捆绑，用户可在平台上写出自己的要求，系统自动匹配符合条件的玩家一起进行游戏。,昌邑市鼎润网络科技有限公司,,370786200028962,2015-12-23,齐斌斌,50万元人民币,91370786MA3C4LLF9C
